Ministro de Estado e das Finanças|Ministro|… e uma maior qualidade dos serviços públicos que estão a ser prestados aos cidadãos. As privatizações permitiram essas melhorias no acesso e na qualidade e permitiram também a modernização e o progresso do País.\n Contraponho a este modelo em que privatizamos, em que crescemos, em que nos desenvolvemos, em que melhoramos a qualidade, o modelo estatal em que os senhores tanto confiam. Qual foi o progresso, durante tantos anos, do capitalismo de Estado?
Francisco de Assis|PS|Boa pergunta!
|PCP|*** Protestos ***
Ministro de Estado e das Finanças|Ministro|Sim! Como é que progrediu a Rússia? Vamos tomar a Rússia como um exemplo de desenvolvimento? E Cuba? E outras economias? A Coreia do Norte? São exemplos de prosperidade, de dinamismo, de inovação, de bem-estar dos cidadãos, de acesso a serviços e a bens públicos?! Sim, porque esses são os «grandes» exemplos da propriedade do Estado, da gestão do Estado e da provisão, por parte do Estado, de serviços fundamentais!
Bernardino Soares|PCP|Logo na primeira resposta ficou sem argumentos!
Ministro de Estado e das Finanças|Ministro|Não, não partilho desse referencial! Não acredito nesse modelo, porque esse é um modelo que, historicamente, já mostrou a sua falência.\n Relativamente à relação entre dividendos e juros da dívida, devo informar esta Assembleia de que, se olharmos, por exemplo, para a REN, a EDP, a Galp, os CTT, os dividendos distribuídos por estas empresas rondarão algo entre os 160 e os 170 milhões de euros/ano. O encaixe previsto com a alienação destas participações representará cerca de 80% dos 6000 milhões que esperamos obter. E estes 80% dos 6000 milhões, isto é, feitas as contas, 4800 milhões de euros, só em juros, à taxa de 4,2%, que é aproximadamente a média das últimas emissões de dívida, representam mais de 200 milhões de euros em economia de juros.\n Portanto, nós estamos a confrontar uma economia de juros de um pouco mais de 200 milhões de euros com dividendos que andarão na ordem dos 160 milhões de euro. Creio que, confrontando estes números, são óbvios a economia e o ganho que teremos.\n
Bernardino Soares|PCP|Então, não é?!...
Ministro de Estado e das Finanças|Ministro|Dúvidas foram suscitadas quanto ao serviço público. Ora, quero garantir que, tal como no passado, como foi feito com a PT, com redes de distribuição, etc., asseguraremos o serviço público e ele não será posto em causa. Nenhum cidadão foi prejudicado, no acesso ao serviço público telefónico, por causa da privatização da PT e nenhum cidadão será prejudicado, no acesso, por exemplo, ao serviço postal, por causa da privatização dos CTT.\n
|BE e PCP|*** Protestos ***
Jerónimo de Sousa|PCP|É o exemplo da Rodoviária!
Ministro de Estado e das Finanças|Ministro|Não, de forma nenhuma! Isso será assegurado! Aliás, este é um «fantasma» que o PCP quer acenar, na sua «cruzada» contra as privatizações.\n Quanto à ANA, quero ser muito claro: vai ser privatizada! A ANA vai ser privatizada no âmbito da construção do novo aeroporto. A decisão que há a tomar é sobre o momento exacto, no processo de execução e construção do novo aeroporto, em que ANA deve ser privatizada. Se deve ser logo no início ou durante a execução do projecto, dependerá muito, primeiro, das condições de acesso a financiamento e, segundo, da alavancagem que o próprio novo aeroporto dará à valorização da ANA enquanto activo. E não faz sentido que o Estado, se houver uma valorização significativa da ANA em virtude da criação do novo aeroporto, a venda sem assegurar a incorporação dessa melhoria no seu valor antes da sua privatização, porque isso não seria defender o interesse patrimonial do Estado. É isso que está a ser reavaliado. Não é saber se privatiza ou não! Ela vai ser privatizada. Temos é que escolher o melhor momento, que é aquele em que podemos maximizar o valor a obter pela alienação da ANA.\n
Presidente|Presidente|Queira concluir, Sr. Ministro.
Ministro de Estado e das Finanças|Ministro|Relativamente às empresas não vendáveis, de que me falou a Sr.ª Deputada Assunção Cristas, tenho a dizer que elas serão vendáveis, pois serão objecto de processos de reestruturação e de reorganização,…
José Soeiro|PCP|Claro! O CDS sabe!
Ministro de Estado e das Finanças|Ministro|… como sempre foram.\nEu privatizei a PT, eu privatizei a EDP, eu privatizei a Brisa,…
|PCP|*** Protestos ***
Ministro de Estado e das Finanças|Ministro|… privatizei inúmeras empresas e, antes de qualquer privatização, houve um processo de reorganização, de reestruturação empresarial no sentido de as preparar para a privatização, e é isso que vai ser feito!
Bruno Dias|PCP|Agora, diga lá: é de esquerda ou de direita?!
Ministro de Estado e das Finanças|Ministro|Quanto a outras medidas de limitação do endividamento, a Sr.ª Deputada sabe que temos vindo a alinhar as práticas de gestão das empresas públicas com critérios adoptados no âmbito da Administração.\n No que se refere, em particular, à limitação do endividamento, como sabe, as empresas têm planos de actividades, têm planos de investimento,…
Presidente|Presidente|Queira concluir, Sr. Ministro.
Ministro de Estado e das Finanças|Ministro|… terão que submetê-los à tutela e será através da aprovação, por parte de tutela, dos seus planos de actividades e de investimento que se concretizará a imposição dos limites de endividamento.\n
|PS|*** Aplausos ***
Presidente|Presidente|Para pedir esclarecimentos, tem a palavra o Sr. Deputado José Luís Ferreira.
José Luís Ferreira|Os Verdes|Sr. Presidente, Srs. Membros do Governo, Sr.as e Srs.\nDeputados, Sr. Ministro das Finanças, o Pacto de Estabilidade e Crescimento tem vindo a ser objecto de várias críticas de muitos sectores, sectores que, como é público, não se limitam apenas aos partidos da oposição, abrangem também pessoas do próprio Partido Socialista, e alguns deles tiveram até grandes responsabilidades em governos do PS.\n E as grandes reservas e críticas de algumas dessas pessoas do Partido Socialista — que continuam a ser do partido — no que diz respeito ao PEC residem exactamente na questão das privatizações: são receios fundados relativamente à sobrevivência do serviço público, mas também à manutenção dos centros de decisão.\n Deixo aqui apenas alguns exemplos que têm sido referidos na imprensa.\n Manuel Alegre afirma que estas privatizações, a concretizarem-se, comprometem, talvez irremediavelmente, a função estratégica do Estado.\n Mário Soares diz não compreender como é que se vai privatizar os CTT ou uma companhia de bandeira como a TAP. «É evidente que não podemos estar a desbaratar o nosso próprio património» — acrescenta.\n Henrique Neto, ex-Deputado do Partido Socialista, admite com mágoa, mas também com alguma ironia, que o seu pensamento involuiu: «devemos privatizar tudo». E lamenta, ainda, a capacidade que certos grupos privados têm hoje de influenciar o poder político.\n Por fim, João Cravinho, ex-ministro e ex-Deputado do Partido Socialista, diz que deixou de haver uma noção do que é património público não transferível.\n De facto, face a esta avalanche de privatizações que o Governo pretende levar para a frente, e perante estes insuspeitos comentários, fica a ideia de que o Governo se limitou apenas a elaborar um simples inventário de activos para venda, ou seja, havendo comprador vende-se.\n Ora, perante este cenário, gostaríamos que o Sr. Ministro das Finanças nos explicasse, porque era importante que os portugueses tivessem disso conhecimento, se o Governo, antes de apresentar este enorme elenco de empresas a entregar aos privados, definiu quais os sectores que considera estratégicos para Portugal, quais as áreas que são, na perspectiva do Governo, essenciais ao bem público. Ou devemos concluir que o rol das empresas a privatizar começou apenas a ser feito com base em critérios financeiros ou, então, na triste fórmula de «se há comprador, vende-se»?
Heloísa Apolónia|Os Verdes|Muito bem!
Presidente|Presidente|Para pedir esclarecimentos, tem a palavra o Sr. Deputado Bruno Dias.
Bruno Dias|PCP|Sr. Presidente, Srs. Deputados, Sr. Ministro das Finanças, a sua mensagem de hoje ao Parlamento parece resumir-se a esta ideia: «Esqueçam tudo aquilo que aconteceu, esqueçam tudo o que viram nos últimos 20 anos, esqueçam a gestão ruinosa e o subfinanciamento a que tem sido votado o sector público! Não valeu, agora é que conta! A partir de agora é que vale!».\n Mas nós não esquecemos, Sr. Ministro! Não esquecemos o desastre que foi a privatização do handling da TAP para os trabalhadores, para os passageiros e para a própria companhia, que teve que readquirir a empresa que tinha sido alienada!
Jerónimo de Sousa|PCP|Bem lembrado!
Bruno Dias|PCP|O senhor insiste na melhoria do acesso e da qualidade do serviço público após as privatizações?! Desafiamo-lo a ir dizer isso aos utentes dos transporte rodoviário, que são confrontados actualmente com o encerramento de serviços, com a supressão de carreiras, com um verdadeiro recolher obrigatório, com o abandono a que as populações são votadas, nomeadamente nas regiões do interior e nas povoações mais isoladas!
Bernardino Soares|PCP|Muito bem!
Bruno Dias|PCP|Vá dizer isso aos utentes da Fertagus que pagam, por quilómetro, tarifas que são praticamente o dobro das que são praticadas na CP! Vá dizer isso àqueles que já hoje estão a pagar a factura — utentes e trabalhadores — pela estratégia que dura há anos para a privatização dos correios e que só agora vem a lume relativamente ao encerramento de estações, relativamente à destruição de postos de trabalho, relativamente à degradação da qualidade! É essa a experiência concreta que não podemos ignorar, Sr. Ministro!
Bernardino Soares|PCP|Muito bem!
Bruno Dias|PCP|O Sr. Ministro, por acaso, conhece o processo dos aeroportos de Londres, vendidos à Ferrovial, e que deixou a British Airways numa crise sem precedentes, a ponto de ter sido criada uma comissão de inquérito no Parlamento britânico?! Quer alienar toda a rede nacional de aeroportos por um negócio milionário que vai, seguramente, interessar a muita gente, mas que não interessa ao País e não interessa ao futuro da nossa economia?!
Bernardino Soares|PCP|Muito bem!
Bruno Dias|PCP|O senhor quer alienar a companhia aérea de bandeira, que é um factor de soberania e de projecção de Portugal no mundo?!
João Oliveira|PCP|Exactamente!
Bruno Dias|PCP|O senhor sabe quem comprou a transnacional Arriva, que tem o capital da Barraqueiro, dos TST, do Metro Sul do Tejo? Nós dizemos-lhe: foi a Deutsche Bahn, o operador público ferroviário alemão! É que há países que vão às compras e há outros que são vendidos a pataco pelos seus governantes!
Bernardino Soares|PCP|Exactamente!
Bruno Dias|PCP|É esta a política deste Governo que não podemos aceitar!
|PCP|*** Aplausos ***
Presidente|Presidente|Para pedir esclarecimentos, tem a palavra o Sr. Deputado José de Matos Rosa.
José de Matos Rosa|PSD|Sr. Presidente, Srs. Deputados, Srs. Membros do Governo, em relação ao programa de privatizações previsto, verifica-se que o mesmo não está enquadrado numa estratégia política coerente e fundamentada de redução do peso do Estado na economia, que se impunha. Fica-se, assim, pelo único objectivo de tentar obter 6000 milhões de euros de receita, a aplicar na redução da dívida pública.\n O sector empresarial do Estado necessita imperiosamente de reorganização e de reestruturação, visando a melhoria da sua eficiência. Todavia, nesta fase o Estado apenas propõe, no prazo de seis meses, a emissão de orientações nesse sentido. Ora, mais do que meras orientações, é fundamental equacionar um modelo de gestão eficaz do sector empresarial do Estado. Saliente-se, a este propósito, que o PEC anterior referia já a criação de um novo modelo de governo do sector empresarial do Estado.\n Verificamos que não são anunciadas reformas estruturais nem se redefine o papel do Estado na economia e por via disso continuaremos uma trajectória económica de morte lenta e de empobrecimento colectivo.\n Além de mais, o Governo tem que contar com as incertezas do mercado quanto ao valor destas privatizações. O sucesso destas operações está ameaçado pela turbulência dos mercados. As empresas mais valiosas e mais fáceis de privatizar são os três grupos de energia que já estão cotados. Há poucos dias, valiam menos 530 milhões de euros do que em Janeiro deste ano.\n Mas também já se percebeu que nem no partido do Governo este tema é consensual. Vejamos o que disse Manuel Alegre e que passou para os jornais. Perante quase duas centenas de pessoas que o aplaudiram de pé, Manuel Alegre manifestou-se também contra as privatizações de algumas empresas, destacando os CTT, a REN e a TAP.\n Mas não só ele, também Mário Soares afirmou: «Não compreendo como é que se vão privatizar os CTT, uma empresa de bandeira como a TAP e outras companhias» — disse o ex-Presidente da República, somando-se às diversas críticas. Disse, ainda: «Não podemos estar a desbaratar o nosso património» — acrescentou Soares num debate promovido pela Federação do PS de Setúbal.\n Sr. Presidente, Srs. Membros do Governo, Sr. e Srs. Deputados: Poderemos chegar a 2013 com o problema de défice público aparentemente resolvido, mas, como as máquinas do despesismo público e do empobrecimento económico se manterão intactas, voltaremos a ter gravíssimos problemas a partir de então.\n Deixo-lhe a seguinte questão: considera o Governo e o Sr. Ministro das Finanças que este programa de privatizações tem alguma coerência lógica e fundamentação?
|PSD|*** Aplausos ***
Presidente|Presidente|Para pedir esclarecimentos, tem a palavra o Sr. Deputado Telmo Correia.
Telmo Correia|CDS-PP|Sr. Presidente, Srs. Membros do Governo, Sr. e Srs. Deputados, Sr.\nMinistro de Estado e das Finanças, em primeiro lugar, como imagina, e não será preciso muito, nesta matéria tudo, ou quase tudo, nos separa do partido interpelante.\n
Bernardino Soares|PCP|É verdade!
Telmo Correia|CDS-PP|Temos particular consciência, Sr. Deputado Bernardino Soares, que quando, no socialismo real, caiu o muro, o que estava por detrás do muro era, sobretudo, uma economia completamente atrasada, completamente falida e muita, muita miséria!
|CDS-PP|*** Aplausos ***
|PCP|*** Protestos ***
Telmo Correia|CDS-PP|Mas, Srs. Deputados Bernardino Soares e Bruno Dias, se me ouvirem mais um pouco, ainda vamos encontrar um ou outro ponto de convergência!! Risos do CDS-PP.\n
Bernardino Soares|PCP|Por este andar não parece possível!
Telmo Correia|CDS-PP|Têm que me dar essa oportunidade.\nNão obstante essa diferença, também várias coisas nos separam do Partido Socialista nesta matéria.\n
Bernardino Soares|PCP|Cada vez menos!
Telmo Correia|CDS-PP|Portanto, veremos que ainda não vai ser assim tão grave como pensam.\n Em primeiro lugar, queria lembrar que houve um Primeiro-Ministro socialista que, em nome da salvação do País, chegou a «meter o socialismo na gaveta». Parece-me que o actual Governo «meteu a mão na gaveta», onde era suposto estar o socialismo, e tirou uma fúria privatizadora absoluta, de um dia para o outro.\n
|CDS-PP|*** Aplausos ***
Telmo Correia|CDS-PP|Digamos mesmo — e o Dr. Bagão Félix dizia-o há pouco tempo — que é verdade que a tradição já não é o que era. Mas o socialismo também não, Sr. Ministro!
|CDS-PP|*** Aplausos ***
Telmo Correia|CDS-PP|O socialismo também é uma coisa muito diferente daquilo que era. Diria mesmo, Sr. Ministro, que nos faz alguma confusão! Ainda hoje de manhã, num debate, o Prof. Jacinto Nunes dizia: «Keynes está a ser usado erradamente, a crise sobre a qual Keynes escreveu era completamente diferente desta».\n O que nos faz confusão é que os senhores, nos grandes investimentos e nas grandes obras públicas, aplicam Keynes; nas privatizações, aplicam Adam Smith. É uma estratégia que nem sempre é fácil de compreender ou de perceber! Há, de facto, privatizações com as quais estamos de acordo. Estamos de acordo, como disse a Sr.ª Deputada Assunção Cristas, com a privatização da ANA, da Inapa, do sector segurador da Caixa Geral de Depósitos. Estamos de acordo com muitas privatizações! Mas, Sr. Ministro, no que respeita à privatização de monopólios naturais, temos — expresso-o me nome do nosso grupo — muitas reservas de que seja uma solução interessante e que não tenha consequências graves para os cidadãos.\n Disse-nos o Sr. Ministro, relativamente a monopólios em empresas de serviço público, como, por exemplo, os CTT, que não vão existir consequências para os cidadãos. Nos países onde foram privatizados, a regra foi a de que as empresas beneficiaram, mas os cidadãos em nome individual passaram a pagar mais caro. É, portanto, uma preocupação lógica.\n Sr. Ministro, outra preocupação tem a ver com a questão da oportunidade. Poderia colocar questões de soberania, que venho defendendo há muitos anos, em relação, por exemplo, à privatização da TAP e à visão estratégica de uma companhia de bandeira, mas pergunto-lhe se V. Ex.ª teve em conta a oportunidade e o momento em que algumas destas empresas vão ser privatizadas, pois, com o mercado completamente em baixa, algumas delas vão ser dadas, prejudicando com isso, obviamente, o interesse estratégico nacional.\n
Vozes do CDS-PP|CDS-PP|Muito bem!
Telmo Correia|CDS-PP|VV. Ex. diziam, há uns tempos, que iriam privatizar o BPN, não falavam de mais nada. A propósito, sobre o BPN temos sabido igualmente muito pouco.\n Hoje em dia, a pergunta é a de saber o que não vai ser privatizado, porque aparentemente tudo aquilo que existe é para ser privatizado, e não sabemos ainda em que percentagens estas empresas vão ser privatizadas.\n Somos críticos da privatização da REN, que é um monopólio natural. Repito: somos críticos da privatização da REN. Somos contra a sua privatização, se quiserem! Mas em que percentagem é que ela vai suceder? E a TAP, em que percentagem vai ser privatizada? Qual a percentagem? Sr. Ministro, mais uma vez, citando o autor que referi há pouco, afirmo que, no fim deste modelo, vão sobrar as barras de ouro que estão no Banco de Portugal, se é que vão sobrar. E isso, para nós, é obviamente preocupante.\n
|CDS-PP|*** Aplausos ***
Presidente|Presidente|Para responder, tem a palavra o Sr. Ministro de Estado e das Finanças.
Ministro de Estado e das Finanças|Ministro|Sr. Presidente, Sr.as e Srs. Deputados, começo por responder aos Srs. Deputados José Luís Ferreira e Matos Rosa, dizendo que, de alguma forma, VV. Ex.\n tiveram um comportamento muito semelhante àquilo que se costuma dizer do cuco, que é o de «pôr os ovos nos ninhos dos outros». VV. Ex. usam os argumentos dos outros para atacarem o programa de privatizações e não apresentam os vossos próprios argumentos. Eu constato que os senhores não têm argumentos quanto às privatizações, usam os argumentos de membros do Partido Socialista que levantaram dúvidas e ressalvas quanto a essa matéria. Isso também é esclarecedor quanto à vossa capacidade crítica e analítica desta matéria! Mas, com o devido respeito pelas opiniões que aqui foram emitidas, digo o seguinte: não partilho dessas opiniões; sou o Ministro das Finanças; propus ao Governo; o Governo não partilha dessas mesmas opiniões e pretende levar a cabo um programa de privatizações. A realidade é esta e o programa aí está para ser conduzido.\n Gostaria também de responder ao Sr. Deputado José Luís Ferreira, que me perguntou quais são as áreas essenciais ao bem público, dizendo-lhe, Sr. Deputado, que todas as áreas da actividade são essenciais ao bem público, independentemente de serem geridas pelo sector público ou pelo sector privado. Eu dou importância a todas as áreas da economia que, de facto, criam emprego, criam riqueza e contribuem para o nosso bem-estar.\n Mais uma vez, devo repetir que não concordo com a visão, muito retrógrada, diria, desta concepção do Estado proprietário e gestor que o PCP aqui veicula, achando que é uma desgraça a gestão privada das empresas e acenando com casos, mas esquecendo aquilo que foi a experiência histórica dos países de economia estatizada.\n
Bernardino Soares|PCP|Fale de Portugal!
Ministro de Estado e das Finanças|Ministro|Agora, acusam os privados de terem os seus interesses obscuros, etc. E a nomenclatura partidária que dominou as empresas dos países comunistas?!
Bernardino Soares|PCP|O Sr. Ministro não quer é falar de Portugal!
Ministro de Estado e das Finanças|Ministro|Sim, essa nomenclatura, que enriqueceu à custa dessas empresas!?
Bernardino Soares|PCP|Deve estar a falar de Rui Pedro Soares, do Dr. Armando Vara ou de João Carlos Silva! Ou, então, de Américo Thomati!
Ministro de Estado e das Finanças|Ministro|Foi esse o governo do povo? Foi esse o governo do Estado ao serviço do bem-estar do povo? Não!
|PS|*** Aplausos ***
|PCP|*** Protestos ***
Ministro de Estado e das Finanças|Ministro|A História mostrou bem o engano e a mentira que foram esse modelo económico, assim como mostrou o atraso e a pobreza que reinam nesses modelos económicos! Portanto, não venham aqui, novamente, de forma dissimulada, querer defender um Estado como esse, porque esse, sinceramente, rejeito, não acredito nele!
|PCP|*** Protestos ***
Ministro de Estado e das Finanças|Ministro|Uma outra questão, que aqui tem vindo a ser expressa, tem a ver com as condições de mercado com que nos poderemos confrontar para levar a cabo estas privatizações.\n Srs. Deputados, não pensemos que as condições de mercado que, hoje, vivemos são condições nas quais o Estado vai agora fazer as operações. Não! Nós temos um programa de privatizações para um horizonte até 2013. Temos pela frente mais de três anos, três anos e meio, mais propriamente, para levar a cabo essas privatizações. Portanto, acho que, neste momento, não podemos estar excessivamente preocupados com as condições actuais e conjunturais em relação a um programa a três anos e meio.\n Obviamente que esperamos que as condições venham a melhorar e que o Estado tenha condições propícias para levar a cabo essas operações de privatização. Isso também depende da nossa capacidade de governação e de condução da nossa política económica e financeira.\n Quanto à questão dos monopólios naturais, que aqui foi levantada, gostaria de frisar o seguinte: os monopólios naturais, quando forem, de facto, monopólios naturais, serão salvaguardados, isto é, ou por uma participação dominante do Estado ou por regulação adequada, garantir-se-á a defesa do interesse público e, obviamente, o limite ou os limites do poder do monopólio, que resultam dessa natureza natural do monopólio.\n Chamo a atenção do Sr. Deputado Telmo Correia para o facto de os CTT não serem monopólio natural!
Telmo Correia|CDS-PP|São serviço público!
Ministro de Estado e das Finanças|Ministro|O Sr. Deputado referiu os CTT como um exemplo de monopólio natural, mas não são um monopólio natural.\n
Bernardino Soares|PCP|Era a REN!
Ministro de Estado e das Finanças|Ministro|Os CTT estarão abertos à concorrência. Há um interesse público a defender e ele será defendido, como já afirmei.\n Uma última observação para dizer ao Sr. Deputado Telmo Correia o seguinte: Keynes e Adam Smith não são tão contraditórios quanto isso, porque o Keynes não renegou, nunca, o Adam Smith!
|PS|*** Aplausos ***
Presidente|Presidente|Para pedir esclarecimentos, tem a palavra a Sr.ª Deputada Cecília Honório.
