Jerónimo de Sousa|PCP|Cala-se, perante aquela declaração de um guru do FMI que declara Portugal à beira da falência, Sr. Primeiro-Ministro?! Sr. Primeiro-Ministro, onde é que estavam esses senhores quando se tratou de pôr os Estados a abrir os cordões à bolsa, a pagarem a fraude, a especulação e a jogatana em que os dinheiros públicos serviram para acudir a essas situações? Onde é que estavam esses comissários e esses gurus?! Assim, Sr. Primeiro-Ministro, gostaria de saber que iniciativas pensa tomar junto da Comissão e dos países que estão na mira da especulação no sentido de, pelo menos no imediato, desencadearem acções que visem alguma flexibilização do Pacto de Estabilidade e Crescimento, embora fosse justo e certo fazer o questionamento do próprio Pacto.\n Sr. Primeiro-Ministro, a nossa preocupação tem um fundo: não assistir a um rasgo patriótico por parte do Governo na defesa do interesse nacional, da nossa economia e do futuro do País. Tenha esta preocupação, de certeza que os portugueses apreciariam! E deixe de ouvir essas empresas, esses que estiveram cegos, mudos e quedos perante a crise, as suas consequências e os seus causadores, e que nos vêm agora dar lições em relação ao futuro de Portugal.\n Portugal é um país que está em condições de afirmar a sua soberania, mas não o fará com as posições de silêncio que o Governo tem tido nesta matéria!
|PCP|*** Aplausos ***
Presidente|Presidente|Tem a palavra o Sr. Primeiro-Ministro.
Primeiro-Ministro|Primeiro-Ministro|Sr. Presidente, Sr. Deputado Jerónimo de Sousa, mais uma vez digo que o PEC português foi recebido pela Comissão Europeia com as seguintes palavras: credível, ambicioso, exequível, bastante concreto — o que significa uma avaliação positiva, sim! A isto chama o Sr. Deputado uma «boa nota»…!
Bernardino Soares|PCP|Positiva!
Primeiro-Ministro|Primeiro-Ministro|Pois digo-lhe, Sr. Deputado: antes uma «boa nota» do que uma má nota. E a verdade é que muitos PEC foram recebidos sem estas palavras e muitos tiveram necessidade de ser corrigidos. Não foi o que aconteceu com o PEC português. E isso, sim, teve um impacto nos mercados, que seguem com atenção estas avaliações. O Programa de Estabilidade e Crescimento estrutura e orienta a política económica para os próximos anos e é preciso dar conta da determinação naquilo que é um objectivo ao serviço do crescimento económico, que é, naturalmente, o objectivo de consolidação das nossas contas públicas.\n Segundo ponto, Sr. Deputado — talvez estejamos aqui no mais profundo dos nossos desacordos: acho que a defesa da soberania portuguesa se faz melhor partilhando a nossa soberania com outros, construindo o projecto europeu.\n O Sr. Deputado não acreditará nisso, mas acontece que essa é uma das mais profundas convicções que tenho. É que a ideia da soberania moderna exige uma partilha de soberanias e a construção de um espaço europeu onde, dessa partilha de soberanias, resultem benefícios para todos os cidadãos.\n Essa é a minha visão de soberania e também a minha visão de ser patriota hoje. É por isso que, na construção do projecto europeu, Portugal teve sempre uma posição bem vanguardista. Estivemos a favor do alargamento quando foi necessário para que a Europa se reencontrasse com a sua própria história e não hesitámos um minuto no calculismo: fomos a favor disso, porque esse foi talvez o contributo mais inestimável que a Europa deu para a paz no mundo e para um mundo melhor, o alargamento e a integração dos antigos países do bloco soviético nas democracias europeias.\n Em segundo lugar, batalhámos e tudo fizemos para estar na linha da frente da moeda única, que é uma das grandes conquistas do mundo, uma das grandes conquistas europeias, uma das grandes conquistas da política, e é por isso que Portugal apoiou e apoia as decisões da União Europeia com vista a transmitir um sinal claro de que se algum país, como é o caso da Grécia, tiver dificuldades nós cá estaremos para ajudar.\n Não dando nada à Grécia, mas emprestando dinheiro à Grécia, comprometendo-nos com isso, porque isso é da maior importância.\n É esse o meu entendimento do projecto da moeda única.\n Se um país como a Grécia tem dificuldades na colocação da sua dívida, o dever da União Europeia é estar presente e ao lado da Grécia. Por isso mesmo, nós não hesitámos um minuto ao estar ao lado daqueles países que se disponibilizaram imediatamente para construir um sistema. A Grécia ainda não decidiu utilizá-lo, mas se acaso o quiser utilizar estaremos disponíveis para isso. Não, mais uma vez, para dar alguma coisa aos gregos, que os gregos sabem, e têm orgulho nisso, que são eles que têm de resolver os seus problemas. Tal como nós. Nós não queremos nem nunca aceitaríamos que alguém nos ajudasse pagando as dívidas por nós.\n Nem os gregos querem isso. Querem, isso sim, uma solidariedade europeia que se expressou neste plano.\n
Jerónimo de Sousa|PCP|Não é isso!
Primeiro-Ministro|Primeiro-Ministro|É por isso que estou a favor desse plano. E farei tudo para ajudar se acaso ele for necessário aos gregos, porque sinto que o que acontece à Grécia é também o que pode acontecer à Europa. É preciso que a Europa esteja presente.\n Vejo nisto uma determinação firme em não abandonar uma das maiores conquistas do projecto europeu. E mais uma vez repito que esse projecto europeu é dos projectos mais generosos e mais importantes da nossa geração, das nossas vidas.\n
|PCP e de Os Verdes|*** Protestos ***
Primeiro-Ministro|Primeiro-Ministro|É por isso que a construção europeia, pese embora não ser do vosso agrado, é um projecto da maior importância para os europeus. Temos, pois, de estar na linha da frente da defesa do euro e da defesa da moeda única.\n
|PS|*** Aplausos ***
Presidente|Presidente|Tem a palavra a Sr.ª Deputada Heloísa Apolónia.
Heloísa Apolónia|Os Verdes|Sr. Presidente, Sr. Primeiro-Ministro, julgo que o pensamento do Sr. Primeiro-Ministro tem ficado claro neste debate no que concerne à questão da liberalização do preço dos combustíveis, que deu naquilo a que hoje estamos a assistir.\n O mercado gera injustiças, a entidade reguladora não faz nada e o Governo acha que o Estado não deve fazer nada. É nisto que dá! E é este o perigo que as pessoas têm de perceber que está no plano de privatizações de sectores estratégicos que o Estado quer desenvolver.\n Há sempre, a partir daí, um prejuízo para o consumidor e um benefício para os administradores. Esta é a conclusão absoluta e clara daquilo que o Governo defende e do pensamento do Sr. Primeiro-Ministro. Mas, depois, assumam as consequências dessas vossas opções.\n Sr. Primeiro-Ministro, segunda nota: o Governo farta-se de trabalhar para os números e não para as pessoas. Não é, Sr. Ministro da Defesa? Farta-se de trabalhar para os números, mas não para as pessoas. E o PEC é a prova provada disso. É claro que Bruxelas aprovou! Então, não havia de aprovar?! Ele foi feito direitinho para Bruxelas, mas tão tortinho para os portugueses, Sr. Primeiro-Ministro! Mas, por falar em trabalhar para os números, há um ano atrás, o Sr. Ministro da Administração Interna afirmou peremptoriamente que não havia definição de objectivos quantitativos para avaliar agentes e comandos da PSP. Agora, a Direcção Nacional da PSP define objectivos quantitativos para o desempenho dos diferentes comandos, ou seja, temos agora os agentes da PSP a trabalhar para as estatísticas e para os números e não para a segurança das pessoas.\n Sr. Primeiro-Ministro, isto é para ser levado a sério?
Presidente|Presidente|Tem a palavra o Sr. Primeiro-Ministro.
Primeiro-Ministro|Primeiro-Ministro|Sr. Presidente, gostaria que fosse o Sr. Ministro da Economia a responder à primeira pergunta e, se o Sr. Presidente estiver de acordo, o Sr. Ministro da Administração Interna também está disponível para responder à segunda questão que a Sr.ª Deputada Heloísa Apolónia colocou.\n
Presidente|Presidente|Tem a palavra, em primeiro lugar, o Sr. Ministro da Economia.
Ministro da Economia, da Inovação e do Desenvolvimento|Ministro|Sr. Presidente, Sr. e Srs. Deputados, Sr.ª Deputada Heloísa Apolónia, o nosso sistema de regulação de preços no sector energético e, em particular, no sector dos combustíveis assenta — o mundo separa-nos nessa visão — na existência de uma economia de mercado neste sector, ainda que regulada, ainda que com a existência de reguladores e de uma autoridade que zela pela concorrência.\n Sr.ª Deputada, aquilo que está sempre implícito nas intervenções sobre este tema que vêm desse lado do Parlamento é que talvez fosse mais vantajoso — acabou de ser dito pelo Sr. Secretário-Geral do Partido Comunista, Sr. Deputado Jerónimo de Sousa — haver preços regulados, preços administrados. Sr.ª Deputada, nós sabemos bem onde é que conduzem os preços regulados e administrados: conduzem sempre a serem outros a pagar aquilo que não é pago pelo preço! E asseguro-lhe que quem paga esse diferencial são sempre aqueles que mais pagam em todas as circunstâncias! Aquilo que está provado, Sr.ª Deputada, é que, no que toca aos combustíveis — ainda em Fevereiro a Autoridade da Concorrência aqui esteve, no Parlamento, a discutir e a mostrar os dados da formação de mercado —, de facto, pelos dados conhecidos — e ninguém foi capaz de o desmentir —, não existe cartelização nos preços dos combustíveis.\n No entanto, o Governo considera que, face à oscilação dos preços do petróleo e do gás natural, que são a base da formação do preço dos combustíveis, deve haver uma atenção redobrada sobre a forma como esses acréscimos se fazem repercutir nos nossos combustíveis e, principalmente, sobre o ritmo como esses acréscimos se repercutem no mercado português.\n É assim que nós trabalharemos, naturalmente em conjunto com a autoridade de defesa da concorrência.\n
|PS|*** Aplausos ***
Presidente|Presidente|Tem agora a palavra o Sr. Ministro da Administração Interna.
Ministro da Administração Interna|Ministro|Sr. Presidente, Sr. e Srs. Deputados, Sr.ª Deputada Heloísa Apolónia, os objectivos fixados pela Direcção Nacional da PSP visam o adequado desenvolvimento da actividade operacional no âmbito da prevenção e repressão criminal e no domínio da segurança rodoviária.\n Esses objectivos são traçados em função de critérios operacionais e não em função dos resultados. São definidas metas em relação ao número de operações de fiscalização de trânsito, mas não em relação às contra-ordenações levantadas. O levantamento de autos de contra-ordenação não é um critério de avaliação individual dos agentes da PSP.\n Os objectivos não são estabelecidos individualmente, mas sim a nível de subunidade policial, após a avaliação da área de intervenção e respectivos problemas policiais.\n Em suma, o que eu disse há um ano continua a ser verdade.\n
Presidente|Presidente|Tem a palavra a Sr.ª Deputada Heloísa Apolónia.
Heloísa Apolónia|Os Verdes|Sr. Presidente, o Sr. Primeiro-Ministro está muito cansado. Já o admitiu há pouco. Temos de compreender. É que a sua própria demagogia também o cansa. É compreensível… Não levarei a mal…
|PS|*** Protestos ***
Heloísa Apolónia|Os Verdes|Queria dar outra oportunidade ao Sr. Primeiro-Ministro para passar a palavra a outro Ministro, que é o Ministro da Agricultura, mas já não dispõe de tempo para falar, pois os seus dois outros colegas esgotaram o tempo do Governo. Mas vai levar o recado na mesma.\n O Sr. Ministro da Economia pergunta-me onde é que levariam os preços regulados. Olhe, Sr. Ministro, aquilo que os portugueses estão a perceber é onde é que levam os preços desregulados, onde é que conduziu a liberalização do preço dos combustíveis.\n Os senhores querem assobiar para o lado, até fingir que a realidade não é aquela que, de facto, há. Por isso, o Sr. Ministro tem o descaramento de dizer que não há cartelização. Não há porque ninguém quer ver!
Ministro da Economia, da Inovação e do Desenvolvimento|Ministro|A senhora é que vê!
Heloísa Apolónia|Os Verdes|Sr. Ministro da Administração Interna, aquilo que disse há um ano é diferente daquilo que diz hoje. Mas o Governo tem uma mania que está espalhada por todos os membros do Governo: gostam de desdizer aquilo que disseram e, depois, gostam de dizer que aquilo que disseram não era bem aquilo que as pessoas ouviram.\n Não, aquilo que o Sr. Ministro disse é que também não havia definição de objectivos quantitativos para os comandos. Mas eles existem! Não existem objectivos individuais, ficamos mais descansados, mas existem para os comandos. Ou seja, esses comandos vão ter objectivos quantitativos de detenção de pessoas, de apreensão de armas, de caça à multa. Ou seja, vamos ter agentes da PSP a trabalhar para as estatísticas e não para a prevenção do cidadão e para a segurança, que se quer preventiva.\n Mesmo a terminar, Sr. Presidente, quero pedir ao Sr. Primeiro-Ministro que leve daqui um recado de Os Verdes: por favor, na União Europeia, votem contra a proposta de aprovação do primeiro transgénico que irá directamente para o nosso prato.\n A Bayer irá comercializar uma semente de arroz e um herbicida. Este arroz será pulverizado de herbicida, o que não é bom para a saúde pública.\n Por favor, que Portugal seja pró-activo e que aja com segurança ao nível da União Europeia para recusar a aprovação do cultivo deste transgénico no espaço europeu. É essa a vossa obrigação. Por favor, não façam tudo aquilo que a União Europeia vos quer impor, porque a União Europeia age em função de interesses económicos. Sejam pró-activos na recusa deste transgénico.\n
|Verdes|*** Aplausos ***
Presidente|Presidente|Sr. e Srs. Deputados, assim se conclui o nosso debate com o Sr. Primeiro-Ministro.\nEntretanto, temos ainda de votar um parecer da Comissão de Ética, Sociedade e Cultura, de que a Sr.ª Secretária vai dar conta.\n
Secretária|Celeste Correia|Sr. Presidente, Sr. e Srs. Deputados, o parecer é no sentido de autorizar o Sr. Deputado Altino Bessa (CDS-PP) a prestar depoimento por escrito, como testemunha, no âmbito de auto provindo do Tribunal Judicial de Guimarães – 2.º Juízo Cível (Processo 1118/09.0TBGMR).\n
Presidente|Presidente|Está em apreciação.\nPausa.\n Não havendo pedidos de palavra, vamos votar o parecer.\n Submetido à votação, foi aprovado por unanimidade.\n
Presidente|Presidente|Srs. Deputados, a próxima reunião plenária será na próxima quarta-feira, dia 21, e terá como ordem do dia uma interpelação ao Governo. Trata-se da interpelação n.º 5/XI (1.ª), apresentada pelo PSD, sobre política económica e social.\n Muito obrigado a todas e a todos.\n Está encerrada a sessão.\n
