Primeiro-Ministro|Primeiro-Ministro|…e eu afirmo que o melhor para obter imediatamente emprego e dinamismo económico – porque isto, mais uma vez, não é ideologia, é economia –, é mais investimento público. Isto é o que nos separa, é certo, mas reafirmo que qualquer economista…
Presidente|Presidente|Queira concluir, Sr. Primeiro-Ministro.
Primeiro-Ministro|Primeiro-Ministro|… será capaz de explicar em muito curto espaço de tempo e em poucas páginas por que é que o investimento público tem uma consequência mais imediata e mais rápida no emprego e no dinamismo económico do que a baixa de impostos.\n É por isso, Sr. Deputado, que, do meu ponto de vista, o modelo que estamos a seguir é o indicado para fazer o País sair da recessão e para que, no futuro, Portugal tenha uma economia mais competitiva e possamos apoiar quem efectivamente necessita numa altura de grave recessão económica.\n
|PS|*** Aplausos ***
Presidente|Presidente|Para formular perguntas ao Sr. Primeiro-Ministro, tem a palavra o Sr. Deputado Paulo Portas.\n
Paulo Portas|CDS-PP|Sr. Presidente, Sr. Primeiro-Ministro, cada um acredita naquilo que quer.\nO que lhe digo é que com um crescimento económico que não supera 1% não se gera emprego e, não se gerando emprego, não se consegue nem dinamizar a economia nem reduzir a fractura social.\n Por isso, Sr. Primeiro-Ministro, falo muito concretamente sobre questões que nos separam.\n O que é que o Sr. Primeiro-Ministro entende que deve dizer a um pequeno e médio empresário que no ano passado, ano de crise, não teve lucros e que, de acordo com a sua política, tem de efectuar o pagamento especial por conta por conta dos prejuízos que teve no ano passado?
|CDS-PP|*** Aplausos ***
Presidente|Presidente|Para responder, tem a palavra o Sr. Primeiro-Ministro.
Primeiro-Ministro|Primeiro-Ministro|Sr. Presidente, Sr. Deputado Paulo Portas, o que digo a um empresário neste momento é que estaremos ao lado das empresas, mas não faremos nada que reduza a confiança, isto é descer impostos, porque isso seria irresponsável e colocaria em causa a necessidade de consolidação orçamental no futuro.\n
|PS|*** Aplausos ***
Presidente|Presidente|Tem a palavra o Sr. Deputado Paulo Portas.
Paulo Portas|CDS-PP|Sr. Presidente, Sr. Primeiro-Ministro, passo à segunda questão que nos separou.\n Em 2007, o Primeiro-Ministro cometeu um erro: o de não admitir polícias nem guardas-republicanos, confiando numa suposta substituição dos efectivos por actuais administrativos. Isso não aconteceu! Em 2009, depois de muita pressão do CDS, pelo seu lado, das forças de segurança e de quem as dirige (com toda a razão), fez um concurso para a admissão de efectivos na PSP e na GNR. Ainda bem que o fez! Em 2010, olha-se para o Orçamento e não está lá a verba para o concurso normal de entrada de polícias nem de guardas-republicanos.\n Medem-se os prazos: sete meses para preparar o concurso, nove para dar treino e instrução aos polícias e aos guardas, que no caso da GNR até é mais prolongado. Resultado de tudo isto, Sr. Primeiro-Ministro: voltou à política de 2007 e num momento em que a insegurança é preocupante, em que o aumento da criminalidade é preocupante, sobretudo nas zonas urbanas, vamos ter um ano de 2010 e meio ano de 2011 sem reforço prático de efectivos e sem incorporação nacional normal, a necessária na PSP e na GNR.\n O que é que isto tem de grave? É porque o Programa do Partido Socialista, aquando das eleições, dizia que era preciso voltar à política dos concursos anuais para reforçar os efectivos, e isto não acontece no Orçamento para 2010.\n Quero dizer-lhe, com toda a franqueza, o seguinte: preocupe-se em fazer o que estiver ao seu alcance para que os concursos normais sejam feitos o mais rapidamente possível, não desiluda outra vez a confiança das forças de segurança e dê uma resposta à população, porque o Estado tem de ser forte relativamente às questões da insegurança e da criminalidade!
|CDS-PP|*** Aplausos ***
Presidente|Presidente|Sr. Primeiro-Ministro, tem a palavra.
Primeiro-Ministro|Primeiro-Ministro|Sr. Presidente, Sr. Deputado Paulo Portas, já que falou nas negociações com o Governo e naquilo que nos separou, também quero referir essa separação.\n O que nos separou foi, em primeiro lugar, o CDS achar que deveríamos ter uma redução de 50% do Pagamento Especial por Conta (PEC). O Governo não está de acordo!
Vozes do PS|PS|Muito bem!
Primeiro-Ministro|Primeiro-Ministro|Em segundo lugar, o CDS também achava que devíamos aumentar as pensões mínimas. O Governo não esteve de acordo!
Paulo Portas|CDS-PP|Fiscalizando o rendimento mínimo, Sr. Primeiro-Ministro!
Primeiro-Ministro|Primeiro-Ministro|Ó Sr. Deputado, estou a referir aquilo que nos separou, porque no caso do rendimento mínimo nós próprios colocámos na nossa proposta de Orçamento o que nos parece ser razoável: uma avaliação dessa prestação e até uma perspectiva de maior exigência no controlo dos beneficiários.\n Em terceiro lugar, o Sr. Deputado referiu a questão do número de polícias e de guardas nacionais republicanos que vamos admitir. Vamos iniciar imediatamente esse processo de abertura de concurso.\n Quero recordar-lhe — como já fiz muitas vezes, mas o Sr. Deputado olha para o lado como se nada fosse — que na última legislatura houve um aumento líquido do número de polícias da ordem dos 1200. Desculpe, o Sr. Deputado tem de ter isto em consideração.\n Os Srs. Deputados compreendam: o que o CDS nos pedia era que reduzíssemos o PEC em 50%; que aumentássemos as pensões mínimas, pois já as temos aumentado acima da inflação; e que tivéssemos um concurso de polícias e de guardas nacionais republicanos — para admissão de cerca de 2000, já não me lembro exactamente…
Vozes do CDS-PP|CDS-PP|Mil!
Primeiro-Ministro|Primeiro-Ministro|Ora bem, os Srs. Deputados reconhecerão que isto significa menos receita e mais despesa: menos receita no PEC e mais despesa no resto!
Presidente|Presidente|Tem de concluir, Sr. Primeiro-Ministro.
Primeiro-Ministro|Primeiro-Ministro|Foi isto que nos afastou.
Paulo Portas|CDS-PP|Não é verdade!
Primeiro-Ministro|Primeiro-Ministro|Mas o Sr. Deputado não tente disfarçar aquilo que nos afastou. Foi isto!
Paulo Portas|CDS-PP|Não é verdade!
Primeiro-Ministro|Primeiro-Ministro|Apesar de tudo, Sr. Deputado, o que tenho a dizer, pela parte do Governo, é que conduzimos negociações muito detalhadas e pormenorizadas com o CDS e aprendemos com elas.\n Aprendemos com as posições do CDS e espero que os senhores tenham retirado igual ensinamento das conversas com o Governo.\n Finalmente, Sr. Deputado, quero chamar a sua atenção para uma coisa…
Presidente|Presidente|Tem mesmo de concluir, Sr. Primeiro-Ministro.
Primeiro-Ministro|Primeiro-Ministro|Quando o Sr. Deputado diz que Portugal está sob vigilância, quero dizer-lhe que não é apenas Portugal que está sob vigilância! Todos os países do mundo o estão!! Estão sob vigilância das agências internacionais e dos mercados os Estados Unidos, com um défice de 12,5%; o Reino Unido, que tem um défice de 11,6%, e a Espanha.\n
Presidente|Presidente|Tem de concluir, Sr. Primeiro-Ministro.
Primeiro-Ministro|Primeiro-Ministro|Portanto, Sr. Deputado, recuso essa visão de que todo o mundo está a olhar para Portugal como se fossemos um caso isolado.\n Sr. Deputado, isso não é verdade, isso não é justificável e peço que corrija essa observação, porque a verdade é que todos os países desenvolvidos do mundo que têm défices estão, naturalmente, sob vigilância.\n São todos, não é apenas o nosso.\n
|PS|*** Aplausos ***
Paulo Portas|CDS-PP|Sr. Presidente, peço a palavra.
Presidente|Presidente|Para que efeito, Sr. Deputado?
Paulo Portas|CDS-PP|Sr. Presidente, para uma curta interpelação à Mesa.
Presidente|Presidente|Tem a palavra, Sr. Deputado.
Paulo Portas|CDS-PP|Sr. Presidente, interpelo a Mesa para pedir ao Sr. Presidente que distribua ao Sr. Primeiro-Ministro as normas administrativas, que lhe farei chegar, segundo as quais para fazer um concurso de entrada na polícia são precisos sete meses para preparar o concurso, mais nove meses para dar treino e instrução. Nove, mais sete, são 16. Estamos em Fevereiro de 2010, o que significa que só haverá polícias e guardas na rua, com a nova incorporação, a fazer policiamento de proximidade já com o próximo ano bem adiantado ou, no caso da guarda, quase a chegar ao fim!
Vozes do CDS-PP|CDS-PP|Muito bem!
Paulo Portas|CDS-PP|Este é que é o erro! Deveria ter feito os papéis e os documentos há muitos meses atrás!
Vozes do CDS-PP|CDS-PP|Muito bem!
Paulo Portas|CDS-PP|Por fim, Sr. Primeiro-Ministro, em matéria de advertência externa, quero dizer-lhe que Portugal não é a Grécia, mas tem de dar sinais seguros de que não quer ser a segunda Grécia!
|CDS-PP|*** Aplausos ***
Presidente|Presidente|Tem a palavra o Sr. Deputado Francisco Louçã… Pausa.\n Peço desculpa, mas o Governo acaba de sinalizar à Mesa que também quer interpelá-la.\n Sr. Primeiro-Ministro, tem a palavra para o efeito.\n
Primeiro-Ministro|Primeiro-Ministro|Sr. Presidente, desculpará, mas também quero usar da palavra para responder ao Sr. Dr. Paulo Portas. Estamos num debate, o Sr. Deputado Paulo Portas já tinha esgotado o seu tempo e quis ter uma última intervenção.\n Bom, sou muito tolerante quanto a isso,…
Paulo Portas|CDS-PP|O Sr. Presidente é que é!
Primeiro-Ministro|Primeiro-Ministro|… mas também quero ter o direito de responder-lhe.
Presidente|Presidente|Está concedida a palavra, Sr. Primeiro-Ministro. Mas para lhe ser concedida tinha de ser pedida.\n
Primeiro-Ministro|Primeiro-Ministro|Bem me esforcei… Risos.\n … a fazer sinal para que o Sr. Presidente ma pudesse conceder.\n
Presidente|Presidente|Tem a palavra para interpelar a Mesa.
Primeiro-Ministro|Primeiro-Ministro|Sr. Presidente, Sr. Deputado Paulo Portas, quero dizer-lhe, em primeiro lugar, que a vigilância que existe sob o nosso País existe sob todos os países europeus, e sob todos os que estão numa situação orçamental que é pior do que a situação portuguesa. Já tive ocasião de referir que os Estados Unidos estão com um défice de 12,5%, e também estão com um défice superior ao nosso o Japão e o Reino Unido.\n Desculpe, mas o facto de termos Deputados portugueses a dizerem que todo o mundo está a olhar para nós não só é um exagero como é até, digamos, uma visão um pouco paroquial da situação e não tem qualquer fundamento.\n É claro, diz o Sr. Deputado, que devíamos fazer algo para não sermos uma segunda Grécia. Olhe, foi justamente por isso que não aceitámos as propostas do CDS de redução do PEC em 50%!! Foi justamente por isso que não aceitámos as propostas de aumentar as pensões mínimas.\n
|PS|*** Aplausos ***
Primeiro-Ministro|Primeiro-Ministro|Ó Sr. Deputado, responda-me lá com franqueza: então, nós íamos dar bons sinais aos mercados aumentando pela segunda vez, e de forma extraordinária, as pensões mínimas?
Paulo Portas|CDS-PP|Cortando o rendimento mínimo!
Primeiro-Ministro|Primeiro-Ministro|O que é que um analista pensaria disso? Depois, iríamos dizer também a esses tais mercados «sim, o primeiro passo é este: vamos reduzir em 50% o PEC». Ó Sr. Deputado, tamanha incoerência… Bem sei que quando se está na oposição não se tem responsabilidades e se pede «sol na eira e chuva no nabal»… O Sr. Deputado desculpará, mas isso foi exagerado!! Finalmente, Sr. Deputado, vamos fazer o que devemos em matéria de segurança.\n
Nuno Magalhães|CDS-PP|Vão, vão…!
Primeiro-Ministro|Primeiro-Ministro|Mas há um número que o Sr. Deputado não contesta: na última legislatura, houve um saldo líquido positivo de 1200 polícias. Isto que dizer investimento na segurança.\n
|PS|*** Aplausos ***
Presidente|Presidente|Para formular as suas perguntas, tem a palavra o Sr. Deputado Francisco Louçã.
Francisco Louçã|BE|Sr. Presidente, Sr. Primeiro-Ministro, bom dia.\nNum momento de ternura deste debate, a Presidente do PSD anunciou aspirar pelo dia em que possa acusar o Governo das mesmas «manigâncias orçamentais» de que o Governo acusa a passada gestão das direitas. Pois é mesmo sobre manigâncias orçamentais que lhe quero falar, Sr. Primeiro-Ministro, porque há quatro meses os portugueses acreditaram em si nas eleições e o Governo assegurou, de facto, que o défice estava controlado em 5,9%.\n Se os portugueses tivessem sabido que faltariam 5000 milhões de euros, bem poderiam antecipar a manigância de um acordo com as direitas para a aprovação de um Orçamento que reduz os salários, reduz as pensões, reduz o investimento público e, por exemplo, diz aos enfermeiros, que estão agora em greve, que a estes licenciados não reconhece o mesmo estatuto de todo e qualquer licenciado no serviço público e, portanto, lhes quer pagar 700 € líquidos numa profissão especializada.\n
Vozes do BE|BE|Muito bem!
Francisco Louçã|BE|Mas a manigância pior é faltar à promessa, porque, Sr. Primeiro-Ministro, é nos momentos de dificuldades que é preciso rigor, é nos momentos de dificuldades que é preciso responsabilidade. E, Sr. Primeiro-Ministro, leio nos jornais que os 10 maiores investidores na bolsa ganharam 5000 milhões de euros este ano. Sei que o Sr. Primeiro-Ministro não quer ouvir e está muito entretido com a conversa com os seus ministros, mas esses dez investidores ganharam 5000 milhões este ano. Tivessem vendido as acções e qual era o imposto que pagavam? Zero cêntimos!! Ora, o Governo prometeu aos portugueses que aqui haveria igualdade, que agora haveria igualdade, e não há! É por isso que é tão fácil um acordo com a direita.\n Pergunto-lhe, por isso, Sr. Primeiro-Ministro, sobre soluções, responsabilidade e rigor. Como é que o Sr.\n Primeiro-Ministro pode olhar nos olhos de um trabalhador e dizer-lhe: «o seu salário paga 20, 30 ou 40% de IRS» e, ao mesmo tempo, que quem ganhou 5000 milhões de euros na bolsa não paga um cêntimo de imposto sobre o rendimento?!
|BE|*** Aplausos ***
Presidente|Presidente|Para responder, tem a palavra o Sr. Primeiro-Ministro.
Primeiro-Ministro|Primeiro-Ministro|Sr. Presidente, Sr. Deputado Francisco Louçã, o senhor classifica o resultado de uma negociação política como manigância. Isso diz tudo! O Sr. Deputado acha que os resultados das negociações que o Governo encetou com todos os partidos foram uma manigância com a direita. Antes acusava o Governo de não dialogar, de ser arrogante, de ser distante, de querer impor a sua vontade… Assim que o Governo negoceia diz: «lá estão eles a fazer manigâncias».\n Sr. Deputado, não sei porquê, mas vejo aí um certo ciúme… Risos do PS e do BE.\n … pelo facto de o Bloco de Esquerda achar que tivemos um sucesso político na negociação. O que o Sr.\n Deputado realmente pretende é diminuir o que o País todo considerou um sucesso político.\n Isso é um sucesso político para o Governo? É, sem dúvida, mas é principalmente um sucesso político para o País! Claro está que o Sr. Deputado, como sempre nos habituou, não é capaz de argumentar e dispensa-se de argumentar. O que o Sr. Deputado sabe fazer é acusar! Vem logo com manigâncias!!! E vem acusar, em particular, o Partido Socialista! Há que tempos que o seu discurso político não passa disso! Dispensa-se de argumentar, de apresentar de fazer julgamentos!! Mas, Sr. Deputado, quem acaba por julgar, são os portugueses!
Vozes do BE|BE|Exactamente!
Primeiro-Ministro|Primeiro-Ministro|Sim, exactamente!…
Francisco Louçã|BE|Nisso, estamos de acordo!
Primeiro-Ministro|Primeiro-Ministro|É exactamente isso! Porque é típico dos partidos da esquerda mais radical, depois de perderem as eleições, ou se alguém as ganha, virem imediatamente dizer, três meses depois, que, «se as eleições fossem agora, então, nós perderíamos as eleições e, agora, é que ia ser!…»
Fernando Rosas|BE|*** Protestos ***
Primeiro-Ministro|Primeiro-Ministro|Esse preconceito de pretender interpretar a vontade soberana e global dos portugueses é apenas um preconceito de superioridade e, devo dizer-lhe — para quem, há tanto tempo, está na política… —, um bocadinho já «passado» e um bocadinho, até, insuportável no debate político.\n
|PS|*** Aplausos ***
Primeiro-Ministro|Primeiro-Ministro|Depois, outro aspecto que considero surpreendente e relevante: é que temos aqui um partido de esquerda que critica o Governo por ter défice! Temos um partido da esquerda mais radical que critica por existir défice!… Olhe, Sr. Deputado, há duas coisas que um político deve saber sobre recessão económica: é que, nas alturas de recessão económica, os Estados devem fazer um esforço para colocarem na economia estímulos orçamentais e, portanto, apostarem na subida do défice público para melhorar a situação económica. Foi isso o que fizemos e é surpreendente que o Sr. Deputado venha agora dizer que 9,3% é exagerado.\n
Francisco Louçã|BE|É exagerado?! Não me ouviu dizer isso!
Primeiro-Ministro|Primeiro-Ministro|Desculpará, Sr. Deputado, mas considero que essa não é uma análise correcta: o nosso défice e o nosso esforço orçamental foram para salvar muita gente do desemprego e para salvar muitas empresas de irem à falência! Finalmente, o Sr. Deputado diz: «Mas, então, as mais-valias?».\n Ó Sr. Deputado, sei bem o que está no meu Programa! Talvez o senhor…
Francisco Louçã|BE|*** Protestos ***
Primeiro-Ministro|Primeiro-Ministro|Sim!
Presidente|Presidente|Queira concluir, Sr. Primeiro-Ministro.
Primeiro-Ministro|Primeiro-Ministro|Olhe, até sei o que está no seu!
Francisco Louçã|BE|Eu, também!
Primeiro-Ministro|Primeiro-Ministro|Sim, sim!… Nós ainda estamos à espera de que o Sr. Deputado apresente legislação para acabar com os benefícios fiscais nos PPR! Ainda estamos à espera de que Sr. Deputado apresente a sua legislação para acabar com os benefícios fiscais na saúde! Sei que os Srs. Deputados vão meter isso de lado e na gaveta, mas, Sr. Deputado, cá estarei para lho recordar!… Sei o que está no meu Programa, que é o seguinte: vamos taxar as mais-valias, em linha com as melhores práticas europeias e, até, mundiais. Mas vamos fazê-lo nesta Legislatura!
Vozes do BE|BE|Ahhh!…
Primeiro-Ministro|Primeiro-Ministro|É o que está lá, Sr. Deputado!
|BE|*** Protestos ***
Primeiro-Ministro|Primeiro-Ministro|Ah!… Vão fazer o mesmo quanto aos PPR?! Risos do BE.\n Ah, bom! Muito bem! Cá estaremos à espera, Sr. Deputado! Agora, considero que seria um erro, num momento em que os mercados de capitais estão a recuperar daquilo que foi uma situação muito difícil no ano passado…
José Gusmão|BE|30%!
Primeiro-Ministro|Primeiro-Ministro|… é um erro, neste momento, mexer nessas mais-valias. Mas fá-lo-emos, para obter mais justiça.\n Mas reparo que o Sr. Deputado Francisco Louçã, para falar nisto, não falou noutras medidas no Orçamento. O Sr. Deputado nada tem a dizer quanto aos bónus no sector financeiro? Não apoia essa medida?
Presidente|Presidente|Tem de concluir, Sr. Primeiro-Ministro.
Primeiro-Ministro|Primeiro-Ministro|Bem..., ou tem vergonha de dizer que apoia qualquer medida do PS? Talvez não lhe fique mal, Sr. Deputado, fazer uma referência a isso...!
Helena Pinto|BE|Não temos vergonha alguma!
Primeiro-Ministro|Primeiro-Ministro|Finalmente, Sr. Deputado, não encontra no Orçamento uma medida que diz respeito à utilização de benefícios fiscais pelos sectores financeiros e, pela primeira vez, nós termos definido, como limite para a redução fiscal, a taxa de 18,25% como taxa efectiva de imposto? Não lhe parece que essa é uma medida que vai no bom sentido?
Presidente|Presidente|Tem mesmo de concluir, Sr. Primeiro-Ministro.
Primeiro-Ministro|Primeiro-Ministro|Ou o Sr. Deputado só faz intervenções, não para analisar o Orçamento, mas para atacar tudo o que o Orçamento não tem ou deveria ter, no seu ponto de vista?!
|PS|*** Aplausos ***
Presidente|Presidente|Tem a palavra o Sr. Deputado Francisco Louçã.
Francisco Louçã|BE|Sr. Presidente, Sr. Primeiro-Ministro, fará o favor de não medir o Bloco de Esquerda pela bitola do Governo!
Vozes do PS|PS|Ahhh!…
Francisco Louçã|BE|Nós não temos afixado, no nosso Gabinete: «Amanhã cumpre-se a promessa!».\n
Cecília Honório|BE|Muito bem!
Francisco Louçã|BE|Nós aplicamos o nosso Programa, batemo-nos por ele e não recuamos perante dificuldades! E é por isso que é agora que é preciso seriedade!
|PS|*** Protestos ***
Francisco Louçã|BE|Mas vamos à questão do ciúme, Sr. Primeiro-Ministro — «ciúme», diz-nos o Sr. Primeiro-Ministro. O Sr.\n Primeiro-Ministro «pôs-se à janela», com aquela conversa: «quem quer casar com a carochinha, que é rica e bonitinha?»… Risos.\n Mas o que o senhor tem a oferecer é, naturalmente, a política da direita: baixar os salários! Acha que isso é responsabilidade?! Baixar as pensões! Acha que isso é responsabilidade?! E vamos à questão crucial da economia. Diz-nos que, em dificuldades, é preciso rigor e investimento.\n O Sr. Primeiro-Ministro, aliás, chegou ao ponto de aqui, num debate quinzenal, me dizer o seguinte: «O dever moral de um governo é fazer mais investimento público, seja qual for a opinião das agências de rating!».\n
Cecília Honório|BE|Muito bem!
Francisco Louçã|BE|Ora, eu conheço os números deste Orçamento: o senhor baixa o investimento público, baixa o PIDDAC 25,4%! O senhor, em 2005, quando havia crescimento económico, investia 6700 milhões; agora, quando há crise, investe pouco mais de 4000!
Vozes do BE|BE|Exactamente!
Francisco Louçã|BE|O senhor diz uma coisa e faz outra! «Dá com uma mão e tira com outra»!!
Cecília Honório|BE|Exactamente!
Francisco Louçã|BE|Reduz o investimento público! Segundo o seu critério, isto é o fracasso absoluto! E uma manigância é dizer uma coisa aos portugueses e fazer outra! Isso é falta de responsabilidade! E, Sr. Primeiro-Ministro, é aí que o seu Governo tem de ser atacado e é aí que o Bloco de Esquerda o critica.\n
|BE|*** Aplausos ***
Presidente|Presidente|Tem a palavra o Sr. Primeiro-Ministro.
Primeiro-Ministro|Primeiro-Ministro|Sr. Presidente, Sr. Deputado Francisco Louçã, o que o Sr. Deputado pretende é apoucar e diminuir aquilo que é, inegavelmente, um sucesso político: um sucesso político da negociação do Governo com os partidos e um sucesso político também para o País, e uma garantia de governabilidade, que, é certo, nada interessa, nada!, ao Bloco de Esquerda.\n
Fernando Rosas|BE|*** Protestos ***
Primeiro-Ministro|Primeiro-Ministro|Em segundo lugar, fica clara também a sua ideia de democracia: quando um governo se decide a negociar com os outros, o Sr. Deputado acha que é uma «carochinha posta à janela». Não é uma «história da carochinha»; é apenas democracia!
Vozes do BE|BE|Ahhh!…
Primeiro-Ministro|Primeiro-Ministro|E o Sr. Deputado ri-se, com essa pequena história para «encantar telejornais».\nO Sr. Deputado desculpe, mas eu levo isso mais a sério. Eu acho que isto é fazer aquilo que a democracia nos pede para que seja feito.\n Finalmente, investimento público, Sr. Deputado: o investimento público sobe 3% neste Orçamento! E ficamos à espera da seriedade para que o Sr. Deputado apresente os projectos de lei que constam do seu Programa.\n
|PS|*** Aplausos ***
Presidente|Presidente|Tem a palavra o Sr. Deputado Francisco Louçã.
Francisco Louçã|BE|«Manigâncias», «seriedade» e «rigor»: vamos a isso, Sr. PrimeiroMinistro! O Sr. Primeiro-Ministro baixa o investimento público, sempre, ao longo desta Legislatura; os piores anos da crise foram no mínimo do investimento público. Promete uma coisa e faz outra! E desperdiça! Por isso, vou directamente a um dos desperdícios do Governo, que é a trapalhada da lei das finanças regionais da Madeira: o senhor fez uma lei que prejudicou a responsabilidade perante as regiões e os seus cidadãos; e, na trapalhada dessa lei, veio, depois, à última da hora, no Orçamento Rectificativo, introduzir um aumento de endividamento de 79 milhões de euros.\n Diz-se que o Ministro das Finanças até contrariou essa medida e ele não o desmentiu. Mas cá estava o dinheiro.\n E eu leio, agora, com surpresa, que o Governo permitiu, ao governo de Alberto João Jardim, avales de 1174 milhões de euros, acima do limite legal. Três vezes o que tem a Madeira! Acima do limite legal! E eu quero saber, Sr. Primeiro-Ministro, como é que diz aos enfermeiros, que têm de ter um salário abaixo do de um licenciado, que não pode ser respeitada a sua formação, que tem de ser desprezado o esforço que fazem para o Serviço Nacional de Saúde, para um despesismo sem regras, em que o Governo pode dar tudo a todos os favorecimentos...! E isso, Sr. Primeiro-Ministro, o senhor sabe como se chama: chama-se manigância!
|BE|*** Aplausos ***
Presidente|Presidente|Tem a palavra o Sr. Primeiro-Ministro, que não dispõe de muito tempo.
Primeiro-Ministro|Primeiro-Ministro|Sr. Presidente, Srs. Deputados, o Sr. Deputado Francisco Louçã não consegue fazer uma intervenção no Plenário sem dar uma «lição de seriedade» aos outros! Sr. Deputado, eu não lhe aceito nem lições de seriedade nem lições de moral! Poupe-nos a isso!! Claro está que o Sr. Deputado não consegue contribuir para um debate com o mínimo de elevação, um debate em que se possa referir aquilo que nos separa, mas que tenha um mínimo de elevação.\n
|BE|*** Protestos ***
Primeiro-Ministro|Primeiro-Ministro|Por isso, Sr. Deputado, a recomendação que lhe deixo é a de que faça menos acusações, menos ataques e mais argumentos.\n
Vozes do PS|PS|Muito bem!
