Afonso Candal|PS|Não é o Governo que impõe as regras à iniciativa privada, não é o Governo que tutela aquilo que os cidadãos fazem nos seus investimentos ou não investimentos. E, porventura, não deve ser o Governo a exercer a gestão, directa ou indirectamente, sobre algumas das empresas que, ainda hoje, têm essa força.\n É evidente que, em relação a alguns sectores, as privatizações estão fora de causa! Em relação a outros, elas estão equacionados e, daí, não vem dano nenhum para o serviço público. O serviço público ou o serviço universal de interesse público é, hoje, garantido por empresas de transportes, de telecomunicações, de energia, etc. Toda a gente tem acesso a esse serviço, não obstante uma parte significativa das empresas ser privada.\n O papel do Estado é o de garantir que esse serviço público é prestado a todos os cidadãos, independentemente da sua condição, porque é o elemento-base de coesão nacional, tenha a empresa, em grande parte dos casos, natureza pública ou privada. Noutros casos, assim não é. E esses outros casos não estão equacionados, não fazem parte do Programa de Estabilidade e Crescimento, não fazem parte do nosso compromisso em termos comunitários e em termos dos nossos parceiros da União Europeia! V. Ex.ª também sabe que aquilo que o Governo fez foi levar a zero os prémios dos gestores das empresas públicas. Devo dizer que, pessoalmente, entendo que fazia sentido manter uma componente variável. É evidente que a medida é datada, é de uma altura em que se pedem sacrifícios a todos, em especial àqueles que mais têm e, aí, incide também sobre os gestores públicos. Mas a verdade é que a gestão pública também tem de fazer depender a remuneração dos seus gestores da questão do mérito. É porque há muitas empresas públicas com prejuízo, mas isso não quer dizer que a gestão seja errada. Porventura, haverá outras com lucro, mas com uma gestão que poderia ser melhorada.\n Em todo o caso, aquilo que temos hoje em causa aqui e a discussão que fazemos é sobre o compromisso que o País assumiu junto dos parceiros europeus no sentido de privatizar — parcialmente, na maior parte dos casos — algumas das empresas públicas.\n
Bernardino Soares|PCP|E nós temos de aceitar!…
Afonso Candal|PS|Quais são as soluções que o Partido Comunista Português propõe para o País? Pense nisto: é porque, desde o 25 de Abril (ou reportando-me ao 25 de Abril), há 37 anos que gasta mais do que aquilo que tem para gastar! Gasta mais do que aquilo que tem para gastar! Há 37 anos!…
Bernardino Soares|PCP|E ainda cá estamos!…
Jerónimo de Sousa|PCP|E 20 anos são da vossa responsabilidade!
Presidente|Presidente|Queira concluir, Sr. Deputado.
Afonso Candal|PS|Qual é a solução? Em nome do futuro do País, em nome das gerações futuras, temos de pôr fim a esta lógica de que podemos gastar sempre mais do que aquilo que temos, porque alguém terá de pagar no futuro! Porventura, esse futuro, ainda parcialmente, estará mais próximo ou há o risco de estar mais próximo do que aquilo que era expectável.\n Mas é bom que as chamadas de atenção que têm sido feitas sobre a nossa situação nos levem também a tomar medidas para pôr cobro a uma despesa constantemente superior à receita, não em nome de quem cá anda — porventura, que interessa mais ao Partido Comunista Português, por outras razões —, mas em nome daqueles que vêm a seguir a nós. Em nome das novas gerações, o legado que temos de deixar não é um legado de uma «mão-cheia de anéis, mas sem dedos»…
Bernardino Soares|PCP|Claro, claro!…
Afonso Candal|PS|Diz o velho ditado português: «Vão-se os anéis, mas fiquem os dedos», e é importante…
Presidente|Presidente|Sr. Deputado, quando é que pretende concluir?
Afonso Candal|PS|Pretendo concluir já, Sr. Presidente.\nRisos.\n V. Ex.ª também diz que a dívida tem aumentado e as privatizações têm pouca importância, apesar de tudo, no aumento da dívida. Mas se não houvesse as privatizações para abater à dívida, porventura a dívida seria ainda maior!
Bernardino Soares|PCP|É quase a mesma coisa!…
Afonso Candal|PS|Portanto, Srs. Deputados do Partido Comunista, é importante é haver medidas para sanear as finanças públicas, em nome dos compromissos internacionais, em nome do presente mas, principalmente, em nome das gerações futuras!
|PS|*** Aplausos ***
Presidente|Presidente|Para responder, tem a palavra o Sr. Deputado Agostinho Lopes.
Agostinho Lopes|PCP|Sr. Presidente, Sr. Deputado Afonso Candal, obrigado pelas questões colocadas. Infelizmente, o tempo é curto para responder a uma intervenção…! Risos.\n De qualquer das formas, gostaria de começar por notar uma questão: eu julgava que me vinha explicar, relativamente a esta matéria de bónus e remunerações de alguns gestores de empresas com forte participação pública, a razão por que o Estado não utilizou o seu poder na divisão dos dividendos para impor a esses gestores aquilo que dizia querer como salários, vencimentos e remunerações.\n
Bernardino Soares|PCP|Ora bem!…
Agostinho Lopes|PCP|Talvez hoje o Sr. Ministro de Estado e das Finanças nos possa explicar porque é que o Governo abdicou desse poder que tem relativamente a algumas dessas empresas.\n
Vozes do PCP|PCP|Muito bem!
Agostinho Lopes|PCP|Depois, Sr. Deputado, em matéria de privatizações, depois de 20 anos de privatizações, depois de 36 000 milhões de euros de receitas de privatizações — e podíamos juntar mais, ou seja, depois de 50 000 milhões de euros de fundos comunitários —, os senhores, e os seus parceiros aí da bancada ao lado, quando estiveram à frente do governo, conduziram o País ao triste estado em que ele se encontra, Sr. Deputado!
Vozes do PCP|PCP|Muito bem!
Agostinho Lopes|PCP|Explique-nos como é que esse instrumento das privatizações foi uma política ajustada, adequada e correcta para responder aos problemas do País, para responder à situação que o País vivia!
Vozes do PCP|PCP|Muito bem!
Agostinho Lopes|PCP|O Sr. Deputado diz que nós somos em absoluto contra o capital estrangeiro nas empresas. Está enganado, Sr. Deputado!
Afonso Candal|PS|O Sr. Deputado é que disse, ali, da tribuna!
Agostinho Lopes|PCP|Não, não disse!
Afonso Candal|PS|Disse, disse!
Bernardino Soares|PCP|Ouviu mal!
Agostinho Lopes|PCP|Ouviu mal, mas permita-me que lhe explique. Não estamos contra investimento estrangeiro que venha para Portugal, que monte empresas novas — novas, Sr. Deputado! —, criando emprego, trazendo tecnologia, assegurando o crescimento do valor acrescentado e das exportações deste País.\n Estamos contra o capital estrangeiro que venha para Portugal para entrar em empresas que já existem, que já funcionam, que já produzem…
Vozes do PCP e de Os Verdes|Verdes|Claro!
Agostinho Lopes|PCP|… para, pura e simplesmente, devolver ao estrangeiro vultosos dividendos, como aconteceu em 2008!
Bernardino Soares|PCP|Claro!
Agostinho Lopes|PCP|Foram 20 000 milhões de euros, Sr. Deputado!!
|PS|*** Protestos ***
Agostinho Lopes|PCP|De facto, não estamos de acordo com esta vinda de capital estrangeiro para comandar estrategicamente empresas portuguesas nem para se apropriar dos rendimentos destas empresas portuguesas!
Vozes do PCP|PCP|Muito bem!
Agostinho Lopes|PCP|Mas o Sr. Deputado, certamente, vai poder esclarecer-nos, dizendo se está de acordo em que esse capital venha para cá, por exemplo, tome conta da EDP, da Galp ou da REN e leve os centros de decisão destas empresas para o estrangeiro, para os seus países. Responda-me a esta questão!
|PCP|*** Aplausos ***
Presidente|Presidente|Srs. Deputados, informo que há doze pedidos de esclarecimentos ao Sr. Ministro de Estado e das Finanças, que responderá em grupos de quatro.\n O primeiro inscrito é o Sr. Deputado Bernardino Soares, a quem dou a palavra para formular o seu pedido de esclarecimentos.\n
Bernardino Soares|PCP|Sr. Presidente, Sr. Ministro de Estado e das Finanças, o Sr. Ministro não referiu nem podia referir a legitimação do Governo no programa eleitoral e no Programa do Governo que apresentou à Assembleia, para fazer este programa de privatizações!...\n
Bruno Dias|PCP|Ora bem!
Bernardino Soares|PCP|É porque não existe! É porque este extenso programa nunca foi apresentado aos portugueses como um dos objectivos da política do Partido Socialista! E nem vale a pena dizer que a isso somos obrigados por imposições externas. A decisão é sempre nossa, a decisão é sempre do Governo e da Assembleia da República! É aqui que está a responsabilidade do que se vai fazer! O Sr. Ministro não se conseguiu explicar… Tentou, de forma técnica, esconder o problema de que nem do ponto de vista financeiro as privatizações compensam, quer porque se as empresas se mantiverem no Estado acabarão por dar mais dividendos ao Estado do que aquilo que significa o valor embolsado com as privatizações, quer porque as empresas, assim que são privatizadas, passam a pagar menos impostos, passam a usar mais benefícios fiscais e a diminuir assim a receita fiscal, como aconteceu no passado.\n
Miguel Tiago|PCP|Exactamente!
Bernardino Soares|PCP|Diz o Sr. Ministro que a entrada de capitais privados traz ganhos de eficiência às empresas públicas. Essa é a velha linha de que o que é público é incompetente e o que é privado é eficiente. Ora, Sr. Ministro, como é o senhor e o seu Governo que nomeiam o gestores das empresas públicas, talvez o incompetente aqui seja o Governo e os gestores que nomeia… Ou talvez até o façam de propósito, para degradar as empresas públicas e assim justificarem a sua privatização…!
Jerónimo de Sousa|PCP|Claro! Claro!
Bernardino Soares|PCP|Mas explique-nos lá qual foi o ganho de eficiência para a economia nacional que resultou de pagarmos combustíveis mais caros do que os outros países da Europa? Qual foi o ganho para a eficiência da economia nacional pagarmos a energia eléctrica mais cara do que outros países da Europa? Explique-nos onde é que ficou o serviço público para aquelas populações que ficaram sem transporte rodoviário por causa da privatização, há uns anos, da empresa nacional de transporte rodoviário de passageiros? Onde é que fica a eficiência nacional nessas matérias? Diz o Sr. Ministro que vai haver dinheiro para a educação, para a saúde e para o subsídio de desemprego..., quem o diz é o mesmo Governo que vai cortar agora mesmo no subsídio de desemprego, com a justificação mais uma vez da crise!...\n Explique-nos finalmente, Sr. Ministro, como é que uma empresa como os CTT, que tem um papel essencial no desenvolvimento e na coesão regional, na coesão social e que presta um serviço público indispensável às camadas mais favorecidas, vai cumprir bem o seu papel (e ainda por cima é lucrativa) se for privatizada? Explique-nos, se puder, como é que tudo isto ajuda o Estado português, como ajuda o nosso país a ser mais desenvolvido. É porque não ajuda, Sr. Ministro! Não ajuda!!
|PCP|*** Aplausos ***
Presidente|Presidente|Para pedir esclarecimentos, tem a palavra o Sr. Deputado Miguel Frasquilho.
Miguel Frasquilho|PSD|Sr. Presidente, Sr. Ministro de Estado e das Finanças, somos confrontados neste PEC com um enorme programa de privatizações. Diria mesmo, um megalómano programa de privatizações,...\n
Bernardino Soares|PCP|Até para o PSD!…
Miguel Frasquilho|PSD|… o que não deixa de ser surpreendente, atendendo ao actual momento que os mercados financeiros atravessam, que não é propriamente de uma grande saúde, como o Sr.\n Ministro concordará, e também porque nos três últimos anos as intenções do Governo em matéria de privatizações se saldaram por um rotundo zero.\n Os senhores previram sempre cerca de 1000 milhões de euros de encaixe de receitas de privatizações (2007, 2008 e 2009) e a verdade é que isso não foi cumprido. Ficou, aliás, próximo de zero em cada ano.\n Ora, esta realidade com que somos confrontados levanta-nos as maiores dúvidas. Não porque sejamos contra as privatizações. Naturalmente que não o somos.\n
Bernardino Soares|PCP|Bem me parecia que não era isso!…
Miguel Frasquilho|PSD|Somos favoráveis e concordamos com vários dos motivos que o Sr.\nMinistro elencou.\n
Bernardino Soares|PCP|Partilham! Convergem!…
Miguel Frasquilho|PSD|Mas, Sr. Ministro, deve haver, neste elencar de privatizações até 2013, uma estratégia devidamente coerente, devidamente calendarizada, devidamente ponderada. E não é a isso que assistimos aqui.\n Temos um montante global de receitas que se pretende obter com estas privatizações — cerca de 6000 milhões de euros — e temos montantes anuais, mas não se tem o ano em que a empresa x ou em que o sector x estará mais em foco. Portanto, Sr. Ministro, gostaria de perguntar-lhe qual é a estratégia que preside a estas privatizações que o Governo pensa executar até 2013.\n Recuso-me a acreditar que estejamos apenas perante uma venda por razões financeiras, uma privatização para abater à dívida pública, sem qualquer estratégia por detrás. É certo que as razões financeiras são importantes, mas, ó Sr. Ministro, não se pode privatizar tudo, com base unicamente em razões financeiras para abater ao endividamento público!...\n Por isso, gostaria de perguntar-lhe não só qual a estratégia global, mas também a estratégia para cada um dos sectores. Que estratégia para a energia, para os transportes, para as infra-estruturas, para as comunicações?! Em particular, Sr. Ministro, não posso deixar de questioná-lo sobre um caso em concreto: o caso da ANA.\n O Governo sempre referiu nos últimos anos que a privatização da ANA estaria associada à construção do novo aeroporto de Lisboa e à sua exploração, mas, na semana passada, o Primeiro-Ministro, no debate quinzenal, veio dizer — e tenho a notícia aqui, à minha frente — que estavam a reavaliar a privatização da ANA e que não era certo que fosse feita ao mesmo tempo que a construção do novo aeroporto. Ainda esta semana, ontem, o Sr. Ministro, na Comissão de Orçamento e Finanças, veio reafirmar que a ANA é para privatizar e para privatizar o quanto antes.\n Sr. Ministro, parece que estamos em presença de um Governo que não tem qualquer estratégia, que perdeu o norte, que perdeu o rumo e isso é a pior coisa que podia acontecer ao nosso país, sobretudo no momento delicado que atravessamos em termos de exposição internacional.\n Gostaria de o ouvir sobre todas estas questões, Sr. Ministro.\n
|PSD|*** Aplausos ***
Presidente|Presidente|Para pedir esclarecimentos, tem a palavra o Sr. Deputado José Manuel Pureza.
José Manuel Pureza|BE|Sr. Presidente, Sr. Ministro de Estado e das Finanças, o Sr. Ministro trouxe-nos aqui uma visão das privatizações segunda a qual as privatizações seriam ou integrariam «uma visão moderna da economia e do País».\n Nada mais falso, Sr. Ministro, porque as privatizações, bem o sabemos, fazem parte dessa tradição antiga, dessa tradição velha que é a tradição, aliás, fácil e indolente de animar, de alimentar, por parte do Estado, que o Estado dê o seu patrocínio a uma classe que é alérgica ao risco, que vive do «apetite» por uma renda generosa garantida! É por isso que as privatizações, frequentes vezes — como, aliás, vai ser, agora, o caso —, incidem, precisamente, sobre monopólios. É a garantia dessa renda sem quaisquer esforços, por parte dos operadores/compradores. Mas que esta estratégia seja agora conduzida por um Governo do Partido Socialista, isto, é particularmente revelador.\n E é por isso, Sr. Ministro, Sr.as e Srs. Deputados, que vale a pena ouvir vozes autorizadas sobre esta matéria. Cito uma dessas vozes: «Quando o País está em dificuldade e é preciso que o Estado tenha poder e capacidade monetária, que venha não somente de fora mas de dentro, para resolver os problemas que afectam as classes mais desfavorecidas — e é para isso que nós, socialistas, servimos, para servir as classes mais desfavorecidas —, é evidente que não podemos estar assim a desbaratar o nosso próprio património.\n Não tem sentido, não faz sentido» — esta voz é de Mário Soares.\n Não tem sentido, não faz sentido! É verdade!! Veja o Sr. Ministro o caso da ANA. Bem sabemos — e, ainda agora, o Sr. Deputado Miguel Frasquilho exprimiu a grande preocupação da direita nesta matéria — que, para a direita, o problema da construção do novo aeroporto não é o novo aeroporto! O problema, para a direita, é que o novo aeroporto seja ou não privatizado.\n
Bruno Dias|PCP|Lucros!
José Manuel Pureza|BE|Mas a isto o Governo já disse que sim, já disse que não, já disse que talvez e, por isso, era bom que clarificasse qual a intenção do Governo relativamente à ANA, Sr. Ministro! O que vai acontecer é que, com a privatização da ANA, em primeiro lugar, vai vender-se um monopólio, o que, Sr. Ministro, dá todas as garantias aos privados, evidentemente, de não terem qualquer esforço, de não terem qualquer risco, porque não vão estar sujeitos a qualquer mercado concorrencial. Vale a pena até perguntar o que vai acontecer às taxas aeroportuárias nos aeroportos das ilhas, depois de o operador privado tomar conta do negócio.\n Mas há mais: é a venda de um bem estratégico. Mas, se queremos ter uma visão estratégica para os aeroportos, designadamente para explorar a vantagem estratégica da posição de Portugal em relação a África e, sobretudo, em relação aos PALOP, o meu grupo parlamentar teme que esta privatização, que abre campo, como é evidente, à compra por operadores de outra orientação e de outra nacionalidade, venha a hipotecar essa posição estratégica.\n Bem sei, já adivinho, que o Sr. Ministro das Finanças nos vai dizer, como sempre tem dito, que não tem qualquer preconceito ideológico contra as privatizações, mas, Sr. Ministro, deixe-me dizer-lhe, com franqueza, que, de um Ministro das Finanças, espera-se, sobretudo, que tenha preconceitos contra negócios que são ruinosos para as finanças públicas e, de um Ministro das Finanças de um Governo socialista, espera-se, sobretudo, que não tenha preconceito contra a defesa dos recursos estratégicos para o País!
|BE|*** Aplausos ***
Presidente|Presidente|Também para pedir esclarecimentos, tem a palavra a Sr.ª Deputada Assunção Cristas.\n
Assunção Cristas|CDS-PP|Sr. Presidente, Sr. Ministro de Estado e das Finanças, o tema, hoje, leva-me a colocar, nesta primeira intervenção, dois conjuntos de questões, o primeiro dos quais tem a ver com a situação das empresas públicas.\n Como é sabido, o mercado não se interessa por empresas que não são lucrativas…
Jerónimo de Sousa|PCP|Ora bem!
Assunção Cristas|CDS-PP|… e, portanto, para as vender, Sr. Ministro, primeiro, tem de colocá-las a ponto de alguém as querer comprar. Portanto, da longa lista que aparece no PEC, de empresas a privatizar, as tais que contribuirão em 6000 milhões de euros, vemos, pelos últimos dados que estão disponíveis, que uma série delas, de que cito algumas, como o BPN, a INAPA, a Edisoft, o Grupo Empordef, a Sociedade Portuguesa de Empreendimentos, os Estaleiros Navais de Viana do Castelo, a TAP, a EMEF/CP, deram prejuízo. Pergunto-lhe, Sr. Ministro: qual é a estratégia do Governo para as empresas públicas, em geral, e estas, em particular, para que elas possam, realmente, apresentar-se vendáveis ao mercado? Pergunto-lhe também, Sr. Ministro — já lhe perguntei ontem, mas volto a perguntar —, se entende que há, neste momento, condições de mercado, ou que haverá, até ao final de 2013, para arrecadar os tais 6000 milhões de euros que permitirão abater, no seu conjunto, 2,4% da dívida, em percentagem do PIB.\n Sr. Ministro, já que o Sr. Ministro tanto gosta das declarações do Dr. Fernando Ulrich, lembro-lhe um importante estudo do BPI, o tal que falava da dívida portuguesa e do peso da dívida das empresas públicas, estimado em 10,7% da dívida consolidada. E pergunto-lhe se está, neste momento, em condições de nos dizer qual o custo anual dos juros dessa dívida, qual a consequência do aumento do spread no custo dessa dívida e qual o défice das empresas, após a apresentação dos resultados trimestrais.\n Como o Sr. Ministro referiu aqui que está a pensar em mecanismos de controlo do endividamento das empresas públicas, e esta era uma pergunta que tinha para lhe fazer, coloco-lhe a seguinte questão: pode especificar que mecanismos são esses, de curto e de longo prazos? Que plafonds existem e que regras há para os quebrar? Que medidas especiais estarão também, eventualmente, pensadas para as empresas mais endividadas e como as controlar? Aliás, isto liga-se à questão de as tornar vendáveis.\n Por outro lado, no que respeita ao corte da despesa, o Sr. Ministro também referiu aqui alguns pontos e, por isso, perguntaria se está disponível — e gostaria de obter respostas muito claras — para adoptar medidas que são urgentes e radicais, tais como limitar fortemente a aquisição de viaturas e imobilizado; não aumentar salários (aqui incluídos quaisquer bónus, prémios e outras formas de remuneração, como cartões de crédito, gasolina e outros); aplicar às empresas públicas a regra de «dois por um»;…
Pedro Mota Soares|CDS-PP|Muito bem!
Assunção Cristas|CDS-PP|… cortar, por exemplo, e no mínimo, 10% na subcontratação de pessoal, 20% nas despesas de consultoria e 30% com marketing e relações de publicidade.\n Agora, no que toca particularmente à ANA, que parece ser uma preocupação que o PSD colheu das nossas intervenções de ontem na Comissão de Orçamento e Finanças,…
Miguel Frasquilho|PSD|O quê?!...
Assunção Cristas|CDS-PP|… o Sr. Ministro afirmou ontem, a isso instado por uma pergunta do CDS, que vai manter o que está no PEC, de privatização da ANA. A minha pergunta — e peço desculpa por estar, outra vez, a formulá-la, mas tenho de o fazer, até porque as declarações do Sr. Primeiro-Ministro não são totalmente coincidentes — é a seguinte: quando será essa privatização? E está ou não ligada à construção do novo aeroporto de Lisboa? Qual é o valor estimado para essa venda? Considerando que isso já estava previsto no ano passado, pergunto-lhe, Sr. Ministro, até para perceber a decisão do Governo, no sentido de um eventual adiamento: qual era o valor previsto para o ano passado? Qual é a variação prevista para este ano? Quando está a pensar colocar a ANA à venda?
Pedro Mota Soares|CDS-PP|Muito bem!
Assunção Cristas|CDS-PP|Depois, Sr. Ministro, tenho de colocar-lhe um outro conjunto de questões que tem a ver com a própria utilidade e a viabilidade do novo aeroporto. Com a recente redução do número de passageiros, pergunto se os estudos feitos para justificar o novo aeroporto continuam ou não a ser actuais. Neste momento, a Portela chega perfeitamente…
Presidente|Presidente|Tem de concluir, Sr.ª Deputada.
Assunção Cristas|CDS-PP|Vou concluir, Sr. Presidente.\nNeste momento, a Portela chega perfeitamente para as necessidades. Até quando é que vai chegar? Mais: quando nós tivermos, no sonho do Governo, uma terceira auto-estrada para o Porto, mais o TGV e mais o aeroporto, será que todos estes meios de comunicação não irão entrar em concorrência uns com os outros?
Pedro Mota Soares|CDS-PP|Muito bem!
Assunção Cristas|CDS-PP|E, então, afinal, qual será o custo estimado para o financiamento de todos estes projectos? É porque, Sr. Ministro, e vou terminar, é preciso ver mais longe e perceber que, quando o sonho do Governo estiver concretizado, se alguma vez estiver concretizado, os fluxos de passageiros e as necessidades poderão ser muitíssimo diferentes e não vemos sítio algum onde isso esteja estudado e explicado.\n E pergunto-lhe, Sr. Ministro, para terminar, se é preciso relembrar aqui, hoje, o que aconteceu aos inúmeros estádios de futebol.\n
|CDS-PP|*** Aplausos ***
Presidente|Presidente|Para responder, tem a palavra o Sr. Ministro de Estado e das Finanças.
Ministro de Estado e das Finanças|Ministro|Sr. Presidente, Sr.as e Srs. Deputados, vou responder ao Sr.\nDeputado Bernardino Soares e, ao mesmo tempo, respondo também ao Sr. Deputado José Manuel Pureza, quanto à estratégia e legitimação do Partido Socialista para levar a cabo as privatizações.\n Em primeiro lugar, recordo que o Partido Socialista, sempre que foi Governo, levou a cabo operações de privatização, e importantes operações de privatização.\n
Bernardino Soares|PCP|É um argumento histórico!
Ministro de Estado e das Finanças|Ministro|Eu próprio, quando fui Secretário de Estado, entre 1995 e 1999, pude executar dois importantes programas de privatização na economia portuguesa.\n
Cecília Honório|BE|Não diga?!
Ministro de Estado e das Finanças|Ministro|A legitimação vem-me, pois, de trabalho feito neste domínio… Risos do PCP.\n … e também da própria lei. Temos um quadro legal ao abrigo do qual o Governo tem toda a legitimidade para levar a cabo a alienação de participações em empresas, sejam elas maioritária, minoritária ou exclusivamente detidas pelo Estado.\n Não tenho dúvidas quanto ao impacto positivo na economia portuguesa das privatizações que foram feitas ao longo dos últimos 20 anos: modernizou-se o nosso sistema produtivo,…
Bernardino Soares|PCP|O resultado está à vista!
Ministro de Estado e das Finanças|Ministro|… foram um estímulo à inovação e ao desenvolvimento tecnológico e constatamos, decorridos estes 20 anos, que temos um mais amplo acesso dos cidadãos a serviços públicos…
Bernardino Soares|PCP|E mais caro!
