Luís Fazenda|BE|Sr. Presidente, desejo, em nome do Grupo Parlamentar do Bloco de Esquerda, felicitá-lo pela sua reeleição no cargo.\n O Sr. Presidente Jaime Gama teve uma votação expressiva, que significa um respeito consolidado por parte de toda a Câmara. Isto, exactamente porque, na anterior Legislatura, para além de outras qualidades, como parlamentar e dirigente do Estado, que lhe conhecíamos, foi capaz, com muita sageza, de encontrar as convergências que a instituição parlamentar requer e que a democracia reivindica.\n Nesse aspecto, só podemos exprimir a nossa alegria no sentido de que seja possível manter este trabalho parlamentar e esta cooperação institucional.\n Sr. Deputadas, Srs. Deputados, Sr. Ministro dos Assuntos Parlamentares: Costuma dizer-se que a legislatura mais importante é aquela que começa — mas esta muito em especial, dado que não há maioria de um só partido. Isto devolve ao Parlamento uma centralidade acrescida, uma responsabilidade muitíssimo maior, não só na qualidade e na eficácia do debate político mas, sobretudo, na acuidade, na força e na capacidade de compromisso do processo legislativo.\n Creio que as portuguesas e os portugueses esperam de nós uma capacidade redobrada de afirmação do Parlamento e esta é, em muitas das circunstâncias, «a hora» do Parlamento perante o País.\n O Bloco de Esquerda empenhar-se-á numa oposição que não abdica do programa com que se fez sufragar junto dos portugueses e das portuguesas, mas será, no trabalho legislativo, na fiscalização do Governo e no debate político, uma oposição leal e cooperativa, sem deixar de ser verdadeiramente uma oposição de esquerda socialista nesta Câmara.\n Quero desejar a todas as Sr. Deputadas e a todos os Srs. Deputados as maiores felicidades no trabalho parlamentar e também naquilo que possa ser a sua realização pessoal agora aqui, na Casa da democracia.\n
|BE|*** Aplausos ***
Presidente|Presidente|Tem a palavra o Sr. Deputado Bernardino Soares.
Bernardino Soares|PCP|Sr. Presidente, quero cumprimentar todos os Srs. Deputados e todas as bancadas com quem naturalmente teremos as relações institucionais e parlamentares de correcção para que a Assembleia funcione nas melhores condições. Em especial, quero cumprimentar o Sr. Presidente pela sua reeleição e dizer-lhe que, da nossa parte, entendemos ter sido um sucesso a tentativa de atribuir ao debate parlamentar centralidade política, o que foi conseguido na Legislatura que agora terminou, bem como a modernização da Assembleia em tantos aspectos, incluindo o do seu Regimento, e a aplicação concreta de novas normas, o que permitiu, de uma forma criativa e adequada à realidade política, dar maior vivacidade e maior expressão a cada uma das correntes políticas expressas e representadas nesta Assembleia.\n No início da Legislatura anterior, parecia-nos que seria bem difícil a missão de um Presidente numa Assembleia de maioria absoluta, porque sempre é preciso garantir e ajudar a defender os direitos das oposições. No entanto, penso que, neste momento, podemos dizer que mais difícil será a missão de um Presidente num quadro de maioria relativa e com uma composição da Assembleia como a que temos — e ainda bem! — neste momento. Outras serão as exigências, mas estou certo de que, com o mesmo equilíbrio e a mesma equidistância, o Sr. Presidente irá conseguir levar a bom porto esta sua missão.\n Nesta última Legislatura, concordámos muitas vezes sobre o funcionamento da Assembleia e discordámos muitas vezes sobre questões políticas e de orientação política do País. Fico contente por não se ter cumprido uma parte do programa do Sr. Presidente no início da anterior Legislatura, parte essa que, felizmente, não se concretizou, mas, em relação a tudo o resto, penso que o balanço é positivo e esperamos desta nova Legislatura um novo impulso na melhoria do funcionamento da Assembleia e na sua vivacidade parlamentar.\n Pela nossa parte, com um grupo parlamentar reforçado e renovado, com uma grande vontade de defender as políticas que consideramos correctas para o País e de traduzir na Assembleia um compromisso de rotura e mudança que foi o que trouxemos do mandato que o povo nos atribuiu, cá estaremos para, nesta situação de maioria relativa, procurar que, havendo continuidade na presidência, não haja continuidade nas políticas da última Legislatura.\n
|Verdes|*** Aplausos ***
Presidente|Presidente|Tem a palavra a Sr.ª Deputada Heloísa Apolónia.
Heloísa Apolónia|Os Verdes|Sr. Presidente, Sr. e Srs. Deputados: Em nome do Grupo Parlamentar de Os Verdes, quero, em primeiro lugar, saudar e felicitar a reeleição do Sr. Dr. Jaime Gama, como Presidente da Assembleia da República.\n Julgo que a leitura que o Sr. Presidente faz desta reeleição e dos votos expressivos aqui ocorridos é inteiramente correcta e justa. Creio que esta reeleição, na forma como aconteceu, expressa bem o reconhecimento da presidência anterior e a confiança em relação a esta nova presidência.\n Gostava de realçar dois aspectos, extraordinariamente importantes, da presidência da Assembleia da República no mandato anterior: um prende-se com o profundo empenho na modernização deste Parlamento por via dos meios tecnológicos, mas também ao olhar dos portugueses, e no próprio debate político e, por outro lado, a procura permanente de abrir a Assembleia da República a todos os cidadãos. Considero isso extraordinariamente importante! Por outro lado ainda, o sentido de pluralidade que entendemos que o Sr. Presidente da Assembleia da República teve no mandato anterior. Mesmo no quadro de maioria absoluta, muitas vezes, o Sr. Presidente da Assembleia da República — permitam-me a expressão — «furou» na agenda parlamentar para dar mais voz às oposições e também reforçou, e contribuiu para reforçar, o nosso papel, de fiscalização ao Governo.\n Já aqui foi dito — e com inteira justiça, porque é óbvio — que este é o quadro parlamentar que os portugueses escolheram. Esta Assembleia da República assumirá um papel muito mais relevante face a este quadro parlamentar, nesta próxima Legislatura, porque as vozes serão mais plurais e terão mais força, no quadro de uma maioria relativa, como aqui temos.\n E, agora, aquilo que quero referir, concretamente, é que o Grupo Parlamentar de Os Verdes acredita que é possível resolver os problemas do País, neste quadro. Nada de instabilidades parlamentares, nada disso tem de ser assim! É possível resolver os problemas do País — a enorme instabilidade económica e social que vivemos neste país — neste quadro parlamentar que vivemos. Assim haja vontade de que isso aconteça! Por parte do Grupo Parlamentar de Os Verdes queremos demonstrar a nossa inteira disponibilidade em relação a isto e dizer-vos que é nisto, justamente, que estamos empenhados. A nossa postura será idêntica à anterior: um profundo empenho, uma enorme responsabilidade e lealdade para com o País e para com este Parlamento.\n Termino, cumprimentando todos os Srs. Deputados — todos, mesmo: os reeleitos e aqueles que vêm pela primeira vez. Seremos colegas, a partir de agora! —, muitos, com posturas ideologicamente diferentes.\n Saberemos confraternizar dessa forma. A democracia é assim! O debate político far-se-á, intensamente, aqui.\n Mas quero também cumprimentar os pilares desta Casa, que são os inúmeros funcionários que atribuem sempre todo o seu empenho na dignificação também deste Parlamento, quando nos auxiliam, em tantos e tantos aspectos, no exercício, justamente, do nosso trabalho parlamentar — a todos, um muito obrigado, por parte do Grupo Parlamentar de Os Verdes!
|PCP|*** Aplausos ***
Presidente|Presidente|Tem a palavra o Sr. Deputado Alberto Martins.
Alberto Martins|PS|Sr. Presidente, Sr. e Srs. Deputados: Quero começar por felicitar V. Ex.ª, Sr. Presidente da Assembleia da República, Dr. Jaime Gama! A sua eleição honra a Assembleia da República e nós, como Grupo Parlamentar Socialista, sentimo-nos muito honrados com a sua eleição e com a forma como V. Ex.ª tem desempenhado as altas funções de Presidente da Assembleia da República! Como já foi dito, por muitos dos meus Colegas, vamos iniciar uma nova Legislatura — estamos a fazê-lo — , mas temos de ter presente que estamos numa situação de aprofundamento de alguns dos passos decisivos que foram dados na democracia portuguesa, na legislatura anterior e que estamos a aprofundar.\n Na legislatura anterior, sob a presidência de V. Ex.ª e a participação de muitos dos Deputados que, hoje, estão aqui de novo, como Deputados reeleitos, e que os novos Deputados seguramente acompanham, a Assembleia da República ganhou uma centralidade política, no espaço público português, ímpar. Essa centralidade foi dada com a reforma do Parlamento, com a maior capacidade de fiscalização que as oposições tiveram face ao Governo, com o debate mais regular, com uma fiscalização mais próxima, mais constante e mais incisiva, por parte do Parlamento face ao Governo. Essa centralidade política é exemplar na nossa vida democrática.\n Há ainda um dado novo, que é um adquirido para esta Legislatura e que é inultrapassável e único na democracia portuguesa: é a consequência da aprovação da Lei da Paridade, que faz com que o rosto da democracia portuguesa tenha uma dimensão feminina que, de outra forma, não alcançaria — que era injusto não ter alcançado e que é alcançado desta forma, com este meio da Lei da Paridade —, no sentido de nos aproximarmos de um terço dos Deputados eleitos para a Assembleia da República.\n Uma outra dimensão que importa reter e aprofundar: as condições técnicas e logísticas de apoio que os Deputados têm direito a ter, e necessidade de ter, para cumprir as suas funções. Sabemos que temos um pessoal técnico e administrativo muito qualificado, mas as necessidades de um Parlamento moderno devem ser cada vez mais exigentes e precisas, no quadro dos meios de uma democracia, que tem as limitações materiais que conhecemos.\n Sr. Presidente da Assembleia da República, creio que há dois momentos muito significativos, próximos, nesta Legislatura: o Centenário da República, que é um momento nuclear de construção da nossa democracia, da nossa República, do bem comum, da participação dos cidadãos, da virtude republicana; e, naturalmente, a Revisão Constitucional, que é sempre um quadro de referência para melhoria da nossa democracia.\n Em tudo isto, está presente a nova situação política nacional — maioria relativa, mas maioria de governo que o povo deu ao Partido Socialista — que implica uma nova adequação, uma nova pluralidade, uma nova responsabilidade do Governo e do partido que o suporta, mas também uma nova responsabilidade de todos os grupos parlamentares. O povo português não nos perdoaria — à oposição, ao partido de Governo e à Assembleia da República como um todo — que não fossemos capazes de pôr o bem comum, os interesses nacionais acima dos interesses partidários.\n É isso que exigem de nós. É isso que sei que o Sr. Presidente da Assembleia da República, de uma forma superior, irá concretizar. É isso que nos deve pautar no nosso funcionamento político.\n
|PS|*** Aplausos ***
Presidente|Presidente|Tem a palavra o Sr. Ministro dos Assuntos Parlamentares.
Ministro dos Assuntos Parlamentares|Ministro|Sr. Presidente, Sr. e Srs.\nDeputados: Em nome do Governo ainda em funções e em meu nome pessoal, gostaria de, em primeiro lugar, saudar todas as Deputadas e todos os Deputados desta XI Legislatura dos vários grupos parlamentares e de, em segundo lugar, a todas e todos desejar os maiores êxitos no seu trabalho.\n Sr. Presidente, gostaria também de saudar e felicitar V. Ex.ª pela reeleição como Presidente da Assembleia da República. A expressividade da votação que obteve basta por si só para demonstrar a justeza e a qualidade da presidência que V. Ex.ª assumiu na X Legislatura e para prometer igual qualidade, igual isenção, igual ponderação, igual responsabilidade, sensatez, sabedoria, experiência e, sobretudo, amor à democracia que, certamente, caracterizará a presidência de V. Ex.ª na XI Legislatura.\n Estou certo de que o Parlamento continuará, senão melhorará, o seu desempenho como centro da vida política portuguesa, com as novas responsabilidades que são as suas e com os novos meios que são os seus.\n O Parlamento soube dotar-se das condições para que houvesse maiores e mais profundos direitos potestativos das oposições, maior capacidade de escrutínio dos actos do Governo e da Administração Pública, maior fiscalização política, maior debate político e mais eficaz capacidade legisladora. E isso fez-se com uma maioria, de onde decorre que não é propriamente a dimensão da maioria, mas a qualidade e a convicção democrática dos protagonistas que está na raiz das transformações para o aprofundamento da qualidade da nossa democracia.\n Estou certo, portanto, de que, da mesma forma que o XVII Governo pôde contar com a lealdade, o espírito crítico, o escrutínio e o debate democrático da anterior Legislatura, o próximo Governo contará também. E estou certo ainda de que a Assembleia da República, que pôde contar com o respeito escrupuloso do XVII Governo no cumprimento dos seus deveres perante o Parlamento e, portanto, perante o País, poderá contar com a mesma atitude da parte do próximo governo, de modo que todos convirjamos, a partir das perspectivas que são as nossas, para uma concentração comum nos problemas e também nos anseios do País.\n
|PS|*** Aplausos ***
Presidente|Presidente|Sr. e Srs. Deputados, Sr. Ministro, agradeço as palavras que me foram dirigidas e que interpreto como um estímulo, para mim e para todos, de bom desempenho nos trabalhos que se vão seguir.\n Os trabalhos que se vão seguir de imediato são a eleição dos restantes membros da Mesa e do Conselho de Administração. Estão disponíveis duas urnas que se encontram à vossa esquerda e que, depois do encerramento da sessão, se manterão disponíveis durante mais meia hora, o tempo suficiente para poderem exercer o vosso direito de voto. Após o escrutínio, os Deputados Secretários da Mesa anunciarão publicamente os resultados, mas não será necessário voltarmos a reunir hoje em sessão plenária.\n Está convocada uma Conferência de Líderes para a próxima terça-feira, às 15 horas, para programar todo o trabalho de arranque legislativo e também sincronizar esse calendário com a futura discussão do Programa do Governo, processo que está a decorrer em paralelo.\n A próxima reunião plenária, que será convocada oportunamente, registará a acta formal da eleição que se vai seguir para os restantes membros Mesa.\n Exerçam o vosso direito de voto.\n Muito obrigado a todos e muito boa tarde.\n Está encerrada a sessão.\n
