Primeiro-Ministro|Primeiro-Ministro|Vamos ao investimento: o investimento público é a pedra central deste Orçamento. Se há estímulo que queremos dar à economia é o investimento! E é o investimento aonde? Considero que todas as discussões sérias sobre a economia, muitas vezes, devem calhar exactamente aqui. É legítimo, para um Estado, aumentar o défice, isto é, endividar-se, para fazer investimentos, num determinado momento, que dêem emprego, mas que modernizem o seu país e que melhorem a competitividade da sua economia!? É isso o que estamos a fazer! A avaliação política é, portanto: onde estamos a gastar o dinheiro?
Presidente|Presidente|Tem de concluir, Sr. Primeiro-Ministro.
Primeiro-Ministro|Primeiro-Ministro|E eu vou dizer onde estamos a gastar o dinheiro: estamos a gastar o dinheiro na requalificação das escolas portuguesas — estamos, neste momento, a requalificar 100 escolas! Nunca as câmaras municipais construíram tantos centros escolares! O esforço que estamos a fazer não tem paralelo nas últimas décadas.\n Neste momento, estamos a construir 10 novos hospitais — nunca se construíram tantos hospitais em Portugal! Estamos, neste momento, a construir 400 creches e lares — nunca foi feito um esforço tão forte no equipamento social!
Presidente|Presidente|Tem mesmo de concluir, Sr. Primeiro-Ministro.
Primeiro-Ministro|Primeiro-Ministro|Concluo já, Sr. Presidente.\nEstamos a construir barragens e é aqui que estamos a gastar o dinheiro doas portugueses, em parcerias público-privadas, sim, onde há parte do Estado e parte de investimento privado! E estamos a fazer aquilo que devemos fazer, isto é, a apostar no futuro: num novo aeroporto; no investimento do TGV; e nas novas concessões rodoviárias, para melhorar a competitividade da nossa economia! Nunca foram feitos tantos hospitais! Nunca foram feitas tantas barragens! Nunca foram feitas tantas creches! Nunca houve tantos investimentos na modernização das nossas infra-estruturas, com três objectivos fundamentais.\n
Presidente|Presidente|Queira concluir, Sr. Primeiro-Ministro.
Primeiro-Ministro|Primeiro-Ministro|Vou já concluir, Sr. Presidente. Desculpe, Sr. Presidente, vou tentar ser muito sintético, agora.\n Aproximar Portugal dos mercados europeus: melhorar as nossas condições logísticas e de transportes e infra-estruturas; apostar na área de energia com as barragens; e melhorar os serviços públicos essenciais de saúde e também do nosso sistema escolar.\n É aqui que estamos a agastar o dinheiro dos portugueses: com mais investimento público, para melhorar a situação da nossa economia e para dar emprego aos portugueses. A isto chama-se investimento público qualificador do nosso país!
|PS|*** Aplausos ***
Presidente|Presidente|Tem a palavra o Sr. Deputado Francisco Louçã.
Francisco Louçã|BE|Sr. Presidente, Sr. Primeiro-Ministro, nós temos, entre o Governo e o Bloco de Esquerda, duas visões distintas e contraditórias sobre como deve ser governado o País, sobre que respostas dar à economia, sobre que programa. Isso é natural, faz parte da democracia.\n Mas deixe-me recomendar-lhe: não se deixe levar sempre pelo ódio!
|PS|*** Protestos ***
Francisco Louçã|BE|É certo que, no debate político, palavras claras podem ser confrontadas e devem sê-lo! Mas todas as alusões pessoais que o senhor faz em todas as intervenções revelam fraqueza e revelam que o nível da democracia não deve passar por isso.\n
Cecília Honório|BE|Muito bem!
|PS|*** Protestos ***
Francisco Louçã|BE|E veja, aliás, os gritos de ódio, que vêm ali, da sua bancada!… Risos e aplausos do PS.\n Aliás, volto à questão: o senhor não diz uma palavra sobre a Madeira, pois não, Sr. Primeiro-Ministro?!… Não diz uma palavra sobre a Madeira! É porque nós, aqui, estamos a discutir Orçamento e o acordo com a direita é saber onde é que se está a gastar — reduzir pensões, reduzir salários tem, naturalmente, o apoio da direita. Mas uma política de seriedade, de preocupação com «onde» estamos a gastar — essa é a decisão sobre o Orçamento.\n E eu respondo-lhe «onde estamos a gastar»: o Governo permite que se gastem 600 milhões em escritórios de advogados, não é Sr. Primeiro-Ministro?!… Onde estamos a gastar? O Sr. Primeiro-Ministro olha para o lado: bem sei, bem o percebo!… Estamos a gastar em 1100 milhões de desvios nas auto-estradas. É aí que estamos a gastar! Estamos a gastar 1000 milhões em submarinos. É aí que estamos a gastar! Estamos a gastar 1000 milhões no offshore da Madeira. É aí que estamos a gastar! E o Sr. Primeiro-Ministro dá-nos o exemplo de parcerias público-privadas?! O Estado está comprometido, até 2048, com 45 000 milhões de rendas a iniciativas privadas, quando podia (e tinha a obrigação) fazer as obras necessárias com recursos públicos, com um juro barato, com capacidade de criação de investimento. É aí que o senhor falha, Sr. Primeiro-Ministro! Bem pode mostrar toda a sua irritação — bem o percebo —, mas este é o debate do Orçamento, e se o Governo falha nalguma matéria, é exactamente aqui: baixa o investimento, aumenta o favorecimento, aumenta o desperdício, aumenta o despesismo. E isto, Sr. Primeiro-Ministro, os portugueses não podem perdoar-lhe.\n
Vozes do PS|PS|Já chega!
Francisco Louçã|BE|Os enfermeiros estão lá fora a perguntar ao Governo por que é que não está a negociar! Por que é que não aceita o direito daquelas pessoas qualificadas de poderem ver reconhecida a sua qualificação e o seu esforço no Serviço Nacional de Saúde? Para eles, o Governo só tem escárnio e desprezo, o que é, Sr. Primeiro-Ministro, a pior manigância, porque é a crise do Governo. É talvez por isso que o Governo fica tão irritado, por ser confrontado com alternativas.\n
|BE|*** Aplausos ***
Presidente|Presidente|Para formular perguntas, tem agora a palavra o Sr. Deputado Jerónimo de Sousa.
Jerónimo de Sousa|PCP|Sr. Presidente, Sr. Primeiro-Ministro, neste debate morno, que deveria ser o das primeiras escaramuças resultantes da proposta orçamental, ficou a pairar uma frase que o Sr. Primeiro-Ministro aqui disse, a de que direita (PSD e CDS) não pediu nada em troca da viabilização do Orçamento.\n Creio que esta é uma frase marcante na medida em que o que a direita fez (pode-se apontar-lhe muitos defeitos, mas temos de reconhecer que tem coerência na definição de uma política económica e social), conjuntamente com o Governo, foi salvar a política de direita. Essa, sim, é a questão!
Bernardino Soares|PCP|Exactamente!
Jerónimo de Sousa|PCP|O interesse nacional tem as costas largas, Sr. Primeiro-Ministro. Tem as costas largas...\n O que a direita subscreve, neste Orçamento, é o facto de estarem lá, preto no branco, as privatizações do que é o «bife do lombo», passe o termo, Sr. Primeiro-Ministro: a ANA, a REN, a TAP, aquilo que interessa aos grandes senhores do capital. A direita está de acordo com isso!
Vozes do PCP|PCP|Ora bem!
Jerónimo de Sousa|PCP|Em relação ao sector financeiro, quase me apetecia chorar quando ouvi aqui o Sr. Primeiro-Ministro dizer que o sector está debilitado, que precisa, nesta fase, de ganhar confiança e, enfim, mais lucros! A primeira pergunta que deixo é esta: por que é tão sensível a essa debilidade circunstancial do sector financeiro e é tão implacável com os salários dos trabalhadores da Administração Pública, com a liquidação de postos de trabalho na Administração Pública, com a situação dos enfermeiros, em que, aparentemente, negoceia apresentando propostas mais recuadas do que as do anterior governo?
Bernardino Soares|PCP|Exactamente!
Jerónimo de Sousa|PCP|É tão implacável com os desempregados sem subsídio e com os trabalhadores da Administração Pública (que começam a pagar já a dobrar) e tão sensível com o sector financeiro. Explique essa contradição, Sr. Primeiro-Ministro! Disse que não há nisto ideologia, mas há! Este Governo fez uma opção: está do lado dos mais poderosos, está do lado daqueles que mais têm e mais podem, e não do lado de quem trabalha, dos trabalhadores, dos desempregados, daqueles que têm reformas baixas, daqueles que vivem do seu pequeno negócio. É, pois, uma opção ideológica de fundo estar do lado dos poderosos!
|PCP|*** Aplausos ***
Presidente|Presidente|Tem a palavra o Sr. Primeiro-Ministro.
Primeiro-Ministro|Primeiro-Ministro|Sr. Presidente, Sr. Deputado Jerónimo de Sousa, nós fizemos uma negociação com todos os partidos e o que fiz, no início deste debate, é mais do que justo: sublinhei a responsabilidade dos partidos que quiseram fazer esta negociação com o Governo (aqueles que o quiseram fazer) e também elogiei o facto de o PSD — não os dois partidos — não ter pedido nada em troca, a não ser verificar se as opções do Orçamento que nós construímos, e que são da nossa responsabilidade, estavam de acordo com a orientação do PSD de começar a corrigir o défice orçamental. Nada mais! Esta é a verdade.\n Sr. Deputado, tenho de recordar-lhe o seguinte: o Partido Comunista não mostrou qualquer vontade ou interesse em dialogar com o Governo. Aliás, o Partido Comunista, antes deste debate, dois ou três dias depois de receber o Orçamento, imediatamente anunciou que iria votar contra.\n
Bernardino Soares|PCP|Foi ontem, Sr. Primeiro-Ministro!
Primeiro-Ministro|Primeiro-Ministro|Foi! Dois ou três dias depois…
António Filipe|PCP|*** Protestos ***
Primeiro-Ministro|Primeiro-Ministro|Sr. Deputado António Filipe, calma! Mas gostaria de perguntar o seguinte: quando é que o PCP votou de forma diferente o Orçamento do Estado? São capazes de dizer à Câmara quando é que tiveram uma outra opção?!
|PCP|*** Protestos ***
Primeiro-Ministro|Primeiro-Ministro|Digam-me: depois do 25 de Abril, nunca houve um Orçamento bom?! Querem convencer os portugueses de que a posição do Partido Comunista, de ter estado sempre contra, desde o início, é uma posição razoável e credível? Será que nunca houve uma oportunidade, neste país, para que o Partido Comunista pudesse encarar a possibilidade de se abster ou de votar a favor?
Bernardino Soares|PCP|O Sr. Primeiro-Ministro não quer falar do Orçamento do Estado para 2010. Porque será?
Primeiro-Ministro|Primeiro-Ministro|Os Srs. Deputados querem convencer os portugueses de que a posição negativista de ser sempre contra todos os Orçamentos é a posição correcta? Os Srs. Deputados julgam que a única possibilidade que tiveram de estar de acordo com o Orçamento foi no tempo do Primeiro-Ministro Vasco Gonçalves? Acham que isso é que é razoável? Há mais de 30 anos que o Partido Comunista vota contra. E qualquer que seja a opção do Orçamento, a sua escolha política, vota sempre contra!
Bernardino Soares|PCP|É sempre a mesma!
Primeiro-Ministro|Primeiro-Ministro|Ah, pois… Sr. Deputado, sempre a mesma é a posição do Partido Comunista! O que toda a gente sabe é que, sempre que o Partido Socialista está no Governo, dois meses depois o PCP identifica muito bem o seu inimigo principal: é o Partido Socialista e é o Governo!
Bernardino Soares|PCP|A velha cassete!…
Primeiro-Ministro|Primeiro-Ministro|A velha cassete é o que os senhores fazem, não há outra alternativa.\nEm segundo lugar, em relação à função pública, o Sr. Deputado tem de concordar que, no ano passado, fizemos um aumento de 2,9%, o que significou um aumento real de 3,7%. E, por isso, os funcionários públicos compreenderão, tenho a certeza, que, nestes dois anos (2009 e 2010), o aumento real dos funcionários públicos andará à volta dos 2,9% ou dos 3%. É só fazer as contas!
Bernardino Soares|PCP|E nos últimos 10 anos?
Primeiro-Ministro|Primeiro-Ministro|Ora bem, isto significa uma opção política? Sim, significa a opção de quem acha razoável que os funcionários públicos, tendo sido aumentados, no ano passado, da forma mais extraordinária que se verificou nos últimos 10 anos, possam agora, também, ter uma compreensão com uma decisão política que tem a ver com a necessidade de começar a reduzir o nosso défice orçamental.\n Finalmente, quanto ao sistema financeiro, o Sr. Deputado não falou, mais uma vez, do que está referido no Orçamento relativamente a taxar os bónus dos gestores do sistema financeiro.\n
Honório Novo|PCP|*** Protestos ***
Primeiro-Ministro|Primeiro-Ministro|Ou Sr. Deputado passou por cima disso ou escapou-lhe.\n Também lhe escapou a decisão que tomámos de limitar o aproveitamento dos benefícios fiscais, mantendo uma taxa efectiva de imposto de 18,75%? Sr. Deputado, é aqui que se dão os sinais correctos de justiça fiscal num orçamento.\n
|PS|*** Aplausos ***
Presidente|Presidente|Tem a palavra o Sr. Deputado Jerónimo de Sousa.
Jerónimo de Sousa|PCP|Sr. Presidente, assim não pode ser. O Sr. Primeiro-Ministro não pode colocar as coisas de uma forma enviesada, não verdadeira. Fala de dois anos dos salários dos trabalhadores da Administração Pública. Eu falo dos últimos dez, em que os salários mais baixos perderam 4% e os mais altos 7%!
|PCP|*** Aplausos ***
Jerónimo de Sousa|PCP|Por que é que se está aqui a manipular os números? Os trabalhadores da Administração Pública sabem quem está a falar verdade ou quem está a dizer só meia verdade!
Bernardino Soares|PCP|Muito bem!
Jerónimo de Sousa|PCP|Em relação à questão da banca e à taxação dos bónus, num outro dia um trabalhador usou uma expressão espantosa quando estava a ouvir o Sr. Ministro das Finanças a tentar «vender» essa ideia. Dizia ele: «Oh, os bónus dos banqueiros… Taxem a banca, taxem os lucros e vão ver que esses bónus serão muito mais baixos!» Faça aquilo que nós propomos, Sr. Primeiro-Ministro: proponha a taxação dos lucros, designadamente em termos de resultados bolsistas. Não o quer fazer porquê? Obviamente, faz uma opção.\n
Bernardino Soares|PCP|Muito bem!
Jerónimo de Sousa|PCP|Ainda me permito insistir (porque é a única forma de tentar que o Sr.\nPrimeiro-Ministro responda a alguma coisa de jeito, a alguma coisa de concreto) em relação à situação dos enfermeiros: considera aceitável manter a proposta de 1020 € de remuneração base dos licenciados que tenham iniciado funções em 7 de Setembro de 2009, quando antes tinha apresentado uma proposta de remuneração de 1400 €? Agora baixou porquê?
Bernardino Soares|PCP|É verdade!
Jerónimo de Sousa|PCP|Pergunte à Sr.ª Ministra da Saúde porque ela, de certeza, responderlhe-á.\nPergunto também se considera aceitável que os enfermeiros portugueses tenham começado a sair licenciados das escolas superiores de enfermagem desde 2000, elevando assim não só as suas qualificações, as suas competências, mas também a qualidade dos cuidados de saúde que são prestados à população, e continuem a auferir remunerações como se de bacharéis se tratassem. Explique lá! Não é obrigado a conhecer o conteúdo das negociações, mas depois não se admire, Sr. Primeiro-Ministro… Geralmente, vejo-o sempre muito distante e arrogante quando se trata destas coisas de conflitos sociais, de conflitos laborais. Mas ouça a razão desses profissionais de enfermagem e vai ver que eles têm razão.\n Responda positivamente aos enfermeiros, Sr. Primeiro-Ministro!
|PCP|*** Aplausos ***
Presidente|Presidente|Tem a palavra o Sr. Primeiro-Ministro.
Primeiro-Ministro|Primeiro-Ministro|Sr. Presidente, Sr. Deputado Jerónimo de Sousa, uma das medidas mais importantes deste Orçamento do Estado é aquela que fixa 18,75% como limite mínimo para a taxa efectiva de imposto. Isto significa um esforço e uma opção política no sentido de reduzir, para o sector financeiro, os benefícios fiscais e aumentar a taxa efectiva de imposto.\n Este é um aspecto que tem sido muito discutido em toda a Europa, juntamente com a taxação dos bónus.\n Mas é um sinal político que também diz ao sector financeiro que as coisas não continuarão como no passado.\n
Honório Novo|PCP|*** Protestos ***
Primeiro-Ministro|Primeiro-Ministro|E não é preciso ter ódio algum contra ninguém, nem preconceito algum contra ninguém para reconhecer que a situação financeira anterior deve evoluir no sentido de oferecer mais confiança em todo o mundo. Não é preciso tratar os bancos por «BANCOS!» nem rendas por «RENDAS!» — com ódio — para nós fazermos aquilo que devemos.\n O importante é que, em primeiro lugar, os bónus dos gestores do sector financeiro serão taxados com 50% e, em segundo lugar, a taxa efectiva de imposto vai ser limitada em 18,75%.\n
Bernardino Soares|PCP|Vamos ver.
Primeiro-Ministro|Primeiro-Ministro|Finalmente, Sr. Deputado, quero dizer-lhe o seguinte: o Governo está a negociar com uma classe, está a negociar com os enfermeiros, e o que tenho para dizer é que espero que o bom senso prevaleça e que regressemos rapidamente à mesa negocial.\n O que me espanta é que haja partidos sempre disponíveis para aproveitar todas as lutas corporativas.\n
Bernardino Soares|PCP|Corporativas?! Essa agora!
Primeiro-Ministro|Primeiro-Ministro|O que me espanta é que haja partidos imediatamente disponíveis para dar razão a todas as reivindicações corporativas. O que me espanta é que haja partidos que, sinceramente, colocam de lado o interesse geral para dar imediatamente razão a qualquer interesse particular.\n O Sr. Deputado fica a saber que o Governo não aceita negociar com partidos questões de classe.\n
Bernardino Soares|PCP|Isto é de interesse geral!
Primeiro-Ministro|Primeiro-Ministro|O Governo aceita negociar com os sindicatos. E nunca nos passou pela cabeça que, agora, os partidos tivessem apenas uma posição neste Parlamento igual à posição e à voz dos sindicatos.\n
Bernardino Soares|PCP|Essa agora!
Primeiro-Ministro|Primeiro-Ministro|O que nos parece razoável é que os partidos defendam o interesse geral e não o interesse corporativo.\n Aos enfermeiros e a todos esses profissionais o Governo garante uma negociação e a boa fé negocial para chegar a um equilíbrio que sirva a sociedade portuguesa, mas que não faça «ajoelhar» o interesse geral diante de qualquer interesse corporativo. Nunca o fizemos e nunca o faremos, porque isso significaria abdicar da tarefa de governar, que é não pensar apenas em satisfazer todas as reivindicações, que não é ir às manifestações.\n Bem o vi, Sr. Deputado, em todas as manifestações de professores. «Há manifestação de professores? Lá vamos nós!»
Jerónimo de Sousa|PCP|Não consegui estar em todas!
Primeiro-Ministro|Primeiro-Ministro|E tenho a certeza de que, hoje, vê-lo-ei também na televisão, ao lado dos manifestantes.\n Realmente, Sr. Deputado, isso é muito fácil e muito simples, mas essa não é a atitude que nos pedem os portugueses. Os partidos devem pensar no interesse de todos, não no interesse das classes.\n Estamos disponíveis para negociar e ansiamos pelo momento em que os enfermeiros regressem à mesa de negociações.\n
|PS|*** Aplausos ***
Presidente|Presidente|Tem a palavra o Sr. Deputado Jerónimo de Sousa.
Jerónimo de Sousa|PCP|Sr. Presidente, Sr. Primeiro-Ministro, em relação a esta última parte da sua intervenção, gostaria de dizer-lhe que não deve estranhar a solidariedade do PCP para com as injustiças de que são vítimas os trabalhadores no ataque que é feito aos seus direitos, para com a sua luta.\n Não estranhe isso, Sr. Primeiro-Ministro.\n O que para nós é estranho é que este Partido Socialista nunca seja capaz de demonstrar solidariedade para com uma luta, seja a dos enfermeiros, seja a dos professores, seja a da Administração Pública ou a de qualquer outro sector de trabalhadores. O mal está na falta de solidariedade do PS e não na solidariedade do PCP.\n
|PCP|*** Aplausos ***
Jerónimo de Sousa|PCP|Estivemos aqui a discutir o défice, mais ponto menos ponto, se devia ter anunciado ou não, antes ou depois, mas o Sr. Primeiro-Ministro não disse uma coisa importante para os portugueses: quem é que o vai pagar? «Todos!» — vai dizer (parece que estou vê-lo!). Não. Vamos ver quem é que o vai pagar. Ora, este Orçamento aponta para que, de facto, já escolheu o alvo mais fácil, que são os salários e os postos de trabalho, e, em termos de investimento, os cortes no PIDDAC, a cativação em relação a esse mesmo investimento. Já percebemos, e por isso mesmo, Sr. Primeiro-Ministro, diga lá quem é que vai pagar o défice que aqui anunciou.\n
|PCP|*** Aplausos ***
Presidente|Presidente|Para formular as suas perguntas, tem a palavra a Sr.ª Deputada Heloísa Apolónia.
Heloísa Apolónia|Os Verdes|Sr. Presidente, Sr. Primeiro-Ministro, como é que, numa altura em que se prevê a continuação do crescimento do desemprego, questão gravíssima no nosso País, o Governo se propõe contribuir para um aumento do desemprego através da liquidação de postos de trabalho na função pública? O Sr. Primeiro-Ministro já se gabou aqui de, na última Legislatura, terem conseguido liquidar 73 000 postos de trabalho na Administração Pública. Há jovens que podiam estar a trabalhar e não estão.\n Houve uma liquidação de postos de trabalho, e o Governo propõe-se retomar a regra do «saem dois, entra um», liquidando mais milhares de postos de trabalho na Administração Pública, contribuindo, assim, para o aumento do desemprego em Portugal.\n Como é que isto é solução, Sr. Primeiro-Ministro?
Presidente|Presidente|Para responder, tem a palavra o Sr. Primeiro-Ministro.
Primeiro-Ministro|Primeiro-Ministro|Sr. Presidente, Sr.ª Deputada Heloísa Apolónia, uma das questões absolutamente centrais para o controlo da despesa e o equilíbrio das contas públicas é, sem dúvida, o controlo sobre as despesas com funcionários, o que acontece em todos os Estados do mundo.\n Este Governo orgulha-se de, nestes últimos cinco anos, ter feito uma reforma da Administração Pública que permite, em primeiro lugar, que todos os funcionários públicos sejam hoje avaliados.\n A reforma da Administração Pública contribuiu para uma modernização e para maior eficiência, mas permitiu também reduzir o número de funcionários, o que nos colocou em linha com as despesas em percentagem do PIB que são a média da União Europeia e dos países da OCDE.\n A verdade é que nenhum Estado responsável pode aceitar um descontrolo nas despesas com funcionários.\n Fizemos esse exercício muito exigente de substituir cada dois funcionários que se reformavam por um porque não esquecemos que o que paga aos funcionários públicos são os impostos de todos os portugueses, e se queremos ter uma boa utilização dos dinheiros públicos devemos ter também uma Administração Pública eficiente e capaz, centrada em responder aos problemas, mas também consciente de que tem de fazer as modificações essenciais para ser sustentável no futuro.\n Um dos aspectos mais importantes daquilo que fizemos, e que vai ajudar-nos ao longo dos próximos anos, é que, agora, as despesas com funcionários estão controladas.\n Como disse, no ano passado, apesar de termos aumentado os funcionários públicos em 2,9%, o resultado no aumento das despesas com funcionários foi de 0,3%. Isso é um bom sinal, principalmente para aqueles que são funcionários públicos. Aqueles que são funcionários públicos hoje sabem que a factura dos funcionários públicos na riqueza e no Estado é hoje menor, e isso é a melhor garantia para termos uma Administração Pública mais eficiente, mais capaz e mais moderna.\n Claro está que para alguém que não acredita no equilíbrio das contas públicas, para alguém que acha que o Estado deve continuar a fazer despesa sem nenhum controlo, isto pouco significa, mas tenho esperança de que a Sr.ª Deputada possa, no seu íntimo, reconhecer que esta é a melhor forma de reduzir a despesa, que isto é um contributo para um Estado mais digno e para um melhor Estado português, capaz de servir melhor os seus cidadãos.\n
|PS|*** Aplausos ***
Presidente|Presidente|Tem a palavra a Sr.ª Deputada Heloísa Apolónia.
