Maria José Gambôa|PS|Sr. Presidente, Sr.as e Srs. Deputados: O projecto de lei n.º 161/XI (1.ª), apresentado pelo Grupo Parlamentar do Partido Socialista, visa a criação da Ordem dos Nutricionistas e aprova o seu Estatuto.\nTrata-se de uma iniciativa legislativa com particular significado para os nutricionistas portugueses, porquanto visa, através da criação da sua ordem profissional, garantir a auto-regulação da sua profissão, cuja representação social tem vindo a ser crescente, na sequência dos seus contributos importantes nos contextos da saúde pública da população.\nCom a presente iniciativa legislativa, o Grupo Parlamentar do Partido Socialista dá cumprimento a uma antiga e legítima pretensão dos nutricionistas portugueses, cuja associação representativa dos seus interesses dotou esta Assembleia de dois estudos independentes, sendo um dos quais elaborado pelo ISCTE, sobre nutrição dietética e alimentação, que caracteriza as profissões ligadas a esta temática, e um outro, da autoria do Professor Vital Moreira, que sustenta parecer favorável à criação da ordem dos nutricionistas, em termos da realização do interesse público e do seu impacto sobre a regulação da profissão em causa, cumprindo-se desta forma o pressuposto previsto no n.º 3 do artigo 2.º da lei da criação das associações públicas profissionais.A criação da ordem dos nutricionistas contribuirá, estamos certos, para a consagração de mecanismos de supervisão desta profissão, disciplinando o exercício profissional do ponto de vista ético e deontológico e, em suma, para uma maior protecção dos cidadãos no domínio da saúde e prevenção da doença através da alimentação.\nNeste contexto, saudamos também o CDS-PP, pela apresentação do seu projecto de lei, hoje em discussão, com idêntico objecto, sendo nossa convicção de que, em discussão conjunta de ambas as iniciativas legislativas, resultará um enquadramento justo e adequado às expectativas do grupo profissional dos nutricionistas.\nSr. Presidente, Sr.as e Srs. Deputados: Encontra-se, hoje, também em discussão a petição n.º 38/XI (1.ª), da iniciativa da Associação Portuguesa de Dietistas (APD), através da qual solicita à Assembleia da República que o projecto de lei do Partido Socialista que cria a ordem dos nutricionistas incorpore os profissionais.\nCumpre-me saudar os peticionários e explicar a disponibilidade do Grupo Parlamentar do Partido Socialista para equacionar esta pretensão, que, naturalmente, só poderá ser exequível se, da parte dos restantes grupos parlamentares, se verificar a mesma vontade.\nAs razões que nos levaram à exclusão dos dietistas, no projecto de lei que, hoje, apresentamos, tiveram objectivamente que ver com os seguintes aspectos.\nPrimeiro: pese embora se reconheça a similitude entre as duas profissões em causa, ambas surgem num estudo apresentado como profissões autónomas, integrando, inclusive, carreiras distintas no âmbito da Administração Pública.\nSegundo: a utilização dos estudos apresentados pela Associação Portuguesa de Nutricionistas à Assembleia da República, para fundamentar a inclusão dos dietistas na ordem a criar, exige um consenso alargado no quadro parlamentar.\nTerceiro: o estudo ou parecer apresentado pela Associação Portuguesa de Nutricionistas, da autoria do Prof. Vital Moreira, apenas respeita exclusivamente ao interesse público subjacente à profissão de nutricionistas e não de dietistas.\nQuarto e último: entendemos que a inclusão dos dietistas na ordem profissional a criar deverá, até por razões de igualdade de tratamento, ser submetida a parecer do Ministério da Saúde, tal como sucedeu com os nutricionistas.\nNeste sentido, e verificados os pressupostos que acabo de referir, reafirmamos a nossa disponibilidade para, em sede de especialidade, equacionarmos a criação de uma ordem que dê guarida a ambos os grupos profissionais.|mp
||Aplausos do PS.|applause
Presidente|Presidente|Para uma intervenção, tem a palavra a Sr.ª Deputada Teresa Caeiro.|president
Teresa Caeiro|CDS-PP|Sr. Presidente, Sr.as e Srs. Deputados: Segundo a Organização Mundial de Saúde, das dez causas que condicionam mais mortalidade no mundo, cinco estão directamente relacionadas com os hábitos alimentares, não constituindo Portugal uma excepção a este cenário.\nO problema da obesidade infantil tem vindo, também, a apresentar valores crescentes e preocupantes em Portugal. Um estudo publicado em 2005 aponta uma prevalência estimada de excesso de peso em crianças que ronda os 20% e de obesidade os 10%. E, já em 2009, estes dados foram confirmados.\nNa população adulta, em Portugal, estima-se que 53,6% tem excesso de peso e 14,2% sofre de obesidade, com consequências graves para a saúde dos próprios, pois o excesso de peso e a obesidade são um factor de risco importante para a doença cardiovascular, a doença músculo-esquelética e alguns tipos de cancros. A obesidade infantil está igualmente associada a uma maior probabilidade de morte prematura e incapacidade na idade adulta.\nO nutricionista é o profissional de saúde que desenvolve funções de estudo, orientação e vigilância da alimentação e nutrição quanto à sua adequação, qualidade e segurança, em indivíduos ou grupos, na comunidade ou em instituições, incluindo a avaliação do estado nutricional, tendo por objectivo a promoção da saúde e do bem-estar e a prevenção e tratamento da doença, de acordo com as respectivas regras científicas e técnicas.Em larga medida, Sr. Presidente e Srs. Deputados, estas competências já estão abrangidas pelas funções dos dietistas. E, tal como já aqui foi dito pela Sr.ª Deputada Maria José Gamboa, devemos encontrar um consenso neste Parlamento não só para a criação da ordem profissional mas para que a criação dessa ordem abranja todos os profissionais com conteúdos funcionais semelhantes.\nÉ nesse sentido, aliás, que a iniciativa do CDS —  mais concretamente, o artigo 5.º do projecto de lei —  prevê que também podem considerar-se elegíveis para serem abrangidas na ordem dos nutricionistas as licenciaturas noutros cursos de ensino superior que, pelo seu plano de estudos, sejam consideradas apropriadas para o acesso à profissão.\nOra, é pretensão da Associação Portuguesa de Dietistas, e assim foi manifestado na petição que entregou nesta Assembleia —  e aproveito para saudar os peticionários, bem como os representantes da Associação Portuguesa de Nutricionistas aqui presentes — , que, em sede de especialidade, a criação da nova ordem profissional (e dos respectivos estatutos) seja mais clara, mais veemente na abrangência também dos dietistas.\nO CDS já demonstrou, em sede de comissão e no âmbito das audições realizadas, disponibilidade para estudar uma forma que seja equilibrada e consentânea não só com a saúde pública mas também com o interesse de todos os profissionais.\nLançamos, pois, um repto às restantes bancadas parlamentares —  visto que foi assumida aqui essa vontade pelo Partido Socialista e já há parecer positivo por parte do Ministério da Saúde —  no sentido de que seja possível chegar a um consenso gratificante para todos, nomeadamente para a sociedade, para a saúde pública e para os profissionais actuais e vindouros.|mp
||Aplausos do CDS-PP.|applause
Presidente|Presidente|Para uma intervenção, tem a palavra a Sr.ª Deputada Teresa Santos.|president
Teresa Santos|PSD|Sr. Presidente, Sr.as e Srs. Deputados: Antes de mais, queria saudar os representantes aqui presentes das duas associações, de dietistas e de nutricionistas.\nPermitam-me que inicie a minha intervenção por citar o tão conhecido ditado popular: «Saber comer é saber viver».\nInfelizmente, os dados que temos ao nosso dispor, nomeadamente da Plataforma Nacional contra a Obesidade, indicam-nos que tal sabedoria não tem sido seguida em Portugal. E, a nível mundial, a incidência e a prevalência quer da pré-obesidade quer da obesidade tem vindo a aumentar, constituindo um grave problema de saúde pública.\nA Organização Mundial de Saúde considera a obesidade como «a epidemia global do século XXI».\nPortugal encontra-se numa das posições mais desfavoráveis no cenário europeu, apresentando mais de metade da população adulta com excesso de peso: 15% dos portugueses são obesos, sendo a prevalência da obesidade infantil uma das mais elevadas da Europa.\nEsta situação tem custos imensos para a sociedade, não só do ponto de vista social como também financeiro, especialmente nos orçamentos do Ministério da Saúde. De facto, o peso no erário público é elevado, estimando-se que 3,5% das despesas totais que o Estado português tem com a saúde se devam à obesidade.\nNeste contexto, a prevenção e o combate à obesidade devem ser uma prioridade política. Tornam-se necessárias acções para alertar a população para a gravidade do problema, bem como ao nível de todos os ministérios que tenham como responsabilidade assegurar uma alimentação equilibrada e adequada, nomeadamente os Ministérios da Saúde e da Educação.\nRefiro aqui, também, o papel fundamental das autarquias locais que, à data, são as entidades que asseguram a alimentação dos alunos dos ensinos pré-escolar e do 1.º ciclo, bem como o papel importante das Instituições Particulares de Solidariedade Social (IPSS).\nSr. Presidente, Sr.as e Srs. Deputados: Se a obesidade é um problema (e já que estamos no Ano Europeu da Luta contra a Pobreza e a Exclusão Social), a má nutrição também já é uma realidade perante grupos sociais mais desfavorecidos. Refiro-me aos desempregados e aos empregados cujo salário que obtêm não ésuficiente para viver com o mínimo de dignidade, bem como aos idosos, principalmente os que beneficiam de baixas pensões.|mp
Vozes do PSD||Muito bem!|interruption
Teresa Santos|PSD|Perante este cenário, é de interesse público que, dispondo o nosso país de centenas de licenciados em áreas das ciências alimentares —  nutricionistas e dietistas, entre outros — , tudo seja feito para que estes profissionais possam responder com mais eficácia aos desafios da saúde alimentar dos portugueses.\nConsiderando que o conteúdo funcional destes grupos profissionais é coincidente, o Grupo Parlamentar do PSD é a favor, à semelhança do que acontece noutros países europeus, nomeadamente a Espanha, da criação de uma ordem profissional no nosso país que promova a existência de regras deontológicas no seu exercício e, sobretudo, contribua para a defesa da saúde pública.\nPor isso, o Grupo Parlamentar do PSD votará favoravelmente os projectos em apreciação e apresentará, em sede de especialidade, os seus contributos.|mp
||Aplausos do PSD.|applause
Presidente|Presidente|Para uma intervenção, tem a palavra o Sr. Deputado João Semedo.|president
João Semedo|BE|Sr. Presidente, Sr.as e Srs. Deputados: No entender do Bloco de Esquerda, esta problemática que hoje aqui estamos a discutir, quer os dois projectos de lei quer a petição, justifica mais alguma ponderação, por isso vemos com muita expectativa o debate que, em sede de especialidade, vai desenvolver-se de seguida.\nQuando falamos em mais ponderação não nos referimos apenas aos argumentos aduzidos na petição que também hoje é objecto de discussão. Sem dúvida que esses argumentos são importantes, devem ser avaliados, ponderados, pesados e medidos.\nO Bloco de Esquerda considera que deve ser bem avaliado este facto, que tem ocorrido em Portugal nos últimos anos, da multiplicação da criação de ordens profissionais, em particular no domínio das áreas de actividade relacionadas com a saúde. Não consideramos esse facto, por si só, um aspecto negativo, mas o que pretendemos dizer é que deve haver alguma ponderação, nomeadamente quando estamos a tratar da delegação de competências e de poderes públicos em organizações de cariz profissional, sendo certo que há experiências em Portugal que já revelaram os benefícios e as vantagens dessa delegação de competências.\nMas também há situações em que essa delegação de competências se traduziu no encerramento de importantes problemas, num clima e num ambiente excessivamente corporativo.\nPara terminar, consideramos que devemos pesar bem, nesta discussão que vamos ter em sede de especialidade, que competências são delegadas e sobre que universo essas competências vão incidir e o que, exactamente, no domínio quer da certificação quer da regulação, os projectos de lei devem conter para que a ordem profissional que venha a ser constituída se transforme num elemento construtivo e positivo na resolução do problema que está no objecto da sua criação, e não numa delimitação de novos poderes que possam vir a contrariar a resolução desses mesmos problemas.\nGostaria, por último, de saudar a presença daqueles que subscreveram a petição e, também, da associação que representa os nutricionistas portugueses, apelando para que continuem a acompanhar este debate, na especialidade, da forma como o fizeram até hoje.|mp
||Aplausos do BE.|applause
Presidente|Presidente|Para uma intervenção, tem a palavra a Sr.ª Deputada Paula Santos.|president
Paula Santos|PCP|Sr. Presidente, Srs. Deputados: Em primeiro lugar, também queríamos saudar a presença da Associação Portuguesa de Nutricionistas e da Associação Portuguesa de Dietistas.Hoje está em discussão a criação da ordem dos nutricionistas à luz do novo quadro legal e, simultaneamente, a petição que foi entregue pela Associação Portuguesa de Dietistas, a solicitar a integração dos dietistas nesta ordem.\nO PCP entende a necessidade de regulação das profissões, designadamente as da área da saúde, pela sua relevância na prestação dos cuidados de saúde à população. Contudo, não podemos esquecer que é o Governo o responsável pela regulação destas profissões.|mp
Bernardino Soares|PCP|Muito bem!|mp
Paula Santos|PCP|Mas, na verdade, em Portugal há uma ausência desta regulação e desta fiscalização.\nNeste sentido, é justa a preocupação de diversas áreas profissionais em relação à regulação do perfil profissional, funções que desempenham e deontologia e ética profissional. Não existindo a intervenção do Governo, os profissionais encontram soluções no plano da auto-regulação, através da criação das associações públicas profissionais.\nNa nossa opinião, deve haver um planeamento e uma coordenação global relativamente à regulação das profissões na área da saúde conduzidos pelo Ministério da Saúde, em detrimento da criação avulsa de ordens, sem integração numa opção política. A proposta para a criação de ordens profissionais deve ser abrangente e não restritiva, como as propostas em discussão, muito embora já tenha havido abertura para essa integração.\nEmbora ambas as propostas refiram, no preâmbulo, a semelhança de formação e dos desempenhos profissionais dos nutricionistas e dos dietistas em torno da alimentação e saúde, abordam a ordem sempre na perspectiva do exercício da profissão nutricionista e dos profissionais licenciados em Ciências de Nutrição.\nTendo em conta que quer os nutricionistas quer os dietistas detêm o mesmo grau académico —  licenciatura —  e desempenham funções semelhantes ligadas à alimentação e prevenção de cuidados de saúde, não compreendemos a sua não inclusão. Muito embora estas propostas incluam uma norma que permite a inscrição de profissionais que detenham outra licenciatura que, pelo plano de estudos, seja considerada apropriada para o acesso à profissão, esta está dependente do parecer da ordem dos nutricionistas, o que, do nosso ponto de vista, introduz discriminação entre estas duas profissões.\nAssalta-nos ainda uma outra preocupação, que não foi esclarecida: caso as propostas avancem sem a integração dos dietistas, quais as consequências que terá no futuro destes profissionais? A Associação Portuguesa de Dietistas dirigiu uma petição à Assembleia da República a manifestar a intenção de integrar, em conjunto com os nutricionistas, esta ordem, sob pena de esvaziamento do seu conteúdo funcional e de criar dificuldades no acesso à profissão de dietista. Na nossa opinião, esta pretensão é justa.\nA Assembleia da República tem aqui, hoje, uma enorme responsabilidade. O PCP apela a todos os partidos políticos para que não criem situações de desigualdade que coloquem em causa o desempenho profissional e a vida de um número alargado de trabalhadores.|mp
||Aplausos do PCP.|applause
Presidente|Presidente|Srs. Deputados, passamos ao último ponto da nossa ordem de trabalhos: a apreciação, na generalidade e em conjunto, dos projectos de lei n.os 139/XI (1.ª) —  Condições de exploração do Terminal Portuário de Alcântara (Os Verdes), 63/XI (1.ª) —  Revoga o Decreto-Lei n.º 188/2008, de 23 de Setembro, que introduziu alterações nas bases do contrato de concessão do direito de exploração, em regime de serviço público, do Terminal Portuário de Alcântara (PSD), 70/XI (1.ª) —  Determina o carácter público da gestão do terminal de contentores de Alcântara (PCP), 74/XI (1.ª) —  Revogação do Decreto-Lei n.º 188/2008, de 23 de Setembro (BE), e 176/XI (1.ª) —  Suspende a vigência do Decreto-Lei n.º 188/2008, de 23 de Setembro, que introduziu alterações nas bases do contrato de concessão do direito de exploração, em regime de serviço público, do Terminal Portuário de Alcântara (CDS-PP), e do projecto de resolução n.º 80/XI (1.ª) —  Recomenda ao Governo que desenvolva as diligências necessárias à modificação das bases do contrato de concessão do direito de exploração, em regime de serviço público, do Terminal Portuário de Alcântara, na redacção resultante do Decreto-Lei n.º 188/2008, de 23 de Setembro (CDS-PP).|president
||- Para uma intervenção, tem a palavra o Sr. Deputado José Luís Ferreira.|statement
José Luís Ferreira|Os Verdes|Sr. Presidente, Srs. Membros do Governo, Sr.as e Srs. Deputados: Em Abril de 2008, e para grande surpresa de todos, já que nem discussão pública houve, o País tomou conhecimento, pela imprensa, da assinatura de um acordo para a realização do projecto de requalificação do terminal de contentores de Alcântara.\nEste empreendimento foi mesmo considerado como um «projecto de relevante interesse público», ainda que nunca devidamente explicado pelo Governo, que se apressou, no entanto, a aprovar o respectivo decretolei. Um decreto-lei que, para além de permitir um conjunto de alterações em obras e infra-estruturas, acrescenta às áreas concessionadas novas parcelas de terreno e determina a prorrogação do prazo de vigência da concessão até 2042.\nAssim, e sem qualquer concurso público, entrega-se a uma empresa privada a actividade de carga contentorizada, isentando-a de taxas de utilização das instalações portuárias e de taxas de movimentação de contentores. Ou seja, para além do processo de privatização, o Governo garante aos privados novas áreas de implementação para prolongamento do terminal.\nAcresce ainda que a pretensa sustentabilidade da ampliação do terminal radicava em estudos que indicavam que a sua capacidade estaria, por esta altura, esgotada, o que veio a revelar-se completamente irrealista.\nMais alarmante é o facto de, no caso de o tráfego acabar por constituir uma condicionante negativa, o ónus do risco do negócio acabar por passar para o Estado português.\nPor tudo o que foi dito, Os Verdes entendem que, para além dos impactes ambientais não terem sido estudados (desde logo, há a referir a ausência de avaliação ambiental estratégica), este contrato de concessão não consubstancia nem um bom negócio nem um bom exemplo para a gestão do sector público, pois o interesse público não foi devidamente acautelado.\nAté a própria oportunidade da celebração deste contrato, face à actual crise, é objectivamente questionável, se tivermos em conta tanto as condições de financiamento como a nova extensão do prazo de concessão, que acabou por comprometer o concedente público por mais 27 anos, sem qualquer concurso público! Acresce ainda que, em caso de risco, é ao concedente público que cabe cobrir os eventuais prejuízos. E de tal modo se admite que o risco possa ser elevado que a própria banca não aceitou financiar o projecto sem que primeiro o Estado aceitasse dar cobertura a valores mínimos de tráfego. Um autêntico manancial de benesses em que o Estado, para variar, sai a perder»! Foi, aliás, por isso, que o Tribunal de Contas considerou não ser nem rigoroso nem aceitável que o concedente público tenha dado o seu acordo em suportar o risco de tráfego, pois se esse risco foi inaceitável para os bancos também o deveria ser, por maioria de razão, para o erário público. Ainda por cima, o Estado assume o risco de tráfego sem qualquer contrapartida.\nPor fim, o Tribunal de Contas conclui que a ausência de um concurso público não pode deixar de ser considerada como fragilizante da mais-valia da solução económica contratualizada pelo Estado.\nAssim, Os Verdes, não pondo em causa o facto de o Porto de Lisboa ser uma infra-estrutura fundamental enquanto factor económico essencial à economia regional e no quadro da realidade económica nacional, consideram também que é necessária uma gestão portuária sustentável e integrada a nível nacional. Aliás, é também pela importância de que o porto se reveste que propomos a sua gestão pública.\nFoi nesse sentido que Os Verdes apresentaram a presente iniciativa legislativa, propondo a revogação do Decreto-Lei n.º 188/2008, de 23 de Setembro, impedindo a renovação da concessão e no sentido de devolver à gestão pública atribuições que, pela sua importância na economia nacional e porque se trata de uma actividade de interesse público, ao Estado deverão pertencer.\nFinalmente, propomos que o eventual processo de expansão do terminal fique condicionado à definição de alturas máximas de contentores empilhados e ao estabelecimento de um espaço público de fruição ao longo do Tejo, de livre acesso aos cidadãos e aos visitantes da cidade de Lisboa.|mp
Vozes do PCP||Muito bem!|interruption
Presidente|Presidente|Tem a palavra o Sr. Deputado Luís Rodrigues para uma intervenção.|president
Luís Rodrigues|PSD|Sr. Presidente, Sr.as e Srs. Deputados: Foi difícil mas, finalmente, é possível, quatro meses após a entrada na Mesa do projecto de lei do PSD para revogação do novo contrato de concessão do terminal de contentores de Alcântara, debater de novo este caso grave de promiscuidade entre o poder político e o poder económico.\nJá passaram cerca de dois anos desde que o Primeiro-Ministro anunciou este negócio no Porto de Lisboa.\nNa altura, estava tudo previsto: túneis, nós desnivelados, jardins. Enfim, estava o horizonte a ser pintado de cor-de-rosa, sendo a lata de tinta o prolongamento da concessão do terminal de contentores.\nComo em todas as grandes obras que o Governo queria fazer, a justificação era a urgência pelo colapso das várias estruturas, neste caso porque rapidamente o terminal rebentaria pelas costuras. As linhas transoceânicas e o super porta-contentores de nova geração aí estavam para justificar o que já na altura era um logro.\nEm Setembro de 2008, quando é aprovado o diploma que garante ao concessionário o controlo do terminal de contentores até 2042 sem a realização de concurso público, já o tráfego de contentores neste local estava em declínio, confirmando aquilo que o PSD afirmava, ou seja, que era um embuste e um falso argumento o congestionamento iminente do terminal.\nNa altura, o PSD perguntou quais eram as razões objectivas deste negócio. As respostas não apareceram, tal como permaneceu escondido, por muitos meses, o contrato celebrado entre o Porto de Lisboa e o concessionário (sabem que é verdade!). Este folhetim continuou até que o contrato viu a luz do dia, mas em que a parte importante desse documento permaneceu escondida numa qualquer gaveta do Governo.\nEste escandaloso negócio, denunciado, em primeiro lugar, pelo PSD, teve sempre a contestação unânime de toda a oposição parlamentar, da direita á esquerda,»|mp
Rosário Cardoso Águas|PSD|Muito bem!|mp
Luís Rodrigues|PSD|» em que sempre foi exigida a revogação do contrato.\nChegamos hoje a este debate com a sensação de que a promiscuidade entre o poder político e o poder económico alastrou para além do PS.|mp
Rosário Cardoso Águas|PSD|Muito bem!|mp
Luís Rodrigues|PSD|A reboque do agendamento para debate dos projectos de lei do PSD, de Os Verdes, do BE e do PCP, o CDS aparece como a voz dissonante neste debate, invertendo a posição assumida desde o início do processo.\nQuer agora o CDS a suspensão do contrato e não a sua revogação,»|mp
Miguel Tiago|PCP|Faz lembrar a questão da avaliação dos professores!|mp
