Presidente|Presidente|Srs. Deputados, temos quórum, pelo que está aberta a sessão.
Presidente|Presidente|Sr.as e Srs. Deputados, antes de mais, peço à Sr.ª Secretária que dê conta do expediente.\n
Secretária|Rosa Maria Albernaz|Sr. Presidente, Sr. e Srs. Deputados, deram entrada na Mesa, e foram admitidas, as seguintes iniciativas legislativas: proposta de lei n.º 17/XI — Autoriza o Governo a alterar o sistema de unidades de medida legais, aprovado pelo Decreto-Lei n.º 238/94, de 19 de Setembro, transpondo a Directiva 2009/3/CE, do Parlamento Europeu e do Conselho, de 11 de Março de 2009, que baixa à 6.ª Comissão; projectos de lei n.os 253/XI — Reforça o regime de protecção das uniões de facto (PCP), que baixa à 1.ª Comissão, 254/XI — Integra o concelho de Mação na unidade territorial do Médio Tejo (BE), que baixa à 12.ª Comissão, 255/XI — Integra o município de Mação na NUTS III – Médio Tejo (PCP), que baixa à 12.ª Comissão, 256/XI — Segunda alteração à Lei n.º 59/2008, de 11 de Setembro, que aprova o regime do contrato de trabalho em funções públicas e introduz a jornada contínua no âmbito da protecção na parentalidade (CDS-PP), que baixa à 11.ª Comissão, 257/XI — Altera o Regime Fiscal das Mais-Valias Mobiliárias (PSD), que baixa à 5.ª Comissão, e 258/XI — Altera o Anexo II do Decreto-Lei n.º 46/89, de 15 de Fevereiro, bem como os Anexos I e II do Decreto-Lei n.º 68/2008, de 14 de Abril, de modo a integrar o município de Mação na NUTS III – Médio Tejo (CDS-PP), que baixa à 12.ª Comissão; apreciação parlamentar n.º 34/XI (1.ª) — Relativa ao Decreto-Lei n.º 33-A/2010, de 14 de Abril (CDS-PP); e projectos de resolução n.os 126/XI — Recomenda ao Governo a suspensão do processo de aprovação do Plano de Ordenamento do Parque Natural do Sudoeste Alentejano e Costa Vicentina e a adopção de medidas de efectiva consulta pública e participação das populações para a redefinição do Plano de Ordenamento do PNSACV e do seu regulamento (PCP), que baixa à 12.ª Comissão, e 127/XI — Recomenda a suspensão do licenciamento de novas áreas comerciais de grupos da grande distribuição (suspensão das autorizações de novas instalações de estabelecimentos de comércio e retalho e conjuntos comerciais ao abrigo do Decreto-Lei n.º 21/2009, de 19 de Janeiro) (PCP), que baixa à 6.ª Comissão.\n É tudo, Sr. Presidente e Srs. Deputados.\n
Presidente|Presidente|Srs. Deputados, fui informado pelo Sr. Ministro dos Assuntos Parlamentares de que o Sr. Ministro de Estado e das Finanças já se encontra na Sala, pelo que vamos passar o debate de hoje, que consta da interpelação ao Governo n.º 4/XI (1.ª), sobre privatizações, apresentada pelo PCP.\n Para iniciar este debate, tem a palavra o Sr. Deputado Agostinho Lopes.\n
Agostinho Lopes|PCP|Sr. Presidente e Srs. Deputados e Sr.as Deputadas: As privatizações são um dos mandamentos da cartilha neoliberal que tem presidido às teorizações e, sobretudo, às práticas políticas de sucessivos governos do PS e do PSD, com ou sem CDS-PP, nos últimos 20 anos. A sua aplicação conduziu o País ao triste estado em que se encontra: desemprego, dívidas, défices, dependências e desigualdades.\n Na justificação do esbulho do património público, abundam na propaganda das privatizações mentiras sistemáticas e mistificações persistentes. Os governos nunca abdicaram da tentativa de as justificar, substituindo a teoria económica e política por propaganda.\n Uns contidos, como os governos PSD de Cavaco Silva, outros exuberantes, como os governos do PS/António Guterres, de que apresento algumas «pérolas» publicitárias pagas pelo XIII Governo — isto é, por todos nós! —, uma boa síntese de mentiras e mistificações.\n Ao longo dos anos de política de direita, a mentira dos prejuízos do sector público foi repetidamente propalada, mesmo depois de um livro branco, mandado elaborar por um ministro das finanças, demonstrar uma evidência: as nacionalizações foram financeiramente vantajosas para o Estado português! Depois foi o capitalismo popular! O Livro Branco desfez a mentira: 99% dos accionistas detinham uma percentagem insignificante do capital social das empresas privatizadas.\n Outra tese, hoje caída em desuso, pelo comportamento da GALP, da EDP, da Brisa, etc., foi a da «Privatização igual a fim de monopólios e mais concorrência». De facto, substituíram-se monopólios públicos dirigidos e regulados pelo Estado pela vontade majestática de monopólios privados! Como é extraordinária a propaganda das vantagens para trabalhadores e consumidores: uns foram despedidos aos milhares, os outros passaram a ter ou continuaram a ter preços e tarifas e comissões elevadíssimos na energia, nas comunicações e transportes, nos serviços financeiros, etc., comparados com cidadãos de outros países europeus, com poderes de compra, salários e pensões várias vezes superiores! Os exemplos são bastante conhecidos.\n
Bernardino Soares|PCP|É verdade!
Agostinho Lopes|PCP|Outro objectivo afirmado, e propaganda feita, foi o da redução da dívida pública. Se, inicialmente, tal aconteceu, tendo as privatizações permitido a dita convergência nominal a caminho da moeda única, rapidamente, como os gráficos tão flagrantemente exibem, a dívida pública se transformou num buraco sem fim nem fundo, onde desapareceram milhões e milhões de euros sem nunca a saciarem! Srs. Deputados, o objectivo central das privatizações foi o da reconstituição dos grupos económicos monopolistas, liquidados pelo 25 de Abril e as nacionalizações. Os novos grupos privados que, no dizer do ExPrimeiro-Ministro Guterres, seriam «os elementos racionalizadores das transformações económicas do País, da modernização e de um novo modelo de especialização».\n Conhecemos a modernização feita na primeira década do século XXI: um modelo de mão-de-obra barata e precária, baixo valor acrescentado, dependência e subcontratação.\n Sabemos, também, como esses grupos se especializaram na produção de bens e serviços não transaccionáveis.\n
Bernardino Soares|PCP|Muito bem!
O Agostinho Lopes|PCP|Dá nisto confundir reestruturação económica com centralização e concentração de capitais, pela liquidação de unidades e sectores, pelo desmantelamento da coerência e racionalidade de fileiras produtivas e áreas de actividade das empresas públicas! Não! Os grupos económicos privados e monopolistas não foram nem serão núcleos de racionalidade económica, mas núcleos de racionalização de interesses privados, segundo o seu muito antigo, conhecido e natural critério de racionalidade: a maximização da taxa de lucro.\n
Bernardino Soares|PCP|Exactamente!
Agostinho Lopes|PCP|Srs. Deputados, as privatizações anunciadas no PEC vão agravar todos os problemas decorrentes das anteriores privatizações, um criminoso programa de privatizações atingindo sectores estratégicos e monopólios naturais, eliminando qualquer resquício da presença do Estado em empresas estratégicas e estruturantes da economia e do território.\n As inevitáveis consequências, tendo em conta 20 anos de privatizações, são fáceis de prever.\n No campo de forças económico, o avolumar e consolidar da potência económica, social e política de um número restrito de grupos (económicos e financeiros) acentuará uma estrutura monopolista/oligopolista, em sectores de serviços e bens essenciais, reforçará uma hierarquia de relações de domínio e desfavoráveis a grandes, médias e pequenas empresas privadas e ao próprio Estado. Em matéria de mercados, no acesso a fundos públicos e comunitários, na definição das normas e regras económicas pelo poder político, nos preços e tarifas daqueles bens e serviços.\n
Bernardino Soares|PCP|Muito bem!
Agostinho Lopes|PCP|Não haverá, como a experiência suficientemente tem demonstrado, entidades reguladoras que respondam a este problema.\n No plano das contas públicas, o Estado vai continuar a perder as receitas dos dividendos que deixa de receber — trata-se, no fundamental, de empresas bastante lucrativas —, e também perde receitas fiscais — as mesmas empresas, privatizadas passam, em geral, a pagar menos! —, agravando o défice orçamental. Só entre 2004 e 2009, o Estado recebeu de dividendos mais de 1400 milhões de euros de dividendos. É uma parcela significativa desta fonte de receitas públicas que o Governo pretende agora vender aos grandes grupos económicos.\n Agrava-se a balança de pagamentos pela crescente saída de rendimentos por exportação de dividendos correspondentes à forte presença do capital estrangeiro no capital social das empresas privatizadas! Mais de 50% do capital accionista da PT, da EDP, do BCP, do BES, do BPI e da Brisa está hoje na mão de capital estrangeiro. O Governo PS acha pouco! Em 2008, os rendimentos pagos ao exterior, desta forma, atingiram 20 mil milhões de euros.\n
Bernardino Soares|PCP|Um escândalo!
Agostinho Lopes|PCP|Vinte anos depois, 36 milhões de euros de privatizações depois, o rácio dívida pública/PIB quase duplicou! E vai continuar a agravar-se, como o próprio Governo reconhece no PEC.\n Vão continuar a ser fortemente atingidos os sectores produtivos, como a agricultura, pescas e indústria, pelas condições (fundamentalmente preços) de acesso a factores de produção tão diversos como a energia e os transportes, e pelo agravamento dos efeitos, já referidos, da monopolização dos mercados. Facilitando o domínio do capital estrangeiro, vão abrir caminho, no quadro da relocalização à escala europeia de importantes sectores industriais, para a sua liquidação em Portugal, o que pode acontecer com a Empordef e os com os estaleiros navais de Viana do Castelo.\n Vão agravar a dependência estrutural da economia portuguesa do capital transnacional e o lógico comando estratégico de importantes sectores por centros de decisão não nacionais.\n Só um forte sector empresarial público pode garantir a soberania nacional em centros fulcrais de decisão económica, para resistir com êxito à concorrência feroz no mercado comunitário e mundial e a uma divisão internacional do trabalho desfavorável a Portugal. Só assim será possível manter o controlo nacional sobre o essencial da estratégia de desenvolvimento do País. As privatizações anunciadas remarão em sentido contrário.\n
Bernardino Soares|PCP|Muito bem!
Agostinho Lopes|PCP|Srs. Membros do Governo, Srs. Deputados, no plano do ordenamento do território e do uso dos recursos naturais, o carácter estruturante de muitas das empresas públicas a privatizar, pela sua natureza de organização em rede, pela sua índole estratégica, reforçará a incapacidade do Estado, representante do interesse geral, público, para intervir no ordenamento do território, inclusive na resposta às assimetrias regionais e na defesa de um desenvolvimento sustentável e criterioso uso dos recursos naturais.\n Finalmente, os processos e as políticas de privatizações conduziram a uma situação em que quem determina a política nacional é cada vez menos o povo português, mas os que, ilegitimamente, se vão apropriando dos mecanismos fundamentais da economia portuguesa.\n A degradação do regime democrático de Abril é também indissociável do processo de domínio dos principais grupos económicos monopolistas sobre a sociedade e a vida dos portugueses. A corrupção é indissociável da promiscuidade dos grandes negócios com o poder político e da violação do princípio constitucional da subordinação do poder económico ao poder político. Se quisermos um exemplo recente, recordemos a forma arrogante como os gestores de algumas grandes empresas, ainda com forte presença pública, reagiram e agiram face ao envergonhado recado do Governo em matéria dos seus bónus e remunerações de jackpot.\n
|PCP|*** Aplausos ***
||A Constituição da República Portuguesa continua a estabelecer, como princípios organização económico-social e como incumbências prioritárias do Estado para sua subordinação do poder económico ao poder político democrático e a coexistência dos privado, cooperativo e social, no âmbito de uma economia mista. Ora, tal não é compatível privatizações.\n fundamentais da concretização a sectores público, com a política de
Bernardino Soares|PCP|Muito bem!
Agostinho Lopes|PCP|A política alternativa exige a ruptura com o domínio do capital monopolista; a afirmação da propriedade social e do papel do Estado em sectores estratégicos, nomeadamente com a suspensão do processo de privatizações em curso; e um sector público forte e dinâmico, ao serviço da democracia e do desenvolvimento independente do País.\n
|PCP|*** Aplausos ***
||As imagens projectadas durante a intervenção podem ser vistas no final do DAR.\n
Presidente|Presidente|Para uma intervenção, no período de abertura da interpelação ao Governo sobre privatizações, tem a palavra o Sr. Ministro de Estado e das Finanças.\n
Ministro de Estado e das Finanças|Ministro|Sr. Presidente, Sr. e Srs. Deputados: O Programa de Estabilidade e Crescimento (PEC) para 2010-2013 visa corrigir, até 2013, a situação de défice excessivo e a trajetória de crescimento da dívida pública e do endividamento.\n O PEC assume uma estratégia clara e responsável de consolidação orçamental, que tem de ser encarada como uma condição fundamental da sustentabilidade financeira do País e do financiamento da actividade económica.\n O programa de privatizações a implementar promove uma visão moderna do papel do sector empresarial do Estado na salvaguarda do interesse público e constituirá um contributo para a contenção do crescimento da dívida pública e do endividamento da economia. Por via da redução da despesa com juros, as operações de privatização contribuirão também para a redução do défice.\n No quadro da programação plurianual das operações de privatização, está prevista a alienação das participações na carteira acessória entre 2010 e 2013, contemplando-se ainda um conjunto de diversas empresas nas áreas da energia, da construção e reparação naval, das tecnologias de informação e comunicação, do serviço postal, das infra-estruturas aeroportuárias e do transporte aéreo e ferroviário.\n Avançar-se-á, igualmente, com a alienação de activos detidos fora do País, nomeadamente em Angola e Moçambique.\n O Governo encara as privatizações como uma opção adequada para fazer face aos desafios orçamentais que enfrentamos e, assim, garantir a sustentabilidade económica e financeira do País, sem deixar de acautelar a defesa do interesse público envolvido, a bem da justiça social e da qualidade de vida dos cidadãos, nomeadamente no acesso a serviços públicos.\n É importante não esquecer que o equilíbrio das contas públicas, o crescimento económico sustentado e a qualidade de vida dos cidadãos são domínios intrinsecamente ligados.\n Mas analisemos as razões que consubstanciam as privatizações como uma opção adequada para os objectivos a que nos propomos, isto é, o estímulo à inovação e ao desenvolvimento tecnológico, a modernização da gestão e também a redução do défice e o controlo do crescimento da dívida.\n O Governo salienta que temos actualmente em Portugal um mercado de capitais sólido, transparente, com liquidez e sem distorções, que se encarregará de valorizar adequadamente as participações do Estado a alienar. O Estado não venderá a qualquer preço, venderá ao preço justo, tendo em conta a solidez dos activos em causa e a expectativa de dividendos futuros. Reafirmo: o mercado encarregar-se-á de valorizar adequadamente as participações a alienar.\n Tem sido argumentado que o encaixe obtido com as privatizações das empresas pode ser recuperável em poucos anos com os dividendos pagos ao Estado por essas empresas.\n Pois bem, é importante, e saudável, comparar a redução de juros da dívida pública em resultado da amortização do seu stock e o montante de dividendos cessantes futuros.\n Ao efetuar-se este exercício para o elenco de empresas que actualmente distribuem dividendos, isso conduz a uma situação de indiferença num cenário de alocação de 80% do encaixe à amortização de dívida, mas se a alocação à amortização da dívida pública corresponder a 100% do encaixe com privatizações, o impacto na redução dos juros é francamente superior ao montante dos dividendos cessantes.\n A redução de 6000 milhões de euros — valor de receitas esperado com as operações de privatização — ao stock de dívida pública contribui directamente para o controlo do crescimento da dívida. Com efeito, estima-se que as privatizações terão um efeito de redução anual da dívida equivalente a 0,99% do PIB, em 2011, a 0,79% do PIB, em 2012, e a 0,65% do PIB, em 2013.\n O programa de privatizações repercute-se positivamente no esforço de consolidação orçamental também por via da redução dos encargos da dívida pública. Este mecanismo tem um impacto substancial nos juros suportados anualmente, dependendo o seu impacto, naturalmente, do nível das taxas de juro sobre a dívida da República. Em todo o caso, as estimativas de poupanças com despesas em juros que resultam das privatizações são crescentes até 2013, altura em que atingirão uma redução estimada de 0,1% do PIB.\n Resulta, pois, das operações de privatização, um efeito cumulativo na prossecução da estratégia de consolidação orçamental, por via da redução do stock de dívida pública e por via da redução da despesa com juros.\n Sr. Presidente, Sr.as e Srs. Deputados: O contributo das operações de privatização a levar a cabo pelo Estado não se fica pelo contributo directo para o imperioso esforço de consolidação.\n A entrada de capitais privados em empresas onde o Estado actualmente é accionista único, como sejam a TAP, a ANA, os Estaleiros Navais de Viana do Castelo e os CTT, constitui um elemento potenciador de ganhos de eficiência para o Estado.\n Risos do PCP.\n Numa lógica de gestão privada, tendo em vista a rentabilização dos capitais investidos pelos novos detentores de capital, o Estado também lucrará. De facto, passará a partilhar riscos e a colher os benefícios de uma gestão orientada para o mercado e, porventura, mais bem preparada para enfrentar os desafios da liberalização do mercado, como acontece no caso do sector dos serviços postais e do transporte de energia.\n Além disso, a alienação de partes do capital em sectores onde o Estado já se encontra numa posição minoritária promoverá uma ainda maior dispersão de capital, com um aumento do free float, contribuindo, assim, para o reforço da liquidez dos títulos no mercado bolsista.\n Importa ainda salientar que o Estado, ao alienar a sua participação em empresas, deixando a iniciativa para a condução dessas atividades a privados, obtém recursos que pode redirecionar para outros domínios, onde a presença do Estado, do ponto de vista de justiça social, mais se justifica.\n Deste modo, as políticas públicas respondem ao desafio constante de reafectar recursos escassos a necessidades sociais crescentes, dirigindo-os para setores como a educação, a saúde e a solidariedade social.\n
Vozes do PCP|PCP|Claro…!
Ministro de Estado e das Finanças|Ministro|No que diz respeito às questões envolvendo a manutenção dos postos de trabalho, lembramos os já longos anos e experiência de processos de privatização, que, tendo sido concretizados com cautela, não levaram à existência de situações críticas de perda de postos de trabalho.\n Pelo contrário, as várias empresas privatizadas pelo Estado, ao longo de quase duas décadas, estão hoje fortes e são pilares do desenvolvimento e da sustentabilidade de emprego, como são exemplos a PT, a GALP ou a EDP.\n
Bernardino Soares|PCP|A PT acabou de despedir mais de 4000 pessoas!
Ministro de Estado e das Finanças|Ministro|Sr. Presidente, Sr.as e Srs. Deputados: Ao contrário do que tem também vindo a ser defendido, quanto à falta de detalhe do programa de privatizações, o Governo reitera a transparência com que estas operações têm vindo a ser planeadas, baseando-se, aliás, na experiência dos únicos governos que aprovaram programas de privatizações plurianuais — os governos do Partido Socialista no biénio 2006-2007; de Junho 2000 a Junho 2002; no biénio 1998-1999; e no biénio de 1996-1997.\n Quanto à GALP e à EDP, posso, desde já, adiantar que haverá lugar à emissão de obrigações convertíveis, mantendo o Estado o direito de voto e ao dividendo durante o prazo da emissão.\n
Bernardino Soares|PCP|Qual é o prazo?!
Ministro de Estado e das Finanças|Ministro|Algumas das empresas referidas na lista das empresas a privatizar deverão ainda passar ou concluir os processos de reorganização ou de reestruturação, como são exemplos os seguros do Grupo Caixa, o Grupo TAP e o Grupo CP.\n O programa de privatizações é um dos instrumentos que articula uma visão moderna do papel do sector empresarial do Estado na salvaguarda do interesse público. Actualmente, estão a ser preparadas outras iniciativas relevantes, como o estabelecimento de limites ao endividamento das empresas públicas, o alinhamento das regras em matéria de aumentos salariais, a gestão do parque automóvel com o definido para a Administração Pública e a contratualização do serviço público com todas as empresas de transporte.\n Gostaria de destacar ainda a criação, no âmbito do Ministério das Finanças e da Administração Pública, de uma entidade exclusivamente vocacionada para o acompanhamento das parcerias público-privadas e concessões.\n
Bernardino Soares|PCP|Mais uma!...
Ministro de Estado e das Finanças|Ministro|Sr. Presidente, Sr.as e Srs. Deputados: O programa plurianual de operações de privatização é parte do conjunto de medidas adequadas e necessárias para respondermos com determinação e eficazmente aos desafios que enfrentamos no contexto recente da profunda volatilidade dos mercados de risco e do contágio que deles decorre.\n Uma vez traçada e reconhecida internacionalmente a estratégia de consolidação que temos pela frente até 2013, importa agora, isso sim, implementar de forma célere e decidida as medidas que foram enunciadas.\n
|PS|*** Aplausos ***
Presidente|Presidente|Para pedir esclarecimentos ao Sr. Deputado Agostinho Lopes, tem a palavra o Sr.\nDeputado Afonso Candal.\n
Afonso Candal|PS|Sr. Presidente, Sr. Deputado Agostinho Lopes, V. Ex.ª, na sua intervenção, entre diversas afirmações já previsíveis, fez outras que motivam, desde logo, este meu pedido de esclarecimento.\n V. Ex.ª manifestou-se absolutamente contra a entrada de capital estrangeiro nas empresas portuguesas.\n Eu gostava de lhe perguntar se a sua perspectiva é exactamente a mesma quando falamos de capital português a entrar em empresas estrangeiras. Ou seja: se V. Ex.ª entende que tudo o que é capital exterior deve ser impedido de entrar e que também as empresas portuguesas e os cidadãos portugueses devem ser impedidos de se internacionalizar, de adquirir ou de participar em empresas fora do espaço nacional.\n É para ver se nos entendemos, porque não tenho dúvidas de que o PCP tem uma enorme dificuldade em perceber que hoje nós gerimos a nossa vida, enquanto cidadãos, e a vida económica e a vida do País, num espaço aberto e temos de estar preparados para esse espaço aberto.\n
Jerónimo de Sousa|PCP|Claro!... Para a «roubalheira»!
