Honório Novo|PCP|Todos os recursos judiciais deixarão, assim, de ter efeito suspensivo do acto pretendido.\nFinalmente, pretendemos que a administração tributária passe a receber informação sobre os rendimentos das poupanças de todos os sujeitos passivos, isto é, dos nacionais que residam noutros Estados-membros, como já hoje está previsto, mas também dos que residem em território nacional, facto que o PS tem sistematicamente obstaculizado.\nA terminar, diria que, depois dos faits divers dos últimos anos, depois da famosa penitência criada pelo PS para absolver o enriquecimento ilícito, é tempo de agir e avançar com instrumentos realmente capazes de servir o combate à corrupção e à fraude fiscais.|mp
||Aplausos do PCP.|applause
Luís Fazenda|Presidente|Para uma intervenção, tem a palavra o Sr. Deputado Ricardo Rodrigues.|president
Ricardo Rodrigues|PS|Sr. Presidente, Sr.as e Srs. Deputados: Oito dias volvidos sobre um agendamento potestativo do Bloco de Esquerda, estamos a discutir um agendamento potestativo do PSD e, penso, no dia 17 ou 18, estaremos a discutir outro agendamento potestativo e ainda mais um, quer do PCP quer do CDS-PP.\nCom a vontade, que já exprimimos, de viabilizar — e vamos votar favoravelmente — a constituição da comissão eventual, tal como já foi dito pelo Presidente do meu grupo parlamentar, estamos a dar a ideia sobre qual é a nossa convicção: no Plenário, explicitaremos de forma contundente as discordâncias que temos de princípios e essas discordâncias têm a ver com o enriquecimento ilícito; em relação às outras áreas, em que não temos discordância de princípios, temos até visões que podem ser consensualizadas na comissão, o que faremos é abster-nos para viabilizar a baixa das iniciativas à respectiva comissão.\nComo todos sabem (não é novidade para ninguém), face aos diplomas concretos do enriquecimento ilícito, convém recordar que estamos, nesta Casa, com uma dificuldade que, em comissão, vai ser interessante analisar: por um lado, temos o projecto do Bloco de Esquerda, que pretende a prova de um facto negativo para se atingir o crime de enriquecimento ilícito; depois, o projecto do PCP, que não pretende a prova do facto negativo mas ataca a presunção de inocência e pede ao arguido que identifique o seu património para não ser condenado — o que pensamos ser uma violação da presunção de inocência —; e agora temos o projecto do PSD, que conseguiu inventar o crime de perigo abstracto.\nEm rigor, para que todos os portugueses nos percebam, os três projectos jamais podem ser juntos ou consensualizados. Estamos a falar de princípios jurídicos totalmente distintos, estamos a falar de técnicas legislativas totalmente distintas.\nQuanto ao projecto do Bloco de Esquerda, o Partido Socialista teve oportunidade de justificar, na semana passada, a sua oposição, ou seja, não concordamos com o princípio porque o consideramos inconstitucional.\nHoje, temos a versão do crime de perigo abstracto.\nPara os que não lidam com o Direito com mais frequência, dou dois exemplos típicos de crime abstracto: a condução por efeito do álcool ou de estupefacientes constitui aquilo que, na doutrina criminal e penal, se chama concretamente «crime de perigo abstracto». A acção ou o comportamento em concreto é, em si, perigoso. Fabricar moeda falsa também é considerado perigoso, independentemente do resultado. Ou seja, basta que um indivíduo esteja embriagado para que cometa o crime de condução por efeito do álcool.\nOra, nesta matéria que estamos a discutir, o PSD vai ter de explicar o que considera perigoso para preencher o tipo de crime, se é ser rico, se é ser titular de um cargo político. O que considera o PSD perigoso para preencher o tipo de crime? Qual é a acção, em concreto? Qual é o comportamento, em concreto, que o PSD considera perigoso, para que se possa perceber como é que os senhores conseguem preencher o tipo legal de crime? Mas não chega! O PSD insiste numa técnica legislativa que, a nosso ver, comporta dois erros assinaláveis.\nEm primeiro lugar, é aquele que referi: ser rico não é crime; ser titular de um cargo político ou de função pública também me parece que não é crime, salvo se o PSD conseguir explicar essa própria contradição nos seus termos, uma vez que todos eles exercem um cargo político.|mp
Telmo Correia|CDS-PP|Nem parece que seja perigoso!|mp
Ricardo Rodrigues|PS|Mas não só.\nA verdade é que o texto do PSD diz: «(») com perigo de aquele património ou modo de vida provir de vantagens obtidas pela prática de crimes cometidos».\nSrs. Deputados, vão ter de me explicar como é que, no tipo legal de crime, um dos elementos do tipo é o de já se ter verificado a prática de um crime. Como sabe, essa é a regra elementar do direito penal: pelo mesmo facto não se pode ser julgado duas vezes, muito menos se pode ser punido duas vezes.\nPortanto, os senhores têm no vosso texto essas duas incongruências, aquilo a que, salvo devido respeito, chamo «inconstitucionalidades grosseiras». Admito que, nessa matéria, haja até interpretações diversas, mas, nesse caso, estou confortavelmente acompanhado pelo vosso companheiro Morais Sarmento, que consideraque, embora na vossa bancada haja insignes juristas, ainda não conseguiram inventar a roda. Ela já foi inventada, não vale a pena inventá-la de novo! Portanto, não temos essas questões de princípio. Somos contra a tipificação desse crime, porque, enquanto facto ilícito, ele já é punido. O enriquecimento ilícito é a consequência de um crime.\nSabem, Srs. Deputados, fico com muitas dúvidas e tenho de partilhá-las convosco. Quando abdicamos dos princípios, abrimos a porta para que tudo aconteça. Haver uma décalage, uma desproporção entre o rendimento e o património também se verifica no crime de furto ou no crime de roubo. A pessoa pode roubar dinheiro, pode roubar um quadro valioso, pode roubar ou furtar seja o que for. Nesta matéria, também temos uma décalage entre o rendimento e o património. Então, também vão querer que seja o próprio, nos crimes de furto, a partir de agora, a ter de justificar de onde é que provêm?! Ou seja, quando abrimos a porta, quando abdicamos dos princípios, a seguir, vêm os crimes de furto, os crimes de roubo e outros tantos em que se vai pedir ao arguido que seja ele a participar na descoberta da verdade.\nOra bem, essa é a violação do princípio da inocência e desse nós não abdicamos. Não estamos aqui para inventar álibis mas para continuar a lutar pelos princípios do Direito e do Estado de direito, de que não queremos nem vamos abdicar. Por isso, estas duas questões são fundamentais.\nAlém de mais, as perguntas que o Sr. Deputado Nuno Magalhães fez, às quais o Sr. Deputado Aguiar Branco não respondeu, são muito pertinentes. Mas convinha responder o que é que pensa. Então, o depósito a prazo é elemento do tipo do rendimento, mas o depósito à ordem já não é?! São perguntas pertinentes para que possamos perceber o que o PSD põe no seu projecto: se o projecto é razoável e merece a nossa aprovação ou se, pelo contrário, é completamente desrazoável e não tem o mínimo de senso, nem político nem de política criminal.\nGostaria de dizer ao PCP que apreciamos o projecto que apresentou sobre o sigilo bancário. Não estamos de acordo com ele em alguns pormenores mas pensamos que, baixando à comissão, tem muita viabilidade e há condições para encontrarmos consenso no sentido de continuarmos na senda do levantamento do sigilo bancário.\nO Sr. Deputado Honório Novo não ignora que, na legislatura passada, fizemos progressos nessa matéria.\nQuase no final dessa legislatura, aprovámos uma lei que alterou a Lei Geral Tributária no sentido de acolher praticamente as propostas do Partido Comunista.\nBem sei que agora o Partido Comunista pretende que não seja suspensivo o recurso em todo e qualquer processo. Verificaremos se assim deve ser ou não. O que queremos é defender interesses legítimos de terceiros, mas estou certo de que encontraremos a fórmula adequada para chegar a um consenso. Ou seja, a posição do Partido Socialista é a de que o combate à corrupção não tem, nem deve ter, tréguas.\nO Partido Socialista está disposto a continuar esse combate, que sempre foi um dos seus combates. Não estamos dispostos a perder a verticalidade, não estamos dispostos a corromper o Estado de direito, mas estamos disponíveis, sempre, para encontrar soluções que possam contribuir para dignificar esse combate e para encontrar as melhores soluções para o País.|mp
||Aplausos do PS.|applause
Luís Fazenda|Presidente|Para pedir esclarecimentos, tem a palavra o Sr. Deputado João Semedo.|president
João Semedo|BE|Sr. Presidente, Sr. Deputado Ricardo Rodrigues, o Partido Socialista e o Sr. Deputado insistem sucessivamente que o projecto de lei do Bloco de Esquerda promove a inversão do ónus da prova. O Partido Socialista e o Sr. Deputado podem insistir mil vezes nessa afirmação, mas, até hoje, nem o Sr. Deputado nem o Partido Socialista demonstraram que isso é verdade.\nNa realidade, se há um rendimento declarado e se há, demonstrada e provadamente, um rendimento que não é compatível com o rendimento declarado, onde é que está a inversão do ónus da prova?! O Ministério Público é encarregado da acusação e a acusação tem de incluir a prova desta diferença entre um e outro rendimentos, ou, se quiser, entre o rendimento declarado e o património verificado. Onde é que está a inversão do ónus da prova?!Vou ainda fazer-lhe uma segunda pergunta. Admitamos que o Sr. Deputado tem dúvidas profundas sobre este problema da inversão do ónus da prova. Se o PS tem tanta vontade em combater o enriquecimento ilícito, qual é a proposta do Partido Socialista? É que há quatro anos e meio que o Partido Socialista diz, no Parlamento, que quer combater a corrupção, que quer prevenir a corrupção, que quer combater o enriquecimento ilícito, contesta, muitas vezes de forma sectária, as propostas dos outros partidos, nomeadamente a do Bloco de Esquerda, mas até hoje não vimos uma única proposta do Partido Socialista para combater, efectivamente, o enriquecimento ilícito. A não ser que tenhamos de reconhecer, e ficar a saber, que para o Sr. Deputado e para o Partido Socialista o enriquecimento não justificado é, afinal de contas, um enriquecimento lícito e legal, contra o qual nada deve ser feito!!»|mp
||Aplausos do BE.|applause
Luís Fazenda|Presidente|Para responder, tem a palavra o Sr. Deputado Ricardo Rodrigues.|president
Ricardo Rodrigues|PS|Sr. Presidente, Sr. Deputado João Semedo, aqui somos todos políticos.\nNem o senhor é médico, nem eu sou jurista, somos políticos. Mas, convenhamos, às vezes, nesta discussão, impor um elemento técnico, no sentido jurídico do termo, dá algum jeito para que se possa perceber.\nDizer que não temos propostas para o enriquecimento ilícito é a pura das verdades. Porquê? Porque, para nós, o enriquecimento ilícito já está criminalizado. Está criminalizado na corrupção, quer seja por acto lícito, quer seja por acto ilícito; está criminalizado na prevaricação; está criminalizado no peculato; está criminalizado no tráfico de influências; está criminalizado em n crimes do Código Penal.\nDeputado quer criminalizar uma consequência de um crime. O enriquecimento ilícito proposto por VV.\nEx.as é a criminalização da consequência de um crime e não um crime propriamente dito! Sr. Deputado, a presunção de inocência ataca-se quando os senhores dizem que é preciso provar a proveniência não lícita.\nOra, dizer, em tribunal, que prove a proveniência não lícita é um ataque à presunção da inocência.\nSabe que todos os artigos do Código de Processo Penal são direito constitucional aplicado. O arguido, como o senhor sabe, pode estar calado, em Portugal ou em qualquer parte do mundo civilizado, e isso não pode ser usado contra ele, nem em Portugal nem em nenhum Estado que respeite os princípios do Estado de direito. O silêncio de um arguido jamais o pode prejudicar – este é um princípio constitucional, infere-se directamente da presunção da inocência.\nPortanto, Sr. Deputado, quando o senhor diz que o arguido tem de provar a proveniência não lícita está a querer a contribuição»Srs. Deputados, os senhores verificarão» Vou dizer-vos, com toda a naturalidade e sem nenhuma excitação, que ontem os senhores, tal como nós, receberam algumas organizações de profissões judiciais e aquilo que elas nos disseram foi: «não nos tragam nenhum presente envenenado». Esta vossa proposta é um presente envenenado para o Ministério Público.|mp
||Protestos do BE.|protest
||Aplausos do PS.|applause
Luís Fazenda|Presidente|Para pedir esclarecimentos, tem a palavra o Sr. Deputado Luís Montenegro.|president
Luís Montenegro|PSD|Sr. Deputado Ricardo Rodrigues, a questão política fundamental na criminalização do enriquecimento ilícito é esta: concorda ou não V. Ex.ª, concorda ou não o PS que a desproporção entre os rendimentos de uma pessoa e o seu modo de vida ou património merecem a atenção penal?|mp
Ricardo Rodrigues|PS|Merecem, sim!|mp
Luís Montenegro|PSD|Merecem ou não a atenção penal no contexto do combate à corrupção?|mp
Ricardo Rodrigues|PS|Merecem, sim!|mp
Luís Montenegro|PSD|Diz e pergunta o Sr. Deputado Ricardo Rodrigues: onde é que está o perigo? O perigo está na corrupção que mina o desenvolvimento económico e social do nosso país e ataca os pilares mais importantes do nosso Estado de direito.|mp
Vozes do PSD||Muito bem!|interruption
Luís Montenegro|PSD|Sr. Deputado Ricardo Rodrigues, V. Ex.ª teve aqui uma ligeira evolução que, julgo, não vai passar despercebida: é que na semana passada V. Ex.ª até concordava com este princípio e dizia, desse mesmo lugar, que o PS estava disponível para encontrar uma solução jurídica – aliás, V. Ex.ª disse mesmo «nós estamos á procura, nós ainda estamos á procura»«.\nMas V. Ex.ª não procurou e, é verdade, também não encontrou, porque V. Ex.ª, objectivamente, o que aqui fez, hoje, foi uma inversão daquela que era a definição do princípio que tinha aqui apontado relativamente à posição do PS.\nO PS, pura e simplesmente, não quer criminalizar o enriquecimento ilícito e não quer atacar o fenómeno da corrupção com a construção jurídica que o PSD lhe apresenta e que salvaguarda aquilo que, do ponto de vista dos direitos fundamentais das pessoas, está em causa.\nJá tivemos oportunidade de lhe dizer várias vezes, mas vamos repetir: o nosso projecto de lei garante o respeito pelo princípio da presunção da inocência e garante a não inversão do ónus da prova – aliás, é literal essa garantia.\nDizemos no articulado que «A prova da desproporção manifesta que não resulte de outro meio de aquisição lícito, a que se refere o n.º 1,» – que é o tipo de crime – «incumbe por inteiro ao Ministério Público, nos termos gerais do artigo 283º do Código de Processo Penal.» E também dizemos como é que o Ministério Público o deve fazer, Sr. Deputado, ou seja, é através da comprovação dos elementos do tipo legal de crime, que são: um, os rendimentos do investigado; dois, o seu património e modo de vida; três, a manifesta desproporção entre estes e aqueles; quatro, a não proveniência lícita dos mesmos.|mp
Vozes do PSD||Exactamente!|interruption
Luís Montenegro|PSD|Sr. Deputado, não vale a pena procurar mais: a solução de princípio está aqui! Tenha o Sr. Deputado disponibilidade para arranjar a construção jurídica mais eficaz e que garanta os direitos fundamentais dos cidadãos, que é essa também a nossa intenção.|mp
||Aplausos do PSD.|applause
Luís Fazenda|Presidente|Para responder, tem a palavra o Sr. Deputado Ricardo Rodrigues.|president
Ricardo Rodrigues|PS|Sr. Presidente, Sr. Deputado Luís Montenegro, não mudámos de opinião, estamos disponíveis para, em Comissão, continuarmos nessa busca.\nA questão é que nós dizemos que a vossa proposta é inconstitucional, mas estamos disponíveis para encontrarmos, em conjunto, uma proposta que não seja inconstitucional. Agora, repito, a única coisa que dizemos é que esta vossa proposta é inconstitucional.\nDe qualquer forma, julguei que o Sr. Deputado ia responder às questões que levantei sobre, nomeadamente, o non bis in idem. Como é que resolve esse problema que é o de não ser punido duas vezes pelo mesmo facto? Julguei que ia responder à questão da prova da proveniência não lícita dos rendimentos.\nEssas questões, sim, é que nos preocupam.\nAgora, julgamos que, em Comissão, é possível encontrarmos, por consenso, alguma forma de criminalizar.\nSe calhar, tínhamos de começar por pensar em princípios diferentes do enriquecimento injustificado, porque oenriquecimento ilícito é ele, sim, como já disse, prova e objecto de outros crimes. A criação de um crime novo não é com o enriquecimento ilícito, o enriquecimento ilícito é uma consequência de um crime. Quanto ao enriquecimento injustificado, pensamos que é possível encontrar alguma fórmula que, por aí, possa encontrar uma solução. Por isso, não mudámos de opinião nem de princípios, Sr. Deputado, e não são as frases bonitas com princípios errados que nos trazem luz.\nA verdade ç que dizer que o PS não está interessado no combate á corrupção,» isso ç velho, Sr. Deputado! Estamos completamente disponíveis e, mais, queremos dar um contributo decisivo nessa matéria.\nNão tenho tempo agora, mas todas as vezes que intervenho lembro aos Srs. Deputados as 14 medidas que tomámos na anterior legislatura, e os senhores e mais alguns dizem que não foi nada, que não fizemos quase nada» Bem, esse seu discurso vem branquear aquele que foi um trabalho na anterior legislatura em matéria de combate à corrupção e não é um bom serviço à República. Trabalhámos a sério nessa matéria e queremos continuar a trabalhar a sério; por isso, sejam as propostas constitucionais que nós aqui estamos para as aprovarmos.|mp
||Aplausos do PS.|applause
Luís Fazenda|Presidente|Para uma intervenção, tem a palavra o Sr. Deputado José Luís Ferreira.|president
José Luís Ferreira|Os Verdes|Sr. Presidente e Srs. Deputados: O combate à corrupção volta a ser tema nesta Assembleia, agora por iniciativa do PSD, e, apesar de serem várias as iniciativas legislativas em discussão, todas elas, creio, convergem no mesmo propósito que é o do combate à corrupção.\nDe facto, este combate impõe-se para melhorar a nossa democracia, tornando-a mais transparente e atribuindo mais rigor à gestão da coisa pública, credibilizando as instituições da nossa democracia na defesa e na afirmação de uma cultura de responsabilidade.\nAssim, Os Verdes acompanham globalmente os projectos de lei hoje em discussão mas, dada a sua importância no que respeita ao combate à corrupção, faço referência explícita ao projecto de lei que pretende a criação do crime de enriquecimento ilícito no exercício de funções públicas.\nTrata-se de uma matéria que vem ao encontro dos compromissos assumidos por Portugal no âmbito da Convenção de Mérida, de que Portugal faz parte e que, aliás, foi aqui ratificada, por unanimidade, em Junho de 2007, no âmbito da qual os Estados membros se comprometem a diligenciar no sentido de eleger a crime o enriquecimento ilícito.\nDe facto, a impunidade com que os cidadãos assistem ao enriquecimento anormal de pessoas que exercem funções públicas não apenas fragiliza a justiça como também acaba por atingir o próprio Estado de direito, criando fortes desconfianças até sobre o seu funcionamento.\nÉ, pois, sobretudo, por estes motivos que entendemos que a transparência que deve estar subjacente à gestão da coisa pública e, principalmente, a responsabilização das pessoas que têm essa missão perante os outros cidadãos exige, a nosso ver, a criminalização do enriquecimento ilícito.\nNaturalmente que essa criminalização deve ser feita no respeito pelas garantias constitucionais e, desde logo, a presunção da inocência e o ónus da prova têm, obviamente, de recair sobre o Ministério Público.\nOra, a nosso ver, tanto o projecto de lei do PSD, como, aliás, os projectos de lei que foram discutidos sobre a mesma matéria na semana passada, não procedem a nenhuma inversão do ónus da prova e, portanto, pretendem promover o enriquecimento ilícito a crime respeitando as garantias constitucionais, sendo que compete ao Ministério Público, no âmbito das suas competências de investigação, fazer a prova da desproporção entre os rendimentos e o património que o cidadão apresenta.\nGostaria, ainda, de referir, relativamente ao projecto de lei do PCP que pretende derrogar o sigilo bancário, ou seja, pretende dotar o fisco de informações para poder actuar e combater o crime económico e a corrupção, que, nesse caso, o fisco estaria em condições de investigar as discrepâncias substanciais entre os saldos e os movimentos de depósito nas contas individuais e as respectivas declarações fiscais, sendo que, posteriormente, se fosse caso disso, o fisco poderia proceder à respectiva comunicação ao Ministério Público.  Trata-se, na nossa perspectiva, de uma medida imprescindível para reforçar o combate à corrupção.Em síntese, olhamos para estes projectos de lei como contributos para, de uma forma ou de outra, potenciar e reforçar a eficácia do combate à corrupção e assim, e desde que se respeitem as garantias constitucionais, como é o caso que estamos a discutir, Os Verdes votarão a favor dos projectos agora em discussão.|mp
Luís Fazenda|Presidente|Para uma intervenção, tem a palavra o Sr. Deputado Filipe Lobo d’Ávila.|president
Filipe Lobo d’Ávila|CDS-PP|Sr. Presidente, Sr.as e Srs. Deputados: Para atacar de frente a corrupção há que romper o pacto de silêncio entre corruptor e corrompido, reunindo as condições técnicas que permitam prever definitivamente e de forma sólida e rigorosa o estatuto do arrependido.|mp
Vozes do CDS-PP||Muito bem!|interruption
Filipe Lobo d’Ávila|CDS-PP|Para atacar de frente a corrupção há que aumentar a moldura penal dos crimes de poder.\nPara atacar de frente a corrupção há que prever a figura do crime urbanístico, com reconhecidos resultados aqui ao lado, em Espanha.\nPara atacar de frente a corrupção é preciso que a sanção seja dissuasora. Um presidente de câmara que tenha sido acusado, pronunciado e em julgamento condenado por crime praticado no exercício das suas funções públicas não deve poder candidatar-se novamente.|mp
Nuno Magalhães|CDS-PP|Exactamente!|mp
Filipe Lobo d’Ávila|CDS-PP|Para atacar de frente a corrupção é preciso que todos os titulares de cargos públicos sejam obrigados a fazer uma declaração do seu património e que essa declaração seja efectivamente fiscalizada, coisa que hoje, com todos sabemos, não acontece.|mp
Vozes do CDS-PP||Muito bem! Exactamente!|interruption
Filipe Lobo d’Ávila|CDS-PP|Sr. Presidente, Sr.as e Srs. Deputados: Estas são algumas das propostas que o CDS-PP trará, muito brevemente, ao Parlamento e que reclamam, no acto de legislar, a maior consistência técnica, e, na vontade de regenerar, um trabalho em conjunto com os operadores judiciários e com os operadores policiais.|mp
Vozes do CDS-PP||Muito bem!|interruption
Filipe Lobo d’Ávila|CDS-PP|Sr. Presidente, Sr.as e Srs. Deputados: Quanto às propostas que o PSD aqui nos traz hoje concentro-me na questão do enriquecimento ilícito.\nÉ certo que o PSD fez algum esforço por não ultrapassar pela esquerda o BE; é certo que o PSD fez algum esforço e prestou alguma atenção à clamorosa inconstitucionalidade e – porque não dizê-lo? – injustiça que significaria a inversão do ónus da prova»|mp
Pedro Mota Soares|CDS-PP|Muito bem!|mp
Filipe Lobo d’Ávila|CDS-PP|» e tambçm é certo que permanecem dõvidas, e dõvidas sólidas, não só sobre a pertinência da proposta mas também sobre a sua operacionalidade.|mp
Vozes do CDS-PP||Muito bem!|interruption
Filipe Lobo d’Ávila|CDS-PP|O primeiro risco que permanece nesta proposta é o de não ajudar a encontrar ou condenar um único corrupto, mas ajudar, involuntariamente, a colocar inocentes sob suspeita.|mp
Vozes do CDS-PP||Muito bem!|interruption
Filipe Lobo d’Ávila|CDS-PP|O risco conexo a este é o de contribuir para confundir o trigo com o joio, ou seja, tratar a política e o serviço público como um todo sob suspeita, o que, certamente, não ajudará ao recrutamento, que se deseja, de qualidade para esse mesmo serviço público.|mp
Vozes do CDS-PP||Muito bem!|interruption
Filipe Lobo d’Ávila|CDS-PP|Por outro lado, há o risco de a própria Assembleia da República emitir uma solução penal que parece meramente panfletária, anómala ou, simplesmente, desnecessária, sobretudo na opinião de alguns professores conceituados de Direito Penal e de muitos operadores judiciários.|mp
Pedro Mota Soares|CDS-PP|Muito bem!|mp
Filipe Lobo d’Ávila|CDS-PP|Preciso de vos recordar aqui, hoje, aquilo que o Prof. Costa Andrade referiu recentemente e que, basicamente, consistia no facto de, na sua opinião, não ver qualquer utilidade na criação deste crime, bastando aplicar as leis existentes.|mp
Vozes do CDS-PP||Muito bem!|interruption
