Miguel Macedo|PSD|Sr. Presidente, Sr. Primeiro-Ministro, sobre esta matéria quero dizer-lhe que o Sr. Primeiro-Ministro passou por cima da questão essencial nesta matéria: estas remunerações e estes bónus resultam de contratos a que o accionista Estado nessas empresas não se opôs na altura em que aqueles foram celebrados.\n Não venha V. Ex.ª aqui dizer aquilo que vem dizer, com o à-vontade com que o diz, como se nada tivesse a ver com isto. O accionista Estado, no momento em que foram celebrados estes contratos, não se opôs à sua celebração nem aos valores que resultaram destes contratos naquelas empresas. É essa a questão essencial!
|PSD|*** Aplausos ***
Paulo Portas|CDS-PP|Muito bem! Não é uma instrução do Governo! Há uma norma no Orçamento do Estado aprovada pela Assembleia!
Presidente|Presidente|Tem a palavra o Sr. Deputado Francisco Louçã.
Francisco Louçã|BE|Sr. Presidente, Sr. Primeiro-Ministro, terá constatado como eu que esta é uma semana de revelações.\n Ficámos a saber que há uma direita neste Parlamento que está disponível para uma misteriosa compra de submarinos que custam um milhão de anos de um rendimento de sobrevivência para o mais pobre dos mais pobres, mas que não quer que haja tributação dos ganhos da bolsa.\n Mas ficámos sobretudo a saber que o Sr. Primeiro-Ministro, que há 15 dias atrás repetia também o que me disse também há três meses, no sentido de que não podia haver tributação sobre as mais-valias enquanto a bolsa não recuperasse, que bastou milagrosamente um agendamento do Bloco de Esquerda para que o Governo agora acedesse a uma medida de elementar justiça.\n
Helena Pinto|BE|Muito bem!
Francisco Louçã|BE|É por isso que lhe quero falar de medidas de justiça, Sr. Primeiro-Ministro.\nHoje, a Assembleia Geral da EDP, já aqui discutida, ao que tudo indica, vai rejeitar a proposta do Governo sobre os bónus dos gestores.\n Ora, aquilo a que o País está a assistir é a este espectáculo: há um ex-ministro do Partido Socialista, que já foi do CDS, que impede que seja votada a proposta do Governo para que seja retirado o bónus a um exministro do PSD!...\n Risos do BE.\n Sr. Primeiro-Ministro, o problema é que, se é certa a medida que o Governo propõe para 2010 e 2011 — e escusa de pôr essa cara de raiva, porque, veja bem, nós apoiamos essa proposta…
|PS|*** Protestos ***
Francisco Louçã|BE|Mas, Sr. Primeiro-Ministro, já viu que o senhor vem ao Parlamento dizer que o salário do Mexia é uma escalada gananciosa, mas quando nesta semana esteve com ele falou de «sucesso» exactamente no dia em que ele recebeu 3 milhões de euros?!...\n E digo-lhe mais, Sr. Primeiro-Ministro: é que o salário do Mexia — como diz o Sr. Primeiro-Ministro — é o que se chama «um clássico»…, é que é mesmo um remake, porque este salário foi aprovado há um ano e eu quero saber se o Governo há um ano, no pior da recessão, votou contra estas medidas que agora levam a que António Mexia tenha 3 milhões de euros de bónus.\n
|BE|*** Aplausos ***
Presidente|Presidente|Tem a palavra o Sr. Primeiro-Ministro.
Primeiro-Ministro|Primeiro-Ministro|Sr. Presidente, Srs. Deputados, Sr. Deputado Francisco Louçã: Mais uma vez quero agradecer-lhe as «excelentes» lições de boa educação que o Sr. Deputado sempre dá cada vez que fala neste Parlamento.\n Sr. Deputado, a minha expressão de surpresa perante as suas palavras é porque o Sr. Deputado não tem limites na desonestidade com que se refere…
|PS|*** Aplausos ***
Primeiro-Ministro|Primeiro-Ministro|… na desonestidade intelectual com que se refere aos assuntos.\n O Sr. Deputado refere-se ao Presidente da Assembleia-Geral da EDP como um «ex-governante socialista»...! Ele tem todo o direito a ter as suas posições, tem todo o direito a ter as suas interpretações jurídicas, mas isso em nada o liga ao PS! É por isso que é desonesto do ponto de vista intelectual o Sr. Deputado referir-se dessa forma a quem ocupou funções, como independente, num governo do PS.\n
Vozes do PS|PS|Muito bem!
Primeiro-Ministro|Primeiro-Ministro|Percebe por que é que eu acho que isso é desonesto do ponto de vista intelectual, Sr. Deputado? É por essa razão! E o Sr. Deputado sempre faz isso! E fá-lo com uma pontinha de malícia como quem diz: não estou a dizer nada; estou apenas a sugerir que o Presidente da Assembleia-Geral, se calhar, está conluiado convosco para não aceitar uma proposta do Estado que visa limitar os bónus…! Não, Sr. Deputado!! As questões são muito mais simples e claras. O Estado tomou uma posição e essa posição será expressa em todas as assembleias-gerais.\n Assim, nas empresas públicas onde temos maioria, essa posição será seguida, sem dúvida, mas nas outras, como, por exemplo, na EDP, o Estado e todos aqueles que votam, como por exemplo a CGD, com uma maioria de participação do Estado, exprimirá este ponto de vista e esta posição: não haverá bónus, remunerações suplementares, em 2010 e 2011.\n Repito, mais uma vez: esta é, talvez, a medida mais dura que algum governo na União Europeia tomou em matéria de bónus! Eu percebo que isto lhe tira uma certa bandeira, percebo até a ciumeira do Sr. Deputado de cada vez que vê o PS tomar alguma medida em concorrência com uma certa área com o Sr. Deputado acha que o PS foi a reboque do BE, mas não.\n Esta atitude do Governo é justa, na justa medida que visa também dar um sinal, da nossa parte, de que não acompanhamos essa escalada gananciosa, como lhe chamei — e muito bem, pois não é a primeira vez que me pronuncio sobre isso, sendo que há muito tempo que tenho essa opinião e tenho essa opinião fundada naquilo que considero ser um certo desrespeito pelos accionistas, porque muitos dos ordenados dos gestores são um desrespeito pelos accionistas e uma vertigem gananciosa que leva muitos gestores a usarem o seu poder em detrimento dos interesses dos accionistas.\n Por isso acho que esta posição do Estado é séria e se o Sr. Deputado quer atacar os bónus dos gestores pode fazê-lo, não tem é o direito de atacar o Governo! Mas o Sr. Deputado quer aproveitar tudo para atacar o Governo e para atacar o PS!...\n A sua linha política é apenas essa! Tudo serve, desde que seja para atacar o PS: o PS vai apresentar a sua proposta de mais-valias… Ah, o PS anda a reboque do BE; o Governo do PS decide acabar com os bónus em 2010 e em 2011… Bom isso deve-se ao facto de o Governo ter essa perspectiva, mas, realmente, não acreditar nela e ser pressionado pelo… Não, Sr. Deputado! O que nós fazemos é justo, é razoável, defende o interesse público e promove essa ideia de justiça que temos.\n O que, realmente, acho desonesto, do ponto de vista intelectual, é que o Sr. Deputado pretenda associar ao PS aquela que é uma decisão do Presidente da Assembleia-Geral da EDP, que não tem nada a ver com o PS. É a isso que eu chamo «malícia intelectual», que o Sr. Deputado usa sempre e que, sinceramente, não é bem-vinda ao saudável debate político.\n
|PS|*** Aplausos ***
Presidente|Presidente|Tem a palavra o Sr. Deputado Francisco Louçã.
Francisco Louçã|BE|Sr. Presidente, Sr. Primeiro-Ministro, consigo nós já sabemos a regra: «não há festa nem festança sem a Dona Constança»!...\n Não há nenhum debate que se faça neste Parlamento em que, perante diferenças políticas legítimas e importantes, o Sr. Primeiro-Ministro não utilize definições de carácter e eu não lhe aceito acusações de desonestidade, não lhe ficam bem! Um primeiro-ministro não perde a cabeça num debate!
|BE|*** Aplausos ***
Francisco Louçã|BE|E devo dizer-lhe mais: gosto de o ouvir aqui falar da vertigem gananciosa de António Mexia. Pois, tem razão!, mas por que é que não lhe disse isso esta semana quando esteve ao lado dele, no dia em que ele recebeu 3 milhões de euros?!... Na altura falou de «sucesso»…, sucesso!! Olhe, Sr. Primeiro-Ministro: durante as horas do debate que estamos aqui a ter nesta Assembleia, António Mexia ganhou o equivalente a quase um ano do salário mínimo nacional de um trabalhador. Um ano, isto durante as horas deste debate! É a vertigem gananciosa, sim senhor! Aliás, não é única esta espécie de compadrio económico que se estabelece na sociedade portuguesa e que merece toda a discussão.\n Um exemplo disso foi, aliás, dado por si: o Sr. Primeiro-Ministro, a propósito do nível dos preços da gasolina, veio sublinhar a confiança na Autoridade da Concorrência.\n Sr. Primeiro-Ministro, a Autoridade da Concorrência já fez um estudo sobre os preços da gasolina e sabe o que é que concluiu? Ora, imagine só, Sr. Primeiro-Ministro: foi que era normal, disse a Autoridade da Concorrência, que quando o petróleo sobe suba muito depressa o preço da gasolina e que quando o petróleo desce desça devagar…! Há uma semana de diferença! Ou seja, subir o preço é como um foguete, mas para descer o preço há uma semana de diferença! Diz a Autoridade da Concorrência: é normal! Mas os portugueses olham para os preços e perguntam: é normal que a regra seja uma quando é melhor para a empresa e seja a contrária quando é melhor para o cliente? Podemos aceitar esta regulação ou precisamos de ter um Estado com regras para que não haja vertigem gananciosa?
|BE|*** Aplausos ***
Presidente|Presidente|Tem a palavra o Sr. Primeiro-Ministro.
Primeiro-Ministro|Primeiro-Ministro|Sr. Presidente, Srs. Deputados, Sr. Deputado Francisco Louçã: Para o político que pretende dar, em qualquer intervenção pública que faz, lições de moral a todos vir invocar que alguém no debate político invoca julgamentos de carácter é, realmente, extraordinário.\n Aliás, julgo que quem está a perder a cabeça é o Sr. Deputado e há muito tempo.\n
Francisco Louçã|BE|É o que se vê…!
Primeiro-Ministro|Primeiro-Ministro|A perder a cabeça e também a orientação, porque essa orientação política de fazer do PS o seu inimigo principal não o conduzirá longe.\n Sr. Deputado, eu não fiz nenhum julgamento de carácter; o que eu afirmei, e reafirmo, foi que o Sr.\n Deputado no debate político, muitas vezes, frequentemente, invoca questões que, realmente, são, do ponto de vista intelectual, uma profunda desonestidade.\n Vou dar-lhe mais um exemplo: o que é que o Sr. Deputado faz? O Sr. Deputado confunde objectivos de uma empresa com as condições de retribuição e com os salários dos gestores.\n O que é que tem a ver o sucesso da EDP, a que eu me referi, com a atribuição de suplementos remuneratórios aos gestores da EDP? Nada!! Mas o Sr. Deputado confunde-os, e confunde-os propositadamente para enganar as pessoas que nos estão a ouvir. É que uma coisa não tem a ver com a outra!
Vozes do PS|PS|Muito bem!
Primeiro-Ministro|Primeiro-Ministro|Julgo ser meu dever de Primeiro-Ministro salientar o sucesso da EDP, que se transformou numa grande empresa mundial e ao salientar esse sucesso estou a realçar uma questão muito importante para a economia portuguesa e para os cidadãos portugueses.\n A EDP nestes últimos cinco anos valorizou-se, afirmou-se no mercado global, a EDP é, por exemplo, a quarta maior empresa nas energias renováveis e isso é importante para a nossa economia, para os cidadãos portugueses e é importante para o Orçamento do Estado já que dela vêm alguns dividendos.\n Ora, confundir isso com ordenados dos gestores é uma profunda desonestidade política e foi o que o senhor fez e atribuiu-me a mim essa responsabilidade, dizendo que eu estive ao lado do Mexia e não lhe disse nada sobre os bónus.\n Disse, Sr. Deputado! Aliás, já o tinha dito antes, porque a decisão do Governo foi comunicada muito antes num Conselho de Ministros.\n
Paulo Portas|CDS-PP|É uma decisão da Assembleia!
Primeiro-Ministro|Primeiro-Ministro|Foi uma decisão de em 2010 e em 2011 não atribuir bónus. Mas que interessa isso ao Sr. Deputado? Que lhe interessa a verdade das coisas? Que lhe interessa essa separação entre objectivos da empresa e condições de remuneração dos gestores? Ao Sr. Deputado nada interessa, porque o Sr. Deputado quer confundir tudo com o único objectivo: atacar o Governo! Atacar-me pessoalmente e atacar o PS.\n Risos do BE.\n Mas o que eu noto é uma notável coincidência de pontos de agenda política. Os Srs. Deputados olhem para o CDS: quais são os pontos da agenda? Aumento da gasolina, bónus. Quais são os pontos da agenda do BE? Aumento da gasolina, bónus. É a isto que eu chamo — sabe Sr. Deputado? — o populismo de esquerda e de direita… Risos do CDS-PP.\n … que, tantas vezes, se encontram com o único objectivo: agradar, agradar, agradar e ganhar votos, ganhar votos, ganhar votos!! Isso não é próprio de quem quer ter responsabilidades.\n O Sr. Deputado sabe que eu acredito na regulação e acredito nas autoridades independentes para assegurar as condições de concorrência e o Governo não deixará de estar atento para assegurar aos portugueses e à economia portuguesa que na área dos combustíveis teremos condições de concorrência que promovam a eficiência e a equidade.\n
|PS|*** Aplausos ***
Presidente|Presidente|Tem a palavra o Sr. Deputado Francisco Louçã.
Francisco Louçã|BE|Sr. Presidente, Srs. Deputados, Sr. Primeiro-Ministro: Eu vejo que, de intervenção em intervenção, vai ficando um pouco mais manso…
|PS|*** Protestos ***
Francisco Louçã|BE|… e vai tentando requalificar e justificar sempre sobre as suas próprias acusações.\n Mas, Sr. Primeiro-Ministro, os portugueses sabem o que é que quer dizer desonestidade..., sabem o que quer dizer desonestidade!! Portanto, não baixe o nível, porque não é assim que deve ser o debate na Assembleia da República; o debate no Parlamento e no País é sobre políticas e respostas.\n E digo-lhe mais, Sr. Primeiro-Ministro: o senhor diz que a obsessão do BE é atacar o PS.\n
Ministro dos Assuntos Parlamentares|Ministro|E não é?
Francisco Louçã|BE|Sr. Primeiro-Ministro, eu não preciso de evocar todas as vozes autorizadas que no PS atacaram — e com razão! — os salários «pornográficos», que atacaram a desigualdade inaceitável, que atacaram as políticas sociais deste Programa de Estabilidade e Crescimento e que disseram — e com razão! — que o ataque aos desempregados e aos subsídios sociais é prova de insensatez e de falta de política de esquerda. Por exemplo, João Cravinho diz: «Guinada à direita»!...\n Sr. Primeiro-Ministro, este é o debate de opções e, por isso, populismo é dizer ao País que tudo é fácil se estas medidas de sacrifício forem impostas. O que é difícil para a esquerda é mostrar que no combate às despesas extravagantes, na consolidação orçamental, na justiça fiscal e nas políticas pelo emprego não estamos resumidos a esta aliança do PS com o CDS para tirar 130 milhões de euros ao rendimento social de inserção, não estamos resumidos à aliança do PS com o PSD para dizer que os desempregados são subsídiodependentes…
|BE|*** Aplausos ***
Francisco Louçã|BE|…, porque é, precisamente, em nome de políticas sociais que se faz um Estado regulador. Sr. PrimeiroMinistro, é aí que o seu Governo tem falhado! E perguntámos-lhe porque queremos saber a resposta. Por que é que é neste Programa de Estabilidade e Crescimento que se impõem tectos na política social? Perguntámos-lhe o que é que vai acontecer aos desempregados, porque o Sr. Primeiro-Ministro reconhece que o seu Programa não tem como objectivo criar emprego. Não conseguirá mais do que 25 000 empregos até 2013, o que quer dizer que todos os desempregados de hoje vão estar a bater à porta do rendimento social, porque ninguém lhes vai dar o apoio de que precisam.\n E, se o Governo aceita agora a ideia do PSD de que desempregado ou pobre — o suspeito do costume — é o subsídio-dependente, então, Sr. Primeiro-Ministro, não nos faça discursos sobre a Constituição, porque a defesa do serviço público e da solidariedade elementar, essa, sim, define a esquerda, define um combate de sempre da esquerda! E foi por isso que, aqui, a direita votou contra essas políticas sociais. E que desgraça que seja agora um Governo, com o Eng.º Sócrates como Primeiro-Ministro, o principal baluarte do ataque a estas políticas sociais…! Merece essa crítica porque é aqui que se fazem as opções na esquerda, na democracia e, acima de tudo — sabe, Sr. Primeiro-Ministro? — naquilo que mais nos distingue: na responsabilidade!
|BE|*** Aplausos ***
Ministro dos Assuntos Parlamentares|Ministro|Olhe que quem opta são os eleitores!!
Presidente|Presidente|Tem a palavra o Sr. Deputado Jerónimo de Sousa.
Jerónimo de Sousa|PCP|Sr. Presidente, Sr. Primeiro-Ministro, o senhor pôs aquele ar, que se conhece, de tratar como «coisa menor» esta questão do aumento dos combustíveis. E não me refiro só à gasolina, mas aos combustíveis e ao gás.\n Independentemente da classificação que possa fazer das intervenções aqui feitas por parte de diversos grupos parlamentares, a questão é séria, porque estes aumentos são um factor de acentuação das injustiças sociais e podem ter consequências tremendas no nosso tecido produtivo, no nosso crescimento económico.\n O Sr. Ministro da Economia, questionado sobre o assunto, veio dizer que não compreendia bem e que queria falar com as empresas e com a entidade reguladora. Isto levanta um problema primeiro: o Governo diz que é com a entidade reguladora, a entidade reguladora diz que não pode fazer nada…! Ora, alguém tem de explicar, Sr. Primeiro-Ministro, como é que, por exemplo, em Portugal, de acordo com os últimos dados que temos, o preço da gasolina 95, antes dos impostos, era 4,7% superior à média da União Europeia! Explique porquê, Sr. Primeiro-Ministro!! E por que é que, desde o princípio do ano, a gasolina, o gasóleo, o fuel e o gás registaram, respectivamente, aumentos de 8,5%, de 10,7%, de 8,2% e de 7,9%.\n O Sr. Ministro da Economia não percebe, mas nós dizemos, ajudamos para que compreenda: o problema central reside na insaciável gula dos lucros das empresas petrolíferas no sector energético.\n
Bernardino Soares|PCP|Ora bem!
Jerónimo de Sousa|PCP|Este é o problema central.\nLembra-se, Sr. Primeiro-Ministro, com responsabilidades no PS, quando se tratou da privatização e da liberalização, o que foi dito pelo governo de então? Tratava-se de permitir que essa liberalização e a concorrência levassem à baixa dos preços dos combustíveis.\n
Bernardino Soares|PCP|É verdade!
Jerónimo de Sousa|PCP|Estamos a ver!… É preciso combater a ideia que foi agora «descoberta» pelo PSD de que é preciso impedir que o Estado meta a mão nos negócios. É que se isto não for feito, Sr. Primeiro-Ministro, tem consequências dramáticas.\n Imagina quantas empresas encerraram não por causa dos baixos salários, mas porque, devido aos custos dos factores de produção — ao gás, ao combustível —, foram incapazes de fazer face à concorrência e à competitividade que lhes era exigida?
João Oliveira|PCP|Exactamente!
Jerónimo de Sousa|PCP|Quantos desempregados existem resultantes desta indiferença do Governo?
Bernardino Soares|PCP|Muito bem!
Jerónimo de Sousa|PCP|Da nossa parte, Sr. Primeiro-Ministro, temos propostas e a principal passa por estabelecer para os próximos três anos um sistema de preços regulados de combustíveis e de energia eléctrica que permita criar um mecanismo de preços máximos, tendo como referência o valor abaixo da média da União Europeia.\n Esta é uma proposta concreta e não ponha esse ar de quem vem aqui tratar a questão da gasolina!...\n Estamos a falar de uma coisa muito séria!! Estamos a falar da questão do crescimento económico e da justiça social!
|PCP|*** Aplausos ***
Presidente|Presidente|Tem a palavra o Sr. Primeiro-Ministro.
Primeiro-Ministro|Primeiro-Ministro|Sr. Presidente, Sr. Deputado Jerónimo de Sousa, compreendo bem as nossas diferenças e compreendo que o Sr. Deputado coloque essa questão do preço dos combustíveis, porque há uma diferença entre o meu pensamento e o seu.\n No meu pensamento devo valorizar e assegurar as condições de concorrência, porque acredito na economia de mercado. A posição do Partido Comunista é a de que devíamos nacionalizar esse domínio e ter preços administrativos. Compreendo, portanto, essa diferença. O Sr. Deputado pensa que o melhor caminho seria administrativamente fixar os preços, o que resultaria, aliás, numa posição dominante do Estado neste domínio. Não é o meu ponto de vista nem o ponto de vista do Governo, mas compreendo que coloque essa questão.\n O que não compreendo — e o meu ar é o de quem está um pouco cansado com a demagogia barata com que esta matéria é tratada — é ver a direita portuguesa, que acredita no mercado, dizer que, neste domínio, apenas para ganhar votos, talvez não fosse mau termos alguma intervenção.\n
|PCP|*** Protestos ***
Primeiro-Ministro|Primeiro-Ministro|É o ponto de vista deles. A direita portuguesa acredita no mercado, mas, claro está, como podem ganhar alguns votos, talvez o Dr. Paulo Portas não se importasse de fixar administrativamente os preços, porque é preciso responder à ansiedade do seu eleitorado…! Sr. Deputado, temos feito o que deve fazer um Governo responsável: assegurar que a regulação funciona e, com vigilância, que as condições de concorrência são asseguradas por quem o deve fazer. E quem as deve assegurar é uma entidade independente. Essa legislação foi aprovada na Assembleia da República e agora devemos confiar nessas instituições.\n
Honório Novo|PCP|Vê-se…!
Primeiro-Ministro|Primeiro-Ministro|E temos acompanhado com preocupação, sim, porque esse é um daqueles sectores onde a exigência de concorrência é mais importante. E esperamos, naturalmente, que a Autoridade da Concorrência faça o seu trabalho…
Bernardino Soares|PCP|Eles fazem… E o resultado está à vista!...
Primeiro-Ministro|Primeiro-Ministro|… e nos assegure a todos, Governo e economia, que há condições de concorrência e condições de mercado por forma a que a evolução dos preços da gasolina esteja directamente relacionada com os preços do petróleo e com a concorrência entre os diferentes operadores, e não seja consequência de alguma espécie de concertação.\n Qual é o dever do Governo? É assegurar, justamente, isso, ou seja, que faremos tudo o que estiver ao nosso alcance para impedir qualquer concertação e para promover condições sãs de concorrência no mercado, que queremos saudável.\n
|PS|*** Aplausos ***
João Oliveira|PCP|Reduzir os salários pode ser, mas os preços das gasolineiras é que não…!
Presidente|Presidente|Tem a palavra o Sr. Deputado Jerónimo de Sousa.
Jerónimo de Sousa|PCP|Sr. Presidente, Sr. Primeiro-Ministro, penso que deve ser feita justiça ao CDS, visto que a sua visão do problema é muito parecida com a do Governo, porque eles querem manter intocáveis os lucros obscenos do grande capital destas empresas.\n
Bernardino Soares|PCP|Claro!
Jerónimo de Sousa|PCP|Apontou uma questão preocupante em relação ao problema da regulação, mas, quanto ao resto, o CDS está próximo do Governo nesta teoria.\n Em relação à nossa visão diferente, o Sr. Primeiro-Ministro não sabe que, no plano dos preços, existe a cartelização, de facto, por parte dessas empresas?!
Bernardino Soares|PCP|Claro!
Jerónimo de Sousa|PCP|E, naturalmente, com a posição de Pilatos que este Governo tem, as empresas têm precisamente o que querem: o Estado não mete a mão e elas vão somando lucro ao lucro!! Não se trata da questão de darem prejuízo, Sr. Primeiro-Ministro, mas de saber como é que conseguem esse lucro inaceitável e escandaloso, sacrificando as micro, pequenas e médias empresas, a agricultura e as famílias! Este é o problema central que está colocado e onde o Estado deve, de facto, ter uma intervenção!
Bernardino Soares|PCP|Muito bem!
Jerónimo de Sousa|PCP|Sr. Primeiro-Ministro, uma segunda questão: veio falar da aprovação do PEC pela Comissão e, não se zangue, mas a sua intervenção parecia um pouco a de um aluno bem comportado que teve nota positiva por parte da Comissão Europeia.\n No entanto, há simultaneamente silêncios que não compreendemos e muito menos podemos aceitar. Pode o Governo ficar em silêncio e estar de acordo com as orientações e decisões que atingiram a Grécia e a colocaram nas mãos da especulação financeira e ignorar o princípio que tão badalado foi, incluindo pelo Sr.\n Primeiro-Ministro, na questão do Tratado de Lisboa, ou seja, a coesão económica e social?! Pode aceitar o Governo esse acordo minimalista e a intervenção do Fundo Monetário Internacional (FMI) que vai criar imensas e extremas dificuldades à Grécia, mas também fazer de países como Portugal, Espanha ou Irlanda os alvos preferenciais de toda a especulação financeira a que estamos a assistir?!
Bernardino Soares|PCP|Muito bem!
Jerónimo de Sousa|PCP|Pode o Governo de Portugal aceitar, sem nada dizer — e sublinho sem nada dizer! —, as ameaças feitas anteontem pela Comissão Europeia, pela voz do Comissário da Economia e Finanças, de cortar os fundos comunitários a Portugal se o défice derrapar, tendo, com tais declarações irresponsáveis, feito disparar de imediato os juros dos títulos de dívida pública?!
Bernardino Soares|PCP|Exactamente!
