João Semedo|BE|O que temos são 46 equipas domiciliárias da Rede de Cuidados Continuados Integrados, das quais 13 fazem também cuidados paliativos. Não temos, como disse, nenhuma equipa domiciliária vocacionada especificamente para os cuidados paliativos.\nJulgo, Sr.as e Srs. Deputados, que, comparando as necessidades com a capacidade de resposta, todos concluímos que alguma coisa tem estado errada nestes últimos anos. E é bom lembrar: em 2007, o País dispunha de 55 camas para cuidados paliativos; um ano depois, em 2008, de 93 camas; em 2009, de 118 camas; e este ano, em 2010, a meta do Governo são 186 camas. Diz o Governo ainda que, em 2013, quer ter372 camas para cuidados paliativos. Mas recordemos também que, quando foram apresentadas as medidas anticrise pelo anterior governo do Partido Socialista, se anunciou como um grande sucesso dessas medidas anticrise que o governo tinha como meta antecipar nesta Rede de Cuidados Continuados os objectivos de 2016 para serem concretizados em 2013. Se assim fosse, de acordo com o que foi prometido e anunciado pelo Governo no ano passado, deveríamos ter, em 2013, 999 camas para cuidados paliativos. E, no entanto, a meta do Governo não vai além das 326 camas.\nTemos de nos interrogar porque é que isto acontece, porque é que a Rede é curta e porque é que o seu crescimento é lento e porque é que nem sequer o dinheiro do Orçamento é integralmente gasto nos cuidados paliativos e nos cuidados continuados. Para que todos fiquemos a saber, de tudo o que estava orçamentado para a Rede de Cuidados Continuados Integrados, apenas foram gastos 56% dessas verbas o ano passado. É porque faltam os doentes? Seguramente que não. Porque é que não se gastou todo o dinheiro? Porque não há equipas, nem unidades, nem camas onde se possa gastar esse orçamento.\nA questão que se deve colocar, então, é: porque é que isto acontece? Do ponto de vista do Bloco de Esquerda, por uma razão simples: porque a insistência do Governo em manter na mesma rede uma amálgama de situações sociais e clínicas não ajuda a diferenciar nem promove os impulsos necessários a que os cuidados continuados sejam olhados com outra atenção, com outro rigor e com outra energia.\nComo é que as Sr.as e os Srs. Deputados querem que uma rede em que estão doentes em convalescença, doentes em reabilitação, doentes em recuperação e doentes da saúde mental também consiga incorporar, com qualidade e diferenciação suficiente, os doentes desta rede de cuidados paliativos, nomeadamente doentes com sida, com doenças oncológicas e outras patologias, incluindo crianças que, às vezes, também necessitam de cuidados paliativos.|mp
Maria Antónia Almeida Santos|PS|O que o Bloco quer é estigmatizar!|mp
João Semedo|BE|E como é que é possível admitir que a mesma direcção, a mesma coordenação de uma rede, que tem de fazer coisas tão distintas, possa responder por igual a realidades tão diferentes?! O ano passado, em 2009, a Rede de Cuidados Integrados admitiu 24 000 doentes. Alguém acredita que a mesma estrutura, a mesma organização, a mesma direcção dê a mesma atenção a uma realidade que movimenta 24 000 doentes e a uma outra que não chega a movimentar 2000? Isto é impossível! E o que vai acontecer, se as redes, de facto, não forem diferenciadas e autonomizadas é que, daqui a dois, quatro ou seis anos, vamos estar com os cuidados paliativos num grau de desenvolvimento muito aquém das suas necessidades.\nÉ por isso que o Bloco de Esquerda apresenta o seu projecto de lei, que é muito simples no seu enunciado.\nO nosso diploma pretende, por um lado, autonomizar a rede, o que não implica, de maneira nenhuma, a paralisação de nada do que está a ser feito, bem pelo contrário; por outro lado, que fiquem claros na lei a condenação e o sancionamento de uma prática clínica errada, vulgarmente designada por obstinação terapêutica, que consideramos um abuso sobre o ser humano que necessita por um determinado período de cuidados de outra natureza; e, finalmente, que seja consagrado na lei, com toda a clareza, o direito inalienável dos cidadãos à prestação de cuidados paliativos quando a sua vida assim o reclamar.|mp
||Aplausos do BE.|applause
Presidente|Presidente|Tem a palavra, para uma intervenção, a Sr.ª Deputada Maria José Nogueira Pinto.|president
Maria José Nogueira Pinto|PSD|Sr. Presidente, Sr.as e Srs. Deputados: Este é um tema muito importante e sensível, porque está na fronteira entre a vida e a morte. Tem a ver com direitos fundamentais e, como aqui já foi dito e sempre realçámos, com o direito a exercer o direito, o que infelizmente não é uma realidade para muitos portugueses.\nOs cuidados continuados têm demonstrado imensas insuficiências e deficiências, como todos temos visto, particularmente ao longo deste ano, por razões de financiamento, de recursos humanos, de desigualdade da própria rede a nível nacional, do número de camas, das expectativas muito modestas e frustrantes do seu crescimento, entre outras. Julgo, no entanto, que o que mais tem prejudicado esta Rede de CuidadosContinuados é o facto de ela não constituir de maneira nenhuma uma prioridade para este Governo do Partido Socialista, para esta Ministra do Partido Socialista e para este Ministério da Saúde. Ou seja, os cuidados continuados não são considerados uma prioridade e, portanto, o seu desenvolvimento fica comprometido e vai-se enviesando! Disse a Sr.ª Deputada Galriça Neto que os cuidados paliativos eram um «parente pobre». Gostava de convocar aqui —  é minha obrigação por muitos anos de trabalho com estas pessoas —  o «parente paupérrimo», que são as demências. É bom que o Parlamento saiba que há 150 000 portugueses afectados por demências, 80% dos quais por doença de Alzheimer. Para estes 150 000 portugueses, que valem tanto como quaisquer outros 150 000 portugueses, para nós têm de valer exactamente o mesmo, não há qualquer resposta, porque caíram nesta tremenda armadilha de terem sido retirados da área da saúde mental e de terem ficado na rede de cuidados continuados. Esta rede, que lhes devia dar resposta, não dá. São «parentes paupérrimos», porque não há apoio domiciliário, não há centros de dia, nem há camas. Em termos numéricos, ficaríamos com uma expressão muito reduzida.\nA questão que temos de colocar é a de saber se os dois projectos de lei em discussão representam um passo em frente ou uma marcha atrás. Digo isto precisamente pelo respeito que o tema a todos nos infunde e pelo respeito que temos, nesta bancada, pelos proponentes desta lei.\nA rede actual —  lembro —  é a primeira e a única que assenta num conceito integrado, quer na vertente da saúde, quer na da segurança social, o que constituiu um ganho enorme. Por que é que foi um ganho enorme? Porque não é possível, num País envelhecido, num País pobre, num País com um crescente número de doentes crónicos, num País com famílias ultra-sobrecarregadas e de fraquíssimos recursos, dissociar estes dois aspectos. Chamo a atenção do Parlamento para este facto, porque esta é a realidade que conheço, que muitos conhecem e que, por mais empolgante que este debate seja, não podemos escamotear, pelo que importa falar em nome deles.\nO conceito desta rede está correcto, mas a sua aplicação tem vindo a ser pervertida. Questão diferente é a aplicação ter sido pervertida e o conceito estar incorrecto. Vejo que há uma grande angústia porque a rede não cresce. No entanto, não percebo: se ela crescesse passaria a ser boa?! É uma dúvida que tenho.\nQue implicações têm estes projectos de lei? Algumas delas não interessam nada —  o Plano Nacional de Saúde, o Plano Nacional de Cuidados Paliativos podem ser alterados, não são nenhuns dogmas — , mas a eventual criação de uma outra rede sobreposta à actual compromete definitivamente os cuidados continuados em Portugal. Quero também deixar-vos esta mensagem.|mp
Vozes do PSD||Muito bem!|interruption
Maria José Nogueira Pinto|PSD|É a minha profunda convicção e é, neste momento, quero dizê-lo, a minha profunda aflição.\nO que criam estes dois projectos de lei? Criam um conjunto de boas intenções —  digo-o sem qualquer ironia. Não tenho qualquer dúvida sobre a boa-fé dos seus proponentes. Mas trata-se de boas intenções que, curiosamente, são entregues à voragem burocrática de novas estruturas, de novas comissões, de novas equipas, de novos coordenadores e de novos reportes hierárquicos. Ou seja, muda o modelo, mas transferemse todos os problemas e, digo eu, como se transferem para um novo modelo que nem sequer está testado, provavelmente nem terão solução.\nO que é que estes projectos de lei destroem? Para além dos cuidados continuados, destrói um valioso conceito integrado, que é substituído (e eu sei que há dois mçdicos nesta Sala, e eu não sou mçdica») por algo que já não se usa, que é uma visão exclusivamente de saúde, sendo totalmente abandonada a vertente social.\nHá também um grande desperdício: já não falo de dinheiro, falo do esforço, da capacidade das pessoas de acreditarem que a actual rede era uma resposta para os doentes e para as famílias e também para os profissionais que abraçaram o trabalho nesta rede como sendo uma componente digna do Serviço Nacional de Saúde.\nQual é a garantia do êxito destes projectos de lei? Penso que nenhuma. Pelo contrário, há uma armadilha enorme: vão criar um álibi, que, hoje, oferecemos «de bandeja» à Sr.ª Ministra da Saúde, caso os projectos de lei sejam aprovados. A pretexto da criação de uma nova rede por cima da actual, que está num estadoincipiente e cheia de fragilidades, a Sr.ª Ministra vai sentar-se sobre as duas e, quando lhe perguntarmos pela primeira, vai responder que está a cuidar da segunda e, quando lhe perguntarmos pela segunda, vai responder que está a cuidar da primeira.\nPortanto, todo o trabalho que poderíamos agora ter para dar um empurrão e para aperfeiçoar as coisas vai ficar comprometido.\nAntes de destruir o que existe, mesmo que o que exista não nos satisfaça —  e, obviamente, não nos satisfaz! — , temos o dever de reflectir sobre esta questão, ainda que não tenhamos muito tempo. Já falámos disto muitas vezes —  aliás, a nosso pedido, foi criado, na Comissão de Saúde, um grupo específico para os cuidados continuados, o que nos teria permitido acompanhar mais de perto este processo, mas, infelizmente, nunca reuniu.\nOs portugueses esperam, hoje, respostas, aflitos que estão com tantos problemas —  e, sem prejuízo dos cuidados paliativos, volto a falar do enorme peso que há sobre as famílias, sobre os cuidadores familiares, que são as demências, concretamente os doentes de Alzheimer. A maioria dos cuidadores são mulheres que trabalham ou que se reformaram há pouco tempo, estão cansadas, têm ascendentes e descendentes a cargo e, penso, querem soluções. Não querem mais leis, sobretudo leis que não contenham em si a garantia de uma melhor solução, a qual tem de ser dada pelos proponentes, e eu espero que seja dada.\nO País não precisa de mais leis, o País precisa que esta Casa, que tem exactamente a função de fiscalizar e de legislar, seja capaz de dizer: «Não! Agora, não é mais assim! Agora, vai ser desta maneira: o financiamento tem de ter plafonds mínimos, os recursos humanos, que andam numa grande desarrumação, têm de ser arrumados, a formação é necessária, etc.» O crescimento da rede tem de ser este porquê? Por que é que, dentro do orçamento do Serviço Nacional de Saúde, não há uma alocação maior se, de facto, todos consideramos prioritários os cuidados continuados? Porque não? O Governo não o considera, mas todos nós consideramo-lo.\nPor isso, o apelo que faço é no sentido de ser ainda possível que estes dois projectos de lei baixem à Comissão, sem votação, de forma a juntar esforços para pegar nos cuidados continuados, que existem e cujo conceito é correcto, e emendá-los, corrigi-los, defendê-los de possíveis perversões, que também há, e darmos uma resposta aos portugueses de forma muito mais eficaz, rápida e segura.|mp
||Aplausos do PSD.|applause
Presidente|Presidente|Tem a palavra, para uma intervenção, a Sr.ª Deputada Paula Santos.|president
Paula Santos|PCP|Sr. Presidente, Srs. Deputados: À semelhança do que se passa noutras áreas da saúde, a capacidade de resposta das unidades de cuidados continuados integrados de saúde, as quais incluem os cuidados paliativos, são insuficientes face às necessidades da população.\nA Rede Nacional de Cuidados Continuados Integrados, criada pelo anterior governo do Partido Socialista, ficou aquém do que o País precisa. Não se verificou o aumento desejável da capacidade de resposta dos cuidados continuados e dos cuidados paliativos. Se é grave a falta de resposta ao nível dos cuidados continuados, esta é ainda mais grave no que se refere aos cuidados paliativos.\nVejamos alguns dados mais relevantes que constam do Relatório de Monitorização do Desenvolvimento e da Actividade da Rede Nacional de Cuidados Continuados Integrados, elaborado pela Unidade de Missão dos Cuidados Continuados Integrados: o número total de camas a 31 de Dezembro de 2009 era apenas de cerca de 4000 para o universo destes cuidados, das quais somente 118, como já foi hoje referido, são destinadas aos cuidados paliativos. Os cuidados paliativos foram a área com menor crescimento em termos de número absoluto de camas e, na mesma data, no final de 2009, existiam apenas 7 camas por 100 000 habitantes com mais de 65 anos ao nível de cuidados paliativos.\nDe facto, o Governo está muito longe de assegurar a todos os portugueses o acesso aos cuidados de saúde de que estes necessitam e a que têm direito constitucionalmente, que lhes dêem o apoio, a dignidade e a qualidade de vida possível.\nA própria Inspecção-Geral de Finanças, no seu relatório de actividade de 2009, no que se respeita a esta Rede, faz uma apreciação muito crítica da actuação do Governo.Face à carência de resposta dos cuidados continuados e dos cuidados paliativos, o PCP acompanha as preocupações manifestadas nas iniciativas legislativas que hoje discutimos e que propõem a criação de uma rede nacional de cuidados paliativos.\nO PCP defende o reforço da rede pública para os cuidados continuados e também para os cuidados paliativos. No entanto, face à situação do País, não rejeitamos a hipótese de recorrer a entidades de âmbito social e privado lucrativo para dar resposta nesta área, mas isto não pode significar o desinvestimento ou a desvalorização do Governo na ampliação da rede pública para beneficiar esses sectores.\nAs propostas do CDS e do Bloco de Esquerda vão exactamente no sentido de criar uma rede de cuidados paliativos, que integra a vertente pública e privada, social e lucrativa, embora na proposta do Bloco de Esquerda estes aspectos não estejam tão claros. Na nossa opinião, a proposta deveria ser a da criação de uma rede exclusivamente pública e, enquanto esta não tivesse capacidade para dar resposta às necessidades do País, contratualizar-se-ia com entidades privadas de cariz social e/ou lucrativa. Esta é uma formulação significativamente diferente da expressa nos projectos de lei em discussão. Já sabemos qual vai ser o resultado: o social e o privado desenvolvem-se e ampliam-se, em detrimento do serviço público.\nA evolução da capacidade de resposta dos cuidados continuados integrados de saúde no Serviço Nacional de Saúde, no sector social e privado lucrativo demonstra o desinvestimento na rede pública, em benefício dos restantes. O Serviço Nacional de Saúde apenas corresponde a 10% da capacidade de resposta dos cuidados continuados integrados, sendo o sector com menor número de camas e o que menos evoluiu durante o ano de 2009. Já o sector privado com fins lucrativos foi o que mais cresceu no ano de 2009, seja em número de camas, seja nos acordos estabelecidos.\nMais uma vez, tínhamos razão: o PCP alertou e denunciou a subversão que poderia existir com a inclusão na mesma rede da vertente pública e privada, quando foi criada pelo anterior governo.\nContudo, o PCP não vê inconveniente na criação de uma rede nacional de cuidados paliativos, autonomizando-a da dos cuidados continuados integrados, pois possibilita a sua valorização, crescimento e desenvolvimento ao nível dos equipamentos e dos meios humanos, permitindo aumentar esta resposta aos utentes, que se encontram já em situação fragilizada e que precisam destes cuidados de saúde, com qualidade e eficácia.\nMas, na nossa opinião, a questão central não passa obrigatoriamente pela criação de uma nova rede mas, sim, pelo aumento do investimento público nesta área. Mesmo com a inclusão dos cuidados paliativos nos cuidados continuados integrados, como se encontra actualmente, se houvesse investimento do Governo e uma evolução equilibrada, o País não estaria nesta situação.\nO débil investimento do Governo nesta matéria é o grande responsável pela enorme carência dos cuidados continuados integrados e paliativos aos portugueses. A Inspecção-Geral de Finanças refere, no citado relatório, que «a rede nacional de cuidados continuados integrados tinha associada uma dotação entre 2006 e 2009 superior a 303 milhões de euros, embora, até 2008, a execução não tenha ascendido a 63 milhões de euros, o que reflecte falta de eficácia e de eficiência».\nEstamos perante mais uma desresponsabilização do Governo na saúde. O que é preciso é que o Governo reforce o investimento público para ampliar a rede de equipamentos públicos de cuidados continuados e de cuidados paliativos no País, de proximidade à população, que reforce o investimento nos recursos humanos disponíveis para criar as equipas especializadas, que reforce a formação dos profissionais e que assegure as condições de trabalho, com respeito pelas carreiras e direitos dos trabalhadores, que permita acompanhar e prestar os cuidados de saúde que a população precisa e que garanta o direito à saúde com qualidade para todos.|mp
||Aplausos do PCP.|applause
Presidente|Presidente|Tem a palavra, para uma intervenção, o Sr. Deputado José Luís Ferreira.|president
José Luís Ferreira|Os Verdes|Sr. Presidente, Sr.as e Srs. Deputados: Discutimos, hoje, duas iniciativas sobre os cuidados paliativos. Trata-se de uma matéria que Os Verdes consideram da maior importância, sobretudo se tivermos em conta a dimensão que hoje assume a necessidade destes cuidados, mas também a constatação de que o Estado não tem sido capaz de dar resposta em tempo útil.Neste sentido, Os Verdes comungam das preocupações expressas nos dois projectos de lei em discussão, que, aliás, pretendem exactamente os mesmos objectivos, ou seja, consagrar o direito dos cidadãos aos cuidados paliativos, definir a responsabilidade do Estado em matéria de cuidados paliativos e, por fim, promover a criação nacional de cuidados paliativos.\nAs iniciativas legislativas têm, portanto, os mesmos propósitos e os mesmos objectivos, ainda que o projecto de lei do Bloco acentue a responsabilidade do Estado no sentido de garantir a gratuitidade dos cuidados paliativos, enquanto, no projecto do CDS-PP, a garantia de gratuitidade não é tão visível, pelo menos não é expressa de forma tão clara como no projecto de lei do Bloco.\nPara além deste aspecto e da maior relevância que o projecto de lei do Bloco atribui à vontade do doente com cuidados em fim de vida, as duas iniciativas legislativas são basicamente iguais e ambas colocam no mesmo patamar e ao mesmo nível o sector público e o privado, sobretudo o projecto de lei do CDS-PP, facto que nos levanta algumas dúvidas relativamente ao nosso sentido de voto.\nÉ verdade que a Rede Nacional de Cuidados Continuados Integrados, instituída há cerca de quatro anos, não tem sido capaz de dar resposta às necessidades, mas o motivo, na perspectiva de Os Verdes, reside exactamente na pouca disponibilidade manifestada pelo Governo no que diz respeito ao investimento nesta rede e nos cortes cegos na área da saúde, que o Governo tem vindo a fazer, agravadas com os cortes do Pacto de Estabilidade e Crescimento e, mais recentemente, com as medidas adicionais a esse mesmo Pacto.\nMas, para além do necessário investimento que o Governo terá de fazer nesta área, uma eventual rede de cuidados paliativos deverá ter, na perspectiva de Os Verdes, uma natureza pública ou, no limite, contar com uma participação do sector social, desde que tal não coloque o sector privado no mesmo nível do sector público, o que é visível, quanto a nós, e como já disse, sobretudo no projecto de lei do CDS-PP.\nAinda assim, não vamos votar contra os projectos de lei, porque, reconhecendo a falta de capacidade de resposta da rede pública, admitimos que o Estado, nessa circunstância, e com uma natureza meramente transitória, possa vir a contratualizar com os privados, como forma de dar resposta às necessidades das pessoas, mas sem que essa solução transitória se venha a perpetuar no tempo e, ao mesmo tempo, sirva de pretexto para desresponsabilizar o Estado nesta importante função social.|mp
Presidente|Presidente|Para uma intervenção, tem a palavra a Sr.ª Deputada Sónia Fertuzinhos.|president
Sónia Fertuzinhos|PS|Sr. Presidente, Sr.as e Srs. Deputados: Desde 2005, o PS definiu, de forma clara, as suas prioridades para a área da saúde, a saber, cuidados primários de saúde, reorganização hospitalar e criação da rede de cuidados continuados, abrangendo cuidados de convalescença, de média e longa duração, e cuidados paliativos.\nEm 2006, foi aprovada a Rede Nacional de Cuidados Continuados e Integrados e a Unidade de Missão para a concretização dessa mesma rede.\nEm 2009, foi revisto o Programa Nacional de Cuidados Paliativos, revisão que contou com o envolvimento da Organização Mundial de Saúde (OMS) na revisão e aprovação no texto final.\nO ponto de partida em Portugal continental nos cuidados paliativos em 2005 era de oito respostas, no total.\nSe tivermos em conta a evolução nas respostas e nos cuidados continuados nestes últimos quatro anos —  e os números são conhecidos — , a pergunta essencial do nosso debate parece-me, assim, óbvia: as propostas do Bloco de Esquerda e do CDS-PP são melhores e são inovadoras relativamente ao que existe? Garantem, só por si, melhores cuidados e maior optimização de recursos? A resposta para o PS é clara e está fundamentada na evolução dos cuidados continuados no nosso País nestes quatro anos, na experiência internacional nesta mesma área e nas orientações de diversas organizações internacionais reconhecidas por todos, como a Organização Mundial de Saúde.\nAs propostas do Bloco de Esquerda e do CDS-PP não são inovadoras, não vêm preencher um vazio de resposta do Serviço Nacional de Saúde, não provam ser propostas melhores do que as opções tomadas e aprovadas na Rede de Cuidados Continuados Integrados e não garantem, de forma alguma, os resultados imediatos que o Bloco de Esquerda e o CDS-PP pretendem garantir com estas iniciativas, bem pelo contrário.\nEsquematizando, de forma simples e rápida, os objectivos dos projectos, observamos o seguinte:Quando pretendem consagrar o direito dos cidadãos e das cidadãs aos cuidados paliativos, o Bloco de Esquerda ignora e o CDS desvaloriza o facto de este direito já estar hoje consagrado no Programa Nacional de Cuidados Paliativos; Quando definem a responsabilidade do Estado em matéria de cuidados paliativos, desvalorizam que esta já está definida no mesmo Programa, que, repito, é um Programa acompanhado e aprovado pela OMS; Quando propõem a criação e a organização da rede nacional de cuidados paliativos, autonomizando estes cuidados, o Bloco de Esquerda e o CDS-PP, ao mesmo tempo que adoptam, no geral, o modelo organizativo aprovado por decreto-lei em Conselho de Ministros para a criação da Rede Nacional de Cuidados Continuados Integrados, desvalorizam as capacidades dessa mesma rede e modelo e, com isso, põem em causa a resposta integrada e articulada nos diversos tipos de cuidados, que os cuidados paliativos exigem e a que as pessoas que deles necessitam têm direito.\nPara o PS —  e repito — , de acordo com as orientações de diversas instituições internacionais e com a experiência de vários países, não se devem dividir e autonomizar intervenções que devem ser integradas e transversais.|mp
Maria Antónia Almeida Santos|PS|Muito bem!|mp
