Ana Drago|BE|» mas, sim, de trabalhar com eles dentro do espaço escolar, de dar-lhes uma aprendizagem do que é a responsabilidade individual e do que deve ser a convivência democrática dentro do espaço escolar; auxiliares de acção educativa em maior número e com formação; turmas mais pequenas; e formação de gestão de conflitos para os professores. São estas as matérias centrais.\nMas o que interessa também discutir é a disponibilidade das escolas para lidar com tudo isto. Aquilo que sabemos é que as escolas, hoje, precisam de ser pacificadas dos quatro anos de massacre que representou a anterior legislatura e a anterior tutela.\nTenho, portanto, de aproveitar a presença da Sr.ª Ministra e dos Srs. Secretários de Estado nesta Assembleia. Ontem, o Sr. Secretário de Estado Alexandre Ventura veio dizer que, afinal, as alterações que tinham sido introduzidas no Estatuto da Carreira Docente não iam avançar porque o Governo tem pressa. O que queremos esclarecer é se isto é meramente uma questão de timing. Ou seja, se as intenções expressas nas últimas alterações já não são a intenção do Governo ou se é meramente uma questão de tempo e, portanto, elas não entram agora no Estatuto da Carreira Docente mas, a prazo, vão passar a entrar. Portanto, queremos saber se a incerteza, o sufoco burocrático, o mal-estar, a desmotivação, a falta de tempo dos professores para olhar para os alunos e para os problemas de agressividade que existem são questões que vão, ou não, ser resolvidas.|mp
||Aplausos do BE.|applause
Presidente|Presidente|Tem a palavra a Sr.ª Deputada Rita Rato.|president
Rita Rato|PCP|Sr. Presidente, Srs. Membros do Governo, Srs. Deputados, a escola tende a reproduzir no seu seio os comportamentos da sociedade em geral. Perante uma sociedade que, explicita ou implicitamente, promove a violência como forma primária de relacionamento social, resultado do individualismo subjacente à cultura dominante, urge tomar medidas, no plano da escola, inseparáveis da realidade social.\nA violência em meio escolar reveste-se de diversas formas e conteúdos. Os comportamentos violentos devem constituir uma preocupação política de relevo e motivar soluções que actuem sobre o problema no sentido da sua efectiva erradicação.\nO PCP entende que o combate à violência escolar não se promove apenas com sanções e punição do conflito potencial ou real mas também pela criação e generalização do bem-estar na escola.|mp
Bernardino Soares|PCP|Muito bem!|mp
Rita Rato|PCP|Um ambiente escolar saudável e motivante para todos pode resolver, e não esconder, o problema.\nA suspensão e agravamento de penas, a vigilância tecnológica ou o reforço unilateral da autoridade proporcionarão sempre a exclusão em detrimento da inclusão. A via do agravamento ou diversificação da sanção, desacompanhada de medidas concretas nos planos político e social, tende a ser uma solução sobre o sintoma e não sobre a causa.\nA falta de meios materiais e humanos, a instabilidade do corpo docente, a ausência de formação para professores e funcionários para lidar com situações de carácter violento e de prevenção do conflito, aescassez de meios pedagógicos e lúdicos e a extensa dimensão das turmas são factores que fragilizam o diaa-dia nas escolas.|mp
Bernardino Soares|PCP|Muito bem!|mp
Rita Rato|PCP|Uma escola com falta de funcionários, de vigilantes e de auxiliares de acção educativa não será, certamente, uma escola mais segura. Existem hoje cerca de 6500 funcionários não docentes colocados nas escolas através de contratos emprego-inserção. Desempenham tarefas permanentes e indispensáveis para o bom ambiente escolar mas, ao fim de 12 meses de contrato, não renovável, saem da escola e são substituídos.\nO PCP entende que uma política educativa ao serviço do povo e do País, de ligação da escola à vida, da formação integral do indivíduo, de valorização dos professores e funcionários não docentes, de envolvimento dos estudantes e dos pais, é o caminho para o combate à violência escolar e para o reforço da escola inclusiva e democrática.\nPor isso, defendemos a redução do número de alunos por turma; a fiscalização regular que impeça práticas de triagem social; o apoio efectivo a todos os estudantes com necessidades educativas especiais; o envolvimento do estudante na resolução dos problemas, através das associações de estudantes e dos delegados de turma; a criação de actividades extra-curriculares de carácter lúdico, desportivo, cultural ou recreativo; a criação dos gabinetes pedagógicos de integração escolar, com equipas de psicólogos, professores, assistentes sociais, animadores socioculturais e estudantes;»|mp
Bernardino Soares|PCP|Exactamente!|mp
Rita Rato|PCP|» a formação inicial e continuada a professores e funcionários para a mediação de conflitos; a estabilidade e qualidade das condições de trabalho dos professores e funcionários não docentes.\nA violência em meio escolar é um fenómeno complexo, passando a sua resolução por uma abordagem integrada, não exclusivamente centrada nos estudantes mas também na escola e no meio em que se insere.|mp
||Aplausos do PCP.|applause
Presidente|Presidente|Tem a palavra a Sr.ª Deputada Heloísa Apolónia.|president
Heloísa Apolónia|Os Verdes|Sr. Presidente, Srs. Membros do Governo, Sr.as e Srs. Deputados, no decurso da intervenção que a Sr.ª Ministra teve oportunidade de produzir, afirmou que temos escolas seguras, que temos um gabinete de segurança, que temos um Observatório de Segurança na Escola, mas a segurança nas escolas não é uma questão relativamente à qual os portugueses estejam descansados, como bem sabe. Aliás, julgo que a Sr.ª Ministra também não está descansada relativamente a essa matéria, face a todos os factos que vão sendo tornados públicos e mesmo àqueles que não vão sendo tornados públicos. Quem conhece o que se passa no terreno sabe que isso não é verdade.\nEntão, com tantos gabinetes e tantos observatórios, Sr.ª Ministra, por que é que a situação se mantém assim? Esta é a pergunta que quero fazer. E, provavelmente, a resposta é fácil: porque não chega.\nFundamentalmente, aquilo que não chega são os meios humanos, que não conseguem dar resposta às funções e objectivos dos gabinetes e dos observatórios criados, porque falta gente para aplicar princípios.\nAgora, a medida que o Governo vem anunciar é que vai reforçar os poderes dos directores das escolas para suspender mais depressa as crianças e os jovens agressores. É tão fácil, Sr.ª Ministra, mandá-los embora para famílias, tantas vezes, ausentes; para irem para a rua, sabe-se lá para onde; para famílias complexas que não lhes dão apoio!» Ou seja, é tão fácil pô-los fora do espaço escolar e nem sequer querer saber o que se passa para além disso. E, depois, eles retornam à escola e os problemas continuam. É tão fácil, Sr.ª Ministra, anunciar medidas desta natureza.\nO Ministério deveria olhar para a realidade com que nos confrontamos e perceber que a grande falha deste Ministério é, também na área da educação, continuar a tomar o défice como objectivo prioritário do País, nãopercebendo as consequências concretas que daí decorrem, designadamente para as escolas. Porque não temos professores suficientes para as tarefas que hoje lhes são exigidas, não temos auxiliares de acção educativa suficientes para as necessidades das escolas. Um professor que tenha a sua aula perturbada por um aluno e o quer pôr, durante um determinado tempo, fora da sala de aula para poder continuar a aula em condições de normalidade, sai ao corredor e não encontra um auxiliar de acção educativa.|mp
Bernardino Soares|PCP|Exactamente!|mp
Heloísa Apolónia|Os Verdes|E não é porque o auxiliar de educação educativa seja um «balda», como o Governo gosta, às vezes, tanto de fazer crer. Não! É porque tem dois e três corredores para dar atenção e respostas para dar e anda para baixo e para cima sem conseguir dar vazão a tudo aquilo para que é solicitado.\nSr.ª Ministra, o Governo, de uma vez por todas, tem de perceber que os trabalhadores deste País são pessoas, humanos, não são super-homens. Não se desdobram.\nO Governo precisa de colocar mais gente para dar resposta às necessidades do País, nos seus mais diferentes sectores e estruturas. É isso que o Governo não quer fazer. Quer encolher, quer encolher, quer encolher, para não pagar.|mp
Presidente|Presidente|Queira concluir, Sr.ª Deputada.|president
Heloísa Apolónia|Os Verdes|Vou terminar, Sr. Presidente.\nSr.ª Ministra, a educação, a segurança e a qualidade de vida neste País têm custos, e o Governo tem de os pagar.|mp
Presidente|Presidente|Tem a palavra a Sr.ª Ministra da Educação.|president
Ministra da Educação|Isabel Alçada|Sr. Presidente, Sr.as e Srs. Deputados, antes de mais, queria deixar claro que há duas estruturas que se ocupam especificamente desta questão: uma, é o Gabinete de Segurança no Ministério da Educação, e, outra, é o Observatório de Segurança, uma entidade independente que faz análise, aconselhamento e que funciona no Instituto Politécnico de Santarém.\nGostaria de lembrar que se queremos resolver os problemas, em primeiro lugar, é necessário conhecê-los, enfrentá-los mas, sobretudo, actuar.\nOs professores, os directores, os técnicos responsáveis, os técnicos das direcções regionais de educação que estão diariamente nas escolas, os inspectores, os responsáveis políticos do Ministério da Educação, conhecem bem estas questões da segurança e estão diariamente, repito, diariamente, atentos e numa relação directa para apoiar a intervenção daqueles que são os responsáveis, no terreno, pelas escolas, ou seja, os directores e os docentes.\nConheço bem esta questão, não apenas como observadora, analista ou estudiosa. Como sabem, sou professora. Desempenhei todas as funções que um docente pode assumir, desde a direcção de escola, direcção de turma, orientadora de estágio, formadora. Conheço por dentro as escolas e conheço estes problemas por vivê-los no dia-a-dia. Tive que enfrentá-los, tive que resolvê-los e sei como é difícil.\nSei como é difícil um professor ou um assistente operacional intervir e resolver situações, as quais muitas vezes não se compreende como é que foram originadas, são situações súbitas. Sei que as crianças e os nossos jovens trazem para dentro da escola os problemas e as dificuldades que vivem nas suas famílias, nos seus bairros, no seu ambiente. Sei também que é possível atenuar, resolver as dificuldades e, em muitas situações, evitá-las, solucioná-las.\nAs escolas actuam diariamente para resolver estas situações de segurança. A própria organização da escola foi pensada e desenvolvida para ensinar, como missão principal, mas também para vigiar as crianças.\nDaí todo o trabalho de constituição de turmas, vigilância dos recreios, dos pátios, dos espaços comuns.\nA escola é pensada como uma comunidade educativa que permite o relacionamento e a convivialidade, mas que permite também o acompanhamento e a vigilância.|gov
||- Precisamos de continuar nesta linha da intervenção preventiva e da actuação imediata, em casos de ocorrência. É essa a linha que nós todos —  deixem-me que vos diga, Srs. Deputados, que, ao ouvir-vos falar, sinto que a preocupação é comum a todos! —  precisamos de encontrar uma estrutura que permita aos directores, aos docentes e às famílias sentirem que têm instrumentos de actuação, mas precisamos, sobretudo, de dar força, dar autoridade àqueles que estão directamente em contacto com as situações.\nPara isso é necessária uma intervenção que crie e consolide um clima de equilíbrio. São de evitar todo o tipo de radicalismos, sempre negativos, tanto o radicalismo da permissividade, como o do autoritarismo.|statement
||Aplausos do PS.|applause
Paulo Portas|CDS|Mas quem é autoritário?!|mp
Ministra da Educação||Precisamos de recorrer a intervenções formativas para criar um clima de respeito no relacionamento entre adultos e jovens, que se reflicta em ambientes favoráveis ao convívio dos jovens entre si.\nOs objectivos da intervenção preventiva são claros: evitar situações de risco; reduzir a exposição das crianças e jovens a factores de risco; atenuar o impacto de situações em que possa haver risco, promovendo nos jovens o que hoje se chama «resiliência»; desenvolver competências pessoais e sociais nos jovens; estimular a capacidade de auto-regulação e autodomínio, despoletando nos jovens e também nas famílias, nos pais, melhores competências parentais; aprofundar a educação para a cidadania; acompanhar as crianças e jovens em risco, mas também os potenciais agressores.\nAs crianças que agridem, como sabemos, muitas vezes vivem em ambientes de grande dificuldade, ambientes de risco»|gov
Paulo Portas|CDS-PP|As vítimas, por vezes, também vivem em meios desfavorecidos, não são só os agressores.|mp
Ministra da Educação||» e a escola, em conjunto com a nossa sociedade, tem que criar formas de protecção das crianças que sejam dissuasoras para os agressores, mas que apoiem as famílias e que encontrem soluções duráveis, para que não haja, para as crianças e para os jovens, nenhuma situação em que possamos dizer que os rejeitámos.|gov
||Aplausos do PS.|applause
||- A nossa sociedade não é de rejeição. Nesta sociedade, todos devem ter o seu lugar, o seu papel. A educação deve acolher todos, criar situações e instituições nas quais as pessoas possam sentir que têm um caminho e que têm um futuro que os irá integrar e que lhes irá abrir perspectivas para que sintam que a educação e a escola os consideram cidadãos.\nNo quadro da intervenção preventiva, também deve haver um reforço de alguns instrumentos que já existem, que o Ministério da Educação criou para lidar com situações de dificuldade de aprendizagem que, como sabem, muitas vezes estão ligadas a questões de integração.\nEstou a referir-me aos territórios de intervenção prioritária, que propiciam condições especiais nas quais o ratio de professor/aluno nas turmas é menor, para que haja um atendimento mais continuado, mais personalizado, ainda que nas turmas do nosso País o número de professor/alunos nunca é acima dos 24.|statement
Bernardino Soares|PCP|Vá dizer isso à turma da minha filha!|mp
Ministra da Educação||No âmbito destes territórios de intervenção prioritária, importa reforçar não só a forma como se trabalha na sala de aula, nas turmas, mas também as equipas multidisciplinares que trabalham nas escolas, conjuntamente com psicólogos, coordenadores de saúde, gabinetes de apoio ao aluno, enfim, uma estrutura de intervenção preventiva também de acompanhamento, factor que consideramos muito importante.|gov
||- Um outro projecto que poderá ser aprofundado consiste no Projecto Mais Sucesso Escolar, que também ajuda a promover nas crianças o sucesso escolar. O sucesso é essencial para que as pessoas sintam que são aceites, que são acarinhados pela escola e, no seu processo de auto-identificação como elementos positivos, não gerem comportamentos de agressão em relação aos outros: aos colegas, aos pares, bem como aos adultos (professores, funcionários).\nGostaria ainda de focar os percursos curriculares alternativos, mais um projecto que o Ministério da Educação tem em curso, como intervenção preventiva.|statement
||Aplausos do PS.|applause
Presidente|Presidente|Srs. Deputados, vamos dar início à segunda ronda de perguntas.\nTem a palavra a Sr.ª Deputada Teresa Caeiro.|president
Teresa Caeiro|CDS-PP|Sr. Presidente, Sr.ª Ministra, começo por agradecer as suas respostas, mas não posso deixar de tecer alguns comentários.\nMinistra repetiu que existe um Gabinete de Segurança e um Observatório da Violência, que funciona junto do Instituto Politécnico de Santarém. Com toda a franqueza, é capaz de nos apresentar os dados que saem desse Observatório: o número de incidentes, o tipo de incidentes, o tipo de agressões, a evolução por regiões, a evolução por distritos, a evolução por faixa etária? Sr.ª Ministra, se este Observatório só serve para o Gabinete da 5 de Outubro, então não serve para muito!Como sabe, o único estudo académico que fez o levantamento e o acompanhamento de dados estatísticos no nosso País foi um concelho do distrito de Bragança.\nA Sr.ª Ministra referiu, e é verdade, que muitos dos agressores vivem em contextos desfavorecidos. Já lhe ocorreu que também muitas das vítimas vivem em meios desfavorecidos e são duplamente penalizados?|mp
||Aplausos do CDS-PP.|applause
||Aplausos do CDS-PP.|applause
||- Se queremos pensar na escola como um local de oportunidades, como um local para garantir a igualdade de oportunidades, uma mobilidade social, a Sr.ª Ministra não pode estar sempre a desculpabilizar os infractores e a agravar as vítimas, porque assim estas recebem um sinal de que não vale a pena empenharem-se, não vale a pena esforçarem-se, não vale a pena serem bem comportados.|statement
Paulo Portas|CDS-PP|Muito bem!|mp
Teresa Caeiro|CDS-PP|Isto é um sinal que a nossa sociedade não pode dar.\nSr.ª Ministra, registamos o seu reconhecimento face ao enorme erro que foi o Estatuto do Aluno, ocorrido há dois anos.\nDentro de alguns dias, provavelmente na próxima semana ou daqui a umas semanas, vamos ter aqui um debate muito interessante e muito aprofundado, no qual o CDS vai ver reconhecidas as suas ideias e a sua persistência e os senhores vão voltar atrás em relação ao que apresentaram há dois anos. É verdade que não era a Sr.ª Ministra que estava com a pasta, mas o Primeiro-Ministro era o mesmo!»E os Srs. Deputados que, há dois anos, fizeram a defesa do Estatuto do Aluno ainda estão aqui sentados!|mp
||Aplausos do CDS-PP.|applause
||Protestos do PS.|protest
||- O CDS vai voltar a falar do Estatuto do Aluno no que se refere aos deveres dos alunos, à protecção legal da autoridade do professor e do director, à responsabilidade de todos os elementos da comunidade escolar, à diferença entre as faltas justificadas e injustificadas, à relação entre o dever de combater o abandono escolar, que é uma preocupação nossa, e, simultaneamente, o dever de valorizar a assiduidade, o mérito, o esforço e os bons desempenhos dos alunos.|statement
Presidente|Presidente|Queira concluir, Sr.ª Deputada.|president
Teresa Caeiro|CDS-PP|Vou concluir, Sr. Presidente.\nTambém vamos discutir a nossa proposta para uma maior celeridade, agilidade e simplicidade do processo disciplinar, assim como para a defesa do património, da escola e da comunidade educativa. Vamos falar claro dos crimes cometidos dentro da escola e nas imediações»|mp
Paulo Portas|CDS-PP|Muito bem!|mp
Teresa Caeiro|CDS-PP|» e tambçm no direito de os alunos com mçrito verem reconhecido esse mérito. Isso é fundamental.Mas, Sr.ª Ministra, para que não se diga que só temos iniciativas repressivas —  e também acho um pouco temerário alguçm estar a dizer isso, visto que ninguçm viu as sete iniciativas que vamos apresentar»|mp
||Aplausos do CDS-PP.|applause
||Protestos do BE.|protest
||- Calma, calma! Sei que os senhores estão perturbados. E sabe porquê?|statement
Presidente|Presidente|Queira concluir, Sr.ª Deputada.|president
Teresa Caeiro|CDS-PP|Porque os senhores vão ter de reconhecer que nós apresentámos medidas para uma formação específica e adequada»|mp
Paulo Portas|CDS-PP|Muito bem!|mp
Ana Drago|BE|E que nós já apresentámos antes!|mp
Teresa Caeiro|CDS-PP|» dos professores, dos directores e dos auxiliares de acção educativa, um aumento dos funcionários de acção educativa, uma alteração dos rácios de atribuição desses funcionários às escolas, um reforço dos meios técnicos e humanos ao Programa Escola Segura.Portanto, Sr.ª Ministra, Sr.as e Srs. Deputados, são estas as nossas propostas integradas, porque não há uma «varinha de condão» para resolver um problema tão complexo.|mp
||Protestos do Deputado do PCP João Oliveira.|protest
||Aplausos do CDS-PP.|applause
Presidente|Presidente|Tem a palavra a Sr.ª Deputada Paula Barros.|president
Paula Barros|PS|Sr. Presidente, Srs. Membros do Governo, Sr.as e Srs. Deputados, o Grupo Parlamentar do Partido Socialista, hoje, aqui, nesta Câmara, quer reiterar, mais um vez, o seu repúdioveemente a todo e qualquer tipo de violência, seja em meio escolar ou em qualquer outro meio, seja violência física, verbal ou psicológica.\nEsta é uma matéria de elevada complexidade e que exige um forte exercício de responsabilidade por parte de todos. Sobretudo se pretendemos, como o PS pretende, uma escola pública exigente e rigorosa, com qualidade para todos e que não se demita de educar as pessoas.|mp
Vozes do PS||Muito bem!|interruption
Paula Barros|PS|Ou seja, uma escola que não desista e que não desista de ninguém. E não devemos ter receio de assumir esta escola, não devemos. Sabemos que fácil é desistir —  fácil é desistir punindo e excluindo —  e fácil mesmo é mudar a lei. Difícil, muito mais difícil do que isto tudo, é educar as pessoas.E neste processo de educação, a punição também faz falta, mas, apesar de estar provado e reconhecido que faz falta, não é suficiente como instrumento formador e educativo.\nHá muitos exemplos de sucesso de comunidades educativas, de professores, que dedicam todo o seu esforço e todo o seu empenho em corrigir situações para que a escola funcione no sentido daquilo que o Partido Socialista hoje aqui defendeu.\nPena é que esses exemplos positivos raramente, muito raramente, sejam trazidos ao debate político.\nDefendemos que esses exemplos positivos devem ter a mesma repercussão, a mesma visibilidade que têm todos os exemplos negativos que, infelizmente, ocorrem e nos preocupam, mas que, por essa via, só conseguiremos sempre avolumar. E o nosso objectivo —  e creio que o de todos —  não é esse. O nosso objectivo é avolumar, reproduzir o esforço e o empenho de todos aqueles que apostaram fortemente numa escola para todos e que estão a ter sucesso.|mp
||Aplausos do PS.|applause
Vozes do PS||Muito bem!|interruption
Paula Barros|PS|Há diversos caminhos»|mp
Presidente|Presidente|Queira concluir, Sr.ª Deputada.|president
Paula Barros|PS|» que podemos seguir, mas há um caminho que devemos, em conjunto e responsavelmente, construir, um caminho que aponte claramente para a prevenção, que deve ir para além do perímetro escolar, e que envolva todos —  alunos, famílias e comunidade em geral. E há também um caminho de reforço e autonomia dos professores, porque, no mesmo, eles próprios são os melhores a saber avaliar e encontrar as respostas em cada momento, mas, muitas vezes, esbarram nos articulados dos textos legislativos. Sobre isto, o Partido Socialista convida todos a reflectir, porque esta é uma matéria que merece a reflexão e a responsabilização de todos.|mp
||Aplausos do PS.|applause
Presidente|Presidente|Tem a palavra o Sr. Deputado Emídio Guerreiro.|president
Emídio Guerreiro|PSD|Sr. Presidente, Sr.as e Srs. Deputados, ouvimos algumas coisas curiosas neste debate, até este momento.\nDesde logo, ouvimos o Partido Socialista dizer que está preocupado —  e ainda bem que o está porque, penso, essa preocupação é comum a todos os portugueses, aos que se encontram nesta Câmara e aos que não estão aqui — , está disponível e com vontade de contribuir para uma solução diferente.\nAinda bem que o está. Mas permitam-me dizer-lhes o seguinte: não tenho qualquer dúvida de que a vossa disponibilidade está assente apenas no facto de os senhores terem perdido a maioria absoluta. É que essadisponibilidade e essa vontade os senhores nunca as tiveram, ao longo dos últimos cinco anos, quando, face a propostas oriundas desde a direita à esquerda, os senhores foram incapazes de acolher uma única —  repito, uma única — , designadamente, quando fizemos a discussão do Estatuto do Aluno, que os senhores impuseram às escolas e aos portugueses.Ouvimos também aqui a Sr.ª Ministra fazer um retrato de um mundo que não existe, que é um mundo perfeito, onde todas as ferramentas estão lá, mas, pelos vistos, não funcionam. E ouvimos também a Sr.ª Ministra dizer uma frase curiosa, a de que as intervenções casuísticas não têm efeitos duráveis. E é verdade, Sr.ª Ministra, é verdade! Mas pergunto: então, o que foi este Estatuto do Aluno senão uma intervenção casuística? É que, ao fim de dois anos, já tem de ser totalmente revisto!|mp
||Aplausos do PSD.|applause
Rosário Cardoso Águas|PSD|Exactamente!|mp
Emídio Guerreiro|PSD|O que é este conjunto de propostas, hoje anunciadas pela Sr.ª Ministra e ontem aprovadas apressadamente em Conselho de Ministros, senão uma intervenção casuística?|mp
Rosário Cardoso Águas|PSD|Muito bem!|mp
