Paula Santos|PCP|Sr. Presidente, Srs. Deputados: A transparência na atribuição de subsídios às instituições e associações é um dever de todas as entidades públicas, quer seja a nível local, a nível regional ou a nível nacional. Este deve ser um princípio basilar que todo o sector público, todas as instituições devem cumprir.\nPor isso, um dos artigos proposto no projecto de lei do Partido Socialista que se refere à publicitação de todas estas deliberações das decisões por parte das autarquias locais, do nosso ponto de vista, não tem qualquer inconveniente. Aliás, é um aspecto bastante positivo.\nMas isto não é uma novidade. Os Srs. Deputados sabem que há um conjunto de autarquias no nosso País que tem esta prática. Se formos às paginas da Internet desses municípios podemos ver as ordens de trabalhos das câmaras municipais, as deliberações, quais são os subsídios atribuídos e os seus montantes.\nNo entanto, é uma medida que pode ficar explanada na nossa legislação.\nOutra questão a que gostaria de me referir tem a ver com o estabelecimento de critérios de atribuição dos apoios a essas instituições. Naturalmente, não está em causa a mais-valia e o trabalho que estas associações e instituições desenvolvem do ponto de vista local, mas também do ponto de vista nacional. Esta também já é uma prática de muitas autarquias do nosso país. Não há dúvidas de que este deve ser também um dos aspectos que tem de ser cumprido, mas cumprido por todos —  por todo o poder público e por todas as instituições públicas. É que se exige que sejam estabelecidos estes critérios às autarquias, mas o Partido Socialista não vem exigir que o Governo ou que as várias entidades públicas da administração central também tenham de estabelecer estes mesmos critérios.|mp
Bernardino Soares|PCP|Muito bem!|mp
Paula Santos|PCP|Não compreendemos esta dualidade de critérios que o Partido Socialista propõe. Deveríamos estar aqui a discutir que o Governo, as várias instituições do sector público e as autarquias deviam ter mais clareza e transparência nos apoios atribuídos.\nTambém não acompanhamos o que está implícito neste projecto de, mais uma vez, levantar uma suspeição em relação ao poder local democrático.|mp
Bernardino Soares|PCP|Ora bem!|mp
Paula Santos|PCP|Trata-se da suspeição de que é no poder local democrático, nas autarquias e nos autarcas que se registam os grandes problemas de corrupção no nosso país, ideia que rejeitamos claramente.\nEste é um problema do nosso país, que se coloca quer ao nível do poder central quer ao nível do poder local, que deve ser combatido de igual forma. Não estamos de acordo nem consideramos que seja a esse nível que se colocam os grandes problemas de corrupção do nosso país.Aliás, consideramos até uma falta de respeito para com o poder local democrático —  conquista das populações da nossa revolução — , que é eleito directamente pelas populações e que é o poder mais próximo das populações, o facto de o Partido Socialista continuar a argumentar suspeições e estigmas em relação a este nível de poder, que tanto faz pelo desenvolvimento local e pelo desenvolvimento do nosso país.|mp
||Aplausos do PCP.|applause
Presidente|Presidente|Para uma segunda intervenção, tem a palavra o Sr. Deputado Nuno Araújo.|president
Nuno Miguel Araújo|PS|Sr. Presidente, Sr.ª Deputada Luísa Roseira, a sua intervenção deixoume perplexo, porque desconhece a legislação!|mp
Luísa Roseira|PSD|Não, não desconheço!|mp
Nuno Miguel Araújo|PS|A determinada altura da sua intervenção, estava a tentar recordar-me e a fazer um exercício de memória para me lembrar onde já tinha ouvido essa intervenção. Depois recordeime: Trata-se da intervenção que o Sr. Fernando Ruas, Presidente da Associação Nacional de Municípios Portugueses, proferiu quando o Partido Socialista apresentou este projecto de lei aqui, na Assembleia da República.Claramente, recordei-me desse discurso.\nMas deixe-me dizer —  e respondo também à Sr.ª Deputada do PCP Paula Santos —  que o Partido Socialista não tem qualquer pretensão de ser paternalista relativamente a câmaras municipais ou a municípios, bem como à sua actividade e às decisões que tomam de gastarem o dinheiro. O que o Partido Socialista exige é mais transparência no relacionamento que existe entre as autarquias e as instituições sem fim lucrativo, nomeadamente as associações. Isso está bem claro na nossa exposição de motivos.\nMas também pretende alargar essa transparência a outro sector, nomeadamente às empresas municipais e aos serviços municipalizados, onde não é prática recorrente. É verdade que há câmaras municipais no nosso país que já têm regulamentos para a atribuição destes apoios e destes subsídios, mas o que o Partido Socialista quer é generalizar e uniformizar, pelo País todo e por todas as autarquias, esta prática recorrente.\nÉ isso que a Sr.ª Deputada omite, é disso que a Sr.ª Deputada se esquece, o que denota bem que não conhece a legislação e que não conhece a prática corrente junto das nossas autarquias. Esta é a realidade.\nQueria também dizer-lhe que o Partido Socialista está disponível para viabilizar o projecto do CDS —  outra leitura não se podia retirar da minha intervenção — , porque consideramos que também no sector empresarial do Estado é necessário haver uma intervenção. Nunca, no decorrer da minha intervenção, se retirou outra ilação que não fosse essa. Assim, iremos viabilizar e contribuir para que o sector empresarial do Estado seja mais transparente na forma como se relaciona com os apoios e donativos, sejam eles de natureza financeira ou material.\nPortanto, Sr.ª Deputada Luísa Roseira, agradecia que lesse o nosso projecto e, porventura, mudasse o sentido de voto da sua bancada, porque fiquei sem perceber se iria viabilizar ou não a proposta do PS no sentido aumentar a transparência no relacionamento que existe entre as associações, as instituições e as autarquias.|mp
||Aplausos do PS.|applause
||Aplausos do PS.|applause
Presidente|Presidente|Para uma intervenção, tem a palavra o Sr. Deputado Pedro Soares.|president
Pedro Soares|BE|Sr. Presidente, Sr.as e Srs. Deputados: O Bloco de Esquerda considera fundamental e da maior importância a redução da discricionariedade em relação à atribuição de subsídios na área do poder local, assim como também a obrigatoriedade da publicitação da atribuição desses subsídios.Pensamos, no entanto, que a administração central também deve ser coerente com esta matéria e não se eximir a essa publicitação e à redução dessa discricionariedade.\nTendo em conta que a nossa intenção é a viabilização destes projectos de lei, pois são um caminho, um princípio, um passo importante no sentido do aumento da transparência de toda a vida em termos financeiros das autarquias, entendemos, no entanto, que têm ainda bastantes dificuldades que precisam de ser ultrapassadas —  é essa a crítica que temos a fazer — , nomeadamente porque não têm aplicação no âmbito das freguesias. E consideramos que, também a esse nível, devia ser incentivada a transparência na atribuição dos subsídios.\nPor outro lado, estes projectos de lei também não puxam pelo papel das assembleias municipais nesta matéria e consideramos que as assembleias municipais deveriam ter maior capacidade no controle da atribuição destes subsídios e que devia estar plasmada em iniciativa legislativa a obrigatoriedade de formalização de um regulamento que permitisse, de facto, o conhecimento dos critérios e das prioridades na atribuição destes subsídios. Ou seja, não devem ser apenas alguns municípios a terem esses regulamentos —  e ainda bem que os têm — , mas devem generalizados a todas as autarquias, de forma a haver menos discricionariedade e critérios definidos a priori. Assim, todas as entidades, independentemente de serem da cor do poder ou não, saberiam com o que podiam contar e com aquilo a que tinham direito.|mp
José Manuel Pureza|BE|Muito bem!|mp
Pedro Soares|BE|Consideramos ainda que há outras formas de financiamento que não estão aqui abrangidas e que também são muito perigosas. Todos sabemos que há formas de financiamento de colectividades, de associações e até da comunicação social nos municípios que não passam pela atribuição de dinheiro vivo; trata-se de subsídios directos, como, por exemplo, determinada comunicação social ser mais privilegiada que outra na compra de publicidade, assim como o que se verifica com os clubes de futebol. É, de facto, vergonhoso o que se passa nalguns concelhos.\nJulgo que, para o aumento da transparência, para a diminuição da discricionariedade, para que tudo isto seja muito mais claro para todos os cidadãos e para que não haja uns, que são os da cor, que levam tudo e outros, que não são os da cor, e que são ostracizados. O PS e o CDS deviam ter tido a preocupação de incluir estas questões nas suas iniciativas legislativas.\nA determinação do Bloco de Esquerda —  e iremos tomar iniciativas nesse sentido —  é a de que também esse tipo de apoios, muitas vezes encapotados, muitas vezes com orientação partidária bem definida, sejam publicitados, sendo obrigatória a sua publicitação, porque é importante que a opinião pública conheça o que se passa relativamente a essa matéria.\nEstes diplomas são, pois, passos importantes, mas ainda insuficientes, sendo necessário que se ultrapassem as dificuldades que, do nosso ponto de vista neles existem.|mp
||Aplausos do BE.|applause
Presidente|Presidente|Para uma nova intervenção, tem a palavra a Sr.ª Deputada Cecília Meireles.|president
Cecília Meireles|CDS-PP|Sr. Presidente, queria apenas dar alguns esclarecimentos em relação ao projecto do CDS, pois creio que não terá sido cabalmente compreendido, sobretudo pelo Sr. Deputado Pedro Soares.|mp
Sr. Deputado, em relação às freguesias, considero que tem razão, pelo que temos total abertura para juntar essa matéria à discussão na especialidade. De facto, a lei actual fala em executivos municipais, fazendo sentido que fale também nas juntas, até porque sabemos que, em muitos casos, quem atribui subsídios às colectividades são precisamente as juntas. Artur Rêgo|CDS-PP|É verdade!|mp
Cecília Meireles|CDS-PP|Em relação à valorização do papel das assembleias municipais, gostava de lhe lembrar que o projecto do CDS prevê que a lista a enviar seja exactamente ao órgãodeliberativo respectivo. Se no caso das empresas públicas é a Assembleia da República, no caso dos municípios é a assembleia municipal. Se juntarmos a questão, que referiu, das freguesias, nestas não terá aplicação, uma vez não há empresas nas freguesias. Portanto, nesse sentido, o nosso projecto valoriza bastante o papel das assembleias municipais.\nConcordo ainda consigo em relação à questão que tem a ver com a publicidade. No entanto, o problema que se verifica é o seguinte: a lei que modificamos não regula apenas benefícios monetários, regula também outros benefícios concedidos. Por exemplo, se uma autarquia ou uma empresa pública prestar apoio logístico patrocinando um evento, isso é contabilizado e tem de ser publicado e, assim, ficamos a saber.|mp
Pedro Mota Soares|CDS-PP|Muito bem!|mp
Cecília Meireles|CDS-PP|Ou seja, a lei não se aplica apenas a dinheiro, mas também a «benefício auferido». O apoio logístico de uma câmara municipal, por exemplo, terá de ser publicado e poderá ser fiscalizado.\nDeputado levanta ainda outro problema relacionado com a publicidade, mas que é fiscalizado noutra sede. A publicidade é uma aquisição de bens e serviços, é regulada pelo regime de contratação pública e tem obviamente que obedecer a critérios de transparência, que estão estabelecidos no chamado base.gov.pt.|mp
Presidente|Presidente|Peço-lhe para concluir, Sr.ª Deputada.|president
Cecília Meireles|CDS-PP|Sr. Presidente, pretendia apenas dar estes esclarecimentos, porque se trata, de facto, de duas coisas diferentes. É muito difícil fiscalizarmos publicidade, que é uma compra e é regulada pelo regime de contratação pública, através deste sistema. Não é possível fazer-se.|mp
||Aplausos do CDS-PP.|applause
Presidente|Presidente|Para interpelar a Mesa, tem a palavra a Sr.ª Deputada Luísa Roseira.|president
Luísa Roseira|PSD|Sr. Presidente, interpelo a Mesa no sentido de solicitar que seja entregue ao Deputado Nuno Miguel Araújo, do Partido Socialista, o projecto de lei n.º 278/XI, apresentado pela sua bancada, para que verifique que o mesmo não se aplica ao sector público empresarial local.|mp
Presidente|Presidente|Tem a palavra o Sr. Deputado Nuno Miguel Araújo para uma nova intervenção.|president
Nuno Miguel Araújo|PS|Sr. Presidente, Sr. Deputado Pedro Soares, queria dizer-lhe, muito claramente, que o Partido Socialista, com a apresentação deste seu projecto de lei, não pretende diminuir nenhum tipo de apoio ao associativismo, às instituições de solidariedade social ou às instituições sem fins lucrativos. Muito pelo contrário, pretendemos fazer com que as autarquias se relacionem de uma forma transparente no sentido de aumentar ainda mais esse apoio em função da actividade que essas instituições desenvolvem, porque, hoje, o trabalho que essas instituições desenvolvem nas nossas localidades assumem um papel ainda mais relevante do que há uns tempos atrás, tendo em consideração o período que vivemos.\nQueria também dizer-lhe que vemos com muita satisfação a adesão do Bloco de Esquerda a estes projectos de lei e que aguardaremos pelo seu contributo em sede de discussão na especialidade, onde os poderemos certamente melhorar.\nSr.ª Deputada Luísa Roseira, se lesse com atenção a exposição de motivos do nosso diploma e se tivesse estado atenta à minha intervenção perceberia que não estamos aqui hoje a fazer nenhuma votação final global ou coisa que se pareça. Estamos a apresentar um diploma com um conjunto de intenções que poderá ser alterado em função dos contributos. Portanto, a Sr.ª Deputada tem todas as condições para convencer a sua bancada a votar favoravelmente este projecto. Iremos introduzir as alterações que se julguem ser necessárias no sentido de trazer mais transparência a este relacionamento. Da mesma forma, já dissemos e reiteramos que vamos viabilizar o projecto do CDS, que contempla situações mais amplas.\nPortanto, haja espírito de abertura para que a bancada do PSD vote favoravelmente o nosso projecto.|mp
||Aplausos do PS.|applause
Presidente|Presidente|Sr.as e Srs. Deputados, o Grupo Parlamentar do Bloco de Esquerda anunciou a retirada do seu projecto de lei n.º 407/XI (1.ª) —  Combater a precariedade e os falsos recibos verdes (Segunda alteração à Lei n.º 7/2009, de 12 de Fevereiro) da ordem de trabalhos e também do guião de votações.\nPassamos à apreciação conjunta da petição n.º 71/XI (1.ª) —  Apresentada por Rui Manuel Vassalo Namorado Rosa e outros, manifestando à Assembleia da República o seu repúdio pela realização da Cimeira da NATO em Portugal, e dos projectos de resolução n.os 291/XI (2.ª) —  Recomenda ao Governo a rejeição de um conceito estratégico da Organização do Tratado do Atlântico Norte que promova intervenções militares em violação da Carta das Nações Unidas e do direito internacional (BE) e 294/XI (2.ª) —  Propõe a rejeição do novo conceito estratégico da NATO (PCP).\nPara uma intervenção, tem a palavra o Sr. Deputado José Manuel Pureza.|president
José Manuel Pureza|BE|Sr. Presidente, Sr.as e Srs. Deputados: Queria, em primeiro lugar, saudar os peticionários, que nos trazem a debate uma das matérias mais importantes que, no próximo futuro, vão estar em debate em Portugal.\nQueria também assinalar a convergência do Grupo Parlamentar do Bloco de Esquerda com o sentido de fundo desta petição, que é o de repudiar a transformação da NATO numa organização militar de alcance universal, seja directamente, seja através de subcontratação em parcerias com potências regionais.\nDe facto, Sr.as e Srs. Deputados, a Cimeira de Lisboa, de Novembro próximo, vem culminar um caminho de crescente configuração da Organização do Tratado do Atlântico Norte como uma organização militar de alcance global. Esse é o alcance preciso do novo conceito estratégico que será discutido e certamente aprovado nesta Cimeira. É o culminar de um processo que vem desde 1991 com o alargamento crescente das intervenções fora da área geográfica natural da NATO e sempre para fazer face às chamadas «novas ameaças».\nO relatório que serve de base à Cimeira de Lisboa —  elaborado por uma comissão presidida pela Sr.ª Madeleine Albright e cujo vice-presidente, curiosamente, foi o ex-presidente do Conselho de Administração da Shell, o Sr. Van der Veer —  elucida-nos sobre o que a NATO considera hoje como sendo as novas ameaças a que deve fazer face. E são elas: a instabilidade na periferia, as novas tecnologias da informação, o aprovisionamento energético, os riscos ambientais e até mesmo a crise económica internacional.\nQuer isto dizer, portanto, que o que vai estar em discussão na Cimeira de Lisboa é uma ampliação geográfica, por um lado, e temática, por outro, da possibilidade de intervenção militar desta Organização, legitimando, assim, o uso da força armada onde quer que seja e para prevenir a actuação seja do que for que ponha em causa a estabilidade da ordem imperial hoje dominante.|mp
Vozes do BE||Muito bem!|interruption
José Manuel Pureza|BE|E isso significa coisas muito concretas. Significa que, com o novo conceito estratégico que vai estar em discussão em Lisboa em Novembro, se verificará a militarização do acesso às fontes energéticas, se verificará a militarização da resposta às instabilidades na periferia, se verificará a militarização da perpetuação do modelo de desenvolvimento que gera desequilíbrios ambientais e se verificará, até, a militarização da revolta social contra as políticas que geram a crise económica internacional.\nSinal elucidativo são os 5 milhões de euros de aquisições extraordinárias que o Ministério da Administração Interna se propõe fazer com vista à Cimeira da NATO, mas sempre em nome da democracia e da liberdade. A democracia e a liberdade estão, realmente, no «código genético» da NATO e a prová-lo está o facto de o Portugal de Salazar ter sido membro fundador dessa mesma Organização. Democracia e liberdade são coisas que rimam de uma forma extraordinária com Portugal de Salazar»! Sr.as e Srs. Deputados, Portugal acabou de ser eleito para o Conselho de Segurança das Nações Unidas, como membro não permanente, para um mandato de dois anos. O Governo proclamou, nessa ocasião, que a política externa de Portugal estaria sempre guiada pelo primado do direito internacional e da Carta das NaçõesUnidas. Pois, muito bem, está na altura de o provar e só o pode provar se contestar, de uma maneira completa, firme e clara, qualquer conceito estratégico que esvazie a Carta das Nações Unidas e seja contrário ao primado do direito internacional e da Carta das Nações Unidas.\nÉ isso que vai estar em discussão em Lisboa. Veremos qual é a actuação do Governo.|mp
||Aplausos do BE.|applause
Presidente|Presidente|Para uma intervenção, tem a palavra a Sr.ª Deputada Paula Santos.|president
Paula Santos|PCP|Sr. Presidente, Srs. Deputados: Saudamos a campanha «Paz Sim! NATO Não!», todas as associações e organizações que a compõem e os subscritores da petição que hoje discutimos em defesa da paz e contra a realização da Cimeira da NATO, em Portugal.\nO que está em cima da mesa nesta Cimeira é a reformulação do «conceito estratégico» da NATO, a procura de uma saída para a guerra do Afeganistão e a instalação de um novo sistema antimíssil na Europa.\nPretendem elevar a NATO a um novo patamar, como instrumento de ingerência e de agressão a nível mundial.\nOs objectivos passam por alargar a sua intervenção a todo o globo, ampliar o âmbito das suas missões a questões como a energia, o ambiente, as migrações e a segurança interna dos Estados; reafirmar-se como bloco militar; desenvolver o complexo industrial e a investigação militar; exigir aumento das despesas militares dos seus membros; promover a corrida aos armamentos; instalar sistemas de míssil na Europa; incluir nas missões acções de ingerência directa e ocupações a pretexto da manutenção da paz e aprofundar a instrumentalização das Nações Unidas para prosseguir os seus propósitos.\nA realização desta Cimeira em Lisboa associa o nosso País a uma nova escalada de agressão contra os povos, que colide com os princípios constitucionais que regem as relações internacionais de Portugal, de respeito dos direitos dos povos, da solução pacífica dos conflitos internacionais, da não ingerência nos assuntos internos dos outros Estados, preconizando a abolição do imperialismo, do colonialismo e de quaisquer formas de agressão, domínio e exploração nas relações entre os povos, pelo desarmamento e pela dissolução dos blocos político-militares.\nNum momento em que o Governo anuncia um brutal ataque aos rendimentos do trabalho, aos direitos dos trabalhadores e do povo português, com vista ao aumento da exploração, exigindo mais sacrifícios a quem menos tem, continua a colocar as forças militares portuguesas ao serviço da NATO, das suas agressões, que nada têm a ver com os interesses nacionais.\nSaudamos também o Movimento da Paz em Portugal, reunido nesta campanha «Paz Sim! NATO Não!», pelo esclarecimento do povo português, pelas reais intenções desta Cimeira e da NATO e pela realização da manifestação, no próximo dia 20 de Novembro, em defesa da paz.\nO PCP está de acordo com os objectivos desta petição. Neste sentido, apresentamos um projecto de resolução que recomenda ao Governo que rejeite o novo conceito estratégico da NATO, a dissolução e a progressiva desvinculação de Portugal da NATO, a retirada das forças portuguesas envolvidas em missões militares da NATO, o fim das bases militares estrangeiras e das instalações desta organização em território nacional, o desarmamento e o fim das armas nucleares e de destruição maciça e o cumprimento, pelas autoridades portuguesas, da Carta das Nações Unidas e da Constituição da República Portuguesa, em respeito pelo direito internacional, pela soberania e igualdade dos povos, pela paz e progresso da humanidade.|mp
||Aplausos do PCP.|applause
Presidente|Presidente|Para uma intervenção, tem a palavra o Sr. Deputado Miranda Calha.|president
Miranda Calha|PS|Sr. Presidente, Srs. Deputados: Estamos a debater uma petição subscrita por um grupo de cidadãos que se opõem à realização da Cimeira da NATO, em Lisboa. Registamos essa opinião, mas, obviamente, discordamos dela.Penso que o que será mais interessante é analisar e debater os projectos de resolução apresentados pelo Bloco de Esquerda e pelo PCP.\nEm relação ao PCP, nada temos a acrescentar, a não ser louvar a sua tradicional posição sobre a NATO, que está expressa no primeiro ponto do projecto de resolução e que é a dissolução da NATO e a saída de Portugal dessa mesma organização. É uma opinião respeitável, da qual discordamos totalmente.|mp
Bernardino Soares|PCP|Está na Constituição!|mp
Miranda Calha|PS|Aliás, o que VV. Ex.as apresentam no projecto de resolução é uma reedição dos documentos dos anos 70 do período da Guerra Fria.É uma apreciação que demonstra o imobilismo e a situação retrógrada do vosso grupo parlamentar em relação à análise dos novos tempos, da nova realidade e das questões relativas à segurança e à defesa da paz entre os povos.|mp
||Protestos do PCP.|protest
||Aplausos do PS.|applause
||- Essa é, de facto, a vossa posição, pelo que não há mais nada a registar em relação ao projecto de resolução do PCP senão que VV. Ex.as ainda estão no jurássico tempo dos anos 70!|statement
Vozes do PS||Muito bem!|interruption
||Protestos do PCP.|protest
Miranda Calha|PS|A posição do Bloco de Esquerda é muito mais interessante, porque, talvez, um pouco mais sofisticada. O Bloco de Esquerda faz uma condenação total da actuação da NATO, mas, no final, propõem que seja votado um ponto, o que integra precisamente o Tratado de Washington e que é o respeito pelos direitos e pelos princípios considerados na Carta das Nações Unidas. Portanto, é um dejà vu.O que é importante e substancial —  e por isso é que a vossa proposta é sofisticada, mas inteligente —  é que fazem, na nossa primeira parte, uma condenação total da acção da NATO, o que demonstra que também estão contra a NATO e, obviamente, no mesmo registo do PCP, que é o da dissolução da NATO. Este é o registo essencial que temos de fazer sobre a posição do Bloco de Esquerda.|mp
||Protestos do BE.|protest
José Manuel Pureza|BE|É verdade! Interpreta bem!|mp
