Presidente|Presidente|Srs. Deputados, temos quórum, pelo que declaro aberta a sessão.
Presidente|Presidente|Antes de mais, informo a Câmara que decorre, na Sala D. Maria, a eleição para 1 juiz do Tribunal Constitucional, dos membros para o Conselho Superior de Magistratura e para o Conselho Superior do Ministério Público, do Presidente do Conselho Económico e Social e dos membros para a Comissão Nacional de Eleições e para o Conselho Superior de Informações.\n Peço aos Srs. Deputados o favor de exercerem o seu direito de voto até ao final da nossa reunião.\n Srs. Deputados, do primeiro ponto da nossa ordem do dia consta a discussão, na generalidade, da proposta de lei n.º 2/XI (1.ª ) — Segunda alteração à Lei n.º 64-A/2008, de 31 de Dezembro (Orçamento do Estado para 2009).\n Para uma intervenção, tem a palavra o Sr. Ministro de Estado e das Finanças.\n
Ministro de Estado e das Finanças|Ministro|Sr. Presidente, Sr. e Srs. Deputados: A crise financeira e económica tem vindo a apresentar uma intensidade, uma duração e uma extensão geográfica sem precedentes históricos recentes.\n О contágio da crise financeira à componente real da economia reflectiu-se numa deterioração acrescida das expectativas dos agentes económicos, afectando negativamente a produção, o comércio internacional е о emprego.\n No sentido de combater os efeitos eminentemente catastróficos de uma crise desta natureza, o Governo português, em estreita coordenação com os parceiros europeus, adoptou dois grandes tipos de medidas.\n Primeiro, medidas no âmbito do sistema financeiro, que se traduziram na Iniciativa de Reforço da Estabilidade Financeira e que visaram, fundamentalmente, assegurar a regularidade do financiamento da actividade económica e garantir a protecção das poupanças dos portugueses.\n Segundo, medidas de apoio ao investimento e ao emprego, através do lançamento da Iniciativa para o Investimento e o Emprego, que tem vindo a actuar em áreas estratégicas, como a educação, as energias renováveis, as infra-estruturas tecnológicas, o apoio às empresas, nomeadamente às pequenas e médias empresas, o emprego e a protecção social.\n Estas medidas consubstanciaram-se num estímulo orçamental que obrigou a um aumento da despesa e do défice previstos para 2009.\n Para além da intervenção pública através destas medidas extraordinárias, no sentido de apoiar as empresas, o emprego e as famílias mais afectadas, há também que ter em conta o efeito de funcionamento dos chamados estabilizadores automáticos. Como é sabido, o contexto económico gera efeitos nas contas públicas, quer do lado da despesa, quer do lado da receita. Num quadro recessivo de abrandamento da actividade económica, as receitas diminuem (entre outros motivos, pela queda dos lucros das empresas e pela diminuição do consumo) e as despesas aumentam (nomeadamente, as prestações sociais associadas ao apoio aos desempregados).\n Assim sendo, a recessão traduziu-se, na economia portuguesa, à semelhança da generalidade das economias europeias, da OCDE e a nível global, numa deterioração das contas públicas pelo efeito combinado das medidas discricionárias e do funcionamento dos referidos estabilizadores automáticos.\n Neste âmbito, é de assinalar que a crise tem vindo a gerar consequências orçamentais mais acentuadas, sendo de destacar a forte quebra da receita fiscal e contributiva em relação às previsões iniciais. Com efeito, estima-se que a receita fiscal, em 2009, sofra uma queda de 13,2% relativamente ao montante cobrado em 2008, o que implica um valor de cerca de 4,5 mil milhões de euros abaixo daquele previsto no relatório que, em Janeiro, acompanhou a proposta de lei da Iniciativa para o Investimento e o Emprego. Deste valor, cerca de 70% é justificado pela evolução dos impostos indirectos, nomeadamente do IVA. No que respeita a impostos directos, há a destacar a acentuada quebra de receitas em sede de IRC como resultado da diminuição dos lucros das empresas.\n Entretanto, é de relevar a evolução relativamente favorável do sector financeiro em Portugal. O sistema bancário nacional tem vindo a revelar-se globalmente resiliente, comparativamente ao quadro europeu, em termos de liquidez e solvabilidade, o que tem permitido a regularidade dos fluxos de crédito à economia e às famílias.\n Este panorama mais positivo do sector financeiro reflecte-se, desde logo, na diminuição da necessidade de envolvimento efectivo do Estado no apoio à estabilidade financeira, permitindo, nomeadamente, reafectar parte do limite de 20 000 milhões de euros de endividamento público, inicialmente dirigidos ao apoio de instituições financeiras, a favor do financiamento do défice adicional associado à quebra da receita fiscal.\n De salientar que a despesa do Estado se mantém globalmente dentro dos limites anteriormente fixados e autorizados pela Assembleia da República. A presente alteração orçamental procede, isso sim, à recomposição da despesa corrente, que resulta até numa diminuição do montante autorizado em 60 milhões de euros.\n De entre as rubricas de despesa corrente há a ressaltar a diminuição em 630 milhões de euros na dotação de juros e outros encargos da dívida pública. Parte deste montante — 570 milhões de euros — permite colmatar a necessidade de reforçar a autorização para outras rubricas, como a Transferência do Estado para a Caixa Geral de Aposentações, em 210 milhões de euros, face ao aumento do número de novos pensionistas.\n Também de referir o reforço da importância concedida ao Sistema Nacional de Saúde, em 50 milhões de euros, para financiamento de despesas de prevenção e combate ao vírus H1N1 e o reforço da dotação provisional em 310 milhões de euros, de forma a mantê-la a níveis prudentes.\n Esta proposta de alteração orçamental reconhece, assim, a quebra de receita mais acentuada face às previsões iniciais, fruto dos efeitos profundos da crise, mas providencia os mecanismos de equilíbrio necessários, via reafectação de recursos financeiros, para minimizar o efeito de deterioração das contas públicas.\n Sr. Presidente, Sr. e Srs. Deputados: Termino com duas observações adicionais.\n Primeira: o esforço orçamental anticíclico desta dimensão só foi possível devido ao êxito e credibilidade da consolidação orçamental iniciada em 2005, baseada na redução de despesa primária.\n Segunda: este apoio público é temporário, sendo que, assim que os níveis de incerteza diminuírem substancialmente e a recuperação económica e financeira se revele sustentada, a actuação do Governo retomará a imperiosa rota de consolidação orçamental, essencial para a sustentabilidade das contas públicas e para a competitividade e o crescimento económico e social sustentado.\n
|PS|*** Aplausos ***
Presidente|Presidente|Inscreveram-se vários Srs. Deputados para pedir esclarecimentos ao orador.\nEm primeiro lugar, tem a palavra o Sr. Deputado Duarte Pacheco.\n
Duarte Pacheco|PSD|Sr. Presidente. Sr. Ministro de Estado e das Finanças, o documento que hoje nos apresenta é o espelho de um Governo que falhou na política de consolidação orçamental e que escondeu a realidade, a verdade, aos portugueses. Repito, Sr. Ministro: é o espelho de um Governo que falhou na política de consolidação orçamental e que escondeu a realidade aos portugueses.\n
Vozes do PSD|PSD|Muito bem!
Duarte Pacheco|PSD|Sr. Ministro, ao longo dos últimos anos sempre dissemos que o combate com vista à consolidação orçamental estava a ser feito pela via errada; que os senhores estavam a querer a consolidação não pela via da despesa mas, sim, pura e simplesmente, pelo agravamento da carga fiscal e que em qualquer momento, quando houvesse uma crise com repercussão na receita, a realidade estaria à vista de todos e o défice voltaria a aumentar.\n Os senhores sempre o negaram, mas hoje isso é inequívoco. Depois de anos com a despesa não controlada, com a receita fiscal a ser a única via para consolidar o Orçamento, hoje, que a receita cai, temos o défice mais alto dos últimos 20 anos.\n Sr. Ministro, esconderam a realidade aos portugueses, porque não é plausível que não soubessem esta situação ao longo de meses. E durante os últimos meses quiseram escondê-la por um único motivo: por estarmos em vésperas de eleições. Agora, depois das eleições, fica à vista de todos o falhanço da política orçamental do actual Governo.\n Mas a verdade, Sr. Ministro, é que não esconderam a realidade aos portugueses só durante os últimos meses; hoje continuam a fugir da verdade e a querer esconder a realidade aos portugueses. É que, hoje mesmo, estamos a apreciar um documento em que vêm pedir perto de 5000 milhões de euros para agravar o endividamento, mas não têm a coragem — talvez tenham mesmo a vergonha — de dizer quais são as vossas estimativas para os principais agregados macroeconómicos.\n Sr. Ministro, a 15 dias do fim do ano, apresentam-nos um documento em que pedem 5000 milhões de euros, não apresentando qualquer estimativa para o valor do défice, para o valor do crescimento do produto, para o valor do endividamento, para o valor do desemprego. Porquê? Das duas, uma: ou o Sr. Ministro, a 15 dias do fim do ano, não tem essa informação, o que não é plausível, ou a tem e, de forma consciente, não a quer partilhar com os portugueses. E a pergunta que tem de se fazer é só uma, Sr. Ministro: quer 5000 milhões de euros de agravamento do endividamento? Então, tem de dizer-nos quais são as estimativas reais para o produto, para o défice e para o endividamento. Os portugueses merecem saber a verdade.\n
|PSD|*** Aplausos ***
Presidente|Presidente|Tem a palavra o Sr. Deputado Honório Novo.
Honório Novo|PCP|Sr. Presidente, Sr. Ministro, estamos a debater um Orçamento rectificativo que é, em boa verdade, uma alteração ao orçamento do subsector Estado e não um Orçamento rectificativo do Estado.\n Temos claramente enunciadas diversas falhas da proposta de lei: não apresenta uma actualização do cenário macroeconómico; não apresenta uma actualização da previsão da conta do conjunto das administrações públicas; não apresenta uma actualização da previsão do valor da dívida das administrações públicas; não apresenta uma quantificação do grau de execução previsível da iniciativa para o investimento e o emprego; não apresenta uma informação acerca da execução da iniciativa do reforço da estabilidade financeira; não apresenta uma estimativa da taxa de desemprego; não dá factores explicativos da evolução da receita fiscal do Estado de uma forma quantitativa e não apenas qualitativa.\n Mais, constata-se que a proposta de alteração ao Orçamento não constituiu apenas uma alteração de classificação face ao objectivo previsto mas também uma alteração da natureza da dívida — essa é a realidade. Finalmente, não explica documentalmente a finalidade objectiva de um «saco azul» de 310 milhões de euros para a dotação provisional do Ministério a que preside V. Ex.ª, sabendo-se que não estamos no início do ano mas, sim, a 15 dias do final do ano, pelo que não estamos numa indefinição e teríamos de ter essa informação documental.\n Para além disso, Sr. Ministro, estamos perante um Orçamento rectificativo onde não parecem estar contemplados quaisquer reforços eventualmente necessários para poder fazer face ao aumento da despesa resultante da acomodação das medidas de carácter social.\n Esta questão motiva-me a fazer-lhe uma pergunta.\n Sr. Ministro, estamos perante uma taxa de desemprego que não é de 8,5%, como o senhor previa no início do ano, mas, sim, de mais de 10%, segundo o Eurostat. E, portanto, estamos perante despesas inesperadas, previsíveis, no orçamento da segurança social, designadamente para fazer face à subida da taxa de desemprego com as medidas de protecção social.\n Gostava de perguntar-lhe se não será adequado e prudente, nestas condições, fazermos uma transferência de 60 milhões de euros para a segurança social com esta finalidade em vez de cortar na despesa, como o Sr.\n Ministro e o Governo propõem ao pretenderem reduzir o plafond da despesa de 60 milhões de euros.\n Não se trata de um aumento do plafond da despesa, como bem vê, trata-se, sim, relativamente ao Orçamento actual, de não diminuir esse plafond de despesa e de deslocar 60 milhões de euros para um aumento previsto, isto é, para fazer eventualmente face ao aumento dos encargos com o subsídio de desemprego. Gostava que o Sr. Ministro respondesse a esta pergunta.\n
|PCP|*** Aplausos ***
Presidente|Presidente|Tem a palavra o Sr. Deputado José Gusmão.
José Gusmão|BE|Sr. Presidente, Sr. Ministro das Finanças, o Governo vem hoje a este debate com uma séria atrapalhação que decorre de ter sido «apanhado com a boca na botija».\n O Orçamento que o Sr. Ministro das Finanças anunciou como um Orçamento de rigor, de prudência e realismo, não era rigoroso, nem prudente, nem realista.\n
Luís Fazenda|BE|Exactamente!
José Gusmão|BE|Mas, quando o Governo procedeu à primeira alteração orçamental, aquilo que ainda poderia considerar-se com algum esforço um gigantesco erro de previsão, quando saíram os números da quebra da receita fiscal no final do primeiro semestre de 2009, já não poderia ser considerado um erro de previsão, era um erro de facto. Não era uma estimativa, nem um perigo, era uma quebra real e efectiva de 21,6% da receita fiscal.\n Nesse cenário, num cenário em que o desemprego aumentava mais em Portugal, como aumentou ao longo do último ano, do que na média da União Europeia, onde também houve uma crise financeira internacional, num cenário em que falhou a política de investimento público do Governo, com um programa de investimento público que está aplicado a menos de metade até ao final do terceiro trimestre, restava ao Governo dizer que pelo menos as contas públicas estão bem — a receita fiscal está bem, as contas públicas estão bem, o défice está controlado.\n Portanto, num quadro de falhanço da resposta à crise económica, o Governo agarrou-se a factos que, nessa altura, já sabia — não podia deixar de saber! — serem falsos sobre a realidade das contas públicas.\n Tivemos, pois, um Orçamento, uma primeira alteração orçamental e todo um discurso do Governo feitos não já para enganar Bruxelas, como já tínhamos alguma experiência de anteriores governos, mas, desta vez, para enganar os portugueses.\n E já que se vai falar neste debate de responsabilidade e de transparência, queremos colocar apenas uma pergunta ao Sr. Ministro das Finanças, para não o sobrecarregar. Essa pergunta tem a ver com esta hora da verdade. É que se esta vai ser a hora da verdade, que seja, pelo menos, a hora de toda a verdade. Assim, gostaríamos de saber, Sr. Ministro, qual é a estimativa, que o Governo já tem com toda a certeza, para o défice em 2009.\n
|BE|*** Aplausos ***
Presidente|Presidente|Para responder, tem a palavra o Sr. Ministro de Estado e das Finanças.
Ministro de Estado e das Finanças|Ministro|Sr. Presidente, Sr. Deputado Duarte Pacheco, o Governo não falhou a consolidação orçamental. O Governo conseguiu uma consolidação orçamental sem precedentes entre 2005 e 2007, conseguindo baixar o défice de 6,1% do PIB para 2,6% do PIB, o défice mais baixo dos últimos 35 anos.\n
Duarte Pacheco|PSD|Também com a maior carga fiscal dos últimos 35 anos!
Ministro de Estado e das Finanças|Ministro|E fê-lo de uma forma exemplar e reconhecida a nível internacional por várias instituições, como a Comissão Europeia, o Fundo Monetário Internacional, a OCDE, etc.\n E o que fizemos em termos de consolidação orçamental contrasta, de forma gritante, com aquilo que foi a prática do PSD enquanto governo. Recordo ao Sr. Deputado que, enquanto o PSD foi governo, a receita aumentou o seu peso no PIB em 3 pontos percentuais e que, no último governo do PS, aumentou, até 2008, 1,7 pontos percentuais. Já a despesa primária, durante o tempo em que o PSD foi governo, aumentou 2,5 pontos percentuais do PIB e, durante o governo do PS, baixou 2,1 pontos percentuais.\n
Duarte Pacheco|PSD|*** Protestos ***
Ministro de Estado e das Finanças|Ministro|Isto, Sr. Deputado, são números, são estatísticas, são factos incontestáveis que revelam muito bem como abordámos a consolidação orçamental de uma forma mais séria e responsável e sem maquilhagem ou «faz de conta», como os senhores fizeram.\n
|PS|*** Aplausos ***
Duarte Pacheco|PSD|*** Protestos ***
Ministro de Estado e das Finanças|Ministro|Mas há uma coisa que não iludimos e que o PSD procura esconder aos portugueses: nós vivemos uma crise sem precedentes, uma crise que afecta o mundo inteiro e que nos afecta. Ora, essa crise obrigou-nos a um esforço orçamental muito significativo, para atenuar os seus efeitos na economia portuguesa e nas famílias portuguesas, e teve incidência orçamental, obrigando a que o défice aumentasse também para níveis elevados. E não estamos arrependidos das medidas que tomámos. Fizemos o que tínhamos de fazer para enfrentar a crise, para conseguir aliviar os custos desta crise sobre as empresas e sobre as famílias, com estas consequências orçamentais.\n Se o défice do Orçamento é o que é, é porque temos uma crise que é o que é: a crise mais grave que nos afectou nos últimos 80 anos.\n E o Sr. Deputado não venha dar a entender que o défice é o que é, por má gestão das finanças públicas.\n Não, o défice é o que é porque há uma crise que nos obrigou a levar a cabo um esforço considerável.\n Quanto às estimativas pedidas para os agregados macroeconómicos, pergunto: quais foram as vossas estimativas para os agregados macroeconómicos, para o défice, para o crescimento, quando aprovaram aqui a eliminação do PEC e a redução dos pagamentos por conta?
|PS|*** Aplausos ***
Ministro de Estado e das Finanças|Ministro|Então, quando o Governo traz aqui uma simples alteração orçamental, que consiste em alterar o limite de endividamento, exige-se logo um estudo do cenário macroeconómico e projecções, mas quando os senhores trazem aqui medidas gravíssimas para o equilíbrio das contas públicas, avançam com essas medidas sem qualquer rigor de análise, sem terem essas preocupações? Vêm exigir ao Governo aquilo que não exigiram a vós próprios?!
|PS|*** Aplausos ***
Ministro de Estado e das Finanças|Ministro|Sinceramente, Sr. Deputado, são «dois pesos e duas medidas»!
Presidente|Presidente|Queira concluir, Sr. Ministro.
Ministro de Estado e das Finanças|Ministro|Concluo, Sr. Presidente.\nA actualização do cenário macroeconómico faria sentido se estivéssemos numa fase inicial ou intermédia do ano. Estando o ano a findar, já não faz sentido falar em cenários e temos, sim, de olhar para aquilo que são os indicadores da actividade efectiva durante o ano. Não faz sentido fazer projecções para 2009! Para 2010, sim; não para 2009.\n Pede-se uma simples alteração do Orçamento do Estado e estamos aqui com considerações sobre os orçamentos da segurança social e de outros subsectores?! Não! A lei orçamental é clara: as alterações têm de ser acompanhadas de informação ajustada à natureza dessas mesmas alterações. E esta é uma alteração mínima, em termos de limites de endividamento. Assim, não podem exigir que uma proposta de alteração orçamental contenha toda a informação que uma proposta de Orçamento deve conter — haja aqui um sentido realista das proporções! Sr. Deputado Honório Novo — e termino, Sr. Presidente, com este esclarecimento —, as medidas de carácter social terão de ser financiadas com transferências do Orçamento para a segurança social. No âmbito da Iniciativa para o Investimento e o Emprego, há 185 milhões de euros que são transferidos para a segurança social…
Honório Novo|PCP|E a gente quer reforçar isso!
Ministro de Estado e das Finanças|Ministro|… e, até ao momento, já foram transferidos mais de 150 milhões de euros para suportar as despesas sociais acrescidas.\n Quanto à estimativa do défice do ano de 2009, Sr. Deputado, apresentá-la-ei quando apresentar a proposta de Orçamento para 2010.\n
Honório Novo|PCP|Isso já não é estimativa!
Ministro de Estado e das Finanças|Ministro|Nessa altura, apresentarei essa estimativa para o défice de 2009. Isto porque, nessa altura, tendo já findado o ano e completado a execução orçamental em 31 de Dezembro, estarei numa base sólida, com uma informação mais fidedigna, para poder apresentar essa estimativa.\n
|PCP|*** Protestos ***
Ministro de Estado e das Finanças|Ministro|Não faz sentido estar a apresentar, agora, uma estimativa e, daqui a um mês, uma outra estimativa, com base em informação mais actualizada.\n Risos do PCP e do BE.\n E o que está em causa, neste momento, é o Orçamento do Estado…
Honório Novo|PCP|Não, não! É do subsector Estado!
Ministro de Estado e das Finanças|Ministro|… e não o orçamento das administrações públicas. O que o Governo propõe à Assembleia é uma alteração da Lei de Orçamento do Estado. Portanto, interessa olhar para o défice do Estado e não para o défice das administrações públicas, porque a proposta do Governo limita-se, exclusivamente, ao Orçamento do Estado.\n
|PS|*** Aplausos ***
Presidente|Presidente|Tem a palavra a Sr.ª Deputada Assunção Cristas.
Assunção Cristas|CDS-PP|Sr. Presidente, Sr. Ministro das Finanças, esta proposta de lei de alteração à Lei de Orçamento do Estado é a prova evidente — aliás, assumida pelo Sr. Ministro na Comissão de Orçamento e Finanças — do erro clamoroso do Governo nas previsões para este Orçamento.\n
Vozes do PS|PS|Não é verdade!
Assunção Cristas|CDS-PP|As explicações que deu até agora, Sr. Ministro, foram, diria, muito fracas, muito parcas e não convenceram ninguém. Poderia ter feito antes — aliás, já foi aqui dito —, aquando da quebra de 20% nas receitas fiscais no primeiro semestre, mas não o fez. Nenhum Deputado acreditou e creio que nenhum português acredita que a razão principal para não o ter assumido antes não foi outra senão as eleições de Setembro.\n
|CDS-PP|*** Aplausos ***
||Mas, passando à frente, Sr. Ministro, porque nos interessa sobretudo o futuro, o único benefício que se pode retirar de um erro é aprender com esse erro. Pergunto-lhe, pois, Sr. Ministro, se já aprendeu com este erro e que números o Orçamento do Estado para 2010, que deve estar neste momento praticamente fechado, nos vai apresentar.\n Estou há pouco tempo nesta Casa, mas já estou a habituar-me a não obter resposta às perguntas que são colocadas. Acredito, porém, que isso pode mudar, pelo que lhe deixo um conjunto de perguntas.\n Que números, que estimativas nos vai apresentar para 2010 no que diz respeito ao défice? Uma vez que já tem os dados de 2009 praticamente fechados, já poderá prever melhor, acredito, para 2010.\n Que números vai apresentar para a dívida pública? A Comissão Europeia, recentemente, já apresentou uma previsão de 81,5% do PIB. Qual é a previsão do Governo? Qual é a previsão que o Governo tem para a taxa do desemprego, quando sabemos que a tendência é para que vá crescendo? Aliás, se olharmos para a quebra no investimento, vemos que provavelmente isso vai trazer também um agravamento da taxa do desemprego.\n Por fim, que números nos apresenta para o endividamento externo? Coloco-lhe ainda duas últimas perguntas muito breves.\n Primeira: que dados já pode apresentar, neste final do ano, relativamente à execução orçamental do subsector Estado? Segunda, aproveitando a presença do Sr. Ministro aqui e porque sempre é mais agradável ouvi-lo da sua boca do que pela comunicação social: qual é a decisão que vai ser hoje apresentada relativamente ao BPP?
|CDS-PP|*** Aplausos ***
Presidente|Presidente|Tem a palavra o Sr. Deputado Afonso Candal.
Afonso Candal|PS|Sr. Presidente, Srs. Ministros, Srs. Secretários de Estado, Sr. e Srs.\nDeputados, quanto à questão da verdade e da transparência, nunca como nos tempos recentes (e sempre de forma evolutiva) houve tanta verdade e tanta transparência naquilo que respeita, nomeadamente, à execução orçamental.\n Risos do Deputado do PCP Honório Novo.\n É evidente que a verdade e a transparência também não se dão bem com a preguiça. Portanto, convém olhar para os boletins de execução orçamental para acompanhar, a par e passo, com total clareza, em tempo útil e com profundidade, e para abarcar todas as componentes da execução orçamental. Fazendo isso, é fácil saber qual é a verdade dos números da execução orçamental.\n O governo do PS, na Legislatura passada, nunca omitiu, nem escamoteou essa verdade. Portanto, não é razoável e muito menos justo acusar o Governo de ter escondido ou omitido qualquer elemento.\n A Dr.ª Manuela Ferreira Leite entusiasma-se com este novo quadro, é verdade. Porventura, até, noutros tempos, quis implementá-lo, mas não conseguiu, não o implementou. Foi o governo do PS que, na Legislatura passada, conseguiu que o SNS e as autarquias locais pusessem as contas em dia. E se V. Ex.ª fizer um esforço de memória — também não é assim pedir tanto! —, lembrar-se-á das execuções do Serviço Nacional de Saúde e das administrações local e regional do tempo em que era ministra das Finanças.\n
Manuela Ferreira Leite|PSD|E agora?!
