Presidente|Presidente|Tem a palavra o Sr. Deputado Almeida Henriques
Almeida Henriques|PSD|Sr. Presidente, Srs. Membros do Governo, Sr. e Srs. Deputados, deixem que me dirija ao Sr. Secretário de Estado dizendo que, efectivamente, este Acordo da Base das Lajes, assinado em 1995, é de uma importância estratégica muito grande para Portugal e para os EUA e com um impacto muito grande na Região Autónoma dos Açores, do ponto de vista do seu desenvolvimento, mas também com um impacto decisivo no que diz respeito aos cerca de 800 trabalhadores que estão nesta Base.\n Mas, Sr. Secretário de Estado, o que estamos aqui a discutir, como disse, é basicamente uma negociação salarial. E, em relação a este aspecto, tenho de lhe dizer que, do ponto de vista da bancada do PSD, o Governo andou mal em duas vertentes. Primeiro, porque não acautelou devidamente os interesses dos trabalhadores da Base das Lajes, e não acautelou no espírito daquilo que era o acordo inicial celebrado entre Portugal e os EUA. Segundo, andou mal também porque acaba por querer tratar sozinho de um assunto que deveria merecer o envolvimento da parte do Governo e dos diferentes partidos.\n Como disse muito bem o Sr. Secretário de Estado, esta é uma matéria que tem merecido um amplo consenso nacional, mas o Governo não o procurou. Em momento algum houve uma consulta formal do Governo em relação aos outros partidos, designadamente ao Partido Social Democrata. Nesta medida, temos de reafirmar, aqui, que o Governo andou mal, porque efectivamente quebrou um laço e uma tradição, que é muito antiga em Portugal e que aqui não foi acautelada.\n Mas neste debate não podemos deixar também de reafirmar a nossa posição atlântica. Claramente, somos por essa posição e defendemos uma relação privilegiada com os EUA. É em nome dessa relação e em nome desse sentido de responsabilidade que não iremos votar contra e nos iremos abster nesta votação. Mas com uma certeza, Sr. Secretário de Estado, é que entendemos que os interesses destes trabalhadores não estão acautelados, pelo que iremos apresentar, já na próxima semana, um projecto de resolução que visa exactamente, no espírito do acordo inicial, tentar salvaguardar alguns desses direitos dos trabalhadores.\n Portanto, a nossa posição é a de viabilizar este acordo em nome da visão que temos da nossa vocação atlântica e da nossa relação com os EUA, mas quero repetir que o Governo não andou bem, porque acabou por não fazer uma negociação, foi quase um acto unilateral. E não andou bem porque não fez o que devia ter feito, dialogando com os vários partidos para conseguir o tal consenso nacional que o Sr. Secretário de Estado referiu, que pudesse levar a uma boa solução para Portugal e para estes trabalhadores.\n
|PSD|*** Aplausos ***
Presidente|Presidente|Para pedir esclarecimentos, tem a palavra o Sr. Deputado Pedro Mota Soares.
Pedro Mota Soares|CDS-PP|Sr. Presidente, Srs. Membros do Governo, Sr. e Srs. Deputados: A relação com os Estados Unidos da América é um pilar essencial da nossa política externa.\n
Paulo Portas|CDS-PP|Muito bem!
Pedro Mota Soares|CDS-PP|O CDS é um partido atlantista.
Nuno Magalhães|CDS-PP|Exactamente!
Pedro Mota Soares|CDS-PP|Temos sempre presente a importância da relação de Portugal e da Europa com os Estados Unidos da América e a importância que esta Aliança teve, e tem, na nossa segurança colectivo e na manutenção da paz, na Europa, por mais de 50 anos.\n
Vozes do CDS-PP|CDS-PP|Muito bem!
Pedro Mota Soares|CDS-PP|A presença americana na Base das Lajes e o correspondente Acordo são a maior prova do nível estratégico de cooperação militar entre os nossos dois países.\n A existência de uma base americana nas Lajes foi, e é, um factor de desenvolvimento dos Açores e, muito particularmente, da Ilha Terceira.\n
Vozes do CDS-PP|CDS-PP|Muito bem!
Pedro Mota Soares|CDS-PP|Graças à presença americana nas Lajes, muitos açorianos tiveram a oportunidade de trabalho que não teriam de outra forma, dentro da sua ilha, se esta Base não existisse.\n
Vozes do CDS-PP|CDS-PP|Muito bem!
Pedro Mota Soares|CDS-PP|Os açorianos e os terceirenses, em particular, são, por isso mesmo, os maiores defensores da importância das boas relações entre os dois Estados, não só pela sua localização, no meio do Atlântico, mas também pela vasta comunidade de açorianos e dos seus descendentes a residirem em território americano.\n
Vozes do CDS-PP|CDS-PP|Muito bem!
Pedro Mota Soares|CDS-PP|Não nos esquecemos também de que este é o primeiro acordo firmado com a Administração do Presidente Barack Obama.\n O CDS é sempre um partido responsável e um partido com sentido de Estado, mas a nossa responsabilidade não nos coíbe de criticar a falta de responsabilidade e a falta de sentido de Estado que o Governo e o Partido Socialista tiveram na revisão deste Acordo.\n
Vozes do CDS-PP|CDS-PP|Muito bem!
Pedro Mota Soares|CDS-PP|Há 36 anos que existe em Portugal um arco atlântico, composto por três partidos mas, a verdade é que o PS escolheu renegociar este acordo sozinho, não falando com os outros partidos políticos nem sequer incluindo os contributos que a Assembleia Legislativa da Região Autónoma dos Açores, através de uma comissão eventual que se debruçou sobre esta matéria e que teve a votação unânime, até do Partido Socialista, nos deu nesta mesma matéria.\n Sr. Presidente, Sr. e Srs. Deputados, era desejável que a revisão deste Acordo fosse mais abrangente e não se limitasse só e exclusivamente a matérias laborais, e, mesmo estas, de forma insuficiente.\n As conclusões da comissão eventual que já aqui citei alertavam para a necessidade de alterar normas, por exemplo, relativas ao acesso à justiça por parte dos trabalhadores portugueses na Base. Esta é uma matéria essencial e que está totalmente omissa na revisão deste Acordo.\n A alteração, em concreto, do artigo relativo ao Regulamento do Trabalho também ela mereceu sugestões por parte do Parlamento regional que dizia que se deviam conseguir encontrar «soluções técnico-jurídicas claras, que assegurem uma regulamentação uniforme, tendencialmente exaustiva e mutuamente aceite nas relações laborais entre os dois Estados».\n É por isso mesmo que, nestas matérias que têm a ver com o acesso à justiça e no que se prende também com um quadro uniforme, o CDS aproveita para anunciar que vai apresentar um projecto de resolução que recomenda ao Governo a revisão, nomeadamente, deste ponto do acesso à justiça.\n Viabilizamos, com gosto, este Acordo, em nome do nosso sentido de responsabilidade, em nome do sentido de Estado que o CDS sempre teve e que não quebra, mesmo perante as quebras que o Partido Socialista teve.\n
Vozes do CDS-PP|CDS-PP|Muito bem!
Pedro Mota Soares|CDS-PP|Mas não deixamos de criticar o que é criticável e, mais importante, não deixamos de apresentar aqui as soluções que consideramos que defendem melhor o Estado português e, obviamente também, os trabalhadores nos Açores.\n
|CDS-PP|*** Aplausos ***
Presidente|Presidente|Para pedir esclarecimentos, tem a palavra o Sr. Deputado Miguel Coelho.
Miguel Coelho|PS|Sr. Presidente, no âmbito desta discussão conjunta, quero, em primeiro lugar, saudar os trabalhadores portugueses da Base das Lajes e, muito particularmente, aqueles que subscreveram esta petição.\n O Partido Socialista compreende as razões que suscitaram esta petição e também compreende, naturalmente, a frustração que os trabalhadores portugueses da Base das Lajes possam ter em relação às expectativas que estavam criadas.\n Mas é bom recordar, Sr. e Srs. Deputados, que este é um problema que existia. O governo dos Estados Unidos da América decidiu, unilateralmente, deixar de aplicar um acordo, porque estaria em desacordo com a sua própria lei interna e nós, Portugal, ficámos confrontados com uma situação de impasse.\n
António Filipe|PCP|E nós, «dobra a espinha!».
Miguel Coelho|PS|Ora, perante situações de impasse, há duas soluções, há duas alternativas.\nA primeira é radicalizar posições, o que seria, com certeza, muito do agrado dos partidos que julgam que estão à esquerda do Partido Socialista.\n
|PCP|*** Protestos ***
Miguel Coelho|PS|A segunda alternativa é a de procurar negociar um novo acordo, que foi aquilo que foi feito.\n Este novo Acordo, Sr. e Srs. Deputados, como aqui foi dito, salvaguarda o essencial. Como foi dito pelo Sr. Secretário de Estado, poucos trabalhadores portugueses ou, porventura, nenhum trabalhador português terá a possibilidade de poder optar entre o aumento maior, o aumento da função pública ou o aumento dos próprios trabalhadores das bases norte americanas.\n Nesta perspectiva, foi salvaguardado o essencial. Por isso, saudamos o novo Acordo que foi estabelecido entre o Governo português e o Governo americano.\n Por último, gostaria de me referir à posição dos partidos que estão à direita do Partido Socialista.\n Percebemos a dificuldade em que se encontram. Percebemos a dificuldade em que se encontram tentando ganhar votos, a todo o custo, do ponto de vista regional, e compatibilizar isso com a solidariedade atlântica que sempre procuram manifestar. O PSD, muito particularmente, corre o risco de se ver confundido com aqueles partidos que sempre contestaram as opções europeias e as opções transatlânticas de política de defesa nacional, ao não ser claramente a favor de um acordo com a nova administração americana, o que poderia pôr em causa os princípios de defesa nacional.\n Percebemos, naturalmente, o PCP, que vota sempre contra tudo aquilo que seja acordo com os EUA e tenha implicações com a NATO, e também compreendemos as razões ideológicas do BE nesta matéria, mas não aceitamos a posição de neutralidade que o PSD parece querer assumir nesta questão.\n
|PS|*** Aplausos ***
Presidente|Presidente|Tem a palavra o Sr. Deputado José Manuel Pureza.
José Manuel Pureza|BE|Sr. Presidente Sr. e Srs. Deputados, neste início de intervenção, queria saudar os trabalhadores portugueses da Base das Lajes que estão associados à petição que faz parte deste debate e queria sublinhar aquilo que me parece ser essencial.\n A Base das Lajes tem consigo um acumulado histórico, que não é despiciendo, de atropelos à legalidade.\n Desse acumulado histórico faz parte, como todos bem sabemos, a Cimeira de 2003, que deu início à guerra contra o Iraque, mas também não é menos importante que nos lembremos que o que está agora a ser discutido é também um acumulado de ilegalidades porque, ao longo destes anos, aquilo que estava consagrado em tratado internacional, ou seja, um determinado método de cálculo dos salários dos trabalhadores portugueses na Base das Lajes, foi sistematicamente violado pela parte norte-americana, não cumprindo a obrigação de aceitar o inquérito salarial.\n Perante isto, constatamos que a parte que não cumpriu os acordos celebrados entre Portugal e os EUA, a parte incumpridora, vê agora perfeitamente ratificada e premiada a sua estratégia de boicote à legalidade internacional que ela própria tinha subscrito, através do Acordo com Portugal.\n Portanto, trata-se de um prémio ao infractor, um benefício ao infractor que o Estado português aceita dar com esta revisão e este novo acordo relativamente ao regulamento de trabalho.\n Sr. Deputado Miguel Coelho, não concordo consigo em que tenha sido salvaguardado o essencial, porque, aqui, o essencial era justamente obviar a que o infractor à legalidade internacional tivesse um prémio pela sua estratégia de boicote.\n Assim, estiveram bem os trabalhadores portugueses da Base das Lajes ao reivindicar que não houvesse alteração no método de cálculo salarial. Aliás, não há nenhuma justificação que não seja a cedência ao infractor para que se tenha revisto esse método de cálculo.\n Creio que, para a parte portuguesa, não há qualquer dúvida acerca do acerto do método de cálculo baseado em inquérito salarial e, portanto, a única justificação que aqui se vê é beneficiar o infractor.\n Creio que andámos mal nisso e desse ponto de vista não foi salvaguardado o essencial nacional, pelo que nós, BE, estamos claramente contra esta solução.\n
|BE|*** Aplausos ***
Presidente|Presidente|Tem a palavra o Sr. Deputado António Filipe.
António Filipe|PCP|Sr. Presidente, Srs. Deputados, Srs. Membros do Governo, a proposta que o Governo traz a esta Assembleia para rever o acordo laboral relativo à Base das Lajes é uma vergonha nacional.\n Se não, vejamos: nos termos do Acordo em vigor, as tabelas salariais dos trabalhadores portugueses que prestam serviço na Base das Lajes são actualizadas anualmente com base num inquérito salarial realizado na Ilha Terceira. É isso que consta do Acordo celebrado entre Portugal e os EUA, mas não é isso que tem sido cumprido.\n Na verdade, desde 1999 que os EUA não cumprem o Acordo assinado com o Estado português e aplicam unilateralmente o que muito bem entendem. Assim, em 2008, os valores salariais auferidos pelos trabalhadores portugueses da Base das Lajes eram já 13,5% inferiores ao que resultaria da aplicação do inquérito salarial. As autoridades norte-americanas invocam a existência de uma lei interna, a Appropriation Act, para não cumprir as obrigações resultantes do Acordo que celebraram com o Estado português para a utilização da Base das Lajes e, em vez desse Acordo, aplicam o Appropriation Act, que estabelece como critério de actualização salarial o que é praticado para com os funcionários civis do Departamento de Defesa dos EUA.\n Perante o incumprimento do Acordo por parte dos EUA, o que faz o Governo português? Propõe que aceitemos revê-lo de forma a servir os interesses da parte incumpridora. Acaba o inquérito salarial, que as autoridades não querem aplicar, e passa aplicar-se precisamente o Appropriation Act.\n Assim, os trabalhadores portugueses passarão a ter aquilo a que o Governo, cinicamente, chama «o melhor de dois mundos»: ou o aumento da função pública portuguesa ou o dos funcionários civis do Departamento de Defesa dos EUA, o que presentemente significa nada ou coisa nenhuma.\n Acresce que qualquer aumento salarial ficará dependente do financiamento disponível por parte dos EUA, o que quer dizer que os aumentos salariais serão sempre decididos unilateralmente pelas autoridades norteamericanas.\n A exposição de motivos que o Governo apresenta a esta Assembleia para justificar esta completa cedência aos interesses norte-americanos é de um absoluto cinismo. Reconhece que a aplicação do sistema de cálculo dos aumentos salariais dos trabalhadores portugueses da Base das Lajes tinha gerado um impasse que se arrastava há anos e afectava o bom ambiente nas relações laborais, mas omite que esse impasse se deve unicamente ao incumprimento do Acordo por parte dos EUA e propõe-se substituir o inquérito salarial por um sistema que considera mais simples, claro e transparente, que consiste, pura e simplesmente, em aplicar a lei americana prejudicando os trabalhadores portugueses.\n A adopção deste sistema é tanto mais incompreensível quanto o memorando do Ministério dos Negócios Estrangeiros relativo à petição dos trabalhadores da Base das Lajes que contestam a alteração do acordo vigente reconhece que esse sistema é singular, já que, no universo das bases norte-americanas espalhadas pelo mundo, a regra é o sistema do inquérito salarial. E o outro caso singular é o da Turquia, mas aí os aumentos salariais são negociados em cada dois anos com os sindicatos dos trabalhadores. Singularidade bizarra é, portanto, a nossa, que se fica pela imposição da vontade unilateral dos EUA.\n Não admira por isso que esta alteração do Acordo das Lajes conte com a oposição dos trabalhadores da Base, expressa na petição que nos foi enviada, e de todas as forças políticas da oposição nos Açores.\n O PCP vota contra as propostas de alteração ao Acordo das Lajes e considera que a defesa mais elementar da dignidade nacional e dos direitos dos trabalhadores da Base impõem a sua rejeição pela Assembleia da República.\n
|PCP|*** Aplausos ***
Presidente|Presidente|Tem a palavra o Sr. Deputado Almeida Henrique, que dispõe de 10 segundos, mas hoje é um dia especial para si, dia do seu aniversário. Muitas felicitações, em nome de todos.\n
Almeida Henriques|PSD|Muito obrigado, Sr. Presidente, pelas suas gentis palavras.\nAproveitando esses 10 segundos e não querendo abusar da sua complacência, Sr. Presidente, queria reafirmar aqui que, de facto, do ponto de vista do PSD, o Governo não acautelou devidamente os interesses destes trabalhadores da Base das Lajes. E o Sr. Deputado Miguel Coelho não pode vir aqui, assim como o Governo, querer que isto seja aceite como um facto consumado.\n
António Filipe|PCP|O melhor era chumbar isto agora e renegociar. Isso é que era coerente!
Almeida Henriques|PSD|Já estamos habituados a que o PS e o Governo apresentem factos consumados e depois digam que a oposição não está de acordo com aquilo que defendem, mas neste processo o Governo comportou-se mal, violou aquilo que eram regras elementares porque não abriu um processo de negociação nem fez qualquer contacto formal com outros partidos da Assembleia da República.\n Portanto, desse ponto de vista, o Governo não pode querer agora que venhamos a votar favoravelmente um acordo com o qual não concordamos.\n Obviamente que o interesse desta matéria e a relação transatlântica levam-nos a uma posição de abstenção que viabiliza a sua aprovação, mas não deixaremos, em nome da nossa coerência e daquilo em que acreditamos, de apresentar, na próxima semana, um projecto de resolução que virá também ao encontro da petição que deu entrada na Assembleia da República, assinada por várias pessoas.\n
Presidente|Presidente|Tem a palavra o Sr. Deputado Miguel Coelho.
Miguel Coelho|PS|Sr. Presidente, Sr. Deputado Almeida Henriques, em primeiro lugar, quero felicitá-lo pelo seu aniversário, facto que é público, e gostaria que tivesse uma forma mais exaltante para festejar o seu aniversário do que a de vir aqui explicar o inexplicável, que é a hesitação por parte do PSD em assumir-se como um partido do arco atlântico, como um partido que não tem dúvidas nenhumas sobre aquilo que é essencial e aquilo que é acessório, nestas questões.\n Gostava de dizer o seguinte: o Acordo da Base das Lajes é importante para a economia da região e, naturalmente, é importante para o emprego que ele próprio suscita na região.\n A questão que se põe é muito simples: também achávamos que era muito bom que o inquérito salarial continuasse. É evidente! Estamos todos de acordo e tive a oportunidade de o manifestar quando saudei os peticionantes e referi que houve um rompimento unilateral de um Acordo que estava estabelecido. Mas para existir um acordo é preciso que haja duas partes e é preciso que a solução que se encontre não seja pior do que aquela que existia. Ora, a situação, de facto, é que o governo dos EUA deixou de cumprir o Acordo e os trabalhadores deixaram de ter os seus aumentos.\n Perante esta situação, de duas, uma: ou partíamos para uma situação de radicalização e jogávamos tudo – porventura, era isso que os senhores queriam – ou tentávamos encontrar uma nova solução. E esta nova solução, negociada, volto a repetir, não está ao alcance da esmagadora maioria dos trabalhadores da função pública portuguesa nem dos trabalhadores portugueses em geral, pois podem optar pela melhor solução.\n Portanto, os senhores também não podem aqui afirmar de uma forma tão cândida que os trabalhadores da Base das Lajes saem prejudicados nesta matéria, porque, comparativamente com os trabalhadores portugueses em geral, não estão prejudicados.\n
Vozes do PCP|PCP|São uns privilegiados!
Miguel Coelho|PS|Esta é que é a situação que é importante realçarmos.\nSr. e Srs. Deputados, estamos perante um bom acordo, que é o acordo possível, e, nessa perspectiva, saudamos o Governo: Naturalmente, cá estaremos para analisar todas as outras propostas que vierem a surgir a seguir.\n
|PS|*** Aplausos ***
Presidente|Presidente|Tem a palavra o Sr. Secretário de Estado dos Assuntos Europeus.
Secretário de Estado dos Assuntos Europeus|Secretário de Estado dos Assuntos Europeus|Sr. Presidente, Srs. Deputados, aproveito o tempo que me resta para esclarecer aquilo que julgo serem alguns mal-entendidos que denotei em algumas intervenções.\n De facto, é preciso ver que a situação actual é uma situação de impasse
António Filipe|PCP|É de incumprimento! Estão com medo que os tribunais decidam!
Sr. Secretário de Estado dos Assuntos Europeus|Sr. Secretário de Estado dos Assuntos Europeus|… e essa, sim, não beneficia de certeza os trabalhadores portugueses da Base das Lajes.\n É verdade, como disse o Sr. Deputado António Filipe, que na maior parte das bases norte-americanas no mundo se aplica o inquérito salarial, mas aplica-se limitado ao aumento máximo dado pelo Departamento de Defesa dos EUA aos seus funcionários civis.\n Portanto, dado que a solução que o Governo português negociou com os EUA prevê ou o aumento dado pelo Departamento de Defesa dos EUA aos funcionários civis das bases ou, se for maior, o aumento dado aos funcionários públicos, é incompreensível que se possa argumentar que a situação nas outras bases é melhor, e seguramente que a situação actual, essa, de certeza que não é melhor, porque é de impasse, incerteza e contencioso.\n A solução que foi encontrada é clara, é uma boa solução, bem negociada pelo Governo português, a quem compete negociar esses acordos, e defende os interesses dos trabalhadores portugueses da Base das Lajes.\n
|PS|*** Aplausos ***
||os
Presidente|Presidente|Passamos à apreciação dos projectos de lei n. 192/XI (1.ª) – Regulação dos horários de funcionamento das unidades de comércio e distribuição (PCP), 118/XI (1.ª) — Determina o encerramento das grandes superfícies comerciais aos domingos e feriados (BE) e 237/XI (1.ª) — Impõe limites aos horários de funcionamento das grandes superfícies comerciais (Os Verdes).\n Para apresentar o projecto de lei do PCP, tem a palavra o Sr. Deputado Agostinho Lopes.\n
Agostinho Lopes|PCP|Sr. Presidente, Sr. e Srs. Deputados: Os acontecimentos no País e no sector do comércio, depois de, em Maio de 2008, termos aqui discutido projectos acerca de horários para o comércio, só tornaram mais premente a necessidade de uma nova regulação dos horários comerciais.\n Abortou a iniciativa legislativa do PSD que transferia para os municípios a definição dos horários e, a 4 de Dezembro de 2008, o Governo aprovou o Decreto-Lei n.º 21/2009, de completa liberalização do licenciamento.\n Apesar da obrigação de um novo regime jurídico da utilização de espaços em centros comerciais, face ao Novo Regime de Arrendamento Urbano, que deveria estar pronto até Agosto de 2007, o Governo não o fez.\n A crise que caiu sobre o nosso país fez-se sentir significativamente no pequeno comércio tradicional e, face à nova relação de forças na Assembleia da República e às declarações eleitorais dos diversos partidos políticos, nomeadamente do PSD e do CDS-PP, em defesa das micro, pequenas e médias empresas, ninguém compreenderá que não se encontre outra solução para o horário do comércio. É neste contexto que o Grupo Parlamentar do PCP reapresenta o seu projecto de lei.\n A situação, hoje, em Portugal é de uma quase total liberalização. Só as grandes superfícies comerciais estavam obrigadas a encerrar durante as tardes de domingo e feriado. Um recente parecer da ProcuradoriaGeral da República, homologado pelo Secretário de Estado do Comércio e Defesa do Consumidor, acabou por legalizar a abertura de mais 86 grandes superfícies comerciais. Restam agora 191 que estão proibidas de abrir aos domingos de tarde.\n A necessidade de uma regulação diferente e equilibrada do horário de abertura das unidades de comércio é hoje inquestionável, não para fechar tudo, como os adversários da sua regulação acusam, mas para fazer do encerramento ao domingo a regra, com todas as excepções necessárias à vida da sociedade hoje.\n Há um parecer do Conselho Económico e Social, completamente esquecido por sucessivos governos, mas que é um elemento importante para justificar a alteração da actual legislação. Concluiu esse estudo que «As grandes superfícies comerciais e o comércio em geral devem encerrar ao domingo».\n Os argumentos dos defensores da total liberalização dos horários comerciais não são suficientes ou carecem de sustentação.\n Na Europa, incluindo Espanha, a regra é a do encerramento obrigatório ao domingo e a excepção a liberalização. A argumentação do Governo, de que haveria uma tendência liberalizante, não tem ponta por onde se pegue.\n
António Filipe|PCP|Exactamente!
Agostinho Lopes|PCP|Os interesses dos consumidores, também têm costas largas, mas são uma mistificação que Galbraight reduz a pó numa das suas últimas obras — Os mitos dos economistas —, onde se pode ler que «o império do consumidor é como que a cobertura dos todo-poderosos interesses das grandes empresas». Aliás, este argumento deveria, em coerência, levar a que todos os serviços públicos estivessem abertos…!
Bernardino Soares|PCP|Exactamente!
