Presidente|Presidente|Srs. Deputados, temos quórum, pelo que declaro aberta a sessão.
Presidente|Presidente|Sr.as e Srs. Deputados, não havendo expediente, passamos de imediato à discussão, na generalidade, do projecto de lei n.º 377/XI (1.ª) — Redução dos vencimentos dos membros dos gabinetes do Governo, dos presidentes das câmaras municipais e dos governadores civis (CDS-PP).\n Para apresentar o diploma, tem a palavra a Sr.ª Deputada Assunção Cristas.\n
Assunção Cristas|CDS-PP|Sr. Presidente, Sr.as e Srs. Deputados: No Orçamento do Estado para 2010 o CDS propôs o corte de um vencimento dos titulares de cargos políticos e outros titulares de cargos públicos, o que correspondia a um corte de 7,1%. A proposta, como é sabido, foi alvo de muita crítica e foi chumbada.\n Três meses depois, segundo se soube, por pressão do PSD, o PS veio assumir, no chamado PEC 2, um corte de 5% nos vencimentos dos titulares de cargos políticos.\n Em vésperas de votação na especialidade, pela mão do PS e com o apoio do PSD, o Governo veio clarificar que este corte mantinha inalterados quaisquer vencimentos indexados aos dos titulares de cargos políticos. Colocou, assim, a salvo, é verdade, os vencimentos de muitos funcionários públicos, nomeadamente de titulares de cargos dirigentes. Quanto a isso, nada temos a dizer, mas na prática veio também excepcionar deste corte de 5% os vencimentos de chefes de gabinete, adjuntos e assessores de ministros e secretários de Estado, de presidentes e vereadores das câmaras municipais e de governadores civis.\n Ora, em sede de discussão na Comissão de Orçamento e Finanças, o CDS bateu-se por uma explicação séria e sustentada para esta exclusão, mas não a logrou obter. Assumiu, então, o encargo de apresentar a esta Câmara uma proposta que contemplasse o corte nos vencimentos também destas pessoas que, não sendo titulares de cargos políticos, a nosso ver, devem ser tratados da mesma forma. E porquê? Porque se, como todos sabemos, a medida de corte nos salários dos políticos é mais simbólica do que proveitosa do ponto de vista da consolidação orçamental, a verdade é que deixar de fora o staff político de apoio a esses cargos é passar uma mensagem, a nosso ver, errada.\n
Vozes do CDS-PP|CDS-PP|Muito bem!
Assunção Cristas|CDS-PP|Um chefe de gabinete e um adjunto são de nomeação política e ajudam o ministro, o secretário de Estado, o presidente da câmara, o vereador, o governador civil a exercer a sua função política. Que razão haverá, então, para que fiquem de fora deste corte?
Vozes do CDS-PP|CDS-PP|Muito bem!
Assunção Cristas|CDS-PP|Se o sentido do corte nos vencimentos dos políticos — medida, aliás, tenho de lembrar, foi aprovada por unanimidade — é dar o sinal simbólico e exemplar do empenhamento na consolidação orçamental e no contributo para a melhoria das contas públicas, pergunto se haverá razão para excluir deste esforço colectivo um chefe de gabinete ou um adjunto.\n
Pedro Mota Soares|CDS-PP|Muito bem!
Assunção Cristas|CDS-PP|Pergunto: não são ambos coadjuvantes da função política e não são ambos de nomeação política?
Pedro Mota Soares|CDS-PP|Muito bem!
Assunção Cristas|CDS-PP|Sr.as e Srs. Deputados, hoje teremos oportunidade, assim o espero, de corrigir nesta Câmara uma decisão que só posso reputar de apressada por parte do PS, ao introduzir, com esta amplitude, a excepção do n.º 5 do artigo 11.º. A ver vamos, então, as vossas opiniões!
|CDS-PP|*** Aplausos ***
Presidente|Presidente|Tem a palavra, para uma intervenção, o Sr. Deputado Luís Fazenda.
Luís Fazenda|BE|Sr. Presidente, Sr.as e Srs. Deputados: O Bloco de Esquerda não tem dificuldade em acompanhar este projecto de lei do CDS, porquanto, uma vez adoptada essa orientação de corte simbólico nos salários dos políticos e de titulares de altos cargos públicos — um simbolismo discutível, mas em todo o caso adoptado —, nos parece ser absolutamente lógico e decorrente dessa decisão que o pessoal dos gabinetes, na generalidade das circunstâncias, acompanhe essa diferenciação que foi feita.\n Em todo o caso, neste momento, por amor ao debate e por alguma coerência na política, gostaria de chamar a atenção para a falta de autoridade política e moral do CDS para trazer esta iniciativa a debate.\n Quero recordar — e para tal não é preciso remexer muito na memória — os ordenados principescos que se pagavam no gabinete do ministro da Defesa Paulo Portas e que, a justo título, escandalizaram o País: um assessor de imprensa ganhava mais do que um general de quatro estrelas, um assessor político ganhava mais do que um general de quatro estrelas.\n
Vozes do BE e do PS|PS|Muito bem!
Luís Fazenda|BE|O jornal Expresso dizia, há uns anos: «Gabinete de Paulo Portas faz contratações milionárias, violando resolução de Conselho de Ministros».\n O CDS-PP tem um passivo do ponto de vista da coerência política e da autoridade para vir propor este tipo de medidas. Há sempre uma reciclagem democrática e o CDS, que agora provavelmente aspira voltar ao Governo em coligação com o Partido Socialista, talvez seja mais espartano naquilo que procura para enquadrar o pessoal dos gabinetes.\n
José Manuel Pureza|BE|Muito bem!
Luís Fazenda|BE|Enfim, democraticamente, e com a bonomia de uma sexta-feira de manhã, entendamos que se trata de uma autocrítica do CDS.\n
|BE|*** Aplausos ***
Presidente|Presidente|Tem a palavra, para uma intervenção, o Sr. Deputado Bernardino Soares.
Bernardino Soares|PCP|Sr. Presidente, Srs. Deputados: Esta proposta vem na decorrência de uma medida anterior para os titulares de cargos políticos e, naturalmente, tem coerência com essa medida.\n Por isso, vamos acompanhá-la sem dificuldade.\n No entanto, é preciso que fique bem claro que, sendo uma matéria simbólica que acompanharemos, não é este tipo de medidas que vai resolver os problemas ou as desigualdades que temos no País. Bem sei que para quem quer manter o fundamental dessas desigualdades é importante usar este tipo de propostas para esconder essa vontade. Ao longo dos anos tem sido assim, sempre.\n O próprio Primeiro-Ministro José Sócrates, como sabia que ia tentar levar por diante uma série de medidas contra os interesses de uma grande maioria da população, logo entrou com propostas deste tipo na Legislatura anterior, que usou depois, como argumento e álibi, para fazer todas as patifarias contra os trabalhadores da Administração Pública, contra os reformados e contra os trabalhadores, agravando o Código do Trabalho, sempre dizendo «mas eu também tomei aquelas medidas para penalizar os titulares de cargos políticos». No fundo, também há aqui uma grande convergência na forma de usar estas propostas para esconder outras orientações.\n Gostaria, aliás, de saber se é hoje, finalmente, que vamos ouvir o PSD e o PS, os tais partidos que o CDS quer candidatar a fazerem uma coligação de Governo… E isso faz sentido, porque esses partidos têm vindo, nos últimos anos, a defender uma política muito semelhante. Essa proposta tem, pois, a sua coerência. Aliás, foram estes três partidos que aprovaram o Orçamento do Estado que está em vigor. O CDS agora não fala muito nisso, está a tentar parecer um pouco desligado dessa responsabilidade, mas o Orçamento em vigor é do PS, do PSD e do CDS. Naturalmente, isso tem de ser relembrado.\n
Assunção Cristas|CDS-PP|O CDS absteve-se!
Bernardino Soares|PCP|Vamos, pois, ver se é hoje, finalmente, que conseguimos ouvir os partidos que estão inseridos nesta política de direita, na governação ou na oposição, pronunciarem-se sobre a taxa fiscal efectiva sobre a banca, sobre se é ou não verdade que um dos maiores escândalos deste país — muito para além do que pretende ser resolvido com esta proposta — é que a banca continue a pagar pelo menos 10 pontos percentuais a menos de taxa do que qualquer pequena empresa, que a banca perspective de pagamento de impostos sobre os rendimentos de 2009 uma taxa que até pode vir a ser de 5% neste tempo de crise.\n Gostava de saber se os Srs. Deputados estão disponíveis para corrigir essa situação, porque é fácil fazer propostas que, em bom rigor, procuram cavalgar um certo populismo anti-parlamentar e anti-funcionamento do sistema político, mas é difícil e é preciso coragem para enfrentar aqueles que verdadeiramente mais beneficiam com a política de direita que se tem praticado neste país. E não temos visto o CDS a enfrentar esse problema de frente.\n
|PCP|*** Aplausos ***
Presidente|Presidente|Para uma intervenção, tem a palavra o Sr. Deputado Luís Montenegro.
Luís Montenegro|PSD|Sr. Presidente, Sr.as e Srs. Deputados: Gostaria de começar por dizer que o corte simbólico que esta Assembleia aprovou no vencimento dos titulares de cargos políticos é isso mesmo, um corte simbólico, proposto pelo PSD. Faz todo o sentido que, no momento em que o Governo e este Parlamento aprovam medidas que exigem um grande sacrifício de todos os portugueses — das famílias e das empresas —, os políticos tenham a capacidade de também demonstrarem algum espírito de sacrifício nas suas vantagens patrimoniais e, no caso concreto, nos seus vencimentos. É certo que muitos consideraram esta medida demagógica, mas hoje já quase todos aderem a ela. Esta é uma primeira nota que queria registar neste debate.\n A proposta que o CDS aqui, hoje, apresenta, do nosso ponto de vista faz sentido. Porquê? Porque não estamos a falar de uma redução do vencimento de todos aqueles funcionários da Administração que têm os seus vencimentos indexados aos titulares de cargos políticos. Estamos a falar, e é nessa circunstância que esta proposta merece a nossa aprovação, daqueles que têm funções eminentemente políticas, de nomeação política e que, portanto, exercem uma actividade conexa muito relacionada com a acção dos titulares de cargos políticos.\n Queria, desde já, dizer que é importante que, no texto final que vier a ser aprovado sobre esta matéria, não fiquem dúvidas de que a aplicação deste regime de redução fica circunscrita àqueles que exercem, nos gabinetes respectivos, funções eminentemente políticas e de nomeação política.\n Há ainda uma outra nota que também é importante aqui deixar. Não pode haver uma dupla redução nestes casos, porque muitos dos vencimentos de que estamos a falar já são, eles próprios, indexados aos vencimentos dos titulares de cargos políticos. E se esses vencimentos foram já reduzidos em 5%, uma nova redução de 5% no vencimento dos assessores e dos membros dos gabinetes pode compaginar uma dupla redução.\n
Assunção Cristas|CDS-PP|Foram excluídos! Esse é que é o ponto!
Luís Montenegro|PSD|O que queremos é que essa situação fique salvaguardada e que, efectiva e objectivamente, no final, aquilo que sobre seja a extensão do regime que o PSD propôs de simbolizar o sacrifício dos titulares de cargos políticos àquilo que é a exigência que todos fizemos neste Parlamento e que o Governo também está a empreender com as medidas de austeridade que estão a vigorar transitoriamente nos anos de 2010 e de 2011.\n
|PSD|*** Aplausos ***
Presidente|Presidente|Tem a palavra, para uma intervenção, o Sr. Deputado Victor Baptista.
Victor Baptista|PS|Sr. Presidente, Sr.as e Srs. Deputados: O CDS já nos habituou a um certo populismo, mas de má memória, porque, Sr. Deputado Luís Fazenda, não foram só esses contratos que referiu e que foram publicados pelo jornal Expresso. O Sr. ex-Ministro de Estado e da Defesa, na altura, tinha apenas um ministério, mas tinha dois gabinetes e, por isso, dois chefes de gabinete e vários adjuntos.\n Portanto, o que o CDS agora propõe, esquecendo e limpando o que fez anteriormente, é no mínimo surpreendente.\n Este diploma do CDS é interessantíssimo. E porquê? Os Srs. Deputados do Grupo Parlamentar do CDS podem, por acaso, explicar-nos por que é que o diploma só se dirige às câmaras municipais e ao Governo? Por que é que ficam de fora a Presidência da República, os gabinetes dos grupos parlamentares e a Assembleia da República? Fracamente, não se compreende.\n
Vozes do PS|PS|Nada!
Victor Baptista|PS|Por outro lado, o PSD diz que esta iniciativa resultou da sua manifesta vontade. Temos, assim, também, dois PSD. Por que é que o PSD não convence o Dr. Alberto João Jardim e os Deputados regionais da Madeira a abdicarem dos 5%, ao contrário do que acontece nos Açores?
Vozes do PS|PS|Muito bem!
Victor Baptista|PS|Não conseguem convencer o Dr. Alberto João Jardim desse benefício tão interessante? Srs. Deputados, o PS não vai em demagogia. Entendemos que há cargos políticos e que, do ponto de vista político, demos um sinal para o esforço que é solicitado aos portugueses. Em muitos gabinetes, as pessoas são requisitadas, são agentes da Administração Pública. O facto de apoiarem e trabalharem com detentores de cargos políticos não justifica que se lhes corte o vencimento. Isso não nos parece justo, pelo que, evidentemente, não acompanhamos esta vossa preocupação.\n Sobretudo não vos acompanhamos numa outra preocupação. Aliás, penso que o CDS ainda disporá de algum tempo para explicar-nos por que é que retirou do diploma a Presidência da República. Não são cargos políticos? O chefe de gabinete da Casa Civil não é um cargo político? Para o CDS não são cargos políticos, garantidamente. Como as coisas são interessantes!
|PS|*** Aplausos ***
Presidente|Presidente|Tem a palavra a Sr.ª Deputada Assunção Cristas para uma intervenção.
Assunção Cristas|CDS-PP|Sr. Presidente, Sr.\nmais apetitoso! e Srs. Deputados: Começo pelo final, que é o
Nuno Magalhães|CDS-PP|E divertido!
Assunção Cristas|CDS-PP|E divertido também! Sr. Deputado Vítor Baptista, a questão que se coloca é a de saber se o PS está ou não disponível para assumir o princípio de que todo um conjunto de pessoas que têm cargos de nomeação política, que colaboram na função política, devem ou não ser afectados pelo corte dos 5%. No nosso entender, sim; pelos vistos, no entender da maioria dos partidos, sim; no entender do Partido Socialista, não.\n Questão diversa, Sr. Deputado, é a de saber por que é que este ou aquele organismo ficou de fora. Devo dizer que o CDS tem total disponibilidade para, na especialidade, rever essa matéria e alargar, eventualmente, o seu âmbito.\n
Vozes do PS|PS|Ah!
Assunção Cristas|CDS-PP|Mas, já agora, devo dizer que a Presidência da República já fez o corte no seu orçamento, ao contrário do Governo e dos gabinetes ministeriais.\n
|CDS-PP|*** Aplausos ***
Assunção Cristas|CDS-PP|A Assembleia da República, como o Sr. Deputado tão bem sabe, também já fez os cortes em todo o seu orçamento. Além do mais, o vencimento dos assessores não está indexado ao dos Deputados; se estivesse, claro que faria sentido estarem incluídos. Mas podemos estudar com rigor e com pormenor essa questão na especialidade, sede em que espero o contributo do Sr. Deputado.\n Quanto à questão das regiões autónomas, temos total disponibilidade para a estudar e para saber se o podemos fazer nesta sede, com as consultas que a própria Constituição impõe. Portanto, não temos qualquer preconceito ou pré-entendimento em relação a essa matéria.\n Para nós, o princípio é muito claro: um chefe de gabinete e um adjunto co-adjuvam na função política, são titulares de um determinado cargo de nomeação política e, portanto, devem fazer parte deste conjunto de pessoas que dão, de alguma forma, o seu exemplo — é mais de exemplo do que de dinheiro propriamente dito que estamos a falar.\n Sr. Deputado Luís Montenegro, folgo em ver que o PSD agora acompanha o CDS, porque quando discutimos esta questão na especialidade o PSD pôs-se de fora. Ainda bem que, com o tempo, veio a acompanhar a nossa proposta.\n
|CDS-PP|*** Aplausos ***
Assunção Cristas|CDS-PP|E ainda bem que o que antes era demagógico para o PSD agora já não o é. Ficamos sempre satisfeitos por ver estas evoluções.\n Sr. Deputado Bernardino Soares, fez uma intervenção muito clara e muito bem aproveitada para, mais uma vez, colocar a visão do PCP sobre estas matérias.\n Folgo em saber que acompanha a nossa proposta, até porque, relembro, apesar de agora a acusar de demagógica, o seu partido votou também a proposta de corte nos salários dos titulares de cargos políticos.\n
Presidente|Presidente|Tem de concluir, Sr.ª Deputada.
Assunção Cristas|CDS-PP|Concluo já, Sr. Presidente.\nDevo dizer, no entanto, Sr. Deputado, que não é só isto que o CDS apresenta. O CDS tem sempre apresentado aqui a sua proposta, que, como bem compreenderá, é diferente da do PCP. A nossa proposta não é de aumento de impostos, é de corte de impostos.\n
|CDS-PP|*** Aplausos ***
Assunção Cristas|CDS-PP|A nossa proposta é no sentido de dar condições para que as empresas possam trabalhar e criar emprego, porque são elas que criam o emprego — é bom que isto fique claro, Sr. Deputado! Por fim (os últimos são os primeiros), Sr. Deputado Luís Fazenda, muito me espanta que, em 2003, o Bloco de Esquerda nada tenha falado sobre essas notícias que agora refere e que venha, todo este tempo depois, querer ressuscitar coisas que têm o tempo que têm, estão onde estão. O que nos preocupa agora é encontrar soluções que sejam coerentes, que façam sentido e que sejam ajustadas aos nossos tempos.\n
|CDS-PP|*** Aplausos ***
Presidente|Presidente|Tem a palavra o Sr. Deputado Victor Baptista para uma intervenção.
Victor Baptista|PS|Sr. Presidente, Srs. Deputados, Sr.ª Deputada Assunção Cristas: Mas que má consciência! Agora já não é uma questão de lei, é uma questão de boas vontades!… Na Presidência da República não é uma questão de lei, é uma questão de boa vontade: há uma boa vontade para reduzir o vencimento em 5%!… Sr.ª Deputada, nos vencimentos indexados — o Sr. Deputado Luís Montenegro já chamou a atenção para isto — não constará já a redução automática de 5%? Se são indexados e se o salário desceu… Não estarão incluídos? Talvez seja melhor olhar para a própria lei.\n Independentemente disso, não alinhamos pela demagogia; distinguimos claramente o exercício de cargos políticos do exercício de outras funções de apoio a cargos políticos, as quais, muitas vezes, são exercidas por funcionários de carreira das próprias instituições em regime de requisição, como sabemos.\n E se quisermos avançar para o apoio a cargos políticos, então começamos já pela Assembleia da República, pelos seus funcionários, que também apoiam um órgão político! No limite, então, poderíamos ir mais longe, Sr.ª Deputada. Não, não vamos por esse caminho. Somos coerentes e distinguimos os cargos políticos dos assessores e dos gabinetes de apoio.\n Repito que, nesta matéria, o PSD surpreende-me, cujo sentido de voto já pudemos perceber pela intervenção que foi proferida, mas é incapaz de dizer ao Dr. Alberto João Jardim… Nesse caso, sim, dado tratar-se de cargos de governação regional, de uma assembleia regional, deveriam assumir esse corte de 5% ao mesmo nível que a Assembleia da República e os membros do Governo. Mas, pelos vistos, temos um PSD no Continente, na Assembleia da República, e outro PSD na Madeira.\n
|PS|*** Aplausos ***
Assunção Cristas|CDS-PP|Peço a palavra para interpelar a Mesa, Sr. Presidente.
Presidente|Presidente|Faça favor, Sr.ª Deputada.
Assunção Cristas|CDS-PP|Sr. Presidente, Sr.as e Srs. Deputados, a lei referida é a Lei n.º 12A/2010, de 30 de Junho, mas a memória do Sr. Deputado Victor Baptista está muito curta.\nSr. Presidente, peço, pois, que a Mesa que faça distribuir o n.º 3 do artigo 11.º desse diploma que, de acordo com uma proposta feita, em sede de especialidade, pelo Grupo Parlamentar do PS, diz o seguinte: «O regime excepcional previsto no presente artigo…» — o corte dos 5% — «… não implica a alteração do vencimento dos titulares de cargos cujos vencimentos se encontrem indexados aos de qualquer dos titulares de cargos políticos referidos no número anterior, tomando-se como referência, para efeitos da referida indexação, os valores em vigor antes da data de entrada em vigor da presente lei.» Portanto, todos aqueles que têm vencimentos indexados aos dos titulares dos cargos políticos aqui referidos não são afectados pelo corte. O que queremos é que algumas dessas pessoas, as que têm funções políticas e de nomeação política, sejam afectadas por esses cortes. Foi isso que propusemos na especialidade e que os senhores não aprovaram e é isso que propomos aqui hoje.\n
|CDS-PP|*** Aplausos ***
Presidente|Presidente|Tem a palavra o Sr. Deputado Luís Montenegro para uma intervenção.
Luís Montenegro|PSD|Sr. Presidente, Sr.as e Srs. Deputados: Muito rapidamente, quero só clarificar que o PSD não mudou de opinião nesta matéria.\n Como a Sr.ª Deputada Assunção Cristas já teve ocasião de referir na sua primeira intervenção, a norma excepcional que ficou na lei é uma norma que, a não existir, faria aplicar a todos os funcionários, agentes e dirigentes da Administração Pública que têm os seus vencimentos indexados aos vencimentos dos titulares de cargos políticos a redução de 5%. Essa não é a intenção do PSD nem foi a intenção do PSD quando propôs simbolizar esta redução nos salários dos titulares de cargos políticos.\n Por isso, não há nenhuma diferença de opinião. Entendemos que a proposta que hoje o CDS aqui apresenta circunscreve o âmbito de aplicação àquelas pessoas que exercem funções eminentemente políticas, nomeadas politicamente e que, portanto, têm, também elas, directamente, uma acção política. Essa é a nossa posição, que já tínhamos, que mantivemos e que, naturalmente, mostra a nossa coerência neste domínio.\n
|PSD|*** Aplausos ***
Presidente|Presidente|Srs. Deputados, está concluído o debate, na generalidade, do projecto de lei n.º 377/XI (1.ª).\n Passamos, agora, ao debate que se realiza após a conclusão do último conselho europeu de cada presidência da União Europeia, ao debate sobre o parecer da Comissão de Assuntos Europeus relativo ao Programa de Trabalho da Comissão Europeia para 2010 — «Chegou o momento de agir» e ao debate do relatório do Governo sobre a participação de Portugal na União Europeia no ano de 2009.\n Para uma intervenção, tem a palavra o Sr. Secretário de Estado dos Assuntos Europeus.\n
