Agostinho Lopes|PCP|Sr.ª Presidente, Sr. e Srs. Deputados: Na terça-feira, João Ferreira do Amaral, Professor no Instituto Superior de Economia e Gestão, teve, no Jornal de Negócios, uma importante entrevista sobre as consequências para o País da adesão ao euro e os problemas decorrentes da presença na União Económica e Monetária (UEM) no actual contexto de crise.\n Não são propriamente uma novidade para quem, quase sempre isolado na sua área ideológica e partidária, ao longo dos anos, travou um combate persistente contra os erros da adesão à moeda única e de uma política monetária que transformaram, no seu dizer, Portugal numa grande junta de freguesia. E ainda não havia a perspectiva de a Comissão e a Sr.ª Merkel exigirem o visto prévio do Orçamento do Estado português, antes da sua entrega à Assembleia da República! É uma entrevista lúcida e corajosa, num País de onde o pensamento económico dominante, de matriz neoliberal, ocupa a 100% o espaço do artigo e do comentário na comunicação social (generalista e especializada), para lá de conduzir as práticas políticas de sucessivos governos do PS e do PSD.\n O PCP, que, ao longo dos anos, foi sublinhando a coerência e a justeza das suas intervenções sobre a matéria, único grande partido nacional que se opôs, de forma substantiva e fundamentada, à integração de Portugal na UEM, não pode deixar de a saudar.\n Não podemos deixar de apelar a uma leitura atenta e não preconceituosa do seu conteúdo, neste momento de grandes e graves dificuldades para milhões de portugueses. Gravidade engrossada pelas últimas medidas do Governo, com a preciosa colaboração do PSD, de forte penalização do poder de compra com cortes salariais, restrições nos apoios sociais e agravamento do IVA, inclusive sobre bens essenciais.\n Srs. Deputados, João Ferreira do Amaral faz uma síntese, no curto texto da entrevista, das questões centrais colocadas pelo euro ao País. E, mais uma vez, corajosamente, não deixa de avançar possíveis respostas para a situação criada. Muitas das suas teses não poderão deixar de lembrar argumentação desenvolvida pelo PCP, antes e depois da integração monetária, fundamentando a sua posição.\n Numa breve exposição, destaco: a adesão ao euro, feita como forma de impulsionar a integração política, é «um erro tremendo», em que a economia foi usada «como cobaia»; A brutal contradição entre um euro forte e a fragilidade da estrutura produtiva portuguesa, tendo-se traduzido a adesão do País na «principal razão da perda de competitividade»; De como uma taxa de câmbio desajustada para a economia portuguesa e a redução das taxas de juro travaram a aposta no sector dos bens transaccionáveis e fizeram crescer uma dívida externa insustentável.\n Entre 1999 e 2009, como sabem, o endividamento externo líquido do País, em percentagem do PIB, saltou de 31,5% para os 111,6%! Comparação das promessas feitas com os resultados: prometeram mais crescimento e mais emprego, e não aconteceu; prometeram estabilidade monetária, e não houve; não aconteceriam problemas de financiamento ao País, e eles aí estão (e de que forma!).\n E, em jeito de balanço, afirma: «Olhando para os factos, os resultados são desoladores! A nossa economia tem sido destruída de forma fortíssima devida à participação na zona euro».\n Depois, noutro registo, João Ferreira do Amaral aborda as questões da zona euro face à crise, explicando por que é que a baixa de salários (política que o Governo tem em curso, com o apoio do PSD) não é solução para a competitividade das exportações portuguesas; de como a crise apanhou a zona euro «descalça», sem instrumentos para lhe responder; e por que é que uma política orçamental restritiva pode conduzir a novas recessões, sacrificando o crescimento e o emprego. Destacamos as suas palavras: «o que é grave é o desemprego e a estagnação», e não a inflação.\n E, questionado sobre as saídas, é muito claro: ou se permite (a nível dos órgãos da União Europeia) que o País tome medidas de protecção excepcional, nomeadamente subsídios à exportação ou condicionamentos às importações, ou se alteram as instituições, por forma a criar «um mecanismo de apoio a um país que precisa de sair temporariamente do euro».\n Srs. Deputados, houve um primeiro-ministro que, após a decisão comunitária da entrada de Portugal no euro, exclamou (glosando, de forma estranha, a fórmula cristã de constituição da Igreja de Roma): «Este é o euro e sobre este euro construiremos a Europa». Enganou-se duas vezes. O euro está em vias de se tornar a dinamite da União Europeia e, depois, apesar das boas intenções, o euro, no centro das políticas neoliberais de sucessivos governos, conduziu o País ao triste estado em que se encontra: desemprego, dívidas, défices, dependências e desigualdades! Srs. Deputados, no momento muito difícil como o que o País vive, é absolutamente crucial o papel da soberania e independência nacional para a viabilidade económica de Portugal e o futuro colectivo desta comunidade humana, soberana e independente há mais de oito séculos.\n
Bernardino Soares|PCP|Muito bem!
Agostinho Lopes|PCP|E colocam na ordem do dia a necessidade de uma política patriótica e de esquerda e um governo que a concretize. Um governo de ruptura e mudança que responda aos problemas do País, que respeite e cumpra a Constituição da República.\n
|PCP|*** Aplausos ***
Teresa Caeiro|Presidente|Inscreveram-se dois Srs. Deputados para pedir esclarecimentos, aos quais o Sr. Deputado Agostinho Lopes responderá em conjunto.\n Em primeiro lugar, tem a palavra o Sr. Deputado José Gusmão.\n
José Gusmão|BE|Sr.ª Presidente, Sr. Deputado Agostinho Lopes, com efeito, a crise que a União Europeia actualmente atravessa mostra a falência da política do Pacto de Estabilidade e Crescimento, uma política que, querendo fazer do défice e do endividamento os aspectos centrais da condução da política económica europeia, mergulhou a Europa na maior crise de endividamento que alguma vez teve de enfrentar.\n A falência dessa política é o que está à vista de toda a União Europeia e a entrevista dada pelo Dr. João Ferreira do Amaral aponta caminhos que são, sem dúvida, caminhos novos, não nas suas propostas mas no discurso de alguns dos nomes mais importantes da nossa economia.\n É uma posição antiga a do Dr. João Ferreira do Amaral, mas é importante ouvi-lo, porque essa posição é rara no meio da cegueira e do autismo que marcam grande parte do discurso sobre a política económica, em Portugal, e das soluções que estão, neste momento, a ser patrocinadas pelos dois partidos do bloco central.\n Mas não é uma voz única, isolada. O Prémio Nobel da Economia, Joseph Stiglitz, veio recentemente dizer que a política da austeridade leva ao desastre, é um círculo vicioso, que, a ser prosseguido, só poderá acabar com a ruína económica do espaço comunitário europeu.\n Também um outro Prémio Nobel da Economia, Paul Krugman, veio dizer que, a não ser que se operem mudanças importantes nas instituições europeias e na política económica europeia, o projecto da união económica não é, pura e simplesmente, viável.\n Estes avisos de economistas destacados, em Portugal e fora de Portugal, deveriam pôr-nos a pensar sobre os caminhos da política económica que está a ser seguida pelo Partido Socialista, com o apoio do Partido Social Democrata.\n A política de austeridade irá agravar o ciclo da recessão e essa é a política que, hoje em dia, tem de ser combatida, para que, em Portugal e nos espaços comunitários, sejam construídos outros caminhos, assentes no combate ao desemprego, em políticas de crescimento, que passem por um novo contrato europeu, um novo compromisso nas instituições comunitárias, através de um orçamento comunitário, de políticas sociais à escala europeia, de instrumentos de endividamento europeu, que apoiem os países em maiores dificuldades.\n
Teresa Caeiro|Presidente|Queira concluir, Sr. Deputado.
José Gusmão|BE|Pensamos que esse é o debate que importa fazer, aqui, em Portugal, e nas instituições europeias. Associamo-nos, desse ponto de vista, a algumas das opiniões muito sensatas que foram transmitidas na entrevista que referiu.\n
|BE|*** Aplausos ***
Teresa Caeiro|Presidente|Para pedir esclarecimentos, tem a palavra a Sr.ª Deputada Hortense Martins.\n
Hortense Martins|PS|Sr.ª Presidente, Sr. Deputado Agostinho Lopes, ouvimos com atenção a sua intervenção e realmente não ficámos surpreendidos. É que a posição do PCP foi sempre contra a Europa, contra o projecto europeu, e mesmo o Bloco de Esquerda tem algumas dúvidas relativamente à construção do projecto europeu. Aliás, até hoje, aquilo a que assistimos da parte destes partidos foi sempre a bloqueios à construção do projecto europeu.\n
|PS|*** Aplausos ***
Hortense Martins|PS|E, tendo sido eleita por um distrito do interior, não posso deixar de pensar que os portugueses que me estão a ouvir não são ingratos e sabem muito bem que os fundos que recebemos da União Europeia, durante cerca de 30 anos, ajudaram a construir o nosso País, ajudaram a construir Portugal, ajudaram a construir o interior. Portanto, estas posições dos partidos à nossa esquerda já são esperadas.\n
Bernardino Soares|PCP|E as empresas que fecharam?!
Hortense Martins|PS|Isto não obsta a que, na Europa, haja necessidade de políticas em comum, de se encontrar formas de reforçar a competitividade da Europa. Ora, é isso que tem de ser feito, e está a fazer-se, a diversos níveis.\n Temos de reconhecer que a Europa respondeu tardiamente a esta crise, mas, quando o fez, os mercados, nesse próprio dia e no dia seguinte, reagiram imediatamente. Por isso, temos de pugnar por respostas coesas da União Europeia e só assim ajudaremos a construir o projecto europeu, que é também o futuro do nosso País.\n
|PS|*** Aplausos ***
Hortense Martins|PS|Srs. Deputados, não podemos esquecer que, ainda assim, e falando da Europa, ainda esta semana, tivemos alguns resultados de indicadores económicos, como os da OCDE e do próprio FMI, que nos dão alguns sinais positivos relativamente à nossa economia.\n Queria, no entanto, chamar à responsabilidade todos os partidos no ataque a esta crise internacional sem precedentes e perguntar se os partidos à nossa esquerda, nomeadamente o PCP, estão dispostos a construir a solução para a crise internacional, o que não nos parece.\n
|PS|*** Aplausos ***
Teresa Caeiro|Presidente|Para responder, tem a palavra o Sr. Deputado Agostinho Lopes.
Agostinho Lopes|PCP|Sr.ª Presidente, Sr. Deputado José Gusmão, agradeço as questões que referiu, com as quais, certamente, estamos de acordo. No entanto, vou concentrar-me nas questões colocadas pela Deputada Hortense Martins.\n Sr.ª Deputada, não estranho que fique surpreendida com as nossas posições. Elas são conhecidas, têm sido várias vezes afirmadas e debatidas nesta Assembleia.\n Depois da intervenção que fiz, teria gostado que a Sr.ª Deputada reflectisse e dissesse alguma coisa sobre as palavras do Prof. João Ferreira do Amaral, que, por acaso, é membro do Partido Socialista.\n A Sr.ª Deputada considera que a moeda única não colocou problemas, como o da competitividade e da perda de instrumentos orçamentais pelo País.\n
Bernardino Soares|PCP|Não leu a entrevista!
Agostinho Lopes|PCP|Vou dizer por que é que a Sr.ª Deputada não fica preocupada. Não fica preocupada, porque este Governo, como os anteriores, encontrou forma de responder ao espartilho criado pela moeda única, que foi passar as responsabilidades para as duas únicas variáveis que sobraram neste processo, e em primeiro lugar o factor trabalho, com as vossas medidas para facilitar o desemprego, para reduzir os apoios ao subsídio de desemprego, para pressionar a precariedade, no fundo, para que os salários baixem.\n Não ficou surpreendida também porque os senhores aceitam com toda a facilidade a redução do investimento público, que está a cair desde a adesão ao euro, com consequências desastrosas no País, inclusive pelo facto notável de, em virtude desta política orçamental, o País não ter conseguido sequer, como é sabido, aproveitar devidamente fundos comunitários recebidos ao longo destes últimos anos, pressionado pela tentativa de restrição do próprio Orçamento do Estado.\n A Sr.ª Deputada fala em interior. Sei que é de uma zona do interior, mas certamente que não está atenta aos dados divulgados pelo Instituto Nacional de Estatística relativamente aos profundos e agravados desequilíbrios regionais que vão crescendo no nosso país entre o litoral e o interior.\n
|PCP|*** Aplausos ***
Teresa Caeiro|Presidente|Para uma declaração política, tem a palavra a Sr.ª Deputada Rita Calvário, do Bloco de Esquerda.\n
Rita Calvário|BE|Sr.ª Presidente, Sr.as e Srs. Deputados: Foram ontem divulgadas as mais recentes previsões da OCDE sobre a economia nacional. De acordo com esta Organização, o produto crescerá um pouco mais do que era esperado, mas continuando, mesmo assim, a divergir da média europeia.\n Este estudo confirma a absoluta incapacidade em criar emprego como o elemento mais preocupante da nossa economia.\n Até ao final de 2011, o desemprego continuará sempre acima dos 10%, um valor superior à média europeia e muito, muito acima da média registada nos países da OCDE. Há 30 anos que Portugal não registava um desemprego tão persistente e enraizado. Um em cada dez portugueses não encontra posto de trabalho; oito em cada dez das pessoas que perderam o emprego em 2009 tinham um vínculo precário. São estes os números da economia real.\n Perante a urgência da criação de emprego e do apoio social ao crescente número de desempregados, o que faz o Governo? Anuncia mais um corte radical no apoio aos desempregados, dificulta o acesso ao subsídio de desemprego e coloca um ponto final ao seu próprio plano anticrise. Não que a crise tenha chegado ao fim, pelo contrário, mas porque PS e PSD se juntaram e, depois de terem apertado a mão para aparecer na fotografia, elegeram os pobres e os desempregados como os principais responsáveis pelo estado da economia.\n É este o resultado do encontro entre Sócrates, Primeiro-Ministro, e o seu «vice-primeiro-ministro», Pedro Passos Coelho: pedir a conta pela crise aos desempregados, não poupando mesmo os mais pobres dos mais pobres.\n
Cecília Honório|BE|Muito bem!
Rita Calvário|BE|É o reforço da violência social contra os mais afectados e desgastados pela crise. O subsídio de desemprego em Portugal vai voltar a ser um dos menos acessíveis da Europa. Dos 27 países da União, 20 exigem um prazo inferior ao português para ter acesso ao subsídio. Num País como o nosso, que apresenta a terceira economia com maior percentagem de trabalho precário, não é difícil adivinhar o que irá acontecer: dezenas e dezenas de milhar de pessoas, essencialmente jovens, deixarão de ter acesso ao subsídio de desemprego, aumentando, por esta via, a pobreza e a exclusão social.\n
Cecília Honório|BE|Muito bem!
Rita Calvário|BE|Diz a Ministra Helena André que estes cortes pretendem que as pessoas se tornem activas. Ou seja, o que ela nos diz é que volta a atirar para as costas de todos quantos, procurando emprego, não o encontram a responsabilidade pela sua situação. Também aqui o encontro com Passos Coelho fez escola. Onde o PSD quer colocar os desempregados a trabalhar à borla, o PS quer fazer-nos acreditar que, acabando com os mecanismos de protecção social, nos levará ao pleno emprego.\n O Governo encontra-se, portanto, em fase de negação. O problema do País não são os portugueses que não querem trabalhar, Sr.as e Srs. Deputados do Partido Socialista. É um modelo económico que não cria emprego e que diverge, todos os anos, dos outros países. Se retirar os apoios aos desempregados e dificultar ainda mais o acesso ao subsídio de desemprego estimula o mercado de trabalho, alguém no Governo tem de explicar como é que temos 200 000 desempregados sem qualquer subsídio e o desemprego não pára de aumentar todos os dias.\n Manuel Pinho, que ficou famoso por proclamar o fim da crise com a pontualidade de um relógio suíço, já se foi embora, mas o Governo parece continuar em fase de negação. Ainda ontem, a Ministra do Trabalho garantia «que o mercado de trabalho está a dar sinais de recuperação». Estranha recuperação esta, quando todos os indicadores garantem que mais de 600 000 portugueses vão continuar sem emprego até ao final de 2011.\n
Heitor Sousa|BE|Muito bem!
Rita Calvário|BE|Vale a pena lembrar que o plano anticrise, agora retalhado, tinha sido apresentado pelo próprio Primeiro-Ministro, com a pompa do costume, há menos de seis meses. De acordo com comunicado do Conselho de Ministros de então, este plano anticrise pretendia «assegurar a manutenção de postos de trabalho, incentivar a inserção de jovens no mercado de trabalho, criar emprego e combater o desemprego».\n Deduz-se, portanto, que o Governo entende que a crise acabou e já não é necessário promover a qualificação do trabalho, reduzir o prazo de acesso ao subsídio de desemprego e reforçar as linhas de crédito.\n O Governo, com o apoio do seu parceiro de coligação, o PSD, encontra-se em pleno processo de negação.\n Estamos em crise e a resposta do Governo e do PSD é cortar nos apoios sociais e acentuar a grave crise que o País enfrenta com um crescimento anémico e com o aumento dos impostos do consumo e do trabalho.\n Sr.as e Srs. Deputados: O País não precisa deste tango desastroso que só nos arrasta para o desastre e o abismo social. O País precisa, sim, de coragem política do Governo para criar emprego e resolver os graves problemas sociais com que os portugueses se confrontam todos os dias.\n
|BE|*** Aplausos ***
Teresa Caeiro|Presidente|Inscreveram-se, para pedir esclarecimentos à Sr.ª Deputada, três Srs. Deputados.\n Tem a palavra o Sr. Deputado José de Matos Rosa, do PSD.\n
José de Matos Rosa|PSD|Sr.ª Presidente, Sr.ª Deputada Rita Calvário, os últimos anos traduziram-se, em Portugal, por um avolumar de problemas em matéria de crescimento: endividamento do País face ao exterior, queda de competitividade externa, desequilíbrio nas contas públicas, aumento do desemprego e da pobreza, entre outros.\n Neste ponto, posso concordar consigo. A situação económica do País chegou a uma situação de tal gravidade, reconhecida e alertada por inúmeras instituições e pelo próprio PSD.\n De há muito que o PSD chama a atenção para a falta de sustentabilidade e uma política económica que tem conduzido a níveis excessivos de despesa pública e privada do País e que tem minado as condições de competitividade das empresas, com implicações graves no emprego.\n O País está sob observação permanente por parte de todas as organizações internacionais, das empresas de rating e dos investidores externos que são indispensáveis para o financiamento da nossa economia.\n É neste quadro de grande preocupação que o PSD tem insistido numa redefinição de prioridades.\n As consequências desta política vão tornar-se desastrosas no actual quadro da situação económicofinanceira internacional e nacional. Vamos chegar a 2013 sem os problemas estruturais resolvidos.\n Sr.ª Deputada, este Governo só me faz lembrar uma avestruz, pois, ao primeiro sinal de problema, mete a cabeça na areia, depois sacode o pó das penas e segue como se nada fosse.\n No entanto, por outro lado, o Governo parece aquele doente que vai ao médico, mostra as análises e o médico diz: «O senhor, com estas análises, está tecnicamente morto.» Então, o doente — refiro-me agora também à Sr.ª Deputada do Partido Socialista que acabou de falar — diz-lhe: «A partir de agora, Sr. Dr., é só melhorar.» Sr.ª Deputada, quero deixar-lhe uma pergunta muito simples. O Governo prevê grandes projectos de investimento. Não considera a Sr.ª Deputada que, com a presente situação económica, estes investimentos deveriam ser repensados e reavaliados e que a linha do TGV entre as «grandes» cidades do Poceirão e Caia deveria ser adiada?
|PSD|*** Aplausos ***
Teresa Caeiro|Presidente|Tem a palavra, para responder, a Sr.ª Deputada Rita Calvário.
Rita Calvário|BE|Sr.ª Presidente, Sr. Deputado José de Matos Rosa, disse-nos que o Governo socialista é como um doente que vai em busca das receitas. Ora, parte dessas receitas foram-lhes dadas precisamente pelo PSD,…
Cecília Honório|BE|Muito bem!
Rita Calvário|BE|… que deu a mão ao PS e ao Governo socialista para aplicar medidas de austeridade social que pedem sacrifícios a quem menos tem e a quem mais é desgastado por esta crise.\n Ainda agora, assistimos a mais um corte nas prestações sociais e a um ataque aos desempregados mais pobres. Certamente que o PSD também inclui nas suas receitas este tipo de medidas.\n Sr. Deputado, relativamente ao investimento público, é conhecida a posição do Bloco de Esquerda.\n Consideramos que o investimento público é fundamental para reanimar a economia e criar postos de trabalho e sem ele aquilo que temos são estes pacotes de medidas recessivas e de austeridade que empurram a economia para baixo e só adicionam crise à crise e desempregados aos desempregados.\n
|BE|*** Aplausos ***
Teresa Caeiro|Presidente|Para pedir esclarecimentos tem a palavra a Sr.ª Deputada Jamila Madeira.\n
Jamila Madeira|PS|Sr.ª Presidente, Sr.ª Deputada Rita Calvário, queria refutar algumas das afirmações que aqui foram feitas.\n Gostaria de perceber se a Sr.ª Deputada tem presente que o crescimento do PIB e o efeito no desemprego não é instantâneo. Essa é a primeira grande questão. Gostaríamos que fosse, mas não é, e essa é uma realidade que todos temos presente.\n O efeito também atinge de forma diferenciada os diferentes sectores de actividade, as diferentes áreas afectadas pela crise e, portanto, a capacidade de apoiar ou não apoiar os mais afectados em cada momento pela crise.\n Todos sabíamos, quando o Governo criou medidas suplementares — permita-me que sublinhe «suplementares» — de apoio aos desempregados, que elas eram suplementares e, por isso, transitórias. Essa é uma mensagem absolutamente clara.\n Sabemos que não podemos viver acima das nossas capacidades financeiras. Temos já um grande encargo para suportar e as medidas de apoio aos desempregados são agora reafectadas aos sectores que estão a viver, neste momento, uma maior crise. Veja-se, por exemplo, o sector automóvel, que agora começa a recuperar. Temos, por outro lado, outros sectores que agora sentem o período mais difícil da crise. Ou seja, se quiser comparar, e já que eu sou do Algarve, compare o turismo com o sector automóvel. O turismo está agora a viver o seu momento mais difícil; em comparação, o sector automóvel está já a viver momentos de crescimento.\n Portanto, Sr.ª Deputada, temos de afectar os apoios que podemos, que devemos e que urge dar aos cidadãos que procuram utilizar os incentivos do Governo, à criação líquida de postos de trabalho, aos cidadãos que ainda assim procuram utilizar instrumentos para criar o seu próprio emprego, a todos aqueles que, de alguma forma, estão a ser apoiados no sentido de terem instrumentos de acesso ao crédito, de poderem dinamizar a economia.\n Não podemos é continuar a apoiar numa banda larga, sabendo que, assim, nenhum sector da nossa economia ficará certamente apoiado.\n É preciso direccionar, é preciso especializar, mas, como a nossa economia tem recursos limitados, temos de nos cingir a eles e temos de procurar alavancá-los da melhor maneira e, com isso, conseguir apoiar aqueles que mais precisam.\n
Teresa Caeiro|Presidente|Para responder, tem a palavra a Sr.ª Deputada Rita Calvário.
