Cecília Honório|BE|Sabe bem que isso não é verdade!
Secretário de Estado dos Assuntos Europeus|Secretário de Estado dos Assuntos Europeus|Mas trata-se de uma questão de opção, Sr.ª Deputada. Aliás, uma das lições desta crise foi a de que, de facto, as políticas têm de ser coordenadas,…
Presidente|Presidente|Queira concluir, Sr. Secretário de Estado.
Secretário de Estado dos Assuntos Europeus|Secretário de Estado dos Assuntos Europeus|Vou terminar, Sr. Presidente.\nComo estava a dizer, as políticas têm de ser coordenadas, a autonomia, no final, aprovadas as políticas, mantém-se nos Parlamentos, o que é absolutamente essencial, os Parlamentos fazem as suas opções, Sr.ª Deputada.\n Sobre a governação económica na União Europeia, o Governo português tem defendido que ela deve ser mais equilibrada. Hoje em dia, temos uma política monetária, mas não temos uma coordenação efectiva ao nível da política orçamental e não temos, praticamente, coordenação ao nível das políticas de competitividade e macroeconómicas. Nesse sentido, temos defendido um maior equilíbrio entre estes três pilares da governação económica e daí a importância da Estratégia Europa 2020, nomeadamente no âmbito da coordenação das políticas de competitividade.\n
Presidente|Presidente|Tem de concluir, Sr. Secretário de Estado.
Secretário de Estado dos Assuntos Europeus|Secretário de Estado dos Assuntos Europeus|Concluo já, Sr. Presidente.\nQuero apenas dizer à Sr.ª Deputada Luísa Roseira que não é verdade que a Estratégia de Lisboa tenha falhado,… Risos da Deputada do PSD Luísa Roseira.\n … nomeadamente, porque a Estratégia de Lisboa, tal como a Estratégia Europa 2020, não se implementa de forma automática, Sr.ª Deputada, precisa de um nível europeu — e é verdade que houve aqui algumas falhas — e precisa de um nível nacional. Ora, a verdade é que, desde 2005, os indicadores, em Portugal, têm vindo a melhorar consistentemente. Porquê? Porque foi criada uma estrutura precisamente para implementar esses indicadores. Por isso, o Governo português irá manter essa estrutura, grosso modo, porque foram obtidos bons resultados, em metade do tempo da Estratégia de Lisboa.\n Quanto às estatísticas, Sr. Deputado Serpa Oliva, quero apenas dizer-lhe que o Governo português tem vindo a insistir neste ponto, da transparência das estatísticas, porque o Governo português oferece total transparência e fiabilidade nas suas estatísticas e considera absolutamente indispensável, para a estabilidade da zona euro, que todos os Estados-membros procedam do mesmo modo.\n
|PS|*** Aplausos ***
Presidente|Presidente|Para uma intervenção, tem a palavra o Sr. Deputado Vitalino Canas.
Vitalino Canas|PS|Sr. Presidente, Sr.as e Srs. Deputados: Portugal e a Europa estão em mais uma encruzilhada. Costumamos dizer, muitas vezes, que a Europa é um gigante económico e um anão político, mas isto é uma ilusão, porque, na verdade, a Europa ainda não é um gigante económico, é, sim, composta por um conjunto de economias importantes, que não têm uma visão integrada e conjunta das políticas económicas.\n Mas há uma outra ilusão que também temos vindo a perder, que é a ilusão de que podemos ter uma moeda comum, o euro, sem ter coordenação e articulação de políticas económicas orçamentais, fiscais e sociais. Temos acreditado que basta haver um conjunto de critérios de convergência para garantir que a moeda comum possa funcionar adequadamente, mas esses critérios de convergência têm mostrado, muitas vezes, serem cegos e até, por vezes, constituírem «biombos» em relação a problemas que existem.\n Começa, portanto, a formar-se um consenso sobre uma maior articulação, uma maior coordenação de políticas económicas orçamentais, fiscais e sociais. Mas agitam-se, entretanto, os «soberanistas», e já tivemos hoje, aqui, expressão disso — e não nos surpreende que isso venha da esquerda mais radical, mas surpreende-nos que, de alguma forma, o próprio PSD manifeste algumas dúvidas sobre isso —, dizendo «mas vamos perder, mais uma vez, soberania; os Parlamentos, os Estados, vão perder, mais uma vez, poderes».\n Mais uma vez, também, enganam-se, porque o que está aqui em causa não é, verdadeiramente, perder soberania mas, antes, recuperar o poder de decisão, o poder de controlo que os Estados da União Europeia têm vindo a perder para instâncias que não estão sujeitas ao controlo democrático — é disto que se trata.\n
Honório Novo|PCP|Onde é que inventou essa?!
Vitalino Canas|PS|Temos de criar, na Europa, mecanismos que nos permitam controlar as nossas políticas sociais, as nossas políticas económicas, as nossas políticas orçamentais e as nossas políticas fiscais, sem estarmos dependentes de decisões que vêm de fora do círculo político.\n Numa estratégia de coordenação e de articulação, este Parlamento e os outros Parlamentos nacionais — podemos assegurá-lo, e ainda agora ouvimos o Sr. Secretário de Estado dizê-lo — terão um papel essencial, desde logo, na definição, porventura, de novas regras que permitam essa articulação. Temos, na Europa, diferentes calendários, diferentes regras, ao nível da elaboração dos orçamentos, pelo que teremos, porventura, de conduzir-nos no sentido de haver harmonização nesse campo. Temos, também, muitas vezes, dificuldade de circulação de informação entre os Parlamentos nacionais e entre estes e o Parlamento Europeu, pelo que teremos, igualmente, de resolver esta questão, de forma a haver maior coordenação.\n Porventura, também ao nível das regras técnicas, temos de olhar para o facto de os diferentes orçamentos nacionais serem elaborados com base em indicadores díspares. Temos de construir, na Europa, mecanismos que permitam que os orçamentos sejam construídos com base em indicadores mais uniformizados.\n Já aqui falámos da necessidade de construir políticas económicas globais. A Estratégia Europa 2020 desenvolve uma política verdadeiramente económica, com um sentido global, mas não basta. No âmbito da Estratégia Europa 2020, temos de entender que importa ter liderança política, não basta deixar a Estratégia 2020 ao arbítrio dos Estados-membros, tem de haver liderança política ao nível europeu, para que os objectivos sejam cumpridos.\n Sr. Presidente, Sr. Secretário de Estado dos Assuntos Europeus: Portugal tem todos os motivos para continuar na linha da frente, na construção de novos mecanismos de aprofundamento da Europa.\n O Partido Socialista estará, certamente, com o Governo nesse caminho.\n
|PS|*** Aplausos ***
Presidente|Presidente|Ainda para uma intervenção, tem a palavra o Sr. Deputado Honório Novo.
Honório Novo|PCP|Sr. Presidente, Sr. Secretário de Estado dos Assuntos Europeus, Srs.\nDeputados: Para quem tivesse dúvidas, o comportamento e as decisões da União Europeia, antes e durante a actual crise, mostram bem que interesses defendem e por quem são comandadas as instituições comunitárias.\n Vale a pena recordar a forma tardia como, já no final de 2008, a União Europeia elaborou um conjunto de medidas ditas de combate à crise, perfeitamente insuficiente e com meios orçamentais quase indigentes, como, aliás, rapidamente se demonstrou.\n Vale também a pena recordar o lamentável papel, então, desempenhado pelo Banco Central Europeu, mantendo as taxas de juro criminosamente elevadas, agravando as condições de funcionamento das economias, permanecendo insensível às falências e ao desemprego e recusando-se a seguir o exemplo de bancos centrais fora da zona euro, que, há muito, tinham levado as suas taxas directoras a valores mínimos históricos.\n Era o momento em que, apesar da evidente crise, o ideário monetarista do directório da Sr.ª Merkel e do Sr. Trichet impunha o controlo da inflação à realidade de um desemprego crescente e de uma evidente recessão económica. Era também o momento em que o Governo Sócrates, com a sua proverbial confiança quase irresponsável, dizia, no último trimestre de 2008, que o sistema bancário estava imune à crise e que a economia nacional continuava a crescer. Suponho que se recorda disso, Sr. Secretário de Estado.\n Agora, quando os números do desemprego atingem valores recorde, com mais de 23 milhões de desempregados e mais de 85 milhões de pobres, quando o crescimento económico é incipiente e incerto, quando a crise está longe de estar superada, regressam em força a obsessão do controle das contas públicas e os programas de austeridade sobre os trabalhadores, os povos e os países.\n Depois de se terem gasto milhões de euros para salvar o sistema financeiro, depois de, por causa disso, os défices e as dívidas terem disparado, a União Europeia e o Banco Central Europeu (BCE) impõem de novo fortes restrições orçamentais, congelam ou cortam salários, eliminam ou cortam prestações sociais, impõem reduções no investimento, lançam programas de estabilidade que são verdadeiros roteiros para novas recessões económicas.\n É este o fiel retrato dos interesses que a União Europeia serve; é também este o retrato fiel da subserviência do nosso Governo face às imposições de Bruxelas e a sua subordinação aos interesses dos grandes grupos económicos.\n
Bernardino Soares|PCP|Exactamente!
Honório Novo|PCP|O que sucedeu nos últimos meses, com a falta de resposta aos ataques especulativos sobre as dívidas soberanas, confirma a subordinação da União Europeia ao método, às estratégias e aos timings da Alemanha, com graves consequências na Grécia e noutros países, mormente em Portugal. Em vez do reforço do orçamento comunitário para assegurar uma resposta coesa, em vez de uma intervenção activa do Banco Central Europeu, concederam-se, depois — só depois —, empréstimos em condições indignas e com juros mais elevados do que os que o BCE pratica nos empréstimos que fez, e faz, à banca.\n Aproveitando a boleia da crise, como mostram as conclusões do Conselho Europeu, a União Europeia quer também agora dar um novo salto em frente no federalismo e, a pretexto da chamada «governação económica», quer lançar uma outra ideia, quer, no fundo, concentrar ainda mais poder e ainda mais instrumentos ao serviço do directório europeu, arrogando-se mesmo a hipótese, o direito, de poder vir a submeter a visto prévio os orçamentos dos Estados-membros. Não se trata apenas de uma usurpação intolerável de soberania, queira o Sr. Deputado Vitalino Canas ou não, trata-se de rasgar princípios legais, princípios e normas constitucionais e, no caso português, do desprezo total pelas atribuições e privilégios da Casa onde estamos a fazer este debate.\n
Bernardino Soares|PCP|Muito bem!
Honório Novo|PCP|Igualmente significativa é a aprovação da Estratégia 2020.\nA União Europeia recusou sempre analisar as causas profundas da crise, as razões pelas quais o pleno emprego anunciado, afinal, se transformou em 23 milhões de desempregados; recusou retirar ilações das apostas da Estratégia de Lisboa na liberalização, na desregulamentação e na privatização de muitos sectores económicos, incluindo os financeiros; não quis nunca avaliar as consequências da designada «flexissegurança laboral». Nada disso interessava à União Europeia.\n Ao invés, agora, a reboque da crise, mais uma vez, a Comissão Europeia e a União Europeia nem hesitaram na aprovação da Estratégia 2020, no fundo, velhas políticas que apostam na mesma rota de precariedade e de destruição de serviços públicos.\n Sr. Presidente, Srs. Deputados: De quase nada do que aqui fica dito fala o Programa de Trabalho da Comissão Europeia para 2010, por mais espantoso que pareça. Até já esqueceu, Sr. Secretário de Estado, a estratégia de desmantelamento dos paraísos fiscais. Veremos em que vão dar os novos sistemas de supervisão financeira ou as anunciadas taxas sobre o sistema financeiro que, pelos vistos, o Governo Sócrates aceita em Bruxelas mas que aqui, na Assembleia da República, rejeita, votando contra as propostas nesse sentido que o PCP tem apresentado.\n E que esperar, no fundo, do relatório do Governo sobre a participação de Portugal na União Europeia no ano de 2009, além do habitual — peço desculpa pela frontalidade, Sr. Secretário de Estado — desfilar de lugares comuns, frases feitas e pronunciamentos laudatórios?
Bernardino Soares|PCP|Muito bem!
Honório Novo|PCP|Pela nossa parte, Sr. Presidente e Srs. Deputados, insistiremos em falar na mudança de políticas e de orientações.\n Insistiremos em combater a concentração da riqueza, em impedir mais privatizações, em defender os serviços públicos, em apostar no crescimento económico e no verdadeiro combate ao desemprego, em aumentar o orçamento comunitário e em reforçar as despesas sociais; insistiremos na extinção do Pacto de Estabilidade e Crescimento e no reforço da coesão económica e social, princípio totalmente esquecido no léxico dos objectivos comunitários, como, aliás, se prova pela intervenção do Sr. Secretário de Estado, em que nem uma vez referiu este princípio.\n
|PCP|*** Aplausos ***
Presidente|Presidente|Para uma intervenção, tem a palavra a Sr.ª Deputada Cecília Honório.
Cecília Honório|BE|Sr. Presidente, Srs. Membros do Governo, Sr. Deputadas e Srs.\nDeputados: O Partido Socialista fez do Tratado de Lisboa uma das suas mais poderosas bandeiras. Fez a festa e deitou os foguetes — é hoje hora de verificar o estado da Europa do Tratado de Lisboa.\n Será a Europa de Durão Barroso e do ataque à golden share? Cito o Presidente da Comissão Europeia: «A decisão…» — do Tribunal — «… confirma que a Comissão Europeia estava certa (…) as golden shares estão, de facto, contra o mercado interno». A mensagem de Durão Barroso é, afinal, esta: «coitado do mercado; que se trame о interesse nacional».\n É esta a vossa Europa? Porque, afinal, a Europa do Tratado de Lisboa é hoje a Europa da obsessão do défice e da austeridade contra os povos, a mando de Sarkozy e de Merkel, e que está a deixar o País à beira da recessão.\n O Governo fez a festa, mas aceita hoje a guilhotina da austeridade, da regressão social, dos vistos prévios sobre os orçamentos nacionais e dos castigos mais severos para os maus alunos.\n Ouçamos as palavras do Comissário Europeu dos Assuntos Económicos e Monetários: «Vigiar, em profundidade, os orçamentos nacionais»; «É altura de reforçar a união monetária com uma união económica forte».\n Falam-nos da governança económica, mas ela trouxe-nos até hoje desgovernança social e ameaça da recessão.\n
José Manuel Pureza|BE|Muito bem!
Cecília Honório|BE|O PEC 1, o PEC 2 e o PEC 3, que está a caminho, são a governança económica para a Europa que exigia crescimento económico e mais justiça social?
José Manuel Pureza|BE|Muito bem!
Cecília Honório|BE|Explique-se aos cidadãos, a quem disseram que o Tratado de Lisboa trazia mais democracia, o que é que isto quer verdadeiramente dizer.\n Explique-se aos portugueses que o Governo vai a exame sobre as suas opções para o Orçamento na Primavera, e só se passar na Comissão é que os Parlamentos nacionais se debruçam sobre o orçamento, ou seja, sobre aquilo que tiver sido decidido pela Comissão Europeia. Se não for um bom aluno, um aluno bem comportado, segue о castigo do agravamento das sanções.\n O défice tornou-se uma doença enquanto a prioridade for a cura da banca. À conta disto, o Governo cede ao directório no sacrifício dos que trabalham, desvaloriza o crescimento económico, a sustentabilidade do investimento público, as condições de vida e dos salários para defender o consumo.\n Há um século — é bom recordá-lo —, a aspiração dos trabalhadores era a de um Estado social, sendo que esta aspiração fez parte da resposta à crise. Hoje, as medidas anticrise — que por mais modestas que fossem, como era o caso português, evitaram danos ainda maiores — foram deitadas no lixo. Onde era necessário mais apoio aos mais pobres e aos desempregados, a Europa do Tratado de Lisboa e o Governo, que cede, responderam com mais impostos e menos prestações sociais.\n Em 2010, aumenta o desemprego, mas o Governo acaba com as medidas anticrise. Para 2011, aproximase a recessão, mas a resposta é austeridade, a espiral de austeridade do bloco central.\n Apanhem hoje as canas do Tratado de Lisboa. O sonho de uma Europa dos povos, da cidadania e da justiça social está hoje mais longe do que nunca. E a verdade é que se a Europa não responder socialmente à ofensiva dos seus governos irmanados com o Fundo Monetário Internacional (FMI), se não se mobilizar contra a regressão social, se não se mobilizar pelo futuro da democracia, corremos hoje o risco de condenar o seu futuro a uma espécie de sala vazia com a D. Merkel a tomar chá com os banqueiros!…
|BE|*** Aplausos ***
Presidente|Presidente|Tem a palavra o Sr. Deputado José Luís Ferreira para uma intervenção.
José Luís Ferreira|Os Verdes|Sr. Presidente, Srs. Membros do Governo, Sr.as e Srs.\nDeputados: Em jeito de «três em um», discutimos hoje a participação do Governo na reunião do último Conselho Europeu, o Programa de Trabalho da Comissão Europeia para 2010 e o relatório anual do Governo sobre a União Europeia.\n Relativamente à reunião do último Conselho Europeu, no entendimento de Os Verdes, os aspectos mais significativos dessa reunião são, por um lado, a pretensão do Conselho em transformar a crise num pretexto para acelerar o passo a caminho do federalismo, numa visão verdadeiramente imperialista da União Europeia; e, por outro lado, um esforço no sentido de aproveitar todas as faculdades que o Tratado de Lisboa permite para, com recurso à chamada «governação económica», reforçar a centralização e a concentração do poder económico ao serviço dos interesses das grandes potências europeias, sobretudo da Alemanha.\n Os aspectos que mais interessam às pessoas, que mais interessam aos europeus, ficaram, mais uma vez, excluídos da discussão. Desde logo, as medidas de regulação financeira e as importantes questões do fim dos paraísos fiscais. Pelos vistos, estas matérias continuam a não ter qualquer importância para os senhores da Europa.\n O mesmo se diga relativamente às alterações climáticas. O Sr. Secretário de Estado fez referência a esta questão, mas nesta matéria o Conselho limitou-se a tomar nota da comunicação da Comissão que analisa as opções para ir além do objectivo de 20% de redução das emissões de gases com efeito estufa e a afirmar que deverá voltar a debruçar-se sobre a questão das alterações climáticas no Outono, antes da Conferência de Cancun.\n Em síntese, aprofunda-se o federalismo e insiste-se nas políticas neoliberais, remetendo, como, aliás, tem sido hábito, as questões sociais e ambientais para outras núpcias.\n Numa altura em que a Europa se encontra envolvida numa profunda crise, o bom senso recomendaria que se procedesse a uma análise e a uma séria reflexão sobre as políticas que a provocaram, que se parasse para pensar, que se considerassem outros caminhos que não passassem forçosamente pelas políticas neoliberais, mas, ao invés disso, insiste-se nas políticas que provocaram a crise, nas políticas responsáveis pelo retrato social que vivemos: desemprego; precariedade; salários em atraso; vencimentos abaixo do salário mínimo nacional; enfraquecimento dos serviços públicos; penalizações nas reformas; cortes nos apoios sociais; agravamento da dependência alimentar; aumento da produção de organismos geneticamente modificados; destruição da nossa biodiversidade; e, por fim, claro, a delapidação do nosso património colectivo através das privatizações.\n É esta a Europa que temos, porque é também esta a Europa que os governos estão a construir. E, depois, queixam-se e encomendam estudos para compreender os elevados níveis de abstenção e a distância dos cidadãos em relação à política. Não admira, porque os cidadãos deixaram de ser considerados, o que interessa é o mercado e só o mercado. É esta, enfim, a Europa que temos.\n O que não temos é um Governo capaz de agir com firmeza quando nos vêem falar da necessidade de voltar a mexer na legislação laboral, penalizando quem trabalha; o que não temos é um Governo capaz de agir com firmeza quando nos vêem falar da possibilidade de a União Europeia poder proceder à fiscalização prévia do nosso Orçamento do Estado. O que temos é um Governo que ainda não percebeu que, de facto, chegou o momento de agir, mas agir contribuindo para uma Europa mais social.\n
Presidente|Presidente|Para uma intervenção, tem a palavra o Sr. Deputado João Serpa Oliva.
João Serpa Oliva|CDS-PP|Sr. Presidente, Sr. Secretário de Estado, Sr. Ministro, Sr.as e Srs.\nDeputados: Em boa hora, esta Câmara coloca em debate o estado de Portugal na União Europeia e o próprio processo de integração. Do CDS ouvirá, sobretudo, uma perspectiva política e um balanço concreto do último ano de Portugal na União Europeia.\n Comecemos por olhar para a recente presidência rotativa da União, da responsabilidade da Espanha.\n Contrariamente a V. Ex.ª, Sr. Secretário de Estado, temos a perspectiva de que foi uma presidência sem grande brilho, diria cinzenta. É verdade que as dificuldades deste semestre nos domínios económico e financeiro seriam críticas para qualquer presidência, mas isso não esconde um conjunto de insucessos. A saber: o quadro institucional pós-Tratado de Lisboa revelou alguns choques naturais entre as principais figuras; a renovação da agenda transatlântica foi adiada e a reunião EU-USA (União Europeia/Estados Unidos da América) não se realizou; a cimeira da União para o Mediterrâneo também foi adiada; o calendário de aprovação e entrada em vigor do serviço de acção externa atrasou-se; faltou, em nosso entender, peso político a Zapatero para coordenar com outro vigor a entreajuda financeira entre Estados-membros. Esta é a nossa opinião.\n Realçamos, no entanto, a aprovação da Estratégia 2020 focada no emprego e no crescimento económico, com quatro grandes objectivos: atingir 75% da população activa empregada; 3% do PIB da União Europeia afecto a inovação e energia; reduzir em 20% as emissões de gases tóxicos; reduzir em 25% o número de europeus abaixo do limiar da pobreza.\n Sr. Presidente, Sr. Ministro dos Assuntos Parlamentares, Sr. Secretário de Estado dos Assuntos Europeus, Srs. Deputados: Centremo-nos um pouco no Programa de Trabalho da Comissão Europeia, que nos trouxe quatro grandes objectivos: combater a crise e apoiar a economia social de mercado europeia; desenvolver uma agenda dos cidadãos, colocando-os no centro da acção europeia; elaborar um programa de acção externa; modernizar os instrumentos e métodos de trabalho comunitários.\n Parece-nos que tem uma orientação política definida e meios para os pôr em prática. O CDS considera que Portugal e o Parlamento devem colaborar com esta agenda com empenho, sem deixarmos de vincar alguns pontos caros ao interesse nacional, do ponto de vista do CDS.\n Sob o ponto de vista das Finanças, é necessário cortar na despesa. A saber: cortar no desperdício da Administração Pública; reduzir drasticamente os custos nas cerca de 90 empresas de capital público; realizar cortes nos serviços integrados do Estado, reestruturação e eliminação de institutos públicos.\n Na agricultura — um tema particularmente caro para nós — propomos fazer um acompanhamento dos regulamentos que definem o financiamento da Política Agrícola Comum e das propostas legislativas sobre a reforma da Política Comum de Pescas.\n Nas relações com África e Brasil, propomos: continuar a promover as relações estratégicas entre a União Europeia e o Brasil, assumindo Portugal um papel de pilar fundamental nesta relação; defender o potencial estratégico marítimo de África, em particular da África Lusófona, do Atlântico Sul e da nossa Plataforma Continental, no quadro das parcerias a desenvolver pela União Europeia, em domínios tão importantes como a segurança, a economia ou nos âmbitos militar e cultural.\n
Vozes do CDS-PP|CDS-PP|Muito bem!
