Secretário de Estado dos Assuntos Europeus|Pedro Lourtie|Sr. Presidente, Sr.as e Srs.\nDeputados: O Governo apresenta-se hoje, perante este Parlamento, para debater o relatório sobre a participação de Portugal na União Europeia em 2009, para debater o balanço da presidência espanhola do I SÉRIE — NÚMERO 82 Conselho da União Europeia do primeiro semestre deste ano, bem como o programa legislativo e de trabalho da Comissão Europeia para 2010.\n Estamos a falar de um período de ano e meio — em 2009 e 2010 — em que muito mudou no mundo e na União Europeia; um período em que a União Europeia progrediu, em que deu passos importantes no sentido de uma maior integração, muito em particular com a entrada em vigor do Tratado de Lisboa, e em que soube responder, em conjunto, a sérios desafios económicos; mas também neste período enfrentou — e continua a enfrentar — grandes dificuldades, marcadas pela crise económica e financeira e pela crise na zona euro, que evidenciaram debilidades no actual estádio de integração europeia.\n O desafio mais urgente com que a Europa está confrontada é, sem dúvida, a resposta à crise económica e financeira. A este respeito, julgo ser útil recordar a cronologia desta crise: uma crise que começou por ser financeira e onde a acção conjunta da União Europeia foi, desde 2008, fundamental para se evitar uma depressão económica, implicando decisões concertadas de disponibilizar crédito e pacotes de estímulo à actividade económica; uma crise que começou por demonstrar a necessidade de reforma do sector financeiro internacional.\n A posição do Governo português tem sido clara neste domínio: será um erro grave se a Europa e o mundo saírem da crise exactamente como lá entraram, em termos de regulamentação financeira.\n Nesse sentido, temos apoiado as propostas sobre supervisão financeira, sobre gestores de fundos alternativos e sobre regulação das agências de notação, e consideramos urgente a apresentação, pela Comissão, de propostas sobre a regulação de mercados de derivados. Portugal tem activamente apoiado a necessidade de avanço nestas medidas, como reconhecido, aliás, pelo Conselho Europeu.\n A crise, que fez sobressair a interdependência das economias europeias, pôs em evidência as fragilidades dos mecanismos de coordenação económica na União. Se é verdade que a União Europeia deveria ter respondido de forma mais célere à crise da dívida grega, deve também ser reconhecido que a evolução que se tem verificado tem sido significativa, nomeadamente em alguns Estados-membros mais reticentes à coordenação de políticas económicas e à criação de mecanismos de solidariedade.\n A lição é, pois, clara: o reforço da zona euro não pode dispensar uma maior coordenação das políticas e das opções económicas dos Estados-membros. O Governo português tem, por isso, defendido uma coordenação reforçada ao nível orçamental, mas tem defendido também, como indispensável, uma coordenação efectiva que permita reduzir os desequilíbrios macroeconómicos e de competitividade no seio da União.\n Se a crise veio pôr à prova a capacidade de resposta da União Europeia ao nível financeiro, o seu grande desafio continua a ser a criação de condições para uma saída sustentável da crise e que garanta à economia europeia uma trajectória consistente de crescimento, de emprego e de coesão social.\n A Estratégia Europa 2020, apontada como uma das principais prioridades da recente presidência espanhola, e que foi aprovada com sucesso no Conselho Europeu de Junho, proporciona o enquadramento para este caminho.\n É evidente que, uma vez definida, o sucesso da estratégia depende da sua implementação, implementação que depende do que a Europa souber fazer em conjunto, muito em particular através do financiamento de programas comunitários e das chamadas «iniciativas emblemáticas», bem como do reforço da governação da estratégia.\n Mas o sucesso da sua implementação depende, também, do nível nacional. Neste contexto, procuraremos fixar os objectivos para Portugal com realismo e ambição: a ambição de recuperar, até 2020, os atrasos estruturais que subsistem relativamente à média europeia ao nível dos indicadores fundamentais da Estratégia 2020, continuando e reforçando o importante trabalho que tem sido feito e prosseguindo a evolução estrutural positiva que se tem verificado nos principais objectivos apontados, em investigação e desenvolvimento, em educação, em energia e clima, em emprego e em inclusão social e pobreza.\n Sr. Presidente, Sr. e Srs. Deputados: 2009 e 2010 são também anos de transição em termos institucionais. Com a entrada em vigor do Tratado de Lisboa e, espera-se, com a entrada em funcionamento, até final de 2010, do Serviço Europeu para a Acção Externa, no seguimento do acordo recentemente obtido entre o Parlamento Europeu e o Conselho, completar-se-á a transição para o novo quadro institucional europeu.\n Um dos objectivos do Tratado de Lisboa é o de dotar a União de instrumentos que permitam aumentar, em coerência e eficácia, a sua capacidade de acção e de influência no mundo. É, agora, preciso traduzir rapidamente estes objectivos em realidade.\n A Europa tem pela frente negociações importantes, que exigem uma actuação determinada e coordenada da União. Quero sublinhar duas.\n Em primeiro lugar, as negociações do clima, que, em Copenhaga, em finais de 2009, mostraram uma Europa com escassa capacidade de influência. A União deverá, no caminho para a Cimeira de Cancun, no final desta ano, ser capaz de demonstrar que Copenhaga pode ter sido o início do caminho para um acordo abrangente e vinculativo de combate às alterações climáticas.\n Em segundo lugar, ao nível do comércio internacional, onde o Governo tem defendido e defende que a União deverá pugnar por uma postura de abertura ao comércio internacional livre e à conclusão da Ronda de Doha, desde que defendendo também o princípio da reciprocidade. Todos temos a ganhar com o comércio internacional livre, desde que seja também justo.\n O ano de 2009 e o primeiro semestre de 2010 foram dominados, não há dúvida, pela crise económica e financeira e pelas alterações institucionais, derivadas da eleição de um novo Parlamento Europeu, da designação de uma nova Comissão Europeia e pela entrada em vigor do Tratado de Lisboa.\n Neste período, o actual e o anterior Governos mantiveram uma atitude activa de defesa dos interesses portugueses e de uma mais efectiva integração europeia, do que gostaria de dar alguns exemplos.\n Portugal foi um dos países que liderou a proposta de alteração ao Regulamento dos Fundos Estruturais e de Coesão, que permite, tendo em conta as dificuldades económicas na Europa, derrogar, até final de 2011, a chamada regra «n+2/n+3», que recentemente entrou em vigor.\n Portugal foi particularmente activo no impulso que deu às alterações ao Regulamento do Fundo Europeu de Ajustamento à Globalização, que facilitam o seu accionamento e aumentam a taxa máxima de financiamento comunitário.\n Foi também possível, com um papel activo da nossa diplomacia, prorrogar por um ano e meio as medidas anti-dumping relativamente às importações de calçado da China e do Vietname, importantes na protecção da nossa indústria. Tomámos a liderança nestas negociações, porque, desse modo, defendemos os interesses de Portugal, defendemos a capacidade da Europa de reagir à crise e defendemos os interesses de uma Europa mais solidária.\n Sr. Presidente, Sr.as e Srs. Deputados: Termino com duas referências.\n A primeira referência é para afirmar que o Governo continuará, como tem feito regular e frequentemente, a informar este Parlamento relativamente às questões europeias e à participação de Portugal na União Europeia, por ser sua obrigação e por considerar que, desse modo, reforça a posição portuguesa no seio das instituições europeias. Nesse sentido, tomámos nota dos pareceres positivos globalmente das comissões parlamentares sobre o documento de balanço de 2009 e trabalharemos para ir ao encontro de várias das sugestões que nos são feitas.\n A segunda referência é para deixar uma palavra de elogio ao trabalho da Presidência espanhola no primeiro semestre deste ano. Foi uma Presidência exercida sob condições difíceis, que teve de fazer a transição para o novo quadro institucional do Tratado de Lisboa, que se confrontou com a entrada tardia em funções da nova Comissão Europeia e que, acima de tudo, teve de lidar com uma crise financeira na zona euro, mas que soube manter o rumo, avançar com sucesso nas suas prioridades e, principalmente, trabalhar em prol da integração europeia.\n
|PS|*** Aplausos ***
Presidente|Presidente|Inscreveram-se, para pedir esclarecimentos, sete Srs. Deputados.\nPara o efeito, tem a palavra, em primeiro lugar, o Sr. Deputado João Serpa Oliva.\n
João Serpa Oliva|CDS-PP|Sr. Presidente, Sr. Secretário de Estado dos Assuntos Europeus, debatemos hoje um conjunto de temas relativos à União Europeia e, por isso, gostava de lhe perguntar como responde o Governo às recentes declarações do Comissário Europeu dos Assuntos Económicos e Monetários, Olli Rehn, quando abriu a porta a um leque de sanções para todos os países que estejam em risco de défices excessivos, sanções estas que podem passar pela suspensão dos financiamentos do orçamento comunitário, das ajudas aos agricultores, dos fundos estruturais às regiões e ao sector das pescas.\n Recentemente, a Comissão Europeia propôs um regulamento sobre a qualidade dos dados estatísticos no contexto dos défices excessivos — de novo, os défices excessivos —, exigindo aos Estados total clareza dos números e colaboração estreita de toda a Administração Pública. A minha segunda pergunta é, pois, a seguinte: está o Governo a tomar as medidas adequadas, exigidas pela Comissão, para garantir que estas informações chegam ao Eurostat com rigor, não esquecendo que o Eurostat pode ir mesmo às autarquias verificar as suas contas?
|CDS-PP|*** Aplausos ***
Presidente|Presidente|Tem a palavra o Sr. Deputado Luís Rodrigues.
Luís Rodrigues|PSD|Sr. Presidente, Sr. Secretário de Estado dos Assuntos Europeus, era importante que o debate de hoje, com a presença do Governo, não fosse apenas para cumprir calendário e uma obrigação legal.\n Ontem, debatemos neste hemiciclo o mau estado da Nação e, hoje, vamos querer saber quais as respostas que o Governo português ainda vai ter de dar a Bruxelas para garantir que vamos deixar de ser um dos principais contribuintes líquidos para o estado fragilizado da Europa.\n A Presidência espanhola atravessou um semestre singular, que ficou marcado pela entrada em vigor do Tratado de Lisboa e pela nova articulação entre a Presidência rotativa e as novas instituições — o Presidente do Conselho Europeu e o Alto Representante para os Negócios Estrangeiros e a Política de Segurança. Neste período, a União enfrentou uma das mais graves crises económicas e financeiras, tendo adoptado medidas excepcionais, tanto no plano do resgate da Grécia como na adopção de um mecanismo europeu de estabilização no valor de 750 000 milhões de euros.\n Neste âmbito, as instituições europeias entenderam que o caminho seguido até aqui teria de ser corrigido, aperfeiçoado e reorientado a vários níveis, nomeadamente no que respeita ao controlo, fiscalização e disciplina. Uma das respostas a este problema que tem sido objecto de maior referência é o que se designa por «governo económico europeu». Os responsáveis políticos europeus têm abordado esta questão de várias maneiras. A nova Presidência belga quer impulsionar esta ideia reunindo um fórum no próximo Outono, permitindo, assim, um debate público, que se destine a esclarecer os diferentes conceitos em análise.\n No início do ano, o Sr. Primeiro-Ministro assumiu publicamente a defesa da criação deste «governo económico». Sr. Secretário de Estado, qual o conceito de «governo económico» defendido pelo Governo português? Será que o Governo defende com prioridade, tal como outros, o reforço da disciplina orçamental, assumindo em comum projectos europeus, tais como o das infra-estruturas de transporte, financiados através de novas fontes de receita, que poderão incluir novas taxas sobre o sistema financeiro? Sendo conhecido o habitual descontrolo orçamental do Governo português e reconhecida a engenharia financeira criativa, muitas vezes traduzida em desorçamentação encapotada, será que o Governo tem coragem de ir defender em Bruxelas aquilo que não pratica em Portugal? Sr. Presidente, na crise que afecta a Europa, Portugal tem sido um dos países mais visados pelas críticas das diversas instituições europeias e internacionais, confirmadas por todos os portugueses, que são quem mais sofre directamente com os governos socialistas.\n Ainda recentemente, a Comissão Europeia considerou que as medidas orçamentais para 2010, se aplicadas rápida e eficazmente, serão suficientes, mas, de uma forma inédita, veio condicionar o próximo Orçamento, afirmando que o Governo, se quiser atingir as metas propostas, tem de especificar novas medidas para 2011, no valor 2500 milhões de euros.\n Sr. Secretário de Estado, a minha pergunta é muito concreta: o Governo já decidiu quais são essas medidas de um novo aperto orçamental em 2011, condicionadas por Bruxelas? Por último, devido ao mau desempenho do Governo socialista, Portugal arrisca-se a, neste estado difícil, vir a perder, progressivamente, cada vez mais, autonomia orçamental e, por via disso, ver uma parte significativa da soberania nacional diminuída de uma forma irreversível, por imposição comunitária. A partilha de soberania deveria ser uma opção nacional debatida livremente, sem quaisquer condicionalismos resultantes de fragilidades nacionais.\n
|PSD|*** Aplausos ***
Presidente|Presidente|Tem a palavra a Sr.ª Deputada Cecília Honório.
Cecília Honório|BE|Sr. Presidente, Sr. Secretário de Estado dos Assuntos Europeus, o debate de hoje é uma boa oportunidade para o Governo nos esclarecer, de uma vez por todas, como é que se comprometeu com o visto prévio sobre os orçamentos nacionais. Acho que esta é a questão determinante, é aquela que exige uma clarificação imediata, porque o Sr. Secretário de Estado sabe que o debate europeu é o debate mais importante que podemos fazer, é o debate das escolhas e das opções do futuro para Portugal, inclusivamente.\n Ora, este quadro em que nos movimentamos, em que dois países determinam aquilo que cada país há-de fazer, nomeadamente em matéria orçamental, exige do seu Governo uma resposta muito clara.\n A verdade é que os orçamentos são verificados pela Comissão Europeia. Os governos, o seu Governo, têm de apresentar as grandes opções orçamentais e têm de definir os níveis mais significativos dessas apostas, nomeadamente apresentar a inflação e o nível de endividamento previstos. Tudo isto, como o Sr. Secretário de Estado sabe, é fiscalizado pelas instâncias comunitárias, pela Comissão Europeia. E só passando no exame é que o seu Governo trará uma proposta à Assembleia da República, que então se pronunciará sobre ela, podendo votá-la.\n É óbvio, Sr. Secretário de Estado, que o seu Governo se comprometeu com a falência da soberania nacional relativamente a estas escolhas.\n Mas, mais importante do que isto, é o facto de desrespeitar a escolha dos cidadãos e a qualidade da democracia portuguesa, porque, como bem sabe, os cidadãos e as cidadãs escolheram os seus representantes políticos que têm assento na Assembleia da República.\n Reconhece, com certeza, que a Assembleia da República tem, nesta matéria, nas grandes escolhas para o Orçamento e no grande debate que é feito em torno dele, como escolhas para o País, um papel determinante.\n E aquilo que o seu Governo aceitou foi prescindir desse papel, foi abandonar esse papel, foi tornar-se refém de uma disciplina orçamental cujos custos, como bem sabe, são os seguintes: ou o Governo se porta como «bom aluno» e cumpre os patamares que são previamente definidos ou vêm aí as sanções e o agravamento das sanções, primeiro nível laranja, depois nível vermelho, com a clarificação, que urge também fazer, de que o castigo mais severo para os «piores alunos» é, com certeza, o corte dos financiamentos.\n Portanto, esta é, para o Bloco de Esquerda, a questão determinante que urge discutir. Como é que o Governo decidiu comprometer a democracia portuguesa, entregando os orçamentos à Comissão Europeia e a capacidade de discutir e de decidir sobre os orçamentos? Esta é a questão a que gostaria que me respondesse.\n
|BE|*** Aplausos ***
Presidente|Presidente|Tem a palavra a Sr.ª Deputada Ana Catarina Mendonça.
Ana Catarina Mendonça|PS|Sr. Presidente, Sr. Secretário de Estado dos Assuntos Europeus, antes de lhe fazer uma pergunta muito concreta, não resisto em dizer à Sr.ª Deputada Cecília Honório que, de facto, para o Bloco de Esquerda o melhor era que Portugal não assumisse qualquer compromisso, o melhor era que Portugal não estivesse na União Europeia,…
Vozes do PS|PS|Muito bem!
Ana Catarina Mendonça|PS|… porque então, sim, resolveria todos os problemas e dúvidas que o Bloco de Esquerda tem.\n Mas concentremo-nos naquilo que é essencial.\n Sr. Secretário de Estado, no momento em que a Europa tenta sair da grave crise em que se encontra, creio que vale a pena valorizar os instrumentos que estão neste momento à nossa disposição e que podem constituir uma resposta global aos desafios que se nos colocam.\n Por isso mesmo, Sr. Secretário de Estado, depois da experiência vivida com a Estratégia de Lisboa, instrumento que tinha objectivos muito concretos, encontramo-nos hoje a definir uma nova estratégia — a Estratégia União Europeia 2020 —, este sim um instrumento de política com um sentido verdadeiramente económico.\n A questão que lhe quero colocar, Sr. Secretário de Estado, é muito simples: quais os mecanismos que estão a ser preconizados para que este instrumento seja verdadeiramente um êxito e possa constituir maior qualificação para os europeus, maior oportunidade de emprego e, em suma, maior coesão social, porque é isso que se requer neste momento.\n
|PS|*** Aplausos ***
Presidente|Presidente|Tem a palavra o Sr. Deputado Arménio Santos.
Arménio Santos|PSD|Sr. Presidente, Sr. Secretário de Estado dos Assuntos Europeus, o programa de trabalho da Comissão elenca um conjunto de iniciativas com as quais concordamos. De resto, o Partido Social Democrata revê-se nas iniciativas, aprovadas em sede de Comissão de Assuntos Europeus, de escrutínio reforçado, onde se abordam as iniciativas de combate à crise, a aplicação do Programa de Estocolmo, a directiva tempo de trabalho, o livro branco sobre os transportes, o apoio à política agrícola comum, bem como a plataforma contra a pobreza.\n Naturalmente que poderíamos elencar outras iniciativas, como a que se reporta, nomeadamente, ao apoio às pequenas e médias empresas, ao papel que cabe a este segmento do tecido empresarial para criar riqueza, proporcionar o relançamento da economia e gerar emprego. Mas sabemos também que este programa decorre numa fase de crise grave e que, com os desafios que a União tem pela frente, mais se impõe, num momento como este, a coesão, o envolvimento de todos os Estados-membros. Por isso, Sr.\n Secretário de Estado, gostava de lhe colocar, de forma breve, duas questões e, se me puder responder, ficarlhe-ei grato.\n Há sinais, como sabemos, de alguns egoísmos e a lentidão com que foi encontrada uma resposta para os problemas da Grécia é disso exemplo. Esses egoísmos não facilitarão, bem pelo contrário, a afirmação do papel da União Europeia no mundo nem a eficácia das suas respostas às dificuldades presentes.\n Por isso, pergunto-lhe se o Governo português considera que há, de facto, uma estratégia convergente entre os 27 Membros da União para atacar a crise e não há diferenciações entre os seus vários membros.\n Por outro lado, compreendemos bem as medidas duras que foram implementadas e que constam das decisões da Comissão e dos órgãos da União para reduzir o défice e os endividamentos externos, mas aquilo que gostaria de ouvir, da parte do Sr. Secretário de Estado, é se considera que também estão a ser implementadas políticas sociais adequadas para combater os efeitos sociais do desemprego e da pobreza e o aprofundamento das desigualdades.\n Entendemos que é importante haver mecanismos, instrumentos de resposta às dificuldades da economia, mas a parte social não pode ser descurada em circunstância alguma, especialmente em momentos de crise como os que vivemos.\n
|PSD|*** Aplausos ***
Presidente|Presidente|Também para pedir esclarecimentos, tem a palavra a Sr.ª Deputada Luísa Roseira.
Luísa Roseira|PSD|Sr. Presidente, Sr. Secretário de Estado dos Assuntos Europeus, o Partido Social Democrata entende que o conteúdo do relatório do Governo sobre a participação de Portugal na União Europeia no ano de 2009 merece, genericamente, o nosso assentimento. Todavia, iremos direccionar esta intervenção para o futuro, designadamente para a Estratégia Europa 2020, que consiste, na nossa óptica, num dos desafios vitais com que a Europa se confronta neste momento. Permitimo-nos fazer um avant e um après.\n No ano de 2000, num contexto de certa euforia e optimismo, com a criação do mercado único e a introdução do euro, a Estratégia de Lisboa surgia como um compromisso de tornar a Europa a região mais bem-sucedida do mundo: a economia do conhecimento.\n Dez anos volvidos, infelizmente, temos de considerar o que todos consideram, unanimemente, ou seja, que resultou num fracasso, não se tendo conseguido alcançar nenhum dos objectivos propostos.\n Os investimentos em investigação e desenvolvimento são inferiores a metade do traçado e a taxa de crescimento económico baixou para uma média de 0,8%, com consequências nefastas para as taxas de desemprego, que subiram exponencialmente.\n A Estratégia Europa 2020 surge, na nossa acepção, de um modo muito mais realista e bem delineado, sendo que, de certo modo, estamos de acordo com a estratégia adoptada, dos 5-3-7, isto é, cinco grandes objectivos, três eixos prioritários e sete iniciativas emblemáticas.\n Há, no entanto, algumas questões que gostaríamos de lhe colocar, Sr. Secretário de Estado.\n Atento o fracasso, assumido pelo Governo português, relativamente aos resultados da Estratégia de Lisboa, vai o Governo manter, na execução da Estratégia Europa 2020, a mesma ou similar estrutura de coordenação nacional que adoptou relativamente à Estratégia de Lisboa? É que, Sr. Secretário de Estado, em face dos resultados obtidos, e adoptando agora, aqui, uma linguagem desportiva, mantendo o mesmo modelo de coordenação, nem da fase de qualificação saímos, quanto mais chegar à final do campeonato. Portanto, gostaríamos de saber se o Governo insiste em manter esse modelo.\n Por outro lado, Sr. Secretário de Estado, tendo em conta que as metas que o Governo português tem de traçar, relativamente à Estratégia Europa 2020, terão um alcance temporal longo, de uma década, gostaríamos de saber o que o Governo português pretende fazer, por consensualização com as outras forças político-partidárias, no sentido de as referidas metas não serem única e exclusivamente do actual Governo mas, essencialmente, de Portugal.\n
|PSD|*** Aplausos ***
Presidente|Presidente|Para responder, tem a palavra o Sr. Secretário de Estado dos Assuntos Europeus.
Secretário de Estado dos Assuntos Europeus|Secretário de Estado dos Assuntos Europeus|Sr. Presidente, Srs. Deputados, noto, em algumas intervenções — e não posso deixar de o dizer, com alguma surpresa —, uma teoria que, da parte de algumas bancadas, nesta Câmara, já é habitual ouvir, que é a teoria de que os problemas da zona euro são culpa de Portugal. O facto de 24 dos 27 Estados-membros da União Europeia terem os seus défices acima dos limites do Tratado de Maastricht deve ser culpa, seguramente, do Governo português.\n Essa teoria não «cola» com a realidade e, por isso, devo dizer que as bancadas parlamentares que nela insistem têm um problema de ligação à realidade europeia e internacional.\n
|PS|*** Aplausos ***
Secretário de Estado dos Assuntos Europeus|Secretário de Estado dos Assuntos Europeus|Quanto à questão do visto prévio dos orçamentos, importa fazer uma correcção: não se trata de um visto prévio nem de tirar poderes aos Parlamentos nacionais. É preciso deixar isto totalmente claro, porque este Parlamento, tal como, aliás, todos os Parlamentos nacionais dos Estados-membros da União Europeia, manterá intactos todos os poderes para aprovar os orçamentos que bem entender — faz parte das competências do Parlamento nacional, aliás, desta Assembleia da República.\n Por isso, Sr.ª Deputada Cecília Honório, não se preocupe, porque este Parlamento mantém todas as suas competências. Agora, coloca-se aqui, seguramente, uma questão de opção, e aí talvez tenhamos as nossas divergências: há a opção pela zona euro, pela participação responsável na zona euro e pela necessidade de coordenação de políticas económicas na zona euro, e até por uma participação na União Europeia; há aqueles que entendem que Portugal não deve estar na zona euro e, se calhar, não deve participar no mercado interno e, se calhar, nem deve participar na União Europeia.\n
