Deniz Cruz de Ramos Padeiro ,PPD / PSD ,Águeda 
Rui Manuel Pereira Marques ,CDS - PP ,Albergaria-a-Velha 
Sílvio Henriques Cerveira ,PPD / PSD ,Anadia 
José Armando de Pinho Oliveira ,PS ,Arouca 
José Girão Pereira  ,CDS - PP ,Aveiro 
Antero Gaspar de Paiva Vieira ,PS  ,Castelo de Paiva 
José Barbosa Mota ,PS ,Espinho 
Vladimiro das Neves R. da Silva ,PS ,Estarreja 
Alfredo de Oliveira Henriques ,PPD / PSD ,Feira 
Humberto Rocha ,PS  ,Ílhavo 
Rui Manuel Leal Marqueiro ,PS ,Mealhada 
Augusto Carlos dos S. Leite ,PS ,Murtosa 
Ângelo da Silva Azevedo ,PPD / PSD ,Oliveira de Azemeis 
Acílio Domingues Gala ,CDS - PP ,Oliveira do Bairro 
Armando Franca Rodrigues Alves ,PS ,Ovar 
Manuel de Almeida Cambra ,CDS - PP ,S. João da Madeira 
Manuel da Silva Soares ,CDS - PP ,Sever do Vouga 
Carlos Fernandes Roseiro Bento ,CDS - PP ,Vagos 
António José de O Fonseca ,PPD / PSD ,Vale de Cambra 
Amares ,Tomé Silvério Gonçalves Macedo ,PPD / PSD 
Barcelos ,Fernando Ribeiro dos Reis ,PPD / PSD 
Braga  ,Francisco S. Mesquita Machado  ,PS  
Cabeceiras de Basto ,Joaquim Barroso de A. Barreto ,PS 
Celorico de Basto  ,Albertino T. da Mota e Silva ,PPD / PSD 
Esposende  ,Alberto Queiroga Figueiredo ,PPD / PSD 
Fafe  ,Parcídio M. Summavielle Soares  ,PS  
Guimarães  ,António Magalhães da Silva ,PS 
Póvoa de Lanhoso ,João Manuel H. Tinoco de Faria ,PS 
Terras de Bouro ,José António de Araújo ,PPD / PSD 
Vieira do Minho ,Manuel Travessa de Matos ,PS 
Vila Nova de Famalicão ,Agostinho Peixoto Fernandes ,PS  
Vila Verde ,António Cerqueira ,CDS - PP 
Alfândega da Fé ,Manuel Cunha Silva ,PS 
Bragança  ,Luis Francisco da Paula Mina ,PS 
Carrazeda de Ansiães  ,António João R. de Sampaio ,PPD / PSD 
Freixo de Espada à Cinta ,António Alberto Madeira ,PS 
Macedo de Cavaleiros  ,Manuel Luis Gomes Vaz ,PS 
Miranda do Douro  ,Júlio Meirinhos Santanas ,PS 
Mirandela  ,José Augusto Gama  ,PPD / PSD 
Mogadouro   ,Francisco António Castro Pires ,PS 
Torre de Moncorvo  ,Fernando António A. Ferreira ,PS 
Vila Flor  ,Artur Guilherme G. Vaz Pimentel ,PS  
Vimioso  ,José Manuel Fernandes Miranda ,PS  
Vinhais  ,José Carlos Taveira ,PS 
Belmonte ,António Pinto Dias Rocha ,PPD / PSD 
Castelo Branco  ,César Augusto Vila Franca  ,PPD / PSD 
Covilhã  ,Jorge Manuel L. da Cruz Pombo  ,PS  
Fundão  ,José de Sampaio Lopes ,PS 
Idanha-a-Nova  ,Joaquim Morão Lopes Dias  ,PS  
Oleiros  ,José Santos Marques ,PPD / PSD 
Penamacor  ,José Luis Oliveira Gonçalves ,PS 
Proença-a-Nova  ,Diamantino Ribeiro André ,PPD / PSD 
Sertã  ,Ângelo Pedro Farinha  ,PPD / PSD 
Vila de Rei  ,Maria Irene da C. B. Joaquim ,PPD / PSD 
Vila Velha de Rodão  ,Vitor Manuel Pires Carmona ,PPD / PSD 
Arganil  ,Armando Dinis Cosme ,PPD / PSD 
Cantanhede  ,Rui Mendes Crisóstomo ,PS 
Coimbra  ,Manuel Augusto Soares Machado ,PS 
Condeixa-a-Nova  ,Jorge Manuel da C. T. Bento ,PS  
Figueira da Foz  ,Manuel A Aguiar de Carvalho  ,PS  
Góis  ,José D. de Ascensão Cabeças ,PS 
Lousã   ,Horácio André Antunes  ,PS  
Mira  ,João Maria Ribeiro Reigota ,PS 
Miranda do Corvo  ,Jorge Manuel Fernandes Cosme ,PS 
Montemor-o-Velho  ,José Manuel Oliveira de Sousa ,PS 
Oliveira do Hospital  ,Carlos A M. Portugal e Brito ,PPD / PSD 
Pampilhosa da Serra ,José Augusto V. N. de Almeida ,PPD / PSD 
Penacova ,Manuel Estácio Marques Florido ,PPD / PSD 
Penela ,Fernando dos Santos Antunes ,PPD / PSD 
Soure ,João Eduardo Dias M. Gouveia ,PPD / PSD 
Tábua ,Francisco Ivo Lima Portela ,PPD / PSD 
V. Nova de Poiares ,Jaime Carlos Marta Soares ,PPD / PSD 
Alandroal ,João António Ribeiro ,PCP / PEV 
Arraiolos  ,Jerónimo José C. dos Loios ,PCP / PEV 
Borba  ,João Manuel Rato Proença ,PCP / PEV 
Estremoz  ,José do Nascimento Dias Sena ,PCP / PEV 
Évora  ,Abílio Miguel  J. D. Fernandes  ,PCP / PEV 
Montemor-o-Novo ,Carlos Manuel R. Pinto de Sá ,PCP / PEV 
Mora  ,João Carlos D. Lopes Saraiva ,PCP / PEV 
Mourão  ,José Manuel Santinha Lopes ,PS 
Portel  ,António José M. Vidigal Amaro ,PCP / PEV 
Redondo  ,Alfredo Falamino Barroso  ,PCP / PEV 
Reguengos Monsaraz  ,Vitor Manuel Barão Martelo  ,PS  
Vendas Novas ,João Teresa Ribeiro ,PCP / PEV 
Viana do Alentejo ,Estevão Manuel Machado Pereira ,PCP / PEV 
Vila Viçosa ,Josué António Almeida Bacalhau ,PPD / PSD 
Albufeira  ,Xavier  Vieira Xufre ,PS 
Alcoutim  ,Francisco Augusto C. Amaral ,PPD / PSD 
Aljezur  ,Manuel José Jesus Marreiros ,PCP / PEV 
Castro Marim  ,José Guilhermino Anacleto  ,PS  
Faro  ,João Carlos D. Botelheiro ,PS 
Lagoa  ,Jacinto M. de Sousa L. Correia ,PPD / PSD 
Lagos  ,José Valentim Rosado ,PPD / PSD 
Loulé  ,Joaquim M. dos Santos Vairinhos ,PS 
Monchique  ,Carlos Alberto dos S. Tuta ,PS  
Olhão  ,Francisco José Fernandes Leal ,PS  
Portimão  ,Nuno Alberto P. Mergulhão ,PS  
S. Brás de Alportel  ,José de Sousa Pires ,PS  
Silves  ,José António Correia Viola ,PCP / PEV 
Tavira  ,Jacinto Luis da C. Rodrigues ,PS  
Vila do Bispo ,José Francisco Boaventura ,PS 
Vila Real de Santo António ,António José Filipe Martins ,PCP / PEV 
Aguiar da Beira ,Joaquim Cândido Ferreira Lacerda ,PPD / PSD 
Almeida ,José da Costa Reis ,PPD / PSD 
Celorico da Beira ,Júlio Manuel dos Santos ,PS 
Figueira de Castelo Rodrigo ,Fernando Carlos M. G. Bordalo ,PS 
Fornos de Algodres ,José da Costa Felício ,PPD / PSD 
Gouveia ,António José Santinho Pacheco ,PS 
Guarda ,Abílio Aleixo Curto ,PS 
Manteigas ,José Manuel Custódio Biscaia ,PPD / PSD 
Meda ,João Germano M. Leal Pinto ,PPD / PSD 
Pinhel ,António Miranda Cavalheiro ,PS 
Sabugal  ,José Santos Freire ,PS 
Seia ,Eduardo Mendes de Brito ,PS 
Trancoso ,Júlio José Saraiva Sarmento ,PPD / PSD 
Vila Nova de Foz Côa ,António dos Santos A. Gouveia ,PPD / PSD 
Alcobaça ,Miguel Martinho F. Guerra ,PS 
Alvaiázere ,Álvaro Clemente P. Simões ,PPD / PSD 
Ansião ,Fernando Ribeiro Marques ,PPD / PSD 
Batalha ,Raul Miguel de Castro ,CDS - PP 
Bombarral ,António Carlos A. Álvaro ,PPD / PSD 
Caldas da Rainha ,Fernando José da Costa ,PPD / PSD 
Castanheira de Pera ,Pedro Manuel B. T. Henriques ,PS 
Figueiró dos Vinhos ,Fernando Manuel da C. Manata ,PS 
Leiria ,Afonso Lemos Proença ,PPD / PSD 
Marinha Grande ,Álvaro Neto Órfão ,PS 
Nazaré ,Jorge Codinha Antunes Barroso ,PPD / PSD 
Óbidos ,José António Pereira Júnior ,PS 
Pedrógão Grande ,Mário Coelho Fernandes ,PS 
Peniche ,João Augusto Tavares Barradas ,PPD / PSD 
Pombal ,Narciso Ferreira Mota ,PPD / PSD 
Porto de Mós ,José Maria Oliveira Ferreira ,PPD / PSD 
Alenquer ,PS ,Álvaro Joaquim Gomes Pedro 
Arruda dos Vinhos ,Mário Henrique F. Carvalho ,PS 
Cadaval ,PS ,Valentim Carvalho Matias 
Cascais ,PS ,José Luis Judas 
Lisboa ,Jorge F. Branco de Sampaio ,PS/PCP/PEV/PSR/UDP
Loures ,PCP / PEV ,Demétrio Carlos Alves 
Lourinhã ,José Manuel Dias Custódio ,PS 
Oeiras ,PPD / PSD ,Isaltino Afonso Morais 
Sintra ,PS ,Edite de Fátima S. M. Estrela 
Sobral de Monte Agraço ,PCP / PEV ,António Lopes Bogalho 
Torres Vedras ,José Augusto de Carvalho ,PS 
Vila Franca de Xira ,PCP / PEV ,Daniel dos Reis Branco 
Amadora ,Orlando Gaspar G. Almeida ,PCP / PEV 
Alter do Chão ,António Hemetério Airoso Cruz ,PPD / PSD 
Arronches ,Gil da Conceição P. Romão ,PS 
Avis ,António Raimundo Bartolomeu ,PCP / PEV 
Campo Maior ,João do Nascimento Gama Guerra ,PS 
Castelo de Vide ,Joaquim Pinto Ferreira Canário ,PS 
Crato ,Manuel António Sanches Ferreira ,PCP / PEV 
Elvas ,Rondão Almeida ,PS 
Fronteira ,Pedro Namorado Lancha ,PPD / PSD 
Gavião ,João Galinha Barreto ,PS 
Marvão ,António Moura Andrade ,PPD / PSD 
Monforte ,António Falé Canoa ,PS 
Nisa ,José Manuel Semedo Basso ,PCP / PEV 
Ponte de Sor ,Joaquim Louro Semedo Carita ,PS 
Portalegre ,João Transmontano de O. Miguens ,PPD / PSD 
Sousel ,Artur Ryder Torres Pereira ,PPD / PSD 
Amarante ,Francisco José P. de A. Miranda ,PS 
Baião ,Emília dos Anjos P. da Silva ,PPD / PSD 
Felgueiras ,Júlio Manuel de C. Lopes Faria ,PS 
Gondomar ,Valentim Loureiro ,PPD / PSD 
Lousada ,Jorge Manuel F. M. Magalhães ,PS 
Maia ,José Vieira de Carvalho ,PPD / PSD 
Marco de Canavezes ,Avelino Ferreira Torres ,CDS - PP 
Matosinhos ,José Narciso R. de Miranda ,PS 
Paços de Ferreira ,Arménio da Assunção Pereira ,PPD / PSD 
Paredes ,José A Granja R. da Fonseca ,PPD / PSD 
Penafiel ,Agostinho Moreira Gonçalves ,PS 
Porto ,Fernando Manuel dos S. Gomes ,PS 
Póvoa Varzim ,José Macedo Vieira ,PPD / PSD 
Santo Tirso ,Joaquim Barbosa Ferreira Couto ,PS 
Valongo ,Fernando Horácio M. P. de Melo ,PPD / PSD 
Vila do Conde ,Mário H. Moreira de Almeida ,PS 
V. Nova Gaia ,José Heitor M. Carvalheiras ,PS 
Abrantes ,Nelson Augusto M. De Carvalho ,PS 
Alcanena ,Carlos Manuel Carvalho Cunha ,PS 
Almeirim ,José Joaquim G. de Sousa Gomes ,PS 
Alpiarça ,Raul Arranzeiro Figueiredo ,PCP / PEV 
Benavente ,António José Ganhão ,PCP / PEV 
Cartaxo ,José Manuel V. Conde Rodrigues ,PS 
Chamusca ,Sérgio M. Da Conceição Carrinho ,PCP / PEV 
Constância ,António Manuel dos S. Mendes ,PCP / PEV 
Coruche ,Manuel d’Azevedo Brandão ,PCP / PEV 
Entroncamento ,José Pereira da Cunha ,PS 
Ferreira do Zêzere ,Luis Ribeiro Pereira ,PPD / PSD 
Golegã ,Manuel Ferraz Vicente Madeira ,PCP / PEV 
Mação ,Elvino Vieira da Silva Pereira ,PPD / PSD 
Rio Maior ,Silvino Manuel Gomes Sequeira ,PS 
Salvaterra de Magos ,António da Silva F. Moreira ,PS 
Santarém ,José Miguel Correia Noras ,PS 
Sardoal ,Fernando C. Moleirinho ,PPD / PSD 
Tomar ,Pedro Alexandre Ramos Marques ,PS 
Torres Novas ,António Manuel O Rodrigues ,PS 
Vila Nova da Barquinha ,José Eduardo Ramos Paulo ,PS 
Vila Nova de Ourém ,Mário da Silva C. Albuquerque ,PPD / PSD 
Alcácer do Sal ,Manuel Rogério de Sousa Brito ,PCP / PEV 
Alcochete ,Miguel Boieiro ,PCP / PEV 
Almada ,Maria Emília G. Neto de Sousa ,PCP / PEV 
Barreiro ,Pedro Alberto C. A. Canário ,PCP / PEV 
Grândola ,Fernando A. de O. Travassos ,PCP / PEV 
Moita ,José Luis Lopes Pereira ,PCP / PEV 
Montijo ,Jacinta Maria Peniche Ricardo ,PCP / PEV 
Palmela ,Carlos M. Barateiro de Sousa ,PCP / PEV 
Santiago do Cacém ,Ramiro Francisco Guiomar Beja ,PCP / PEV 
Seixal ,Eufrázio Filipe Garcez José ,PCP / PEV 
Sesimbra ,Ezequiel Lino ,PCP / PEV 
Setúbal ,Manuel da Mata de Cáceres ,PS 
Sines ,Francisco Maria P. do O Pacheco ,PCP / PEV 
Arcos de Valdevez ,Francisco Rodrigues de Araújo ,PPD / PSD 
Caminha ,Valdemar Augusto Pais Patrício ,PS 
Melgaço ,António Rui Esteves Solheiro ,PS 
Monção ,Armindo Guedes da Ponte ,PPD / PSD 
Paredes de Coura ,António Pereira Júnior ,PS 
Ponte da Barca ,António Cabral de Oliveira ,PPD / PSD 
Ponte de Lima ,José D. R. Capelo da Rocha ,CDS - PP 
Valença ,Alberto Magno P. de Castro ,PPD / PSD 
Viana do Castelo ,Defensor Oliveira Moura ,PS 
Vila Nova de Cerveira ,José Manuel Vaz Carpinteira ,PS 
Alijó ,Joaquim Alberto Oliveira Cerca ,PS 
Boticas ,Fernando Pereira Campos ,PPD / PSD 
Chaves ,Alexandre António Alves Chaves ,PS 
Mesão Frio ,Marco António P. T. da Silva ,PPD / PSD 
Mondim de Basto ,Fernando Carvalho B. P. de Moura ,CDS - PP 
Montalegre ,Joaquim Lopes Pires ,PS 
Murça ,José Gomes ,PPD / PSD 
Peso da Régua ,Álvaro da Costa Mota ,PPD / PSD 
Ribeira de Pena ,João José Alves Pereira ,PPD / PSD 
Sabrosa ,Milcíades E. C. B. de Carvalho ,PS 
Santa Marta de Penaguião ,Artur João Lourenço Vaz ,PS 
Valpaços ,Francisco Baptista Tavares ,PPD / PSD 
Vila Pouca de Aguiar ,Carlos Alberto C. Ambrósio ,PS 
Vila Real ,Manuel do Nascimento Martins ,PPD / PSD 
Armamar ,Hernani Pinto da F. Almeida ,PPD / PSD 
Carregal do Sal ,Atílio dos Santos Nunes ,PPD / PSD 
Castro Daire ,João Augusto Matias Pereira ,PPD / PSD 
Cinfães ,Manuel da C. Pinto Ferreira ,PPD / PSD 
Lamego ,Rui Paulo do Vale Valadares ,PS 
Mangualde ,Mário Videira Lopes ,PS 
Moimenta da Beira ,José Agostinho Gomes Correia ,PPD / PSD 
Mortágua ,Afonso Sequeira Abrantes ,PS 
Nelas ,José Lopes Correia ,PS 
Oliveira de Frades ,João Carlos Azevedo Maia ,PPD / PSD 
Penalva do castelo ,Gabriel de Albuquerque ,CDS - PP 
Penedono ,João Manuel R. de Carvalho ,PPD / PSD 
Resende ,Albino H. de Almeida Brito ,PPD / PSD 
Santa Comba Dão ,Orlando F. de Carvalho Mendes ,PS 
São João da Pesqueira ,António José Lima Costa ,PPD / PSD 
São Pedro do Sul ,Manuel B. d’Almeida Pinho ,PS 
Sátão ,Luis Manuel de M. Cabral ,PPD / PSD 
Sernancelhe ,José Mário Almeida Cardoso ,PPD / PSD 
Tabuaço ,José Carlos Pinto dos Santos ,PPD / PSD 
Tarouca ,Lucílio F. Assunção Teixeira ,PPD / PSD 
Tondela ,António Manuel Tenreiro da Cruz ,PPD / PSD 
Vila Nova de Paiva ,Avantino Loureiro Beleza ,CDS - PP 
Viseu ,Fernando Carvalho Ruas ,PPD / PSD 
Vouzela ,Paulo A de Figueiredo Matos ,PS 
Angra do Heroísmo ,Joaquim Carlos V. da Ponte ,PPD / PSD 
Calheta ,José Leovigildo de S. Azevedo ,PPD / PSD 
Santa Cruz da Graciosa  ,Luis Manuel de Lemos Reis  ,PPD / PSD 
Velas  ,António José B. da Silveira ,PPD / PSD 
Vila Praia da Vitória  ,José Fernandes Diniz Gomes ,PPD / PSD 
Corvo   ,Manuel das Pedras Rita ,PPD / PSD 
Horta  ,Renato Luis Pereira Leal ,PS 
Lajes das Flores  ,Albino Cristiano Alves Gomes ,PPD / PSD 
Lajes do Pico  ,Cláudio José Gomes Lopes ,PPD / PSD 
Madalena  ,Henrique de Faria Paulus ,PPD / PSD 
Santa Cruz das Flores ,João Manuel de Sousa  ,PSD  
São Roque do Pico  ,Manuel Joaquim Neves Costa ,PPD / PSD 
Lagoa ,Luis Alberto M. Martins Mota ,PS  
Nordeste  ,José Carlos Barbosa Carreiro ,PPD / PSD 
Ponta Delgada  ,Manuel Ribeiro Arruda ,PPD / PSD 
Povoação  ,Carlos Emílio L. Machado Ávila ,PS 
Ribeira Grande  ,António Pedro Rebelo Costa ,PPD / PSD 
Vila Franca de Campo  ,José Estevam Pacheco de Melo ,PPD / PSD 
Vila do Porto  ,Alberto da Silva Costa ,PS  
Calheta  ,Manuel Baeta de Castro ,PPD / PSD 
Câmara de Lobos  ,Gabriel Gregório N. Ornelas ,PPD / PSD 
Funchal  ,Virgílio Higino G. Pereira ,PPD / PSD 
Machico  ,José Martins Júnior ,PS 
Ponta do Sol  ,António do Vale da Silva Lobo ,PPD / PSD 
Porto Moniz ,António Geremias de Sousa ,PPD / PSD 
Porto Santo  ,José Jorge de Gois Mendonça ,PS 
Ribeira Brava  ,José Ismael Fernandes ,PPD / PSD 
Santa Cruz  ,Luis Gabriel Andrade Rodrigues ,PPD / PSD 
Santana  ,Carlos de Sousa Pereira ,PPD / PSD 
São Vicente  ,Gabriel Paulo D. Esmeraldo  ,PPD / PSD 
